TRAIN_3.7/build/3_LibraryLogic_eff/arcturus_Cijk_Ailk_Bjlk_HBH.yaml
- {MinimumRequiredVersion: 4.20.0}
- arcturus
- gfx908
- [Device 7380, Device 7388, Device 738c, Device 7390]
- - - [1024, 256, 1, 18944, 1024, 1024, 1024, 256]
    - [164, 23.389]
  - - [64, 128, 624, 128, 64, 64, 64, 128]
    - [14, 17.646]
  - - [1024, 256, 1, 15872, 1024, 1024, 1024, 256]
    - [146, 22.945]
  - - [1024, 256, 1, 10496, 1024, 1024, 1024, 256]
    - [112, 21.877]
  - - [1024, 1024, 1, 1024, 1056, 1056, 1056, 1056]
    - [150, 29.468]
  - - [1024, 1024, 1, 1280, 1024, 1024, 1024, 1024]
    - [130, 28.941]
  - - [1024, 1024, 1, 39, 1024, 1024, 1024, 1024]
    - [122, 3.645]
  - - [256, 11520, 1, 8976, 256, 256, 256, 11520]
    - [26, 66.008]
  - - [256, 9728, 1, 8976, 256, 256, 256, 9728]
    - [26, 55.964]
  - - [1024, 256, 1, 7680, 1024, 1024, 1024, 256]
    - [170, 21.051]
  - - [1024, 4096, 1, 2560, 1024, 1024, 1024, 4096]
    - [24, 52.637]
  - - [1024, 4096, 1, 1024, 1024, 1024, 1024, 4096]
    - [53, 48.136]
  - - [74, 2048, 1, 512, 74, 74, 74, 2048]
    - [33, 5.15]
  - - [33, 32, 1, 33, 33, 33, 33, 32]
    - [2, 0.004]
  - - [1024, 256, 1, 6144, 1024, 1024, 1024, 256]
    - [57, 20.286]
  - - [1024, 4096, 1, 10080, 1024, 1024, 1024, 4096]
    - [28, 56.018]
  - - [1024, 2, 1, 4992, 1024, 1024, 1024, 2]
    - [31, 0.209]
  - - [256, 13568, 1, 8976, 256, 256, 256, 13568]
    - [26, 77.557]
  - - [1024, 4096, 1, 7104, 1024, 1024, 1024, 4096]
    - [28, 57.175]
  - - [100, 2048, 1, 512, 100, 100, 100, 2048]
    - [29, 6.29]
  - - [2048, 2048, 1, 512, 2048, 2048, 2048, 2048]
    - [115, 41.782]
  - - [64, 32, 4608, 35, 64, 64, 294912, 32]
    - [165, 5.311]
  - - [1600, 1024, 1, 960, 1600, 1600, 1600, 1024]
    - [131, 35.384]
  - - [64, 128, 144, 128, 64, 64, 64, 128]
    - [130, 11.975]
  - - [15, 64, 10880, 15, 15, 15, 15, 696320]
    - [3, 1.911]
  - - [512, 512, 1, 512, 544, 544, 544, 544]
    - [120, 8.43]
  - - [4096, 1024, 1, 10064, 4096, 4096, 4096, 1024]
    - [41, 57.467]
  - - [256, 33536, 1, 8976, 256, 256, 256, 33536]
    - [85, 70.834]
  - - [256, 2560, 1, 8976, 256, 256, 256, 2560]
    - [40, 35.266]
  - - [1024, 2, 1, 39, 1024, 1024, 1024, 2]
    - [2, 0.009]
  - - [64, 21, 6144, 17, 64, 64, 393216, 21]
    - [138, 2.099]
  - - [64, 24, 4736, 24, 64, 64, 303104, 24]
    - [81, 2.933]
  - - [4096, 1024, 1, 6528, 4096, 4096, 4096, 1024]
    - [41, 58.037]
  - - [4096, 1024, 1, 7200, 4096, 4096, 4096, 1024]
    - [158, 56.41]
  - - [1024, 1024, 1, 8192, 1024, 1024, 1024, 1024]
    - [110, 43.736]
  - - [256, 21248, 1, 8976, 256, 256, 256, 21248]
    - [85, 69.073]
  - - [512, 64, 64, 512, 512, 512, 512, 64]
    - [37, 27.231]
  - - [1024, 960, 1, 1024, 1056, 1056, 1056, 1056]
    - [135, 33.525]
  - - [4096, 1024, 1, 3840, 4096, 4096, 4096, 1024]
    - [41, 55.804]
  - - [17, 64, 7680, 17, 17, 17, 17, 491520]
    - [162, 1.929]
  - - [1024, 1024, 1, 308, 1024, 1024, 1024, 1024]
    - [124, 15.741]
  - - [1024, 2, 1, 5, 1024, 1024, 1024, 2]
    - [2, 0.001]
  - - [1024, 1024, 1, 3968, 1024, 1024, 1024, 1024]
    - [151, 38.937]
  - - [1024, 256, 1, 2816, 1024, 1024, 1024, 256]
    - [117, 17.271]
  - - [4096, 4096, 1, 1024, 4096, 4096, 4096, 4096]
    - [109, 64.156]
  - - [34, 64, 4736, 24, 34, 34, 34, 303104]
    - [113, 3.97]
  - - [21, 64, 6144, 21, 21, 21, 21, 393216]
    - [153, 2.58]
  - - [1024, 4096, 1, 9520, 1024, 1024, 1024, 4096]
    - [96, 55.822]
  - - [1024, 1024, 1, 4992, 1024, 1024, 1024, 1024]
    - [116, 41.096]
  - - [1024, 256, 1, 3072, 1024, 1024, 1024, 256]
    - [170, 17.405]
  - - [4096, 3840, 1, 4096, 4192, 4192, 4192, 4192]
    - [159, 85.811]
  - - [1024, 256, 1, 4096, 1024, 1024, 1024, 256]
    - [47, 18.712]
  - - [1024, 256, 1, 12032, 1024, 1024, 1024, 256]
    - [112, 22.328]
  - - [256, 6144, 1, 8976, 256, 256, 256, 6144]
    - [106, 59.434]
  - - [4096, 1024, 1, 3072, 4096, 4096, 4096, 1024]
    - [143, 55.516]
  - - [2048, 2048, 1, 960, 2048, 2048, 2048, 2048]
    - [64, 47.638]
  - - [64, 17, 6144, 17, 64, 64, 393216, 17]
    - [165, 1.752]
  - - [64, 512, 96, 512, 64, 64, 64, 512]
    - [70, 29.098]
  - - [1024, 1024, 1, 5248, 1024, 1024, 1024, 1024]
    - [96, 40.71]
  - - [4096, 1024, 1, 10200, 4096, 4096, 4096, 1024]
    - [110, 57.54]
  - - [1024, 256, 1, 5120, 1024, 1024, 1024, 256]
    - [75, 19.444]
  - - [4096, 1024, 1, 4992, 4096, 4096, 4096, 1024]
    - [41, 57.361]
  - - [1024, 1024, 1, 180, 1024, 1024, 1024, 1024]
    - [124, 11.323]
  - - [5, 64, 1, 5, 5, 5, 5, 64]
    - [76, 0.0]
  - - [4096, 1024, 1, 2560, 4096, 4096, 4096, 1024]
    - [167, 54.433]
  - - [4096, 1024, 1, 9216, 4096, 4096, 4096, 1024]
    - [65, 59.031]
  - - [1024, 256, 1, 14336, 1024, 1024, 1024, 256]
    - [98, 22.793]
  - - [1024, 1024, 1, 10080, 1024, 1024, 1024, 1024]
    - [151, 42.765]
  - - [1024, 33712, 1, 9600, 1024, 1024, 1024, 33712]
    - [38, 86.375]
  - - [64, 128, 640, 128, 64, 64, 64, 128]
    - [69, 17.691]
  - - [1024, 256, 1, 5376, 1024, 1024, 1024, 256]
    - [152, 20.013]
  - - [5, 64, 512, 5, 5, 5, 5, 64]
    - [77, 0.075]
  - - [2048, 256, 1, 1024, 2048, 2048, 2048, 256]
    - [160, 18.608]
  - - [1024, 1024, 1, 5, 1024, 1024, 1024, 1024]
    - [126, 0.539]
  - - [1024, 42720, 1, 3968, 1024, 1024, 1024, 42720]
    - [26, 82.425]
  - - [4, 64, 32768, 4, 4, 4, 4, 2097152]
    - [7, 0.17]
  - - [4096, 1024, 1, 2048, 4096, 4096, 4096, 1024]
    - [143, 53.52]
  - - [256, 3328, 1, 8976, 256, 256, 256, 3328]
    - [9, 41.876]
  - - [1024, 1024, 1, 4096, 1024, 1024, 1024, 1024]
    - [116, 39.483]
  - - [1024, 2, 1, 40, 1024, 1024, 1024, 2]
    - [2, 0.009]
  - - [1024, 30522, 1, 160, 1024, 1024, 1024, 30522]
    - [154, 41.785]
  - - [1024, 1024, 1, 800, 1024, 1024, 1024, 1024]
    - [124, 26.168]
  - - [256, 4864, 1, 8976, 256, 256, 256, 4864]
    - [88, 49.855]
  - - [1024, 1024, 1, 41, 1024, 1024, 1024, 1024]
    - [123, 3.725]
  - - [4096, 1024, 1, 8064, 4096, 4096, 4096, 1024]
    - [96, 58.573]
  - - [1024, 256, 1, 14848, 1024, 1024, 1024, 256]
    - [170, 22.895]
  - - [1024, 2, 1, 5248, 1024, 1024, 1024, 2]
    - [163, 0.211]
  - - [4096, 4096, 1, 4096, 4192, 4192, 4192, 4192]
    - [94, 78.169]
  - - [1024, 30522, 1, 385, 1024, 1024, 1024, 30522]
    - [127, 54.612]
  - - [1024, 256, 1, 8448, 1024, 1024, 1024, 256]
    - [75, 21.566]
  - - [64, 30, 2048, 31, 64, 64, 131072, 30]
    - [59, 3.543]
  - - [1024, 4096, 1, 9600, 1024, 1024, 1024, 4096]
    - [28, 57.981]
  - - [256, 22016, 1, 8976, 256, 256, 256, 22016]
    - [108, 69.89]
  - - [2048, 512, 1, 1, 2048, 2048, 2048, 512]
    - [12, 0.117]
  - - [2048, 960, 1, 1, 2048, 2048, 2048, 960]
    - [12, 0.198]
  - - [64, 32, 4608, 32, 64, 64, 294912, 32]
    - [62, 7.173]
  - - [1024, 4096, 1, 1152, 1024, 1024, 1024, 4096]
    - [72, 48.053]
  - - [1024, 1024, 1, 960, 1024, 1024, 1024, 1024]
    - [156, 26.462]
  - - [1024, 2, 1, 512, 1024, 1024, 1024, 2]
    - [137, 0.073]
  - - [1024, 256, 1, 15104, 1024, 1024, 1024, 256]
    - [57, 22.816]
  - - [1024, 1024, 1, 8160, 1024, 1024, 1024, 1024]
    - [116, 41.36]
  - - [4096, 1024, 1, 7104, 4096, 4096, 4096, 1024]
    - [41, 58.409]
  - - [64, 4, 38400, 4, 64, 64, 2457600, 4]
    - [4, 0.171]
  - - [1024, 256, 1, 22016, 1024, 1024, 1024, 256]
    - [57, 23.596]
  - - [1024, 30522, 1, 180, 1024, 1024, 1024, 30522]
    - [154, 40.468]
  - - [1024, 64, 1, 512, 1024, 1024, 1024, 64]
    - [46, 2.617]
  - - [4096, 1024, 1, 512, 4096, 4096, 4096, 1024]
    - [141, 41.437]
  - - [1024, 256, 1, 5632, 1024, 1024, 1024, 256]
    - [104, 19.909]
  - - [1024, 256, 1, 33536, 1024, 1024, 1024, 256]
    - [104, 24.084]
  - - [4096, 1024, 1, 1024, 4096, 4096, 4096, 1024]
    - [143, 48.779]
  - - [1024, 1024, 1, 7200, 1024, 1024, 1024, 1024]
    - [28, 40.606]
  - - [64, 34, 4736, 34, 64, 64, 303104, 34]
    - [4, 4.449]
  - - [256, 12800, 1, 8976, 256, 256, 256, 12800]
    - [26, 73.05]
  - - [480, 1024, 1, 32768, 480, 480, 480, 1024]
    - [10, 30.037]
  - - [4, 64, 38400, 4, 4, 4, 4, 2457600]
    - [7, 0.171]
  - - [1024, 1024, 1, 6528, 1024, 1024, 1024, 1024]
    - [145, 42.144]
  - - [256, 11008, 1, 8976, 256, 256, 256, 11008]
    - [18, 63.057]
  - - [32, 64, 4608, 35, 32, 32, 32, 294912]
    - [60, 5.302]
  - - [1024, 4096, 1, 10200, 1024, 1024, 1024, 4096]
    - [28, 56.398]
  - - [64, 512, 64, 512, 64, 64, 64, 512]
    - [70, 26.654]
  - - [31, 64, 2048, 31, 31, 31, 31, 131072]
    - [34, 3.616]
  - - [1024, 2, 1, 32, 1024, 1024, 1024, 2]
    - [32, 0.009]
  - - [256, 15104, 1, 8976, 256, 256, 256, 15104]
    - [133, 85.406]
  - - [1024, 4096, 1, 3840, 1024, 1024, 1024, 4096]
    - [110, 54.532]
  - - [1024, 2, 1, 9, 1024, 1024, 1024, 2]
    - [2, 0.002]
  - - [8192, 8192, 1, 8192, 8384, 8384, 8384, 8384]
    - [86, 88.28]
  - - [21, 64, 6144, 17, 21, 21, 21, 393216]
    - [49, 2.119]
  - - [256, 8192, 1, 8976, 256, 256, 256, 8192]
    - [51, 47.077]
  - - [30, 64, 2048, 30, 30, 30, 30, 131072]
    - [61, 3.561]
  - - [1024, 30528, 1, 2048, 1024, 1024, 1024, 30528]
    - [129, 78.023]
  - - [1024, 4096, 1, 3968, 1024, 1024, 1024, 4096]
    - [96, 54.592]
  - - [4096, 1024, 1, 1280, 4096, 4096, 4096, 1024]
    - [102, 50.546]
  - - [256, 11776, 1, 8976, 256, 256, 256, 11776]
    - [19, 67.206]
  - - [1024, 1024, 1, 7104, 1024, 1024, 1024, 1024]
    - [151, 42.61]
  - - [1024, 256, 1, 9984, 1024, 1024, 1024, 256]
    - [117, 22.065]
  - - [1024, 256, 1, 17152, 1024, 1024, 1024, 256]
    - [117, 23.132]
  - - [1024, 2, 1, 2048, 1024, 1024, 1024, 2]
    - [44, 0.151]
  - - [1024, 1024, 1, 3072, 1024, 1024, 1024, 1024]
    - [96, 36.897]
  - - [64, 128, 656, 128, 64, 64, 64, 128]
    - [105, 17.782]
  - - [1600, 1024, 1, 512, 1600, 1600, 1600, 1024]
    - [157, 28.756]
  - - [1024, 256, 1, 17408, 1024, 1024, 1024, 256]
    - [146, 23.222]
  - - [1024, 1024, 1, 9216, 1024, 1024, 1024, 1024]
    - [110, 44.007]
  - - [256, 4352, 1, 8976, 256, 256, 256, 4352]
    - [28, 44.993]
  - - [33, 32, 200, 33, 33, 33, 33, 32]
    - [6, 0.741]
  - - [2048, 2048, 1, 1024, 2048, 2048, 2048, 2048]
    - [39, 47.736]
  - - [1024, 4096, 1, 4992, 1024, 1024, 1024, 4096]
    - [28, 55.841]
  - - [9, 64, 512, 9, 9, 9, 9, 64]
    - [3, 0.237]
  - - [4096, 1024, 1, 4096, 4096, 4096, 4096, 1024]
    - [65, 56.215]
  - - [1024, 1024, 1, 9, 1024, 1024, 1024, 1024]
    - [83, 0.94]
  - - [1024, 4096, 1, 512, 1024, 1024, 1024, 4096]
    - [21, 42.851]
  - - [64, 512, 16, 512, 64, 64, 64, 512]
    - [73, 13.879]
  - - [256, 17152, 1, 8976, 256, 256, 256, 17152]
    - [24, 59.109]
  - - [1024, 4096, 1, 10064, 1024, 1024, 1024, 4096]
    - [28, 56.312]
  - - [1024, 2, 1, 6, 1024, 1024, 1024, 2]
    - [1, 0.001]
  - - [256, 7168, 1, 8976, 256, 256, 256, 7168]
    - [134, 63.748]
  - - [256, 9984, 1, 8976, 256, 256, 256, 9984]
    - [26, 57.314]
  - - [1024, 4096, 1, 6528, 1024, 1024, 1024, 4096]
    - [28, 56.752]
  - - [2048, 1920, 1, 2048, 2080, 2080, 2080, 2080]
    - [125, 72.187]
  - - [1024, 4096, 1, 7200, 1024, 1024, 1024, 4096]
    - [24, 55.338]
  - - [1024, 1024, 1, 2048, 1024, 1024, 1024, 1024]
    - [65, 33.384]
  - - [1024, 256, 1, 19712, 1024, 1024, 1024, 256]
    - [170, 23.294]
  - - [1024, 30522, 1, 780, 1024, 1024, 1024, 30522]
    - [92, 61.312]
  - - [64, 128, 128, 128, 64, 64, 64, 128]
    - [82, 10.736]
  - - [560, 1024, 1, 200, 560, 560, 560, 1024]
    - [78, 7.301]
  - - [1024, 30522, 1, 800, 1024, 1024, 1024, 30522]
    - [129, 63.173]
  - - [256, 13312, 1, 8976, 256, 256, 256, 13312]
    - [26, 76.113]
  - - [256, 3840, 1, 8976, 256, 256, 256, 3840]
    - [139, 41.663]
  - - [1024, 256, 1, 6400, 1024, 1024, 1024, 256]
    - [104, 20.444]
  - - [1024, 42720, 1, 6528, 1024, 1024, 1024, 42720]
    - [26, 84.695]
  - - [30, 64, 2048, 31, 30, 30, 30, 131072]
    - [128, 3.68]
  - - [256, 14336, 1, 8976, 256, 256, 256, 14336]
    - [19, 81.665]
  - - [33, 32, 1600, 33, 33, 33, 33, 32]
    - [71, 2.34]
  - - [960, 1024, 1, 1024, 1056, 1056, 1056, 1056]
    - [87, 33.765]
  - - [256, 1280, 1, 8976, 256, 256, 256, 1280]
    - [152, 24.424]
  - - [1024, 1024, 1, 6, 1024, 1024, 1024, 1024]
    - [12, 0.64]
  - - [1024, 4096, 1, 8064, 1024, 1024, 1024, 4096]
    - [28, 57.634]
  - - [1024, 1024, 1, 10200, 1024, 1024, 1024, 1024]
    - [41, 42.958]
  - - [8192, 7680, 1, 8192, 8384, 8384, 8384, 8384]
    - [95, 91.111]
  - - [1024, 256, 1, 3328, 1024, 1024, 1024, 256]
    - [104, 18.224]
  - - [1024, 256, 1, 3584, 1024, 1024, 1024, 256]
    - [117, 18.318]
  - - [14, 64, 10880, 14, 14, 14, 14, 696320]
    - [3, 1.703]
  - - [1024, 2, 1, 1152, 1024, 1024, 1024, 2]
    - [89, 0.111]
  - - [257, 4096, 1, 1024, 257, 257, 257, 4096]
    - [111, 23.736]
  - - [1024, 2, 1, 4, 1024, 1024, 1024, 2]
    - [0, 0.001]
  - - [1024, 1024, 1, 2560, 1024, 1024, 1024, 1024]
    - [169, 35.431]
  - - [1024, 256, 1, 11520, 1024, 1024, 1024, 256]
    - [117, 22.447]
  - - [1024, 256, 1, 19968, 1024, 1024, 1024, 256]
    - [57, 23.461]
  - - [1024, 1024, 1, 77, 1024, 1024, 1024, 1024]
    - [16, 6.458]
  - - [1024, 42720, 1, 7104, 1024, 1024, 1024, 42720]
    - [26, 84.927]
  - - [1024, 1024, 1, 160, 1024, 1024, 1024, 1024]
    - [124, 13.895]
  - - [256, 3584, 1, 8976, 256, 256, 256, 3584]
    - [27, 44.344]
  - - [256, 19968, 1, 8976, 256, 256, 256, 19968]
    - [28, 67.674]
  - - [1024, 64, 1, 960, 1024, 1024, 1024, 64]
    - [58, 3.463]
  - - [256, 10240, 1, 8976, 256, 256, 256, 10240]
    - [26, 58.674]
  - - [1024, 4096, 1, 8192, 1024, 1024, 1024, 4096]
    - [28, 57.677]
  - - [256, 18688, 1, 8976, 256, 256, 256, 18688]
    - [136, 64.125]
  - - [1024, 256, 1, 7936, 1024, 1024, 1024, 256]
    - [57, 21.301]
  - - [1024, 42720, 1, 9520, 1024, 1024, 1024, 42720]
    - [26, 84.27]
  - - [3, 64, 512, 3, 3, 3, 3, 64]
    - [3, 0.027]
  - - [1024, 2, 1, 41, 1024, 1024, 1024, 2]
    - [5, 0.01]
  - - [128, 64, 1, 128, 128, 128, 128, 64]
    - [11, 0.129]
  - - [256, 10496, 1, 8976, 256, 256, 256, 10496]
    - [19, 60.156]
  - - [480, 512, 1, 512, 544, 544, 544, 544]
    - [11, 9.272]
  - - [1024, 1024, 1, 462, 1024, 1024, 1024, 1024]
    - [142, 20.06]
  - - [17, 64, 7680, 15, 17, 17, 17, 491520]
    - [42, 1.952]
  - - [1024, 1024, 1, 780, 1024, 1024, 1024, 1024]
    - [130, 24.145]
  - - [64, 15, 10880, 15, 64, 64, 696320, 15]
    - [81, 1.768]
  - - [64, 30, 2048, 30, 64, 64, 131072, 30]
    - [61, 3.418]
  - - [1024, 4096, 1, 5248, 1024, 1024, 1024, 4096]
    - [169, 55.824]
  - - [1024, 4096, 1, 1280, 1024, 1024, 1024, 4096]
    - [94, 49.113]
  - - [1024, 1024, 1, 4, 1024, 1024, 1024, 1024]
    - [20, 0.436]
  - - [4096, 1024, 1, 9600, 4096, 4096, 4096, 1024]
    - [96, 58.97]
  - - [256, 44505, 1, 8976, 256, 256, 256, 44505]
    - [38, 83.613]
  - - [768, 2048, 1, 256, 768, 768, 768, 2048]
    - [166, 22.166]
  - - [1024, 1024, 1, 32768, 1024, 1024, 1024, 1024]
    - [79, 47.729]
  - - [74, 2048, 1, 960, 74, 74, 74, 2048]
    - [90, 6.842]
  - - [64, 512, 80, 512, 64, 64, 64, 512]
    - [101, 29.485]
  - - [4096, 1024, 1, 1152, 4096, 4096, 4096, 1024]
    - [167, 50.02]
  - - [64, 14, 10880, 14, 64, 64, 696320, 14]
    - [122, 1.546]
  - - [1024, 256, 1, 1280, 1024, 1024, 1024, 256]
    - [144, 11.805]
  - - [4096, 1024, 1, 9520, 4096, 4096, 4096, 1024]
    - [41, 56.695]
  - - [1024, 1600, 1, 1, 1024, 1024, 1024, 1600]
    - [13, 0.168]
  - - [512, 32, 1, 1600, 512, 512, 512, 32]
    - [11, 1.022]
  - - [1024, 1024, 1, 820, 1024, 1024, 1024, 1024]
    - [124, 24.237]
  - - [1024, 2, 1, 2560, 1024, 1024, 1024, 2]
    - [30, 0.168]
  - - [1024, 4096, 1, 9216, 1024, 1024, 1024, 4096]
    - [28, 57.935]
  - - [1024, 1024, 1, 512, 1024, 1024, 1024, 1024]
    - [130, 23.368]
  - - [4096, 1024, 1, 5248, 4096, 4096, 4096, 1024]
    - [169, 57.348]
  - - [1024, 256, 1, 16128, 1024, 1024, 1024, 256]
    - [117, 23.084]
  - - [512, 256, 1, 32768, 512, 512, 512, 256]
    - [48, 12.436]
  - - [1024, 33712, 1, 8192, 1024, 1024, 1024, 33712]
    - [107, 86.479]
  - - [4096, 1024, 1, 10080, 4096, 4096, 4096, 1024]
    - [28, 57.077]
  - - [1024, 1024, 1, 385, 1024, 1024, 1024, 1024]
    - [130, 19.178]
  - - [1024, 256, 1, 13568, 1024, 1024, 1024, 256]
    - [117, 22.689]
  - - [1024, 1024, 1, 1, 1024, 1024, 1024, 1024]
    - [12, 0.112]
  - - [1024, 2, 1, 10, 1024, 1024, 1024, 2]
    - [1, 0.002]
  - - [64, 21, 6144, 21, 64, 64, 393216, 21]
    - [91, 2.568]
  - - [64, 4, 32768, 4, 64, 64, 2097152, 4]
    - [4, 0.169]
  - - [1024, 256, 1, 28672, 1024, 1024, 1024, 256]
    - [98, 23.941]
  - - [34, 64, 4736, 34, 34, 34, 34, 303104]
    - [36, 4.455]
  - - [128, 64, 512, 128, 128, 128, 128, 64]
    - [23, 16.419]
  - - [256, 20992, 1, 8976, 256, 256, 256, 20992]
    - [132, 69.374]
  - - [1024, 256, 1, 4352, 1024, 1024, 1024, 256]
    - [117, 18.997]
  - - [256, 5888, 1, 8976, 256, 256, 256, 5888]
    - [88, 60.265]
  - - [64, 31, 2048, 31, 64, 64, 131072, 31]
    - [59, 3.605]
  - - [512, 64, 1, 512, 512, 512, 512, 64]
    - [58, 1.319]
  - - [1024, 1024, 1, 10, 1024, 1024, 1024, 1024]
    - [35, 1.055]
  - - [512, 32, 1, 200, 512, 512, 512, 32]
    - [120, 0.271]
  - - [5, 64, 960, 5, 5, 5, 5, 64]
    - [1, 0.116]
  - - [64, 35, 4608, 35, 64, 64, 294912, 35]
    - [119, 4.478]
  - - [1024, 2, 1, 5120, 1024, 1024, 1024, 2]
    - [30, 0.207]
  - - [1920, 2048, 1, 2048, 2080, 2080, 2080, 2080]
    - [140, 72.675]
  - - [2048, 2048, 1, 2048, 2080, 2080, 2080, 2080]
    - [64, 53.096]
  - - [1024, 256, 1, 9728, 1024, 1024, 1024, 256]
    - [75, 21.735]
  - - [4096, 1024, 1, 8160, 4096, 4096, 4096, 1024]
    - [158, 56.36]
  - - [64, 34, 4736, 24, 64, 64, 303104, 34]
    - [114, 3.639]
  - - [256, 26112, 1, 8976, 256, 256, 256, 26112]
    - [25, 75.891]
  - - [3840, 4096, 1, 4096, 4192, 4192, 4192, 4192]
    - [63, 86.937]
  - - [1024, 4096, 1, 5120, 1024, 1024, 1024, 4096]
    - [110, 56.012]
  - - [64, 128, 160, 128, 64, 64, 64, 128]
    - [17, 12.765]
  - - [1024, 1024, 1, 10064, 1024, 1024, 1024, 1024]
    - [161, 42.845]
  - - [256, 5120, 1, 8976, 256, 256, 256, 5120]
    - [136, 52.529]
  - - [35, 64, 4608, 35, 35, 35, 35, 294912]
    - [36, 4.38]
  - - [1024, 30522, 1, 308, 1024, 1024, 1024, 30522]
    - [127, 50.782]
  - - [1024, 30522, 1, 820, 1024, 1024, 1024, 30522]
    - [84, 61.735]
  - - [1024, 30522, 1, 200, 1024, 1024, 1024, 30522]
    - [154, 42.668]
  - - [15, 64, 10880, 14, 15, 15, 15, 696320]
    - [3, 1.798]
  - - [1024, 30522, 1, 462, 1024, 1024, 1024, 30522]
    - [148, 55.955]
  - - [256, 8960, 1, 8976, 256, 256, 256, 8960]
    - [26, 51.435]
  - - [15, 64, 7680, 15, 15, 15, 15, 491520]
    - [118, 1.803]
  - - [1024, 1024, 1, 8064, 1024, 1024, 1024, 1024]
    - [96, 43.527]
  - - [13, 512, 1, 32768, 13, 13, 13, 512]
    - [100, 0.747]
  - - [256, 5632, 1, 8976, 256, 256, 256, 5632]
    - [88, 57.699]
  - - [256, 32512, 1, 8976, 256, 256, 256, 32512]
    - [24, 68.99]
  - - [64, 17, 7680, 15, 64, 64, 491520, 17]
    - [50, 1.865]
  - - [17, 64, 6144, 17, 17, 17, 17, 393216]
    - [93, 1.8]
  - - [1024, 2, 1, 1024, 1024, 1024, 1024, 2]
    - [43, 0.107]
  - - [1024, 4096, 1, 4096, 1024, 1024, 1024, 4096]
    - [96, 54.91]
  - - [64, 512, 1, 512, 64, 64, 64, 512]
    - [11, 1.287]
  - - [1024, 30522, 1, 77, 1024, 1024, 1024, 30522]
    - [121, 22.658]
  - - [256, 11264, 1, 8976, 256, 256, 256, 11264]
    - [18, 64.335]
  - - [1024, 1024, 1, 40, 1024, 1024, 1024, 1024]
    - [12, 4.361]
  - - [1024, 1024, 1, 9520, 1024, 1024, 1024, 1024]
    - [103, 42.1]
  - - [1024, 2, 1, 1, 1024, 1024, 1024, 2]
    - [5, 0.0]
  - - [1024, 1024, 1, 3840, 1024, 1024, 1024, 1024]
    - [145, 39.048]
  - - [512, 512, 1, 1600, 512, 512, 512, 512]
    - [168, 12.998]
  - - [1024, 512, 1, 32768, 1024, 1024, 1024, 512]
    - [40, 31.512]
  - - [256, 15872, 1, 8976, 256, 256, 256, 15872]
    - [28, 55.059]
  - - [1024, 2, 1, 8, 1024, 1024, 1024, 2]
    - [2, 0.002]
  - - [3200, 2048, 1, 1024, 3200, 3200, 3200, 2048]
    - [102, 60.388]
  - - [1024, 1024, 1, 8, 1024, 1024, 1024, 1024]
    - [36, 1.09]
  - - [1024, 42720, 1, 7200, 1024, 1024, 1024, 42720]
    - [26, 84.851]
  - - [1024, 30528, 1, 4096, 1024, 1024, 1024, 30528]
    - [129, 81.593]
  - - [27, 128, 32768, 27, 27, 27, 27, 128]
    - [147, 5.277]
  - - [1024, 256, 1, 1024, 1024, 1024, 1024, 256]
    - [55, 10.828]
  - - [64, 15, 7680, 15, 64, 64, 491520, 15]
    - [67, 1.672]
  - - [560, 1024, 1, 1600, 560, 560, 560, 1024]
    - [99, 21.466]
  - - [256, 128, 1, 32768, 256, 256, 256, 128]
    - [68, 3.848]
  - - [512, 2048, 1, 256, 512, 512, 512, 2048]
    - [23, 17.943]
  - - [1024, 256, 1, 21248, 1024, 1024, 1024, 256]
    - [170, 23.576]
  - - [256, 12544, 1, 8976, 256, 256, 256, 12544]
    - [26, 71.665]
  - - [1024, 1024, 1, 9600, 1024, 1024, 1024, 1024]
    - [41, 44.082]
  - - [4096, 1024, 1, 5120, 4096, 4096, 4096, 1024]
    - [65, 57.305]
  - - [1024, 4096, 1, 3072, 1024, 1024, 1024, 4096]
    - [110, 53.355]
  - - [1024, 256, 1, 21504, 1024, 1024, 1024, 256]
    - [170, 23.678]
  - - [32, 64, 4608, 32, 32, 32, 32, 294912]
    - [149, 7.083]
  - - [1024, 1024, 1, 1152, 1024, 1024, 1024, 1024]
    - [130, 28.912]
  - - [512, 480, 1, 512, 544, 544, 544, 544]
    - [80, 9.058]
  - - [1024, 1024, 1, 1024, 1024, 1024, 1024, 1024]
    - [130, 27.606]
  - - [1024, 4096, 1, 8160, 1024, 1024, 1024, 4096]
    - [24, 55.386]
  - - [67, 2048, 1, 512, 67, 67, 67, 2048]
    - [66, 4.765]
  - - [1024, 256, 1, 8192, 1024, 1024, 1024, 256]
    - [117, 21.312]
  - - [64, 15, 10880, 14, 64, 64, 696320, 15]
    - [122, 1.641]
  - - [64, 128, 1, 128, 64, 64, 64, 128]
    - [11, 0.127]
  - - [1024, 256, 1, 4608, 1024, 1024, 1024, 256]
    - [57, 19.16]
  - - [1024, 1024, 1, 5120, 1024, 1024, 1024, 1024]
    - [110, 40.781]
  - - [256, 17408, 1, 8976, 256, 256, 256, 17408]
    - [24, 59.972]
  - - [1024, 1024, 1, 32, 1024, 1024, 1024, 1024]
    - [22, 4.026]
  - - [1024, 42720, 1, 10080, 1024, 1024, 1024, 42720]
    - [26, 85.763]
  - - [256, 32768, 1, 1, 256, 256, 256, 32768]
    - [12, 0.413]
  - - [256, 4096, 1, 8976, 256, 256, 256, 4096]
    - [88, 42.044]
  - - [256, 14848, 1, 8976, 256, 256, 256, 14848]
    - [54, 84.091]
  - - [24, 64, 4736, 24, 24, 24, 24, 303104]
    - [52, 3.204]
  - - [64, 17, 7680, 17, 64, 64, 491520, 17]
    - [155, 1.918]
  - - [1024, 2, 1, 3072, 1024, 1024, 1024, 2]
    - [97, 0.18]
  - - [256, 20480, 1, 8976, 256, 256, 256, 20480]
    - [24, 67.34]
  - - [1024, 4096, 1, 2048, 1024, 1024, 1024, 4096]
    - [24, 51.896]
  - - [7680, 8192, 1, 8192, 8384, 8384, 8384, 8384]
    - [109, 91.306]
  - - [4096, 1024, 1, 8192, 4096, 4096, 4096, 1024]
    - [110, 58.687]
  - - [512, 512, 1, 200, 512, 512, 512, 512]
    - [8, 4.23]
  - - [1024, 2, 1, 1280, 1024, 1024, 1024, 2]
    - [30, 0.121]
  - - [256, 2816, 1, 8976, 256, 256, 256, 2816]
    - [74, 38.62]
  - - [1024, 1024, 1, 1600, 1024, 1024, 1024, 1024]
    - [56, 30.487]
  - - [479, 1024, 1, 32768, 479, 479, 479, 1024]
    - [45, 28.214]
  - - [64, 128, 512, 128, 64, 64, 64, 128]
    - [15, 16.527]
  - - [4096, 1024, 1, 3968, 4096, 4096, 4096, 1024]
    - [41, 56.167]
  - - [1024, 256, 1, 2304, 1024, 1024, 1024, 256]
    - [104, 15.277]
  - - [1024, 1024, 1, 200, 1024, 1024, 1024, 1024]
    - [130, 12.581]
  - - [256, 16128, 1, 8976, 256, 256, 256, 16128]
    - [28, 55.669]
- null
