TRAIN_3.7/build/3_LibraryLogic_eff/arcturus_Cijk_Ailk_Bjlk_BBH.yaml
- {MinimumRequiredVersion: 4.20.0}
- arcturus
- gfx908
- [Device 7380, Device 7388, Device 738c, Device 7390]
- - - [1024, 256, 1, 18944, 1024, 1024, 1024, 256]
    - [51, 44.451]
  - - [64, 128, 624, 128, 64, 64, 64, 128]
    - [11, 32.745]
  - - [1024, 256, 1, 15872, 1024, 1024, 1024, 256]
    - [131, 43.555]
  - - [1024, 256, 1, 10496, 1024, 1024, 1024, 256]
    - [169, 41.431]
  - - [1024, 1024, 1, 1024, 1056, 1056, 1056, 1056]
    - [98, 51.137]
  - - [1024, 1024, 1, 1280, 1024, 1024, 1024, 1024]
    - [141, 51.162]
  - - [1024, 1024, 1, 39, 1024, 1024, 1024, 1024]
    - [151, 7.087]
  - - [256, 11520, 1, 8976, 256, 256, 256, 11520]
    - [156, 88.919]
  - - [256, 9728, 1, 8976, 256, 256, 256, 9728]
    - [27, 77.796]
  - - [1024, 256, 1, 7680, 1024, 1024, 1024, 256]
    - [56, 39.748]
  - - [1024, 4096, 1, 2560, 1024, 1024, 1024, 4096]
    - [190, 77.325]
  - - [1024, 4096, 1, 1024, 1024, 1024, 1024, 4096]
    - [172, 72.032]
  - - [74, 2048, 1, 512, 74, 74, 74, 2048]
    - [79, 10.374]
  - - [33, 32, 1, 33, 33, 33, 33, 32]
    - [90, 0.009]
  - - [1024, 256, 1, 6144, 1024, 1024, 1024, 256]
    - [51, 37.776]
  - - [1024, 4096, 1, 10080, 1024, 1024, 1024, 4096]
    - [181, 79.657]
  - - [1024, 2, 1, 4992, 1024, 1024, 1024, 2]
    - [188, 0.43]
  - - [256, 13568, 1, 8976, 256, 256, 256, 13568]
    - [19, 84.656]
  - - [1024, 4096, 1, 7104, 1024, 1024, 1024, 4096]
    - [61, 79.284]
  - - [100, 2048, 1, 512, 100, 100, 100, 2048]
    - [9, 12.744]
  - - [2048, 2048, 1, 512, 2048, 2048, 2048, 2048]
    - [113, 65.145]
  - - [64, 32, 4608, 35, 64, 64, 294912, 32]
    - [3, 10.356]
  - - [1600, 1024, 1, 960, 1600, 1600, 1600, 1024]
    - [34, 60.951]
  - - [64, 128, 144, 128, 64, 64, 64, 128]
    - [16, 21.74]
  - - [15, 64, 10880, 15, 15, 15, 15, 696320]
    - [41, 3.567]
  - - [512, 512, 1, 512, 544, 544, 544, 544]
    - [93, 16.974]
  - - [4096, 1024, 1, 10064, 4096, 4096, 4096, 1024]
    - [122, 79.853]
  - - [256, 33536, 1, 8976, 256, 256, 256, 33536]
    - [27, 91.212]
  - - [256, 2560, 1, 8976, 256, 256, 256, 2560]
    - [114, 57.017]
  - - [1024, 2, 1, 39, 1024, 1024, 1024, 2]
    - [57, 0.018]
  - - [64, 21, 6144, 17, 64, 64, 393216, 21]
    - [130, 4.011]
  - - [64, 24, 4736, 24, 64, 64, 303104, 24]
    - [121, 5.615]
  - - [4096, 1024, 1, 6528, 4096, 4096, 4096, 1024]
    - [61, 79.663]
  - - [4096, 1024, 1, 7200, 4096, 4096, 4096, 1024]
    - [135, 80.049]
  - - [1024, 1024, 1, 8192, 1024, 1024, 1024, 1024]
    - [128, 59.901]
  - - [256, 21248, 1, 8976, 256, 256, 256, 21248]
    - [104, 88.722]
  - - [512, 64, 64, 512, 512, 512, 512, 64]
    - [118, 46.2]
  - - [1024, 960, 1, 1024, 1056, 1056, 1056, 1056]
    - [123, 59.062]
  - - [4096, 1024, 1, 3840, 4096, 4096, 4096, 1024]
    - [172, 79.101]
  - - [17, 64, 7680, 17, 17, 17, 17, 491520]
    - [168, 3.922]
  - - [1024, 1024, 1, 308, 1024, 1024, 1024, 1024]
    - [109, 30.376]
  - - [1024, 2, 1, 5, 1024, 1024, 1024, 2]
    - [1, 0.003]
  - - [1024, 1024, 1, 3968, 1024, 1024, 1024, 1024]
    - [117, 57.643]
  - - [1024, 256, 1, 2816, 1024, 1024, 1024, 256]
    - [70, 30.978]
  - - [4096, 4096, 1, 1024, 4096, 4096, 4096, 4096]
    - [40, 88.193]
  - - [34, 64, 4736, 24, 34, 34, 34, 303104]
    - [46, 7.467]
  - - [21, 64, 6144, 21, 21, 21, 21, 393216]
    - [162, 4.955]
  - - [1024, 4096, 1, 9520, 1024, 1024, 1024, 4096]
    - [166, 78.968]
  - - [1024, 1024, 1, 4992, 1024, 1024, 1024, 1024]
    - [128, 58.387]
  - - [1024, 256, 1, 3072, 1024, 1024, 1024, 256]
    - [70, 31.598]
  - - [4096, 3840, 1, 4096, 4192, 4192, 4192, 4192]
    - [19, 96.126]
  - - [1024, 256, 1, 4096, 1024, 1024, 1024, 256]
    - [80, 34.12]
  - - [1024, 256, 1, 12032, 1024, 1024, 1024, 256]
    - [175, 42.411]
  - - [256, 6144, 1, 8976, 256, 256, 256, 6144]
    - [7, 73.524]
  - - [4096, 1024, 1, 3072, 4096, 4096, 4096, 1024]
    - [135, 78.504]
  - - [2048, 2048, 1, 960, 2048, 2048, 2048, 2048]
    - [39, 71.502]
  - - [64, 17, 6144, 17, 64, 64, 393216, 17]
    - [54, 3.308]
  - - [64, 512, 96, 512, 64, 64, 64, 512]
    - [101, 53.26]
  - - [1024, 1024, 1, 5248, 1024, 1024, 1024, 1024]
    - [117, 58.389]
  - - [4096, 1024, 1, 10200, 4096, 4096, 4096, 1024]
    - [122, 79.636]
  - - [1024, 256, 1, 5120, 1024, 1024, 1024, 256]
    - [80, 36.355]
  - - [4096, 1024, 1, 4992, 4096, 4096, 4096, 1024]
    - [187, 79.491]
  - - [1024, 1024, 1, 180, 1024, 1024, 1024, 1024]
    - [24, 21.541]
  - - [5, 64, 1, 5, 5, 5, 5, 64]
    - [5, 0.0]
  - - [4096, 1024, 1, 2560, 4096, 4096, 4096, 1024]
    - [142, 78.077]
  - - [4096, 1024, 1, 9216, 4096, 4096, 4096, 1024]
    - [135, 80.218]
  - - [1024, 256, 1, 14336, 1024, 1024, 1024, 256]
    - [80, 43.206]
  - - [1024, 1024, 1, 10080, 1024, 1024, 1024, 1024]
    - [128, 59.035]
  - - [1024, 33712, 1, 9600, 1024, 1024, 1024, 33712]
    - [28, 94.611]
  - - [64, 128, 640, 128, 64, 64, 64, 128]
    - [73, 33.317]
  - - [1024, 256, 1, 5376, 1024, 1024, 1024, 256]
    - [80, 36.584]
  - - [5, 64, 512, 5, 5, 5, 5, 64]
    - [85, 0.15]
  - - [2048, 256, 1, 1024, 2048, 2048, 2048, 256]
    - [29, 34.178]
  - - [1024, 1024, 1, 5, 1024, 1024, 1024, 1024]
    - [13, 1.023]
  - - [1024, 42720, 1, 3968, 1024, 1024, 1024, 42720]
    - [129, 93.735]
  - - [4, 64, 32768, 4, 4, 4, 4, 2097152]
    - [6, 0.332]
  - - [4096, 1024, 1, 2048, 4096, 4096, 4096, 1024]
    - [122, 77.258]
  - - [256, 3328, 1, 8976, 256, 256, 256, 3328]
    - [100, 73.326]
  - - [1024, 1024, 1, 4096, 1024, 1024, 1024, 1024]
    - [128, 57.543]
  - - [1024, 2, 1, 40, 1024, 1024, 1024, 2]
    - [1, 0.018]
  - - [1024, 30522, 1, 160, 1024, 1024, 1024, 30522]
    - [180, 67.094]
  - - [1024, 1024, 1, 800, 1024, 1024, 1024, 1024]
    - [116, 47.292]
  - - [256, 4864, 1, 8976, 256, 256, 256, 4864]
    - [191, 70.128]
  - - [1024, 1024, 1, 41, 1024, 1024, 1024, 1024]
    - [149, 7.451]
  - - [4096, 1024, 1, 8064, 4096, 4096, 4096, 1024]
    - [122, 80.184]
  - - [1024, 256, 1, 14848, 1024, 1024, 1024, 256]
    - [192, 43.261]
  - - [1024, 2, 1, 5248, 1024, 1024, 1024, 2]
    - [30, 0.448]
  - - [4096, 4096, 1, 4096, 4192, 4192, 4192, 4192]
    - [28, 91.564]
  - - [1024, 30522, 1, 385, 1024, 1024, 1024, 30522]
    - [157, 80.148]
  - - [1024, 256, 1, 8448, 1024, 1024, 1024, 256]
    - [52, 40.165]
  - - [64, 30, 2048, 31, 64, 64, 131072, 30]
    - [13, 6.934]
  - - [1024, 4096, 1, 9600, 1024, 1024, 1024, 4096]
    - [22, 79.893]
  - - [256, 22016, 1, 8976, 256, 256, 256, 22016]
    - [69, 91.742]
  - - [2048, 512, 1, 1, 2048, 2048, 2048, 512]
    - [12, 0.226]
  - - [2048, 960, 1, 1, 2048, 2048, 2048, 960]
    - [23, 0.344]
  - - [64, 32, 4608, 32, 64, 64, 294912, 32]
    - [81, 13.686]
  - - [1024, 4096, 1, 1152, 1024, 1024, 1024, 4096]
    - [177, 73.109]
  - - [1024, 1024, 1, 960, 1024, 1024, 1024, 1024]
    - [55, 48.937]
  - - [1024, 2, 1, 512, 1024, 1024, 1024, 2]
    - [193, 0.142]
  - - [1024, 256, 1, 15104, 1024, 1024, 1024, 256]
    - [51, 43.414]
  - - [1024, 1024, 1, 8160, 1024, 1024, 1024, 1024]
    - [111, 58.384]
  - - [4096, 1024, 1, 7104, 4096, 4096, 4096, 1024]
    - [142, 79.91]
  - - [64, 4, 38400, 4, 64, 64, 2457600, 4]
    - [3, 0.338]
  - - [1024, 256, 1, 22016, 1024, 1024, 1024, 256]
    - [178, 44.748]
  - - [1024, 30522, 1, 180, 1024, 1024, 1024, 30522]
    - [186, 67.239]
  - - [1024, 64, 1, 512, 1024, 1024, 1024, 64]
    - [58, 5.278]
  - - [4096, 1024, 1, 512, 4096, 4096, 4096, 1024]
    - [181, 65.462]
  - - [1024, 256, 1, 5632, 1024, 1024, 1024, 256]
    - [72, 36.992]
  - - [1024, 256, 1, 33536, 1024, 1024, 1024, 256]
    - [169, 45.833]
  - - [4096, 1024, 1, 1024, 4096, 4096, 4096, 1024]
    - [160, 72.75]
  - - [1024, 1024, 1, 7200, 1024, 1024, 1024, 1024]
    - [185, 57.794]
  - - [64, 34, 4736, 34, 64, 64, 303104, 34]
    - [3, 8.899]
  - - [256, 12800, 1, 8976, 256, 256, 256, 12800]
    - [104, 80.167]
  - - [480, 1024, 1, 32768, 480, 480, 480, 1024]
    - [158, 48.52]
  - - [4, 64, 38400, 4, 4, 4, 4, 2457600]
    - [6, 0.335]
  - - [1024, 1024, 1, 6528, 1024, 1024, 1024, 1024]
    - [111, 59.314]
  - - [256, 11008, 1, 8976, 256, 256, 256, 11008]
    - [155, 86.916]
  - - [32, 64, 4608, 35, 32, 32, 32, 294912]
    - [88, 10.372]
  - - [1024, 4096, 1, 10200, 1024, 1024, 1024, 4096]
    - [39, 79.046]
  - - [64, 512, 64, 512, 64, 64, 64, 512]
    - [15, 46.846]
  - - [31, 64, 2048, 31, 31, 31, 31, 131072]
    - [12, 7.123]
  - - [1024, 2, 1, 32, 1024, 1024, 1024, 2]
    - [4, 0.016]
  - - [256, 15104, 1, 8976, 256, 256, 256, 15104]
    - [104, 93.777]
  - - [1024, 4096, 1, 3840, 1024, 1024, 1024, 4096]
    - [160, 77.935]
  - - [1024, 2, 1, 9, 1024, 1024, 1024, 2]
    - [1, 0.004]
  - - [8192, 8192, 1, 8192, 8384, 8384, 8384, 8384]
    - [173, 95.115]
  - - [21, 64, 6144, 17, 21, 21, 21, 393216]
    - [140, 4.067]
  - - [256, 8192, 1, 8976, 256, 256, 256, 8192]
    - [136, 67.964]
  - - [30, 64, 2048, 30, 30, 30, 30, 131072]
    - [12, 6.987]
  - - [1024, 30528, 1, 2048, 1024, 1024, 1024, 30528]
    - [182, 93.88]
  - - [1024, 4096, 1, 3968, 1024, 1024, 1024, 4096]
    - [160, 78.071]
  - - [4096, 1024, 1, 1280, 4096, 4096, 4096, 1024]
    - [181, 74.71]
  - - [256, 11776, 1, 8976, 256, 256, 256, 11776]
    - [92, 77.029]
  - - [1024, 1024, 1, 7104, 1024, 1024, 1024, 1024]
    - [111, 59.303]
  - - [1024, 256, 1, 9984, 1024, 1024, 1024, 256]
    - [120, 41.27]
  - - [1024, 256, 1, 17152, 1024, 1024, 1024, 256]
    - [51, 43.923]
  - - [1024, 2, 1, 2048, 1024, 1024, 1024, 2]
    - [47, 0.299]
  - - [1024, 1024, 1, 3072, 1024, 1024, 1024, 1024]
    - [111, 56.241]
  - - [64, 128, 656, 128, 64, 64, 64, 128]
    - [97, 33.792]
  - - [1600, 1024, 1, 512, 1600, 1600, 1600, 1024]
    - [165, 52.687]
  - - [1024, 256, 1, 17408, 1024, 1024, 1024, 256]
    - [174, 44.073]
  - - [1024, 1024, 1, 9216, 1024, 1024, 1024, 1024]
    - [185, 59.991]
  - - [256, 4352, 1, 8976, 256, 256, 256, 4352]
    - [105, 63.213]
  - - [33, 32, 200, 33, 33, 33, 33, 32]
    - [91, 1.499]
  - - [2048, 2048, 1, 1024, 2048, 2048, 2048, 2048]
    - [122, 72.684]
  - - [1024, 4096, 1, 4992, 1024, 1024, 1024, 4096]
    - [166, 78.661]
  - - [9, 64, 512, 9, 9, 9, 9, 64]
    - [85, 0.469]
  - - [4096, 1024, 1, 4096, 4096, 4096, 4096, 1024]
    - [125, 79.005]
  - - [1024, 1024, 1, 9, 1024, 1024, 1024, 1024]
    - [32, 1.785]
  - - [1024, 4096, 1, 512, 1024, 1024, 1024, 4096]
    - [190, 64.724]
  - - [64, 512, 16, 512, 64, 64, 64, 512]
    - [89, 27.012]
  - - [256, 17152, 1, 8976, 256, 256, 256, 17152]
    - [27, 83.599]
  - - [1024, 4096, 1, 10064, 1024, 1024, 1024, 4096]
    - [181, 79.013]
  - - [1024, 2, 1, 6, 1024, 1024, 1024, 2]
    - [1, 0.003]
  - - [256, 7168, 1, 8976, 256, 256, 256, 7168]
    - [139, 84.95]
  - - [256, 9984, 1, 8976, 256, 256, 256, 9984]
    - [27, 79.651]
  - - [1024, 4096, 1, 6528, 1024, 1024, 1024, 4096]
    - [61, 78.999]
  - - [2048, 1920, 1, 2048, 2080, 2080, 2080, 2080]
    - [157, 90.745]
  - - [1024, 4096, 1, 7200, 1024, 1024, 1024, 4096]
    - [68, 79.085]
  - - [1024, 1024, 1, 2048, 1024, 1024, 1024, 1024]
    - [98, 54.097]
  - - [1024, 256, 1, 19712, 1024, 1024, 1024, 256]
    - [175, 44.508]
  - - [1024, 30522, 1, 780, 1024, 1024, 1024, 30522]
    - [157, 87.849]
  - - [64, 128, 128, 128, 64, 64, 64, 128]
    - [152, 19.78]
  - - [560, 1024, 1, 200, 560, 560, 560, 1024]
    - [1, 14.602]
  - - [1024, 30522, 1, 800, 1024, 1024, 1024, 30522]
    - [161, 89.532]
  - - [256, 13312, 1, 8976, 256, 256, 256, 13312]
    - [157, 83.131]
  - - [256, 3840, 1, 8976, 256, 256, 256, 3840]
    - [153, 84.477]
  - - [1024, 256, 1, 6400, 1024, 1024, 1024, 256]
    - [84, 38.062]
  - - [1024, 42720, 1, 6528, 1024, 1024, 1024, 42720]
    - [129, 94.206]
  - - [30, 64, 2048, 31, 30, 30, 30, 131072]
    - [12, 7.153]
  - - [256, 14336, 1, 8976, 256, 256, 256, 14336]
    - [104, 89.177]
  - - [33, 32, 1600, 33, 33, 33, 33, 32]
    - [18, 4.618]
  - - [960, 1024, 1, 1024, 1056, 1056, 1056, 1056]
    - [60, 61.773]
  - - [256, 1280, 1, 8976, 256, 256, 256, 1280]
    - [52, 47.704]
  - - [1024, 1024, 1, 6, 1024, 1024, 1024, 1024]
    - [95, 1.226]
  - - [1024, 4096, 1, 8064, 1024, 1024, 1024, 4096]
    - [22, 79.559]
  - - [1024, 1024, 1, 10200, 1024, 1024, 1024, 1024]
    - [128, 58.878]
  - - [8192, 7680, 1, 8192, 8384, 8384, 8384, 8384]
    - [167, 97.126]
  - - [1024, 256, 1, 3328, 1024, 1024, 1024, 256]
    - [52, 31.83]
  - - [1024, 256, 1, 3584, 1024, 1024, 1024, 256]
    - [194, 32.931]
  - - [14, 64, 10880, 14, 14, 14, 14, 696320]
    - [2, 3.165]
  - - [1024, 2, 1, 1152, 1024, 1024, 1024, 2]
    - [87, 0.231]
  - - [257, 4096, 1, 1024, 257, 257, 257, 4096]
    - [48, 41.599]
  - - [1024, 2, 1, 4, 1024, 1024, 1024, 2]
    - [0, 0.001]
  - - [1024, 1024, 1, 2560, 1024, 1024, 1024, 1024]
    - [143, 55.333]
  - - [1024, 256, 1, 11520, 1024, 1024, 1024, 256]
    - [84, 42.213]
  - - [1024, 256, 1, 19968, 1024, 1024, 1024, 256]
    - [120, 44.392]
  - - [1024, 1024, 1, 77, 1024, 1024, 1024, 1024]
    - [148, 12.489]
  - - [1024, 42720, 1, 7104, 1024, 1024, 1024, 42720]
    - [39, 94.109]
  - - [1024, 1024, 1, 160, 1024, 1024, 1024, 1024]
    - [152, 25.324]
  - - [256, 3584, 1, 8976, 256, 256, 256, 3584]
    - [21, 78.845]
  - - [256, 19968, 1, 8976, 256, 256, 256, 19968]
    - [35, 83.596]
  - - [1024, 64, 1, 960, 1024, 1024, 1024, 64]
    - [115, 7.18]
  - - [256, 10240, 1, 8976, 256, 256, 256, 10240]
    - [27, 81.106]
  - - [1024, 4096, 1, 8192, 1024, 1024, 1024, 4096]
    - [34, 79.601]
  - - [256, 18688, 1, 8976, 256, 256, 256, 18688]
    - [155, 90.206]
  - - [1024, 256, 1, 7936, 1024, 1024, 1024, 256]
    - [169, 39.855]
  - - [1024, 42720, 1, 9520, 1024, 1024, 1024, 42720]
    - [17, 94.075]
  - - [3, 64, 512, 3, 3, 3, 3, 64]
    - [144, 0.055]
  - - [1024, 2, 1, 41, 1024, 1024, 1024, 2]
    - [4, 0.018]
  - - [128, 64, 1, 128, 128, 128, 128, 64]
    - [10, 0.243]
  - - [256, 10496, 1, 8976, 256, 256, 256, 10496]
    - [155, 83.333]
  - - [480, 512, 1, 512, 544, 544, 544, 544]
    - [147, 18.545]
  - - [1024, 1024, 1, 462, 1024, 1024, 1024, 1024]
    - [184, 35.839]
  - - [17, 64, 7680, 15, 17, 17, 17, 491520]
    - [2, 3.766]
  - - [1024, 1024, 1, 780, 1024, 1024, 1024, 1024]
    - [116, 43.737]
  - - [64, 15, 10880, 15, 64, 64, 696320, 15]
    - [81, 3.119]
  - - [64, 30, 2048, 30, 64, 64, 131072, 30]
    - [81, 6.772]
  - - [1024, 4096, 1, 5248, 1024, 1024, 1024, 4096]
    - [34, 78.639]
  - - [1024, 4096, 1, 1280, 1024, 1024, 1024, 4096]
    - [172, 73.399]
  - - [1024, 1024, 1, 4, 1024, 1024, 1024, 1024]
    - [149, 0.818]
  - - [4096, 1024, 1, 9600, 4096, 4096, 4096, 1024]
    - [122, 80.259]
  - - [256, 44505, 1, 8976, 256, 256, 256, 44505]
    - [28, 92.651]
  - - [768, 2048, 1, 256, 768, 768, 768, 2048]
    - [154, 40.301]
  - - [1024, 1024, 1, 32768, 1024, 1024, 1024, 1024]
    - [124, 61.184]
  - - [74, 2048, 1, 960, 74, 74, 74, 2048]
    - [115, 13.823]
  - - [64, 512, 80, 512, 64, 64, 64, 512]
    - [66, 54.849]
  - - [4096, 1024, 1, 1152, 4096, 4096, 4096, 1024]
    - [172, 73.705]
  - - [64, 14, 10880, 14, 64, 64, 696320, 14]
    - [53, 2.74]
  - - [1024, 256, 1, 1280, 1024, 1024, 1024, 256]
    - [37, 23.005]
  - - [4096, 1024, 1, 9520, 4096, 4096, 4096, 1024]
    - [122, 79.735]
  - - [1024, 1600, 1, 1, 1024, 1024, 1024, 1600]
    - [95, 0.313]
  - - [512, 32, 1, 1600, 512, 512, 512, 32]
    - [63, 2.282]
  - - [1024, 1024, 1, 820, 1024, 1024, 1024, 1024]
    - [48, 44.091]
  - - [1024, 2, 1, 2560, 1024, 1024, 1024, 2]
    - [30, 0.34]
  - - [1024, 4096, 1, 9216, 1024, 1024, 1024, 4096]
    - [22, 79.97]
  - - [1024, 1024, 1, 512, 1024, 1024, 1024, 1024]
    - [76, 41.523]
  - - [4096, 1024, 1, 5248, 4096, 4096, 4096, 1024]
    - [122, 79.765]
  - - [1024, 256, 1, 16128, 1024, 1024, 1024, 256]
    - [45, 43.598]
  - - [512, 256, 1, 32768, 512, 512, 512, 256]
    - [106, 25.724]
  - - [1024, 33712, 1, 8192, 1024, 1024, 1024, 33712]
    - [28, 94.528]
  - - [4096, 1024, 1, 10080, 4096, 4096, 4096, 1024]
    - [135, 80.133]
  - - [1024, 1024, 1, 385, 1024, 1024, 1024, 1024]
    - [163, 33.883]
  - - [1024, 256, 1, 13568, 1024, 1024, 1024, 256]
    - [174, 42.95]
  - - [1024, 1024, 1, 1, 1024, 1024, 1024, 1024]
    - [102, 0.22]
  - - [1024, 2, 1, 10, 1024, 1024, 1024, 2]
    - [1, 0.004]
  - - [64, 21, 6144, 21, 64, 64, 393216, 21]
    - [159, 4.844]
  - - [64, 4, 32768, 4, 64, 64, 2097152, 4]
    - [3, 0.334]
  - - [1024, 256, 1, 28672, 1024, 1024, 1024, 256]
    - [169, 45.63]
  - - [34, 64, 4736, 34, 34, 34, 34, 303104]
    - [74, 8.652]
  - - [128, 64, 512, 128, 128, 128, 128, 64]
    - [83, 32.31]
  - - [256, 20992, 1, 8976, 256, 256, 256, 20992]
    - [104, 87.789]
  - - [1024, 256, 1, 4352, 1024, 1024, 1024, 256]
    - [169, 34.608]
  - - [256, 5888, 1, 8976, 256, 256, 256, 5888]
    - [119, 70.557]
  - - [64, 31, 2048, 31, 64, 64, 131072, 31]
    - [75, 6.996]
  - - [512, 64, 1, 512, 512, 512, 512, 64]
    - [44, 2.638]
  - - [1024, 1024, 1, 10, 1024, 1024, 1024, 1024]
    - [149, 2.002]
  - - [512, 32, 1, 200, 512, 512, 512, 32]
    - [31, 0.563]
  - - [5, 64, 960, 5, 5, 5, 5, 64]
    - [85, 0.211]
  - - [64, 35, 4608, 35, 64, 64, 294912, 35]
    - [3, 8.968]
  - - [1024, 2, 1, 5120, 1024, 1024, 1024, 2]
    - [78, 0.434]
  - - [1920, 2048, 1, 2048, 2080, 2080, 2080, 2080]
    - [49, 90.963]
  - - [2048, 2048, 1, 2048, 2080, 2080, 2080, 2080]
    - [134, 78.046]
  - - [1024, 256, 1, 9728, 1024, 1024, 1024, 256]
    - [131, 41.04]
  - - [4096, 1024, 1, 8160, 4096, 4096, 4096, 1024]
    - [113, 80.133]
  - - [64, 34, 4736, 24, 64, 64, 303104, 34]
    - [67, 7.067]
  - - [256, 26112, 1, 8976, 256, 256, 256, 26112]
    - [25, 90.385]
  - - [3840, 4096, 1, 4096, 4192, 4192, 4192, 4192]
    - [110, 96.05]
  - - [1024, 4096, 1, 5120, 1024, 1024, 1024, 4096]
    - [34, 78.734]
  - - [64, 128, 160, 128, 64, 64, 64, 128]
    - [152, 23.79]
  - - [1024, 1024, 1, 10064, 1024, 1024, 1024, 1024]
    - [128, 59.101]
  - - [256, 5120, 1, 8976, 256, 256, 256, 5120]
    - [99, 72.411]
  - - [35, 64, 4608, 35, 35, 35, 35, 294912]
    - [74, 8.68]
  - - [1024, 30522, 1, 308, 1024, 1024, 1024, 30522]
    - [176, 77.261]
  - - [1024, 30522, 1, 820, 1024, 1024, 1024, 30522]
    - [157, 88.096]
  - - [1024, 30522, 1, 200, 1024, 1024, 1024, 30522]
    - [164, 68.701]
  - - [15, 64, 10880, 14, 15, 15, 15, 696320]
    - [144, 3.35]
  - - [1024, 30522, 1, 462, 1024, 1024, 1024, 30522]
    - [167, 81.355]
  - - [256, 8960, 1, 8976, 256, 256, 256, 8960]
    - [189, 74.392]
  - - [15, 64, 7680, 15, 15, 15, 15, 491520]
    - [64, 3.376]
  - - [1024, 1024, 1, 8064, 1024, 1024, 1024, 1024]
    - [128, 59.813]
  - - [13, 512, 1, 32768, 13, 13, 13, 512]
    - [42, 1.476]
  - - [256, 5632, 1, 8976, 256, 256, 256, 5632]
    - [170, 72.586]
  - - [256, 32512, 1, 8976, 256, 256, 256, 32512]
    - [27, 88.594]
  - - [64, 17, 7680, 15, 64, 64, 491520, 17]
    - [59, 3.332]
  - - [17, 64, 6144, 17, 17, 17, 17, 393216]
    - [137, 3.661]
  - - [1024, 2, 1, 1024, 1024, 1024, 1024, 2]
    - [77, 0.225]
  - - [1024, 4096, 1, 4096, 1024, 1024, 1024, 4096]
    - [68, 77.989]
  - - [64, 512, 1, 512, 64, 64, 64, 512]
    - [183, 2.755]
  - - [1024, 30522, 1, 77, 1024, 1024, 1024, 30522]
    - [150, 39.651]
  - - [256, 11264, 1, 8976, 256, 256, 256, 11264]
    - [27, 88.629]
  - - [1024, 1024, 1, 40, 1024, 1024, 1024, 1024]
    - [96, 7.851]
  - - [1024, 1024, 1, 9520, 1024, 1024, 1024, 1024]
    - [128, 58.865]
  - - [1024, 2, 1, 1, 1024, 1024, 1024, 2]
    - [86, 0.001]
  - - [1024, 1024, 1, 3840, 1024, 1024, 1024, 1024]
    - [179, 57.18]
  - - [512, 512, 1, 1600, 512, 512, 512, 512]
    - [70, 25.655]
  - - [1024, 512, 1, 32768, 1024, 1024, 1024, 512]
    - [127, 51.056]
  - - [256, 15872, 1, 8976, 256, 256, 256, 15872]
    - [8, 80.328]
  - - [1024, 2, 1, 8, 1024, 1024, 1024, 2]
    - [1, 0.004]
  - - [3200, 2048, 1, 1024, 3200, 3200, 3200, 2048]
    - [62, 81.934]
  - - [1024, 1024, 1, 8, 1024, 1024, 1024, 1024]
    - [94, 1.939]
  - - [1024, 42720, 1, 7200, 1024, 1024, 1024, 42720]
    - [113, 94.066]
  - - [1024, 30528, 1, 4096, 1024, 1024, 1024, 30528]
    - [161, 95.32]
  - - [27, 128, 32768, 27, 27, 27, 27, 128]
    - [132, 9.525]
  - - [1024, 256, 1, 1024, 1024, 1024, 1024, 256]
    - [43, 21.023]
  - - [64, 15, 7680, 15, 64, 64, 491520, 15]
    - [65, 2.969]
  - - [560, 1024, 1, 1600, 560, 560, 560, 1024]
    - [50, 39.937]
  - - [256, 128, 1, 32768, 256, 256, 256, 128]
    - [82, 7.68]
  - - [512, 2048, 1, 256, 512, 512, 512, 2048]
    - [103, 33.054]
  - - [1024, 256, 1, 21248, 1024, 1024, 1024, 256]
    - [72, 44.61]
  - - [256, 12544, 1, 8976, 256, 256, 256, 12544]
    - [145, 78.862]
  - - [1024, 1024, 1, 9600, 1024, 1024, 1024, 1024]
    - [128, 60.233]
  - - [4096, 1024, 1, 5120, 4096, 4096, 4096, 1024]
    - [125, 79.387]
  - - [1024, 4096, 1, 3072, 1024, 1024, 1024, 4096]
    - [68, 77.619]
  - - [1024, 256, 1, 21504, 1024, 1024, 1024, 256]
    - [51, 44.651]
  - - [32, 64, 4608, 32, 32, 32, 32, 294912]
    - [133, 13.522]
  - - [1024, 1024, 1, 1152, 1024, 1024, 1024, 1024]
    - [195, 49.8]
  - - [512, 480, 1, 512, 544, 544, 544, 544]
    - [93, 17.842]
  - - [1024, 1024, 1, 1024, 1024, 1024, 1024, 1024]
    - [112, 49.017]
  - - [1024, 4096, 1, 8160, 1024, 1024, 1024, 4096]
    - [172, 79.261]
  - - [67, 2048, 1, 512, 67, 67, 67, 2048]
    - [36, 9.46]
  - - [1024, 256, 1, 8192, 1024, 1024, 1024, 256]
    - [72, 39.914]
  - - [64, 15, 10880, 14, 64, 64, 696320, 15]
    - [38, 2.921]
  - - [64, 128, 1, 128, 64, 64, 64, 128]
    - [71, 0.246]
  - - [1024, 256, 1, 4608, 1024, 1024, 1024, 256]
    - [45, 35.162]
  - - [1024, 1024, 1, 5120, 1024, 1024, 1024, 1024]
    - [111, 58.66]
  - - [256, 17408, 1, 8976, 256, 256, 256, 17408]
    - [27, 84.664]
  - - [1024, 1024, 1, 32, 1024, 1024, 1024, 1024]
    - [171, 7.566]
  - - [1024, 42720, 1, 10080, 1024, 1024, 1024, 42720]
    - [28, 93.959]
  - - [256, 32768, 1, 1, 256, 256, 256, 32768]
    - [14, 0.71]
  - - [256, 4096, 1, 8976, 256, 256, 256, 4096]
    - [20, 57.739]
  - - [256, 14848, 1, 8976, 256, 256, 256, 14848]
    - [40, 92.161]
  - - [24, 64, 4736, 24, 24, 24, 24, 303104]
    - [162, 6.382]
  - - [64, 17, 7680, 17, 64, 64, 491520, 17]
    - [108, 3.662]
  - - [1024, 2, 1, 3072, 1024, 1024, 1024, 2]
    - [30, 0.364]
  - - [256, 20480, 1, 8976, 256, 256, 256, 20480]
    - [104, 85.682]
  - - [1024, 4096, 1, 2048, 1024, 1024, 1024, 4096]
    - [190, 76.451]
  - - [7680, 8192, 1, 8192, 8384, 8384, 8384, 8384]
    - [28, 97.125]
  - - [4096, 1024, 1, 8192, 4096, 4096, 4096, 1024]
    - [61, 79.898]
  - - [512, 512, 1, 200, 512, 512, 512, 512]
    - [31, 8.316]
  - - [1024, 2, 1, 1280, 1024, 1024, 1024, 2]
    - [107, 0.243]
  - - [256, 2816, 1, 8976, 256, 256, 256, 2816]
    - [146, 62.752]
  - - [1024, 1024, 1, 1600, 1024, 1024, 1024, 1024]
    - [126, 52.51]
  - - [479, 1024, 1, 32768, 479, 479, 479, 1024]
    - [138, 46.938]
  - - [64, 128, 512, 128, 64, 64, 64, 128]
    - [33, 32.414]
  - - [4096, 1024, 1, 3968, 4096, 4096, 4096, 1024]
    - [122, 78.981]
  - - [1024, 256, 1, 2304, 1024, 1024, 1024, 256]
    - [70, 29.515]
  - - [1024, 1024, 1, 200, 1024, 1024, 1024, 1024]
    - [26, 23.225]
  - - [256, 16128, 1, 8976, 256, 256, 256, 16128]
    - [20, 82.029]
- null
