TRAIN_3.7/build/3_LibraryLogic_eff/arcturus_Cijk_Alik_Bljk_HBH.yaml
- {MinimumRequiredVersion: 4.20.0}
- arcturus
- gfx908
- [Device 7380, Device 7388, Device 738c, Device 7390]
    SolutionIndex: 0
    SolutionIndex: 1
    SolutionIndex: 2
    SolutionIndex: 3
    SolutionIndex: 4
    SolutionIndex: 5
    SolutionIndex: 6
    SolutionIndex: 7
    SolutionIndex: 8
    SolutionIndex: 9
    SolutionIndex: 10
    SolutionIndex: 11
    SolutionIndex: 12
    SolutionIndex: 13
    SolutionIndex: 14
    SolutionIndex: 15
    SolutionIndex: 16
    SolutionIndex: 17
    SolutionIndex: 18
    SolutionIndex: 19
    SolutionIndex: 20
    SolutionIndex: 21
    SolutionIndex: 22
    SolutionIndex: 23
    SolutionIndex: 24
    SolutionIndex: 25
    SolutionIndex: 26
    SolutionIndex: 27
    SolutionIndex: 28
    SolutionIndex: 29
    SolutionIndex: 30
    SolutionIndex: 31
    SolutionIndex: 32
    SolutionIndex: 33
    SolutionIndex: 34
    SolutionIndex: 35
    SolutionIndex: 36
    SolutionIndex: 37
    SolutionIndex: 38
    SolutionIndex: 39
    SolutionIndex: 40
    SolutionIndex: 41
    SolutionIndex: 42
    SolutionIndex: 43
    SolutionIndex: 44
    SolutionIndex: 45
    SolutionIndex: 46
    SolutionIndex: 47
    SolutionIndex: 48
    SolutionIndex: 49
    SolutionIndex: 50
    SolutionIndex: 51
    SolutionIndex: 52
    SolutionIndex: 53
    SolutionIndex: 54
    SolutionIndex: 55
    SolutionIndex: 56
    SolutionIndex: 57
    SolutionIndex: 58
    SolutionIndex: 59
    SolutionIndex: 60
    SolutionIndex: 61
    SolutionIndex: 62
    SolutionIndex: 63
    SolutionIndex: 64
    SolutionIndex: 65
    SolutionIndex: 66
    SolutionIndex: 67
    SolutionIndex: 68
    SolutionIndex: 69
    SolutionIndex: 70
    SolutionIndex: 71
    SolutionIndex: 72
    SolutionIndex: 73
    SolutionIndex: 74
    SolutionIndex: 75
    SolutionIndex: 76
    SolutionIndex: 77
    SolutionIndex: 78
    SolutionIndex: 79
    SolutionIndex: 80
    SolutionIndex: 81
    SolutionIndex: 82
    SolutionIndex: 83
    SolutionIndex: 84
    SolutionIndex: 85
    SolutionIndex: 86
    SolutionIndex: 87
    SolutionIndex: 88
    SolutionIndex: 89
    SolutionIndex: 90
    SolutionIndex: 91
    SolutionIndex: 92
    SolutionIndex: 93
    SolutionIndex: 94
    SolutionIndex: 95
    SolutionIndex: 96
    SolutionIndex: 97
    SolutionIndex: 98
    SolutionIndex: 99
    SolutionIndex: 100
    SolutionIndex: 101
    SolutionIndex: 102
    SolutionIndex: 103
    SolutionIndex: 104
    SolutionIndex: 105
    SolutionIndex: 106
    SolutionIndex: 107
    SolutionIndex: 108
    SolutionIndex: 109
    SolutionIndex: 110
    SolutionIndex: 111
    SolutionIndex: 112
    SolutionIndex: 113
    SolutionIndex: 114
    SolutionIndex: 115
    SolutionIndex: 116
    SolutionIndex: 117
    SolutionIndex: 118
    SolutionIndex: 119
    SolutionIndex: 120
    SolutionIndex: 121
    SolutionIndex: 122
    SolutionIndex: 123
    SolutionIndex: 124
    SolutionIndex: 125
    SolutionIndex: 126
    SolutionIndex: 127
    SolutionIndex: 128
    SolutionIndex: 129
    SolutionIndex: 130
    SolutionIndex: 131
    SolutionIndex: 132
    SolutionIndex: 133
    SolutionIndex: 134
    SolutionIndex: 135
    SolutionIndex: 136
    SolutionIndex: 137
    SolutionIndex: 138
    SolutionIndex: 139
    SolutionIndex: 140
    SolutionIndex: 141
    SolutionIndex: 142
    SolutionIndex: 143
- - - [7680, 8192, 1, 8192]
    - [13, 94.209]
  - - [3840, 4096, 1, 4096]
    - [76, 90.472]
  - - [1920, 2048, 1, 2048]
    - [65, 82.185]
  - - [480, 512, 1, 512]
    - [113, 13.084]
  - - [8192, 7680, 1, 8192]
    - [61, 94.147]
  - - [4096, 3840, 1, 4096]
    - [92, 91.906]
  - - [2048, 1920, 1, 2048]
    - [38, 83.551]
  - - [1024, 960, 1, 1024]
    - [74, 42.82]
  - - [512, 480, 1, 512]
    - [24, 14.187]
  - - [8192, 8192, 1, 8192]
    - [60, 89.731]
  - - [4096, 4096, 1, 4096]
    - [120, 82.08]
  - - [2048, 2048, 1, 2048]
    - [12, 58.763]
  - - [1024, 1024, 1, 1024]
    - [20, 37.919]
  - - [512, 512, 1, 512]
    - [25, 14.605]
  - - [2, 8, 1, 1024]
    - [1, 0.001]
  - - [512, 512, 16, 64]
    - [16, 15.603]
  - - [512, 512, 128, 64]
    - [63, 23.368]
  - - [1024, 77, 1, 1024]
    - [83, 6.996]
  - - [1024, 512, 1, 1024]
    - [138, 28.71]
  - - [1024, 512, 1, 4096]
    - [139, 33.663]
  - - [4096, 512, 1, 1024]
    - [138, 40.275]
  - - [30522, 77, 1, 1024]
    - [47, 31.676]
  - - [30522, 616, 1, 1024]
    - [114, 62.129]
  - - [2, 10, 1, 1024]
    - [21, 0.002]
  - - [128, 128, 128, 64]
    - [16, 11.018]
  - - [128, 128, 160, 64]
    - [95, 12.461]
  - - [1024, 10, 1, 1024]
    - [23, 1.211]
  - - [1024, 200, 1, 1024]
    - [115, 14.868]
  - - [1024, 1280, 1, 1024]
    - [75, 45.02]
  - - [1024, 1280, 1, 4096]
    - [134, 44.779]
  - - [4096, 1280, 1, 1024]
    - [33, 60.388]
  - - [30522, 160, 1, 1024]
    - [75, 38.549]
  - - [30522, 200, 1, 1024]
    - [78, 46.354]
  - - [2, 39, 1, 1024]
    - [21, 0.008]
  - - [128, 128, 624, 64]
    - [96, 15.864]
  - - [1024, 39, 1, 1024]
    - [36, 4.115]
  - - [1024, 780, 1, 1024]
    - [138, 34.634]
  - - [1024, 4992, 1, 1024]
    - [132, 58.737]
  - - [1024, 4992, 1, 4096]
    - [110, 66.898]
  - - [4096, 4992, 1, 1024]
    - [132, 66.784]
  - - [30522, 780, 1, 1024]
    - [120, 60.419]
  - - [2, 4, 1, 1024]
    - [0, 0.001]
  - - [512, 512, 64, 64]
    - [109, 22.28]
  - - [1024, 4, 1, 1024]
    - [101, 0.462]
  - - [1024, 308, 1, 1024]
    - [106, 19.884]
  - - [1024, 2048, 1, 1024]
    - [26, 39.483]
  - - [1024, 2048, 1, 4096]
    - [72, 45.315]
  - - [4096, 2048, 1, 1024]
    - [114, 59.59]
  - - [30522, 308, 1, 1024]
    - [114, 51.744]
  - - [2, 40, 1, 1024]
    - [21, 0.008]
  - - [128, 128, 640, 64]
    - [116, 17.112]
  - - [1024, 40, 1, 1024]
    - [121, 4.005]
  - - [1024, 800, 1, 1024]
    - [108, 35.046]
  - - [1024, 5120, 1, 1024]
    - [132, 59.955]
  - - [1024, 5120, 1, 4096]
    - [110, 64.166]
  - - [4096, 5120, 1, 1024]
    - [82, 68.055]
  - - [30522, 800, 1, 1024]
    - [94, 61.399]
  - - [2, 41, 1, 1024]
    - [21, 0.008]
  - - [128, 128, 656, 64]
    - [10, 16.38]
  - - [1024, 41, 1, 1024]
    - [137, 4.064]
  - - [1024, 820, 1, 1024]
    - [138, 35.292]
  - - [1024, 5248, 1, 1024]
    - [132, 60.444]
  - - [1024, 5248, 1, 4096]
    - [125, 68.323]
  - - [4096, 5248, 1, 1024]
    - [58, 68.413]
  - - [30522, 820, 1, 1024]
    - [94, 62.426]
  - - [2, 5, 1, 1024]
    - [0, 0.001]
  - - [512, 512, 80, 64]
    - [16, 22.92]
  - - [1024, 5, 1, 1024]
    - [22, 0.558]
  - - [1024, 385, 1, 1024]
    - [68, 22.623]
  - - [1024, 2560, 1, 1024]
    - [79, 47.85]
  - - [1024, 2560, 1, 4096]
    - [57, 56.294]
  - - [4096, 2560, 1, 1024]
    - [58, 64.621]
  - - [30522, 385, 1, 1024]
    - [120, 49.959]
  - - [2, 6, 1, 1024]
    - [21, 0.001]
  - - [512, 512, 96, 64]
    - [6, 23.153]
  - - [1024, 6, 1, 1024]
    - [67, 0.693]
  - - [1024, 462, 1, 1024]
    - [80, 22.897]
  - - [1024, 3072, 1, 1024]
    - [126, 55.722]
  - - [1024, 3072, 1, 4096]
    - [57, 67.326]
  - - [4096, 3072, 1, 1024]
    - [132, 64.344]
  - - [30522, 462, 1, 1024]
    - [136, 56.969]
  - - [1024, 8, 1, 1024]
    - [23, 0.97]
  - - [1024, 160, 1, 1024]
    - [105, 13.305]
  - - [1024, 1024, 1, 1024]
    - [75, 36.674]
  - - [1024, 1024, 1, 4096]
    - [135, 40.436]
  - - [4096, 1024, 1, 1024]
    - [132, 49.5]
  - - [2, 9, 1, 1024]
    - [1, 0.001]
  - - [128, 128, 144, 64]
    - [85, 11.975]
  - - [1024, 9, 1, 1024]
    - [23, 1.118]
  - - [1024, 180, 1, 1024]
    - [133, 13.587]
  - - [1024, 1152, 1, 1024]
    - [75, 40.811]
  - - [1024, 1152, 1, 4096]
    - [136, 46.473]
  - - [4096, 1152, 1, 1024]
    - [132, 55.619]
  - - [30522, 180, 1, 1024]
    - [73, 42.356]
  - - [128, 32768, 1, 256]
    - [51, 28.71]
  - - [256, 32768, 1, 512]
    - [20, 50.431]
  - - [512, 32768, 1, 13]
    - [64, 3.619]
  - - [512, 32768, 1, 1024]
    - [132, 66.464]
  - - [1024, 32768, 1, 479]
    - [18, 42.816]
  - - [1024, 32768, 1, 1024]
    - [57, 72.048]
  - - [2, 32, 1, 1024]
    - [21, 0.006]
  - - [64, 128, 512, 128]
    - [122, 14.777]
  - - [128, 128, 512, 64]
    - [127, 16.366]
  - - [1024, 32, 1, 1024]
    - [49, 3.609]
  - - [1024, 4096, 1, 1024]
    - [132, 49.439]
  - - [1024, 4096, 1, 4096]
    - [70, 57.77]
  - - [4096, 4096, 1, 1024]
    - [75, 66.217]
  - - [30528, 4096, 1, 1024]
    - [71, 74.65]
  - - [64, 512, 64, 512]
    - [54, 25.503]
  - - [30528, 2048, 1, 1024]
    - [79, 72.976]
  - - [4, 4, 32768, 64]
    - [2, 0.226]
  - - [4, 4, 38400, 64]
    - [0, 0.228]
  - - [1024, 8192, 1, 1024]
    - [132, 59.946]
  - - [1024, 8192, 1, 4096]
    - [118, 66.491]
  - - [1024, 9600, 1, 1024]
    - [99, 63.911]
  - - [1024, 9600, 1, 4096]
    - [58, 71.939]
  - - [4096, 8192, 1, 1024]
    - [58, 71.887]
  - - [4096, 9600, 1, 1024]
    - [69, 73.211]
  - - [33712, 8192, 1, 1024]
    - [84, 74.716]
  - - [33712, 9600, 1, 1024]
    - [77, 74.974]
  - - [1024, 10064, 1, 1024]
    - [59, 59.78]
  - - [1024, 10064, 1, 4096]
    - [57, 73.507]
  - - [1024, 10080, 1, 1024]
    - [59, 60.167]
  - - [1024, 10080, 1, 4096]
    - [57, 73.611]
  - - [1024, 10200, 1, 1024]
    - [59, 60.079]
  - - [1024, 10200, 1, 4096]
    - [93, 74.362]
  - - [1024, 3840, 1, 1024]
    - [79, 67.289]
  - - [1024, 3840, 1, 4096]
    - [124, 79.539]
  - - [1024, 3968, 1, 1024]
    - [70, 48.25]
  - - [1024, 3968, 1, 4096]
    - [70, 56.006]
  - - [1024, 6528, 1, 1024]
    - [59, 59.095]
  - - [1024, 6528, 1, 4096]
    - [94, 72.199]
  - - [1024, 7104, 1, 1024]
    - [114, 59.941]
  - - [1024, 7104, 1, 4096]
    - [57, 75.979]
  - - [1024, 7200, 1, 1024]
    - [125, 59.573]
  - - [1024, 7200, 1, 4096]
    - [57, 77.09]
  - - [1024, 8064, 1, 1024]
    - [132, 58.834]
  - - [1024, 8064, 1, 4096]
    - [12, 65.236]
  - - [1024, 8160, 1, 1024]
    - [125, 54.583]
  - - [1024, 8160, 1, 4096]
    - [125, 65.675]
  - - [1024, 9216, 1, 1024]
    - [110, 63.154]
  - - [1024, 9216, 1, 4096]
    - [69, 68.681]
  - - [1024, 9520, 1, 1024]
    - [99, 61.744]
  - - [1024, 9520, 1, 4096]
    - [57, 69.755]
  - - [4096, 10064, 1, 1024]
    - [8, 70.465]
  - - [4096, 10080, 1, 1024]
    - [8, 70.489]
  - - [4096, 10200, 1, 1024]
    - [8, 71.214]
  - - [4096, 3840, 1, 1024]
    - [93, 72.222]
  - - [4096, 3968, 1, 1024]
    - [114, 64.627]
  - - [4096, 6528, 1, 1024]
    - [58, 72.505]
  - - [4096, 7104, 1, 1024]
    - [94, 67.403]
  - - [4096, 7200, 1, 1024]
    - [94, 68.165]
  - - [4096, 8064, 1, 1024]
    - [58, 70.843]
  - - [4096, 8160, 1, 1024]
    - [7, 69.463]
  - - [4096, 9216, 1, 1024]
    - [58, 72.683]
  - - [4096, 9520, 1, 1024]
    - [77, 70.598]
  - - [42720, 10080, 1, 1024]
    - [94, 74.802]
  - - [42720, 3968, 1, 1024]
    - [58, 73.647]
  - - [42720, 6528, 1, 1024]
    - [94, 75.062]
  - - [42720, 7104, 1, 1024]
    - [94, 74.416]
  - - [42720, 7200, 1, 1024]
    - [94, 73.824]
  - - [42720, 9520, 1, 1024]
    - [94, 74.49]
  - - [14, 14, 10880, 64]
    - [2, 2.447]
  - - [15, 14, 10880, 64]
    - [4, 2.592]
  - - [15, 15, 7680, 64]
    - [4, 2.555]
  - - [15, 15, 10880, 64]
    - [2, 2.777]
  - - [17, 15, 7680, 64]
    - [0, 2.766]
  - - [17, 17, 6144, 64]
    - [4, 2.307]
  - - [17, 17, 7680, 64]
    - [89, 3.099]
  - - [21, 17, 6144, 64]
    - [48, 2.507]
  - - [21, 21, 6144, 64]
    - [55, 2.847]
  - - [24, 24, 4736, 64]
    - [28, 4.892]
  - - [30, 30, 2048, 64]
    - [50, 4.135]
  - - [30, 31, 2048, 64]
    - [56, 4.338]
  - - [31, 31, 2048, 64]
    - [37, 4.302]
  - - [32, 32, 4608, 64]
    - [14, 6.157]
  - - [32, 35, 4608, 64]
    - [9, 5.404]
  - - [34, 24, 4736, 64]
    - [31, 5.054]
  - - [34, 34, 4736, 64]
    - [5, 3.999]
  - - [35, 35, 4608, 64]
    - [53, 3.679]
  - - [64, 512, 1, 512]
    - [49, 2.908]
  - - [2, 2048, 1, 1024]
    - [21, 0.413]
  - - [512, 512, 1, 64]
    - [19, 3.271]
  - - [128, 128, 1, 64]
    - [3, 0.289]
  - - [64, 128, 1, 128]
    - [3, 0.265]
  - - [2, 1024, 1, 1024]
    - [35, 0.209]
  - - [2048, 512, 1, 2048]
    - [87, 39.875]
  - - [1024, 512, 1, 1600]
    - [46, 32.042]
  - - [2048, 512, 1, 74]
    - [11, 7.41]
  - - [5, 5, 1, 64]
    - [3, 0.0]
  - - [64, 512, 1, 1024]
    - [104, 3.738]
  - - [1024, 1600, 1, 560]
    - [17, 27.877]
  - - [33, 33, 1, 32]
    - [27, 0.007]
  - - [512, 1600, 1, 512]
    - [40, 29.963]
  - - [1024, 1600, 1, 1024]
    - [99, 44.353]
  - - [32, 1600, 1, 512]
    - [36, 4.158]
  - - [3, 3, 512, 64]
    - [0, 0.04]
  - - [5, 5, 512, 64]
    - [2, 0.126]
  - - [5, 5, 960, 64]
    - [41, 0.175]
  - - [9, 9, 512, 64]
    - [34, 0.395]
  - - [27, 27, 32768, 128]
    - [123, 8.15]
  - - [33, 33, 1600, 32]
    - [15, 2.147]
  - - [64, 960, 1, 1024]
    - [102, 5.888]
  - - [256, 684, 1, 1024]
    - [24, 13.212]
  - - [256, 1280, 1, 1024]
    - [103, 21.362]
  - - [256, 1536, 1, 1024]
    - [106, 23.699]
  - - [256, 2304, 1, 1024]
    - [108, 30.065]
  - - [256, 2560, 1, 1024]
    - [108, 33.054]
  - - [256, 2816, 1, 1024]
    - [107, 34.031]
  - - [256, 3328, 1, 1024]
    - [108, 36.448]
  - - [256, 3584, 1, 1024]
    - [98, 36.788]
  - - [256, 4608, 1, 1024]
    - [20, 40.518]
  - - [256, 4864, 1, 1024]
    - [132, 42.164]
  - - [256, 5376, 1, 1024]
    - [82, 45.953]
  - - [256, 5888, 1, 1024]
    - [114, 48.635]
  - - [256, 6144, 1, 1024]
    - [132, 50.75]
  - - [256, 6400, 1, 1024]
    - [132, 52.687]
  - - [256, 6656, 1, 1024]
    - [114, 53.713]
  - - [256, 7168, 1, 1024]
    - [99, 56.361]
  - - [256, 7424, 1, 1024]
    - [59, 57.273]
  - - [256, 7936, 1, 1024]
    - [107, 38.629]
  - - [256, 8192, 1, 1024]
    - [108, 39.639]
  - - [256, 8448, 1, 1024]
    - [107, 40.478]
  - - [256, 8960, 1, 1024]
    - [107, 42.271]
  - - [256, 9984, 1, 1024]
    - [111, 45.107]
  - - [256, 10496, 1, 1024]
    - [71, 47.42]
  - - [256, 11264, 1, 1024]
    - [43, 49.879]
  - - [256, 11520, 1, 1024]
    - [71, 50.921]
  - - [256, 11776, 1, 1024]
    - [126, 52.431]
  - - [256, 12544, 1, 1024]
    - [43, 54.659]
  - - [256, 13312, 1, 1024]
    - [126, 57.801]
  - - [256, 14336, 1, 1024]
    - [79, 61.485]
  - - [256, 14592, 1, 1024]
    - [71, 62.366]
  - - [256, 14848, 1, 1024]
    - [79, 63.459]
  - - [256, 15104, 1, 1024]
    - [13, 64.441]
  - - [256, 16128, 1, 1024]
    - [132, 48.666]
  - - [256, 18176, 1, 1024]
    - [132, 53.465]
  - - [256, 18944, 1, 1024]
    - [132, 55.458]
  - - [256, 19200, 1, 1024]
    - [132, 55.808]
  - - [256, 20480, 1, 1024]
    - [132, 59.388]
  - - [256, 20992, 1, 1024]
    - [114, 60.373]
  - - [256, 21248, 1, 1024]
    - [132, 61.109]
  - - [256, 21504, 1, 1024]
    - [132, 61.919]
  - - [256, 22016, 1, 1024]
    - [66, 62.296]
  - - [256, 22344, 1, 1024]
    - [114, 60.17]
  - - [256, 23296, 1, 1024]
    - [7, 53.114]
  - - [256, 23552, 1, 1024]
    - [30, 53.399]
  - - [256, 31488, 1, 1024]
    - [136, 56.883]
  - - [256, 33536, 1, 1024]
    - [12, 59.531]
  - - [256, 44505, 1, 1024]
    - [114, 62.568]
  - - [684, 8976, 1, 256]
    - [91, 34.207]
  - - [1024, 200, 1, 560]
    - [90, 9.414]
  - - [1024, 960, 1, 1024]
    - [117, 39.252]
  - - [1024, 960, 1, 1600]
    - [131, 41.817]
  - - [1024, 32768, 1, 480]
    - [65, 67.079]
  - - [1280, 8976, 1, 256]
    - [97, 41.082]
  - - [1792, 8976, 1, 256]
    - [97, 43.347]
  - - [2048, 114, 1, 512]
    - [130, 11.776]
  - - [2048, 114, 1, 768]
    - [86, 14.22]
  - - [2048, 215, 1, 512]
    - [80, 16.878]
  - - [2048, 215, 1, 768]
    - [62, 20.417]
  - - [2048, 256, 1, 512]
    - [119, 21.289]
  - - [2048, 256, 1, 768]
    - [39, 25.81]
  - - [2048, 512, 1, 67]
    - [16, 6.849]
  - - [2048, 512, 1, 100]
    - [16, 9.62]
  - - [2048, 684, 1, 512]
    - [52, 33.561]
  - - [2048, 684, 1, 768]
    - [127, 37.015]
  - - [2048, 960, 1, 74]
    - [91, 11.252]
  - - [2048, 960, 1, 2048]
    - [88, 44.228]
  - - [2048, 1536, 1, 512]
    - [45, 46.956]
  - - [2048, 1536, 1, 768]
    - [128, 53.323]
  - - [2048, 8976, 1, 256]
    - [32, 43.519]
  - - [2304, 8976, 1, 256]
    - [42, 44.237]
  - - [2560, 8976, 1, 256]
    - [29, 43.656]
  - - [2816, 8976, 1, 256]
    - [44, 44.723]
  - - [3072, 8976, 1, 256]
    - [32, 44.696]
  - - [3328, 8976, 1, 256]
    - [29, 45.238]
  - - [3840, 8976, 1, 256]
    - [44, 45.446]
  - - [4096, 8976, 1, 256]
    - [129, 45.031]
  - - [4352, 8976, 1, 256]
    - [29, 45.474]
  - - [4608, 8976, 1, 256]
    - [112, 45.727]
  - - [4864, 8976, 1, 256]
    - [44, 45.007]
  - - [5120, 8976, 1, 256]
    - [129, 47.132]
  - - [5376, 8976, 1, 256]
    - [112, 45.622]
  - - [5632, 8976, 1, 256]
    - [129, 45.377]
  - - [5888, 8976, 1, 256]
    - [100, 46.602]
  - - [6144, 8976, 1, 256]
    - [129, 46.229]
  - - [6400, 8976, 1, 256]
    - [129, 46.828]
  - - [7168, 8976, 1, 256]
    - [112, 47.707]
  - - [7936, 8976, 1, 256]
    - [94, 46.704]
  - - [8192, 8976, 1, 256]
    - [58, 47.153]
  - - [8448, 8976, 1, 256]
    - [100, 47.223]
  - - [8960, 8976, 1, 256]
    - [100, 47.918]
  - - [9472, 8976, 1, 256]
    - [94, 47.769]
  - - [9728, 8976, 1, 256]
    - [129, 48.256]
  - - [9984, 8976, 1, 256]
    - [112, 47.796]
  - - [10240, 8976, 1, 256]
    - [100, 48.653]
  - - [10496, 8976, 1, 256]
    - [129, 48.279]
  - - [11264, 8976, 1, 256]
    - [129, 48.022]
  - - [11776, 8976, 1, 256]
    - [129, 48.115]
  - - [12544, 8976, 1, 256]
    - [100, 48.212]
  - - [13312, 8976, 1, 256]
    - [100, 48.429]
  - - [13568, 8976, 1, 256]
    - [100, 48.791]
  - - [13824, 8976, 1, 256]
    - [100, 48.598]
  - - [15104, 8976, 1, 256]
    - [94, 48.982]
  - - [15360, 8976, 1, 256]
    - [94, 48.631]
  - - [15872, 8976, 1, 256]
    - [100, 48.898]
  - - [16128, 8976, 1, 256]
    - [112, 49.013]
  - - [17152, 8976, 1, 256]
    - [112, 49.271]
  - - [18176, 8976, 1, 256]
    - [100, 48.943]
  - - [18688, 8976, 1, 256]
    - [100, 49.54]
  - - [18944, 8976, 1, 256]
    - [100, 49.354]
  - - [19712, 8976, 1, 256]
    - [94, 49.485]
  - - [19968, 8976, 1, 256]
    - [94, 49.045]
  - - [20480, 8976, 1, 256]
    - [100, 49.417]
  - - [20992, 8976, 1, 256]
    - [94, 49.443]
  - - [21248, 8976, 1, 256]
    - [100, 49.179]
  - - [23552, 8976, 1, 256]
    - [112, 49.869]
  - - [28672, 8976, 1, 256]
    - [94, 49.916]
  - - [31488, 8976, 1, 256]
    - [94, 49.799]
  - - [33536, 8976, 1, 256]
    - [94, 49.855]
  - - [44505, 8976, 1, 256]
    - [94, 48.25]
  - - [480, 1024, 1, 1024]
    - [142, 24.405]
  - - [480, 2048, 1, 2048]
    - [140, 46.406]
  - - [1024, 480, 1, 1024]
    - [141, 27.385]
  - - [2048, 480, 1, 2048]
    - [143, 47.102]
- null
