TRAIN_3.7/build/3_LibraryLogic_eff/arcturus_Cijk_Ailk_Bljk_BBH.yaml
- {MinimumRequiredVersion: 4.20.0}
- arcturus
- gfx908
- [Device 7380, Device 7388, Device 738c, Device 7390]
- - - [1024, 8192, 1, 256, 1024, 1024, 1024, 256]
    - [26, 64.621]
  - - [1024, 9728, 1, 256, 1024, 1024, 1024, 256]
    - [49, 65.926]
  - - [64, 128, 624, 128, 64, 64, 64, 128]
    - [35, 29.089]
  - - [1024, 10, 1, 1024, 1024, 1024, 1024, 1024]
    - [125, 1.211]
  - - [1024, 22016, 1, 256, 1024, 1024, 1024, 256]
    - [49, 73.434]
  - - [2048, 2048, 1, 2048, 2080, 2080, 2080, 2080]
    - [83, 77.782]
  - - [1024, 10080, 1, 1024, 1024, 1024, 1024, 1024]
    - [139, 82.292]
  - - [1024, 7936, 1, 256, 1024, 1024, 1024, 256]
    - [49, 63.623]
  - - [1024, 1600, 1, 1, 1024, 1024, 1024, 1]
    - [109, 0.222]
  - - [1024, 10, 1, 2, 1024, 1024, 1024, 2]
    - [2, 0.004]
  - - [256, 8976, 1, 4352, 256, 256, 256, 4352]
    - [17, 70.98]
  - - [1024, 15104, 1, 256, 1024, 1024, 1024, 256]
    - [83, 70.444]
  - - [1024, 5, 1, 2, 1024, 1024, 1024, 2]
    - [2, 0.003]
  - - [1024, 9216, 1, 1024, 1024, 1024, 1024, 1024]
    - [100, 83.971]
  - - [74, 512, 1, 2048, 74, 74, 74, 2048]
    - [87, 6.398]
  - - [1024, 512, 1, 1024, 1024, 1024, 1024, 1024]
    - [123, 34.891]
  - - [512, 200, 1, 32, 512, 512, 512, 32]
    - [66, 0.84]
  - - [1024, 5, 1, 1024, 1024, 1024, 1024, 1024]
    - [21, 0.599]
  - - [512, 256, 1, 2048, 512, 512, 512, 2048]
    - [140, 19.398]
  - - [1024, 21504, 1, 256, 1024, 1024, 1024, 256]
    - [49, 73.423]
  - - [256, 8976, 1, 9984, 256, 256, 256, 9984]
    - [17, 73.413]
  - - [64, 5, 960, 5, 64, 64, 64, 5]
    - [3, 0.186]
  - - [64, 512, 16, 512, 64, 64, 64, 512]
    - [64, 26.868]
  - - [1024, 512, 1, 64, 1024, 1024, 1024, 64]
    - [5, 7.949]
  - - [1024, 1024, 1, 1024, 1056, 1056, 1056, 1056]
    - [72, 44.76]
  - - [1024, 9600, 1, 4096, 1024, 1024, 1024, 4096]
    - [117, 92.788]
  - - [1024, 3328, 1, 256, 1024, 1024, 1024, 256]
    - [89, 51.673]
  - - [1024, 1600, 1, 1024, 1024, 1024, 1024, 1024]
    - [118, 61.692]
  - - [64, 24, 4736, 24, 64, 64, 303104, 24]
    - [10, 4.526]
  - - [64, 15, 7680, 17, 64, 64, 491520, 17]
    - [10, 2.255]
  - - [256, 8976, 1, 9728, 256, 256, 256, 9728]
    - [25, 73.777]
  - - [1024, 4096, 1, 1024, 1024, 1024, 1024, 1024]
    - [86, 72.356]
  - - [512, 512, 64, 64, 512, 512, 512, 64]
    - [26, 35.196]
  - - [1024, 8192, 1, 1024, 1024, 1024, 1024, 1024]
    - [100, 83.089]
  - - [64, 5, 512, 5, 64, 64, 64, 5]
    - [2, 0.117]
  - - [1024, 7680, 1, 256, 1024, 1024, 1024, 256]
    - [89, 63.225]
  - - [1024, 1280, 1, 4096, 1024, 1024, 1024, 4096]
    - [137, 59.706]
  - - [512, 512, 1, 512, 544, 544, 544, 544]
    - [85, 17.691]
  - - [1024, 18944, 1, 256, 1024, 1024, 1024, 256]
    - [49, 71.941]
  - - [1024, 1152, 1, 1024, 1024, 1024, 1024, 1024]
    - [115, 47.597]
  - - [1024, 5248, 1, 2, 1024, 1024, 1024, 2]
    - [60, 0.815]
  - - [256, 8976, 1, 15872, 256, 256, 256, 15872]
    - [52, 74.135]
  - - [256, 8976, 1, 6144, 256, 256, 256, 6144]
    - [25, 70.899]
  - - [1024, 28672, 1, 256, 1024, 1024, 1024, 256]
    - [26, 74.949]
  - - [1024, 820, 1, 1024, 1024, 1024, 1024, 1024]
    - [17, 48.328]
  - - [1024, 6528, 1, 4096, 1024, 1024, 1024, 4096]
    - [15, 86.158]
  - - [1024, 10064, 1, 1024, 1024, 1024, 1024, 1024]
    - [139, 82.16]
  - - [4096, 1152, 1, 1024, 4096, 4096, 4096, 1024]
    - [26, 79.122]
  - - [256, 8976, 1, 33536, 256, 256, 256, 33536]
    - [50, 75.0]
  - - [1024, 308, 1, 30522, 1024, 1024, 1024, 30522]
    - [93, 44.83]
  - - [256, 8976, 1, 19968, 256, 256, 256, 19968]
    - [50, 74.129]
  - - [1024, 39, 1, 1024, 1024, 1024, 1024, 1024]
    - [45, 4.696]
  - - [1024, 616, 1, 1024, 1024, 1024, 1024, 1024]
    - [128, 38.625]
  - - [768, 215, 1, 2048, 768, 768, 768, 2048]
    - [33, 22.932]
  - - [64, 17, 6144, 17, 64, 64, 393216, 17]
    - [10, 2.465]
  - - [64, 512, 96, 512, 64, 64, 64, 512]
    - [73, 49.744]
  - - [1024, 39, 1, 2, 1024, 1024, 1024, 2]
    - [101, 0.021]
  - - [1024, 20992, 1, 256, 1024, 1024, 1024, 256]
    - [49, 72.788]
  - - [128, 128, 1, 64, 128, 128, 128, 64]
    - [6, 0.293]
  - - [1024, 3072, 1, 256, 1024, 1024, 1024, 256]
    - [100, 48.002]
  - - [3200, 1024, 1, 2048, 3200, 3200, 3200, 2048]
    - [96, 73.799]
  - - [1024, 160, 1, 30522, 1024, 1024, 1024, 30522]
    - [131, 34.512]
  - - [1024, 23552, 1, 256, 1024, 1024, 1024, 256]
    - [26, 73.792]
  - - [1024, 2560, 1, 1024, 1024, 1024, 1024, 1024]
    - [147, 70.963]
  - - [4096, 1024, 1, 1, 4096, 4096, 4096, 1]
    - [12, 0.344]
  - - [1024, 2560, 1, 256, 1024, 1024, 1024, 256]
    - [91, 46.178]
  - - [4096, 9600, 1, 1024, 4096, 4096, 4096, 1024]
    - [122, 87.939]
  - - [1024, 8, 1, 2, 1024, 1024, 1024, 2]
    - [2, 0.004]
  - - [1024, 800, 1, 1024, 1024, 1024, 1024, 1024]
    - [121, 46.043]
  - - [64, 128, 640, 128, 64, 64, 64, 128]
    - [3, 29.486]
  - - [4096, 3840, 1, 1024, 4096, 4096, 4096, 1024]
    - [139, 84.725]
  - - [560, 1600, 1, 1024, 560, 560, 560, 1024]
    - [55, 48.238]
  - - [256, 8976, 1, 14336, 256, 256, 256, 14336]
    - [48, 73.672]
  - - [4096, 1024, 1, 1024, 4096, 4096, 4096, 1024]
    - [147, 72.552]
  - - [256, 8976, 1, 3072, 256, 256, 256, 3072]
    - [135, 68.069]
  - - [1024, 8, 1, 1024, 1024, 1024, 1024, 1024]
    - [22, 0.952]
  - - [1024, 4608, 1, 256, 1024, 1024, 1024, 256]
    - [49, 57.972]
  - - [256, 8976, 1, 9472, 256, 256, 256, 9472]
    - [17, 73.467]
  - - [480, 32768, 1, 1024, 480, 480, 480, 1024]
    - [116, 79.94]
  - - [1024, 1024, 1, 2, 1024, 1024, 1024, 2]
    - [7, 0.326]
  - - [256, 8976, 1, 1536, 256, 256, 256, 1536]
    - [132, 64.701]
  - - [128, 27, 32768, 27, 128, 128, 128, 27]
    - [10, 6.349]
  - - [256, 8976, 1, 2816, 256, 256, 256, 2816]
    - [48, 68.696]
  - - [1024, 8064, 1, 1024, 1024, 1024, 1024, 1024]
    - [89, 81.705]
  - - [4096, 5248, 1, 1024, 4096, 4096, 4096, 1024]
    - [139, 86.154]
  - - [256, 8976, 1, 20992, 256, 256, 256, 20992]
    - [50, 74.283]
  - - [1024, 2048, 1, 30528, 1024, 1024, 1024, 30528]
    - [112, 68.57]
  - - [1024, 9520, 1, 1024, 1024, 1024, 1024, 1024]
    - [99, 80.429]
  - - [4096, 4096, 1, 4096, 4192, 4192, 4192, 4192]
    - [73, 90.514]
  - - [1024, 77, 1, 30522, 1024, 1024, 1024, 30522]
    - [130, 21.551]
  - - [1024, 8448, 1, 256, 1024, 1024, 1024, 256]
    - [31, 65.275]
  - - [1024, 9, 1, 2, 1024, 1024, 1024, 2]
    - [2, 0.004]
  - - [256, 8976, 1, 2304, 256, 256, 256, 2304]
    - [146, 67.272]
  - - [1024, 1024, 1, 4096, 1024, 1024, 1024, 4096]
    - [82, 49.318]
  - - [1024, 9, 1, 1024, 1024, 1024, 1024, 1024]
    - [54, 1.077]
  - - [64, 31, 2048, 31, 64, 64, 131072, 31]
    - [108, 5.708]
  - - [4096, 6528, 1, 1024, 4096, 4096, 4096, 1024]
    - [147, 87.169]
  - - [2048, 960, 1, 2048, 2048, 2048, 2048, 2048]
    - [77, 75.894]
  - - [1024, 14848, 1, 256, 1024, 1024, 1024, 256]
    - [49, 70.867]
  - - [1024, 780, 1, 1024, 1024, 1024, 1024, 1024]
    - [142, 45.425]
  - - [64, 4, 38400, 4, 64, 64, 2457600, 4]
    - [3, 0.21]
  - - [4096, 8160, 1, 1024, 4096, 4096, 4096, 1024]
    - [89, 86.895]
  - - [1024, 7104, 1, 1024, 1024, 1024, 1024, 1024]
    - [74, 79.762]
  - - [1024, 4096, 1, 2, 1024, 1024, 1024, 2]
    - [69, 0.674]
  - - [4096, 2560, 1, 1024, 4096, 4096, 4096, 1024]
    - [49, 84.441]
  - - [64, 128, 144, 128, 64, 64, 64, 128]
    - [102, 19.096]
  - - [1024, 780, 1, 30522, 1024, 1024, 1024, 30522]
    - [106, 74.961]
  - - [256, 8976, 1, 5888, 256, 256, 256, 5888]
    - [17, 72.085]
  - - [8192, 7680, 1, 8192, 8384, 8384, 8384, 8384]
    - [76, 96.855]
  - - [1024, 7200, 1, 42720, 1024, 1024, 1024, 42720]
    - [104, 91.354]
  - - [64, 34, 4736, 34, 64, 64, 303104, 34]
    - [3, 6.049]
  - - [1024, 3840, 1, 4096, 1024, 1024, 1024, 4096]
    - [117, 91.212]
  - - [64, 32, 4608, 32, 64, 64, 294912, 32]
    - [14, 12.13]
  - - [2048, 1024, 1, 1, 2048, 2048, 2048, 1]
    - [70, 0.243]
  - - [256, 8976, 1, 2560, 256, 256, 256, 2560]
    - [17, 68.006]
  - - [512, 215, 1, 2048, 512, 512, 512, 2048]
    - [87, 17.014]
  - - [4096, 4096, 1, 1024, 4096, 4096, 4096, 1024]
    - [122, 85.291]
  - - [256, 8976, 1, 26112, 256, 256, 256, 26112]
    - [50, 74.63]
  - - [64, 512, 64, 512, 64, 64, 64, 512]
    - [94, 40.765]
  - - [1024, 4864, 1, 256, 1024, 1024, 1024, 256]
    - [49, 54.988]
  - - [100, 512, 1, 2048, 100, 100, 100, 2048]
    - [98, 8.761]
  - - [1024, 11008, 1, 256, 1024, 1024, 1024, 256]
    - [26, 68.109]
  - - [1024, 13312, 1, 256, 1024, 1024, 1024, 256]
    - [89, 68.97]
  - - [1024, 960, 1, 1024, 1056, 1056, 1056, 1056]
    - [114, 60.388]
  - - [1024, 12288, 1, 256, 1024, 1024, 1024, 256]
    - [100, 68.356]
  - - [1024, 33536, 1, 256, 1024, 1024, 1024, 256]
    - [26, 75.827]
  - - [256, 8976, 1, 11008, 256, 256, 256, 11008]
    - [56, 73.549]
  - - [256, 1024, 1, 1, 256, 256, 256, 1]
    - [36, 0.063]
  - - [1024, 3072, 1, 2, 1024, 1024, 1024, 2]
    - [109, 0.609]
  - - [8192, 8192, 1, 8192, 8384, 8384, 8384, 8384]
    - [144, 95.407]
  - - [1024, 180, 1, 1024, 1024, 1024, 1024, 1024]
    - [43, 19.626]
  - - [2048, 1024, 1, 256, 2048, 2048, 2048, 256]
    - [73, 38.947]
  - - [256, 8976, 1, 2048, 256, 256, 256, 2048]
    - [55, 65.342]
  - - [1024, 1024, 1, 1024, 1024, 1024, 1024, 1024]
    - [12, 43.033]
  - - [4096, 10080, 1, 1024, 4096, 4096, 4096, 1024]
    - [147, 87.671]
  - - [1024, 14592, 1, 256, 1024, 1024, 1024, 256]
    - [49, 70.468]
  - - [1024, 180, 1, 30522, 1024, 1024, 1024, 30522]
    - [134, 37.686]
  - - [1024, 200, 1, 1, 1024, 1024, 1024, 1]
    - [53, 0.049]
  - - [256, 8976, 1, 5376, 256, 256, 256, 5376]
    - [17, 72.097]
  - - [1024, 2048, 1, 4096, 1024, 1024, 1024, 4096]
    - [113, 63.875]
  - - [1024, 512, 1, 2, 1024, 1024, 1024, 2]
    - [41, 0.226]
  - - [1024, 8192, 1, 4096, 1024, 1024, 1024, 4096]
    - [18, 86.789]
  - - [74, 960, 1, 2048, 74, 74, 74, 2048]
    - [62, 11.441]
  - - [1024, 385, 1, 30522, 1024, 1024, 1024, 30522]
    - [141, 52.498]
  - - [512, 512, 1, 64, 512, 512, 512, 64]
    - [44, 4.302]
  - - [1024, 7104, 1, 42720, 1024, 1024, 1024, 42720]
    - [104, 90.063]
  - - [1024, 14336, 1, 256, 1024, 1024, 1024, 256]
    - [83, 69.851]
  - - [1024, 20480, 1, 256, 1024, 1024, 1024, 256]
    - [26, 73.133]
  - - [1024, 10200, 1, 4096, 1024, 1024, 1024, 4096]
    - [127, 87.34]
  - - [4096, 512, 1, 1024, 4096, 4096, 4096, 1024]
    - [97, 57.42]
  - - [32, 33, 1600, 33, 32, 32, 32, 33]
    - [20, 3.598]
  - - [1024, 8160, 1, 1024, 1024, 1024, 1024, 1024]
    - [120, 80.274]
  - - [1024, 160, 1, 1024, 1024, 1024, 1024, 1024]
    - [45, 18.691]
  - - [1024, 5120, 1, 4096, 1024, 1024, 1024, 4096]
    - [117, 82.517]
  - - [1024, 2048, 1, 256, 1024, 1024, 1024, 256]
    - [97, 38.947]
  - - [1024, 3840, 1, 1024, 1024, 1024, 1024, 1024]
    - [100, 76.98]
  - - [1024, 32768, 1, 1024, 1024, 1024, 1024, 1024]
    - [18, 88.813]
  - - [2048, 1920, 1, 2048, 2080, 2080, 2080, 2080]
    - [61, 88.35]
  - - [1024, 462, 1, 1024, 1024, 1024, 1024, 1024]
    - [110, 32.852]
  - - [128, 128, 512, 64, 128, 128, 128, 64]
    - [18, 25.248]
  - - [1024, 462, 1, 30522, 1024, 1024, 1024, 30522]
    - [103, 45.498]
  - - [256, 8976, 1, 44505, 256, 256, 256, 44505]
    - [90, 73.545]
  - - [1024, 5632, 1, 256, 1024, 1024, 1024, 256]
    - [89, 60.732]
  - - [1024, 77, 1, 1024, 1024, 1024, 1024, 1024]
    - [54, 9.104]
  - - [960, 1024, 1, 1024, 1056, 1056, 1056, 1056]
    - [92, 63.438]
  - - [1024, 4096, 1, 256, 1024, 1024, 1024, 256]
    - [61, 52.61]
  - - [1024, 40, 1, 2, 1024, 1024, 1024, 2]
    - [67, 0.021]
  - - [64, 5, 1, 5, 64, 64, 64, 5]
    - [67, 0.0]
  - - [1024, 512, 1, 1, 1024, 1024, 1024, 1]
    - [7, 0.115]
  - - [1024, 40, 1, 1024, 1024, 1024, 1024, 1024]
    - [39, 4.815]
  - - [1600, 512, 1, 1024, 1600, 1600, 1600, 1024]
    - [78, 51.648]
  - - [4096, 5120, 1, 1024, 4096, 4096, 4096, 1024]
    - [89, 86.513]
  - - [4096, 9216, 1, 1024, 4096, 4096, 4096, 1024]
    - [133, 87.727]
  - - [4096, 3968, 1, 1024, 4096, 4096, 4096, 1024]
    - [26, 85.696]
  - - [256, 8976, 1, 7168, 256, 256, 256, 7168]
    - [30, 72.811]
  - - [1024, 9520, 1, 4096, 1024, 1024, 1024, 4096]
    - [117, 90.49]
  - - [1024, 10064, 1, 4096, 1024, 1024, 1024, 4096]
    - [18, 87.26]
  - - [1024, 1792, 1, 256, 1024, 1024, 1024, 256]
    - [129, 46.521]
  - - [256, 8976, 1, 7424, 256, 256, 256, 7424]
    - [17, 73.25]
  - - [256, 8976, 1, 12288, 256, 256, 256, 12288]
    - [82, 73.289]
  - - [67, 512, 1, 2048, 67, 67, 67, 2048]
    - [38, 5.643]
  - - [1024, 5120, 1, 256, 1024, 1024, 1024, 256]
    - [26, 57.486]
  - - [256, 32768, 1, 128, 256, 256, 256, 128]
    - [116, 44.462]
  - - [1024, 6144, 1, 256, 1024, 1024, 1024, 256]
    - [79, 59.931]
  - - [512, 200, 1, 1, 512, 512, 512, 1]
    - [7, 0.025]
  - - [256, 8976, 1, 4864, 256, 256, 256, 4864]
    - [17, 71.568]
  - - [4096, 7104, 1, 1024, 4096, 4096, 4096, 1024]
    - [147, 86.531]
  - - [1024, 200, 1, 30522, 1024, 1024, 1024, 30522]
    - [145, 39.741]
  - - [1024, 11520, 1, 256, 1024, 1024, 1024, 256]
    - [100, 67.289]
  - - [1024, 10496, 1, 256, 1024, 1024, 1024, 256]
    - [83, 66.536]
  - - [1024, 41, 1, 2, 1024, 1024, 1024, 2]
    - [2, 0.021]
  - - [256, 8976, 1, 5632, 256, 256, 256, 5632]
    - [30, 72.24]
  - - [1024, 200, 1, 1024, 1024, 1024, 1024, 1024]
    - [57, 20.659]
  - - [4096, 8192, 1, 1024, 4096, 4096, 4096, 1024]
    - [133, 87.675]
  - - [4096, 9520, 1, 1024, 4096, 4096, 4096, 1024]
    - [133, 87.287]
  - - [1024, 41, 1, 1024, 1024, 1024, 1024, 1024]
    - [59, 4.847]
  - - [1024, 4992, 1, 4096, 1024, 1024, 1024, 4096]
    - [75, 80.669]
  - - [1024, 10200, 1, 1024, 1024, 1024, 1024, 1024]
    - [139, 82.994]
  - - [4096, 1280, 1, 1024, 4096, 4096, 4096, 1024]
    - [89, 76.357]
  - - [256, 8976, 1, 11520, 256, 256, 256, 11520]
    - [17, 73.772]
  - - [1024, 2560, 1, 4096, 1024, 1024, 1024, 4096]
    - [24, 77.593]
  - - [1024, 4992, 1, 2, 1024, 1024, 1024, 2]
    - [11, 0.785]
  - - [64, 35, 4608, 35, 64, 64, 294912, 35]
    - [124, 5.784]
  - - [64, 3, 512, 3, 64, 64, 64, 3]
    - [2, 0.042]
  - - [1024, 6528, 1, 1024, 1024, 1024, 1024, 1024]
    - [89, 82.391]
  - - [64, 30, 2048, 30, 64, 64, 131072, 30]
    - [10, 5.465]
  - - [1024, 4096, 1, 30528, 1024, 1024, 1024, 30528]
    - [71, 82.229]
  - - [768, 256, 1, 2048, 768, 768, 768, 2048]
    - [63, 26.443]
  - - [256, 8976, 1, 8448, 256, 256, 256, 8448]
    - [17, 73.283]
  - - [512, 32768, 1, 256, 512, 512, 512, 256]
    - [49, 70.701]
  - - [1024, 40448, 1, 256, 1024, 1024, 1024, 256]
    - [26, 76.066]
  - - [256, 8976, 1, 22016, 256, 256, 256, 22016]
    - [50, 74.352]
  - - [32, 33, 1, 33, 32, 32, 32, 33]
    - [101, 0.009]
  - - [7680, 8192, 1, 8192, 8384, 8384, 8384, 8384]
    - [76, 96.767]
  - - [4096, 3072, 1, 1024, 4096, 4096, 4096, 1024]
    - [23, 84.117]
  - - [1024, 8064, 1, 4096, 1024, 1024, 1024, 4096]
    - [18, 86.294]
  - - [64, 14, 10880, 14, 64, 64, 696320, 14]
    - [10, 1.918]
  - - [1024, 19712, 1, 256, 1024, 1024, 1024, 256]
    - [49, 72.338]
  - - [64, 31, 2048, 30, 64, 64, 131072, 30]
    - [10, 5.593]
  - - [1024, 32, 1, 2, 1024, 1024, 1024, 2]
    - [5, 0.018]
  - - [1024, 9984, 1, 256, 1024, 1024, 1024, 256]
    - [95, 66.739]
  - - [2048, 512, 1, 2048, 2048, 2048, 2048, 2048]
    - [81, 46.307]
  - - [1024, 16128, 1, 256, 1024, 1024, 1024, 256]
    - [83, 70.843]
  - - [256, 8976, 1, 20480, 256, 256, 256, 20480]
    - [50, 74.154]
  - - [256, 8976, 1, 15104, 256, 256, 256, 15104]
    - [17, 73.768]
  - - [1024, 9600, 1, 1024, 1024, 1024, 1024, 1024]
    - [117, 82.202]
  - - [1024, 10080, 1, 42720, 1024, 1024, 1024, 42720]
    - [71, 91.355]
  - - [4096, 7200, 1, 1024, 4096, 4096, 4096, 1024]
    - [147, 85.874]
  - - [2048, 512, 1, 1, 2048, 2048, 2048, 1]
    - [2, 0.166]
  - - [512, 1600, 1, 512, 512, 512, 512, 512]
    - [138, 40.888]
  - - [1024, 385, 1, 1024, 1024, 1024, 1024, 1024]
    - [32, 31.222]
  - - [1024, 960, 1, 1024, 1024, 1024, 1024, 1024]
    - [114, 54.77]
  - - [256, 8976, 1, 8192, 256, 256, 256, 8192]
    - [42, 71.408]
  - - [4096, 2048, 1, 1024, 4096, 4096, 4096, 1024]
    - [89, 82.66]
  - - [64, 4, 32768, 4, 64, 64, 2097152, 4]
    - [3, 0.207]
  - - [1024, 2048, 1, 1024, 1024, 1024, 1024, 1024]
    - [65, 57.833]
  - - [64, 128, 656, 128, 64, 64, 64, 128]
    - [14, 29.596]
  - - [64, 512, 128, 512, 64, 64, 64, 512]
    - [68, 48.897]
  - - [1024, 4992, 1, 1024, 1024, 1024, 1024, 1024]
    - [115, 75.364]
  - - [1024, 1152, 1, 2, 1024, 1024, 1024, 2]
    - [101, 0.353]
  - - [256, 8976, 1, 10496, 256, 256, 256, 10496]
    - [30, 73.521]
  - - [1024, 5248, 1, 4096, 1024, 1024, 1024, 4096]
    - [117, 84.423]
  - - [1024, 17152, 1, 256, 1024, 1024, 1024, 256]
    - [26, 71.439]
  - - [1024, 9600, 1, 33712, 1024, 1024, 1024, 33712]
    - [80, 95.871]
  - - [1024, 3072, 1, 4096, 1024, 1024, 1024, 4096]
    - [75, 73.682]
  - - [64, 17, 6144, 21, 64, 64, 393216, 21]
    - [10, 2.962]
  - - [1024, 9216, 1, 4096, 1024, 1024, 1024, 4096]
    - [117, 89.619]
  - - [1024, 32768, 1, 512, 1024, 1024, 1024, 512]
    - [61, 85.179]
  - - [1024, 7200, 1, 1024, 1024, 1024, 1024, 1024]
    - [100, 80.015]
  - - [4096, 3840, 1, 4096, 4192, 4192, 4192, 4192]
    - [122, 94.811]
  - - [1024, 6, 1, 1024, 1024, 1024, 1024, 1024]
    - [58, 0.701]
  - - [256, 8976, 1, 19712, 256, 256, 256, 19712]
    - [50, 74.165]
  - - [1024, 5120, 1, 1024, 1024, 1024, 1024, 1024]
    - [115, 77.177]
  - - [1024, 8192, 1, 33712, 1024, 1024, 1024, 33712]
    - [77, 89.951]
  - - [1024, 308, 1, 1024, 1024, 1024, 1024, 1024]
    - [126, 27.476]
  - - [3840, 4096, 1, 4096, 4192, 4192, 4192, 4192]
    - [26, 94.894]
  - - [1024, 2560, 1, 2, 1024, 1024, 1024, 2]
    - [3, 0.551]
  - - [1024, 6, 1, 2, 1024, 1024, 1024, 2]
    - [2, 0.003]
  - - [64, 128, 160, 128, 64, 64, 64, 128]
    - [102, 20.259]
  - - [4096, 8064, 1, 1024, 4096, 4096, 4096, 1024]
    - [139, 87.693]
  - - [256, 8976, 1, 6656, 256, 256, 256, 6656]
    - [56, 73.082]
  - - [64, 15, 10880, 15, 64, 64, 696320, 15]
    - [10, 2.182]
  - - [1024, 960, 1, 64, 1024, 1024, 1024, 64]
    - [105, 12.94]
  - - [1024, 7104, 1, 4096, 1024, 1024, 1024, 4096]
    - [18, 85.234]
  - - [1024, 512, 1, 4096, 1024, 1024, 1024, 4096]
    - [29, 43.784]
  - - [1024, 8960, 1, 256, 1024, 1024, 1024, 256]
    - [26, 65.42]
  - - [1024, 3968, 1, 4096, 1024, 1024, 1024, 4096]
    - [15, 74.611]
  - - [1024, 10080, 1, 4096, 1024, 1024, 1024, 4096]
    - [16, 87.38]
  - - [1024, 7424, 1, 256, 1024, 1024, 1024, 256]
    - [49, 64.017]
  - - [32, 200, 1, 1, 32, 32, 32, 1]
    - [1, 0.001]
  - - [257, 1024, 1, 4096, 257, 257, 257, 4096]
    - [119, 30.248]
  - - [1024, 4096, 1, 4096, 1024, 1024, 1024, 4096]
    - [46, 76.797]
  - - [64, 512, 1, 512, 64, 64, 64, 512]
    - [51, 2.908]
  - - [64, 128, 128, 128, 64, 64, 64, 128]
    - [8, 17.324]
  - - [64, 35, 4608, 32, 64, 64, 294912, 32]
    - [8, 9.255]
  - - [4096, 10064, 1, 1024, 4096, 4096, 4096, 1024]
    - [147, 87.444]
  - - [64, 14, 10880, 15, 64, 64, 696320, 15]
    - [10, 2.047]
  - - [256, 8976, 1, 8960, 256, 256, 256, 8960]
    - [30, 73.317]
  - - [1024, 5248, 1, 1024, 1024, 1024, 1024, 1024]
    - [115, 78.684]
  - - [1024, 820, 1, 30522, 1024, 1024, 1024, 30522]
    - [111, 76.165]
  - - [1024, 1280, 1, 2, 1024, 1024, 1024, 2]
    - [18, 0.377]
  - - [1024, 11264, 1, 256, 1024, 1024, 1024, 256]
    - [26, 68.147]
  - - [4096, 10200, 1, 1024, 4096, 4096, 4096, 1024]
    - [147, 87.79]
  - - [64, 24, 4736, 34, 64, 64, 303104, 34]
    - [40, 5.605]
  - - [64, 15, 7680, 15, 64, 64, 491520, 15]
    - [10, 2.099]
  - - [1024, 7200, 1, 4096, 1024, 1024, 1024, 4096]
    - [12, 85.124]
  - - [1024, 1280, 1, 1024, 1024, 1024, 1024, 1024]
    - [61, 51.69]
  - - [1024, 6400, 1, 256, 1024, 1024, 1024, 256]
    - [49, 61.692]
  - - [64, 9, 512, 9, 64, 64, 64, 9]
    - [7, 0.362]
  - - [1024, 10240, 1, 256, 1024, 1024, 1024, 256]
    - [26, 67.44]
  - - [1920, 2048, 1, 2048, 2080, 2080, 2080, 2080]
    - [61, 88.663]
  - - [1024, 32, 1, 1024, 1024, 1024, 1024, 1024]
    - [84, 4.079]
  - - [560, 200, 1, 1024, 560, 560, 560, 1024]
    - [37, 13.009]
  - - [1024, 3968, 1, 1024, 1024, 1024, 1024, 1024]
    - [34, 70.095]
  - - [1024, 3072, 1, 1024, 1024, 1024, 1024, 1024]
    - [115, 67.515]
  - - [256, 8976, 1, 10240, 256, 256, 256, 10240]
    - [30, 73.304]
  - - [256, 8976, 1, 17152, 256, 256, 256, 17152]
    - [50, 73.879]
  - - [1024, 9520, 1, 42720, 1024, 1024, 1024, 42720]
    - [4, 95.767]
  - - [1024, 19968, 1, 256, 1024, 1024, 1024, 256]
    - [49, 72.411]
  - - [1024, 3840, 1, 256, 1024, 1024, 1024, 256]
    - [86, 56.921]
  - - [64, 21, 6144, 21, 64, 64, 393216, 21]
    - [10, 3.639]
  - - [1024, 7168, 1, 256, 1024, 1024, 1024, 256]
    - [26, 63.141]
  - - [1024, 800, 1, 30522, 1024, 1024, 1024, 30522]
    - [103, 75.202]
  - - [1024, 2048, 1, 2, 1024, 1024, 1024, 2]
    - [10, 0.485]
  - - [64, 128, 1, 128, 64, 64, 64, 128]
    - [9, 0.258]
  - - [256, 8976, 1, 14848, 256, 256, 256, 14848]
    - [27, 74.091]
  - - [512, 1600, 1, 32, 512, 512, 512, 32]
    - [13, 6.373]
  - - [64, 512, 80, 512, 64, 64, 64, 512]
    - [48, 46.955]
  - - [480, 512, 1, 512, 544, 544, 544, 544]
    - [28, 19.79]
  - - [512, 480, 1, 512, 544, 544, 544, 544]
    - [107, 19.464]
  - - [1024, 8160, 1, 4096, 1024, 1024, 1024, 4096]
    - [47, 86.136]
  - - [1024, 13568, 1, 256, 1024, 1024, 1024, 256]
    - [26, 69.708]
  - - [1024, 4, 1, 2, 1024, 1024, 1024, 2]
    - [0, 0.001]
  - - [64, 17, 7680, 17, 64, 64, 491520, 17]
    - [10, 2.556]
  - - [1024, 6528, 1, 42720, 1024, 1024, 1024, 42720]
    - [136, 92.466]
  - - [1024, 8704, 1, 256, 1024, 1024, 1024, 256]
    - [83, 64.219]
  - - [64, 512, 1, 1, 64, 64, 64, 1]
    - [2, 0.009]
  - - [1024, 4, 1, 1024, 1024, 1024, 1024, 1024]
    - [143, 0.47]
  - - [4096, 4992, 1, 1024, 4096, 4096, 4096, 1024]
    - [139, 85.941]
  - - [479, 32768, 1, 1024, 479, 479, 479, 1024]
    - [18, 77.273]
  - - [64, 128, 512, 128, 64, 64, 64, 128]
    - [19, 27.758]
  - - [1024, 1152, 1, 4096, 1024, 1024, 1024, 4096]
    - [88, 54.382]
  - - [1024, 3968, 1, 42720, 1024, 1024, 1024, 42720]
    - [71, 79.3]
  - - [1024, 5120, 1, 2, 1024, 1024, 1024, 2]
    - [11, 0.792]
- null
