TRAIN_3.7/build/3_LibraryLogic_eff/arcturus_Cijk_Alik_Bljk_BBH.yaml
- {MinimumRequiredVersion: 4.20.0}
- arcturus
- gfx908
- [Device 7380, Device 7388, Device 738c, Device 7390]
- - - [33536, 8976, 1, 256, 33536, 33536, 256, 256]
    - [105, 79.875]
  - - [5, 5, 960, 64, 5, 5, 64, 64]
    - [3, 0.216]
  - - [256, 44505, 1, 1024, 256, 256, 1024, 1024]
    - [70, 83.632]
  - - [1024, 10, 1, 1024, 1024, 1024, 1024, 1024]
    - [58, 1.571]
  - - [256, 14592, 1, 1024, 256, 256, 1024, 1024]
    - [61, 77.652]
  - - [2048, 2048, 1, 2048, 2080, 2080, 2080, 2080]
    - [114, 78.046]
  - - [1024, 10080, 1, 1024, 1024, 1024, 1024, 1024]
    - [104, 83.297]
  - - [2, 32, 1, 1024, 2, 2, 1024, 1024]
    - [14, 0.009]
  - - [1024, 32768, 1, 479, 1024, 1024, 479, 479]
    - [88, 57.083]
  - - [18944, 8976, 1, 256, 18944, 18944, 256, 256]
    - [125, 76.98]
  - - [1024, 9216, 1, 1024, 1024, 1024, 1024, 1024]
    - [52, 84.956]
  - - [256, 16128, 1, 1024, 256, 256, 1024, 1024]
    - [121, 71.742]
  - - [1024, 4992, 1, 4096, 1024, 1024, 4096, 4096]
    - [87, 80.636]
  - - [5632, 8976, 1, 256, 5632, 5632, 256, 256]
    - [74, 79.131]
  - - [1024, 5, 1, 1024, 1024, 1024, 1024, 1024]
    - [15, 0.743]
  - - [256, 14848, 1, 1024, 256, 256, 1024, 1024]
    - [61, 78.844]
  - - [256, 14336, 1, 1024, 256, 256, 1024, 1024]
    - [24, 76.539]
  - - [2, 5, 1, 1024, 2, 2, 1024, 1024]
    - [1, 0.001]
  - - [8192, 7680, 1, 8192, 8384, 8384, 8384, 8384]
    - [81, 96.535]
  - - [64, 960, 1, 1024, 64, 64, 1024, 1024]
    - [110, 9.652]
  - - [2, 40, 1, 1024, 2, 2, 1024, 1024]
    - [73, 0.012]
  - - [11264, 8976, 1, 256, 11264, 11264, 256, 256]
    - [125, 76.303]
  - - [1024, 1024, 1, 1024, 1056, 1056, 1056, 1056]
    - [51, 46.307]
  - - [42720, 6528, 1, 1024, 42720, 42720, 1024, 1024]
    - [117, 92.609]
  - - [30, 31, 2048, 64, 30, 30, 131072, 131072]
    - [37, 6.427]
  - - [2048, 215, 1, 768, 2048, 2048, 768, 768]
    - [76, 30.284]
  - - [15, 14, 10880, 64, 15, 15, 696320, 696320]
    - [4, 3.058]
  - - [64, 512, 1, 512, 64, 64, 512, 512]
    - [91, 3.739]
  - - [1024, 4096, 1, 1024, 1024, 1024, 1024, 1024]
    - [124, 72.618]
  - - [18176, 8976, 1, 256, 18176, 18176, 256, 256]
    - [105, 79.338]
  - - [128, 128, 128, 64, 128, 128, 64, 64]
    - [10, 15.604]
  - - [1024, 200, 1, 560, 1024, 1024, 560, 560]
    - [75, 13.849]
  - - [512, 512, 1, 512, 544, 544, 544, 544]
    - [34, 19.626]
  - - [42720, 3968, 1, 1024, 42720, 42720, 1024, 1024]
    - [117, 92.472]
  - - [2, 4, 1, 1024, 2, 2, 1024, 1024]
    - [1, 0.001]
  - - [64, 128, 1, 128, 64, 64, 128, 128]
    - [58, 0.298]
  - - [1024, 2560, 1, 4096, 1024, 1024, 4096, 4096]
    - [86, 77.835]
  - - [30522, 462, 1, 1024, 30522, 30522, 1024, 1024]
    - [122, 78.224]
  - - [1024, 820, 1, 1024, 1024, 1024, 1024, 1024]
    - [71, 51.089]
  - - [34, 34, 4736, 64, 34, 34, 303104, 303104]
    - [6, 7.183]
  - - [19712, 8976, 1, 256, 19712, 19712, 256, 256]
    - [105, 79.603]
  - - [1024, 10064, 1, 1024, 1024, 1024, 1024, 1024]
    - [98, 82.99]
  - - [4096, 5248, 1, 1024, 4096, 4096, 1024, 1024]
    - [117, 88.579]
  - - [256, 21504, 1, 1024, 256, 256, 1024, 1024]
    - [70, 79.871]
  - - [4096, 3840, 1, 4096, 4192, 4192, 4192, 4192]
    - [117, 94.588]
  - - [2048, 512, 1, 100, 2048, 2048, 100, 100]
    - [83, 12.344]
  - - [1024, 39, 1, 1024, 1024, 1024, 1024, 1024]
    - [16, 5.843]
  - - [256, 31488, 1, 1024, 256, 256, 1024, 1024]
    - [102, 80.551]
  - - [256, 8960, 1, 1024, 256, 256, 1024, 1024]
    - [121, 63.438]
  - - [256, 13312, 1, 1024, 256, 256, 1024, 1024]
    - [52, 72.172]
  - - [128, 128, 160, 64, 128, 128, 64, 64]
    - [6, 18.047]
  - - [11776, 8976, 1, 256, 11776, 11776, 256, 256]
    - [125, 76.737]
  - - [7168, 8976, 1, 256, 7168, 7168, 256, 256]
    - [74, 76.975]
  - - [4096, 1280, 1, 1024, 4096, 4096, 1024, 1024]
    - [124, 76.941]
  - - [15, 15, 10880, 64, 15, 15, 696320, 696320]
    - [4, 3.284]
  - - [1024, 2048, 1, 4096, 1024, 1024, 4096, 4096]
    - [42, 66.027]
  - - [64, 512, 1, 1024, 64, 64, 1024, 1024]
    - [45, 5.414]
  - - [32, 32, 4608, 64, 32, 32, 294912, 294912]
    - [4, 8.643]
  - - [1024, 2560, 1, 1024, 1024, 1024, 1024, 1024]
    - [124, 71.98]
  - - [21248, 8976, 1, 256, 21248, 21248, 256, 256]
    - [121, 79.038]
  - - [256, 2304, 1, 1024, 256, 256, 1024, 1024]
    - [78, 39.527]
  - - [1024, 7200, 1, 1024, 1024, 1024, 1024, 1024]
    - [85, 81.398]
  - - [1024, 800, 1, 1024, 1024, 1024, 1024, 1024]
    - [123, 50.811]
  - - [3840, 8976, 1, 256, 3840, 3840, 256, 256]
    - [72, 77.029]
  - - [1024, 3840, 1, 1024, 1024, 1024, 1024, 1024]
    - [85, 80.862]
  - - [1024, 8, 1, 1024, 1024, 1024, 1024, 1024]
    - [17, 1.217]
  - - [30522, 160, 1, 1024, 30522, 30522, 1024, 1024]
    - [79, 66.241]
  - - [2, 1024, 1, 1024, 2, 2, 1024, 1024]
    - [27, 0.295]
  - - [2048, 512, 1, 2048, 2048, 2048, 2048, 2048]
    - [44, 53.735]
  - - [32, 1600, 1, 512, 32, 32, 512, 512]
    - [30, 5.334]
  - - [30522, 308, 1, 1024, 30522, 30522, 1024, 1024]
    - [99, 79.372]
  - - [2560, 8976, 1, 256, 2560, 2560, 256, 256]
    - [40, 74.343]
  - - [30528, 4096, 1, 1024, 30528, 30528, 1024, 1024]
    - [117, 92.778]
  - - [256, 9984, 1, 1024, 256, 256, 1024, 1024]
    - [61, 69.881]
  - - [32, 35, 4608, 64, 32, 32, 294912, 294912]
    - [2, 7.247]
  - - [15104, 8976, 1, 256, 15104, 15104, 256, 256]
    - [121, 79.113]
  - - [17, 17, 6144, 64, 17, 17, 393216, 393216]
    - [4, 3.043]
  - - [4096, 2560, 1, 1024, 4096, 4096, 1024, 1024]
    - [98, 86.179]
  - - [3072, 8976, 1, 256, 3072, 3072, 256, 256]
    - [62, 75.975]
  - - [512, 32768, 1, 13, 512, 512, 13, 13]
    - [12, 5.308]
  - - [2048, 215, 1, 512, 2048, 2048, 512, 512]
    - [80, 25.573]
  - - [1024, 9520, 1, 4096, 1024, 1024, 4096, 4096]
    - [87, 90.786]
  - - [4096, 4096, 1, 4096, 4192, 4192, 4192, 4192]
    - [117, 90.743]
  - - [4096, 8192, 1, 1024, 4096, 4096, 1024, 1024]
    - [98, 89.869]
  - - [4096, 3840, 1, 1024, 4096, 4096, 1024, 1024]
    - [60, 86.08]
  - - [2304, 8976, 1, 256, 2304, 2304, 256, 256]
    - [105, 74.115]
  - - [33, 33, 1, 32, 33, 33, 32, 32]
    - [3, 0.009]
  - - [12544, 8976, 1, 256, 12544, 12544, 256, 256]
    - [121, 78.472]
  - - [1024, 1600, 1, 1024, 1024, 1024, 1024, 1024]
    - [79, 65.148]
  - - [15360, 8976, 1, 256, 15360, 15360, 256, 256]
    - [125, 76.134]
  - - [1024, 5120, 1, 1024, 1024, 1024, 1024, 1024]
    - [56, 77.415]
  - - [1024, 9, 1, 1024, 1024, 1024, 1024, 1024]
    - [58, 1.369]
  - - [256, 2560, 1, 1024, 256, 256, 1024, 1024]
    - [78, 44.227]
  - - [1024, 780, 1, 1024, 1024, 1024, 1024, 1024]
    - [78, 50.859]
  - - [2816, 8976, 1, 256, 2816, 2816, 256, 256]
    - [36, 75.741]
  - - [16128, 8976, 1, 256, 16128, 16128, 256, 256]
    - [121, 78.886]
  - - [256, 4864, 1, 1024, 256, 256, 1024, 1024]
    - [95, 51.767]
  - - [512, 512, 64, 64, 512, 512, 64, 64]
    - [11, 35.632]
  - - [512, 512, 80, 64, 512, 512, 64, 64]
    - [36, 37.216]
  - - [4096, 3072, 1, 1024, 4096, 4096, 1024, 1024]
    - [98, 86.937]
  - - [480, 512, 1, 512, 544, 544, 544, 544]
    - [33, 20.659]
  - - [256, 6144, 1, 1024, 256, 256, 1024, 1024]
    - [86, 62.413]
  - - [1024, 3072, 1, 4096, 1024, 1024, 4096, 4096]
    - [57, 73.909]
  - - [20480, 8976, 1, 256, 20480, 20480, 256, 256]
    - [114, 76.92]
  - - [4096, 1024, 1, 1024, 4096, 4096, 1024, 1024]
    - [107, 73.28]
  - - [1024, 1152, 1, 1024, 1024, 1024, 1024, 1024]
    - [32, 49.581]
  - - [128, 128, 656, 64, 128, 128, 64, 64]
    - [8, 27.392]
  - - [1024, 1024, 1, 4096, 1024, 1024, 4096, 4096]
    - [66, 57.337]
  - - [256, 7936, 1, 1024, 256, 256, 1024, 1024]
    - [97, 56.026]
  - - [684, 8976, 1, 256, 684, 684, 256, 256]
    - [25, 56.033]
  - - [3, 3, 512, 64, 3, 3, 64, 64]
    - [50, 0.054]
  - - [27, 27, 32768, 128, 27, 27, 128, 128]
    - [4, 14.611]
  - - [2048, 684, 1, 768, 2048, 2048, 768, 768]
    - [113, 51.107]
  - - [1024, 960, 1, 1024, 1056, 1056, 1056, 1056]
    - [82, 63.438]
  - - [30522, 820, 1, 1024, 30522, 30522, 1024, 1024]
    - [79, 86.633]
  - - [2, 10, 1, 1024, 2, 2, 1024, 1024]
    - [1, 0.003]
  - - [8960, 8976, 1, 256, 8960, 8960, 256, 256]
    - [121, 77.944]
  - - [1024, 7104, 1, 4096, 1024, 1024, 4096, 4096]
    - [86, 86.342]
  - - [21, 17, 6144, 64, 21, 21, 393216, 393216]
    - [4, 3.475]
  - - [8192, 8192, 1, 8192, 8384, 8384, 8384, 8384]
    - [112, 95.729]
  - - [1024, 32768, 1, 480, 1024, 1024, 480, 480]
    - [25, 87.0]
  - - [1024, 180, 1, 1024, 1024, 1024, 1024, 1024]
    - [111, 21.942]
  - - [128, 128, 624, 64, 128, 128, 64, 64]
    - [55, 27.214]
  - - [5, 5, 512, 64, 5, 5, 64, 64]
    - [3, 0.145]
  - - [1024, 1600, 1, 560, 1024, 1024, 560, 560]
    - [49, 45.073]
  - - [1024, 4096, 1, 4096, 1024, 1024, 4096, 4096]
    - [86, 78.332]
  - - [256, 8448, 1, 1024, 256, 256, 1024, 1024]
    - [102, 59.898]
  - - [1024, 3840, 1, 4096, 1024, 1024, 4096, 4096]
    - [87, 91.405]
  - - [34, 24, 4736, 64, 34, 34, 303104, 303104]
    - [5, 7.371]
  - - [256, 11264, 1, 1024, 256, 256, 1024, 1024]
    - [61, 76.653]
  - - [2048, 512, 1, 67, 2048, 2048, 67, 67]
    - [8, 8.484]
  - - [256, 10496, 1, 1024, 256, 256, 1024, 1024]
    - [70, 72.738]
  - - [4096, 2048, 1, 1024, 4096, 4096, 1024, 1024]
    - [68, 83.174]
  - - [256, 22016, 1, 1024, 256, 256, 1024, 1024]
    - [61, 81.403]
  - - [30, 30, 2048, 64, 30, 30, 131072, 131072]
    - [75, 6.344]
  - - [1024, 960, 1, 1600, 1024, 1024, 1600, 1600]
    - [77, 69.105]
  - - [2048, 1536, 1, 512, 2048, 2048, 512, 512]
    - [31, 61.9]
  - - [1024, 7200, 1, 4096, 1024, 1024, 4096, 4096]
    - [124, 85.926]
  - - [42720, 10080, 1, 1024, 42720, 42720, 1024, 1024]
    - [117, 92.54]
  - - [9984, 8976, 1, 256, 9984, 9984, 256, 256]
    - [121, 78.213]
  - - [4096, 10200, 1, 1024, 4096, 4096, 1024, 1024]
    - [117, 89.949]
  - - [1024, 1024, 1, 1024, 1024, 1024, 1024, 1024]
    - [18, 45.161]
  - - [1024, 10200, 1, 4096, 1024, 1024, 4096, 4096]
    - [124, 88.332]
  - - [256, 33536, 1, 1024, 256, 256, 1024, 1024]
    - [120, 84.294]
  - - [21, 21, 6144, 64, 21, 21, 393216, 393216]
    - [4, 3.957]
  - - [4608, 8976, 1, 256, 4608, 4608, 256, 256]
    - [62, 79.115]
  - - [1024, 8160, 1, 4096, 1024, 1024, 4096, 4096]
    - [101, 87.596]
  - - [1024, 160, 1, 1024, 1024, 1024, 1024, 1024]
    - [109, 20.524]
  - - [256, 19200, 1, 1024, 256, 256, 1024, 1024]
    - [85, 81.07]
  - - [4096, 5120, 1, 1024, 4096, 4096, 1024, 1024]
    - [63, 87.702]
  - - [256, 7424, 1, 1024, 256, 256, 1024, 1024]
    - [85, 73.886]
  - - [4, 4, 38400, 64, 4, 4, 2457600, 2457600]
    - [1, 0.255]
  - - [2048, 114, 1, 512, 2048, 2048, 512, 512]
    - [96, 16.213]
  - - [256, 11520, 1, 1024, 256, 256, 1024, 1024]
    - [70, 78.07]
  - - [2048, 1920, 1, 2048, 2080, 2080, 2080, 2080]
    - [86, 89.559]
  - - [2, 39, 1, 1024, 2, 2, 1024, 1024]
    - [14, 0.01]
  - - [1024, 462, 1, 1024, 1024, 1024, 1024, 1024]
    - [89, 33.832]
  - - [2, 9, 1, 1024, 2, 2, 1024, 1024]
    - [14, 0.003]
  - - [13312, 8976, 1, 256, 13312, 13312, 256, 256]
    - [114, 76.408]
  - - [35, 35, 4608, 64, 35, 35, 294912, 294912]
    - [78, 6.446]
  - - [30522, 180, 1, 1024, 30522, 30522, 1024, 1024]
    - [118, 72.468]
  - - [33712, 8192, 1, 1024, 33712, 33712, 1024, 1024]
    - [117, 92.752]
  - - [2048, 1536, 1, 768, 2048, 2048, 768, 768]
    - [56, 65.916]
  - - [4096, 4096, 1, 1024, 4096, 4096, 1024, 1024]
    - [98, 86.485]
  - - [2048, 512, 1, 74, 2048, 2048, 74, 74]
    - [8, 8.965]
  - - [1024, 77, 1, 1024, 1024, 1024, 1024, 1024]
    - [94, 10.495]
  - - [256, 1280, 1, 1024, 256, 256, 1024, 1024]
    - [93, 32.881]
  - - [8192, 8976, 1, 256, 8192, 8192, 256, 256]
    - [36, 74.915]
  - - [960, 1024, 1, 1024, 1056, 1056, 1056, 1056]
    - [47, 64.523]
  - - [2048, 8976, 1, 256, 2048, 2048, 256, 256]
    - [36, 70.975]
  - - [20992, 8976, 1, 256, 20992, 20992, 256, 256]
    - [114, 77.237]
  - - [256, 7168, 1, 1024, 256, 256, 1024, 1024]
    - [85, 71.628]
  - - [5, 5, 1, 64, 5, 5, 64, 64]
    - [1, 0.0]
  - - [28672, 8976, 1, 256, 28672, 28672, 256, 256]
    - [114, 77.595]
  - - [8448, 8976, 1, 256, 8448, 8448, 256, 256]
    - [121, 77.851]
  - - [1024, 40, 1, 1024, 1024, 1024, 1024, 1024]
    - [16, 5.902]
  - - [2, 8, 1, 1024, 2, 2, 1024, 1024]
    - [0, 0.001]
  - - [24, 24, 4736, 64, 24, 24, 303104, 303104]
    - [4, 6.522]
  - - [512, 512, 96, 64, 512, 512, 64, 64]
    - [86, 37.728]
  - - [1024, 8064, 1, 1024, 1024, 1024, 1024, 1024]
    - [52, 82.687]
  - - [13824, 8976, 1, 256, 13824, 13824, 256, 256]
    - [125, 76.439]
  - - [1024, 9520, 1, 1024, 1024, 1024, 1024, 1024]
    - [117, 84.466]
  - - [256, 6656, 1, 1024, 256, 256, 1024, 1024]
    - [86, 67.058]
  - - [1024, 1152, 1, 4096, 1024, 1024, 4096, 4096]
    - [28, 62.935]
  - - [256, 3328, 1, 1024, 256, 256, 1024, 1024]
    - [78, 53.891]
  - - [4352, 8976, 1, 256, 4352, 4352, 256, 256]
    - [23, 78.61]
  - - [30522, 385, 1, 1024, 30522, 30522, 1024, 1024]
    - [79, 75.148]
  - - [256, 1536, 1, 1024, 256, 256, 1024, 1024]
    - [95, 38.847]
  - - [17, 17, 7680, 64, 17, 17, 491520, 491520]
    - [4, 3.703]
  - - [5376, 8976, 1, 256, 5376, 5376, 256, 256]
    - [43, 78.913]
  - - [1024, 7104, 1, 1024, 1024, 1024, 1024, 1024]
    - [52, 81.391]
  - - [1024, 8160, 1, 1024, 1024, 1024, 1024, 1024]
    - [46, 81.087]
  - - [9472, 8976, 1, 256, 9472, 9472, 256, 256]
    - [105, 78.176]
  - - [256, 23552, 1, 1024, 256, 256, 1024, 1024]
    - [102, 76.629]
  - - [13568, 8976, 1, 256, 13568, 13568, 256, 256]
    - [105, 78.643]
  - - [1024, 200, 1, 1024, 1024, 1024, 1024, 1024]
    - [92, 23.504]
  - - [1024, 5120, 1, 4096, 1024, 1024, 4096, 4096]
    - [57, 82.72]
  - - [30522, 616, 1, 1024, 30522, 30522, 1024, 1024]
    - [106, 83.84]
  - - [1024, 41, 1, 1024, 1024, 1024, 1024, 1024]
    - [16, 6.238]
  - - [4096, 8064, 1, 1024, 4096, 4096, 1024, 1024]
    - [98, 90.358]
  - - [1024, 10200, 1, 1024, 1024, 1024, 1024, 1024]
    - [98, 84.216]
  - - [128, 128, 1, 64, 128, 128, 64, 64]
    - [19, 0.316]
  - - [256, 684, 1, 1024, 256, 256, 1024, 1024]
    - [92, 21.241]
  - - [1024, 5248, 1, 4096, 1024, 1024, 4096, 4096]
    - [57, 84.701]
  - - [4, 4, 32768, 64, 4, 4, 2097152, 2097152]
    - [1, 0.25]
  - - [1280, 8976, 1, 256, 1280, 1280, 256, 256]
    - [105, 66.727]
  - - [2048, 256, 1, 512, 2048, 2048, 512, 512]
    - [84, 29.042]
  - - [4864, 8976, 1, 256, 4864, 4864, 256, 256]
    - [22, 79.119]
  - - [256, 20992, 1, 1024, 256, 256, 1024, 1024]
    - [120, 78.206]
  - - [256, 18944, 1, 1024, 256, 256, 1024, 1024]
    - [102, 80.197]
  - - [1024, 6528, 1, 1024, 1024, 1024, 1024, 1024]
    - [86, 83.247]
  - - [1024, 6528, 1, 4096, 1024, 1024, 4096, 4096]
    - [119, 87.557]
  - - [9728, 8976, 1, 256, 9728, 9728, 256, 256]
    - [125, 75.836]
  - - [256, 12544, 1, 1024, 256, 256, 1024, 1024]
    - [52, 68.921]
  - - [42720, 7200, 1, 1024, 42720, 42720, 1024, 1024]
    - [79, 91.477]
  - - [9, 9, 512, 64, 9, 9, 64, 64]
    - [38, 0.46]
  - - [128, 128, 640, 64, 128, 128, 64, 64]
    - [8, 27.187]
  - - [7680, 8192, 1, 8192, 8384, 8384, 8384, 8384]
    - [53, 96.472]
  - - [4096, 9520, 1, 1024, 4096, 4096, 1024, 1024]
    - [117, 89.247]
  - - [4096, 8160, 1, 1024, 4096, 4096, 1024, 1024]
    - [117, 88.761]
  - - [4096, 9216, 1, 1024, 4096, 4096, 1024, 1024]
    - [68, 89.518]
  - - [19968, 8976, 1, 256, 19968, 19968, 256, 256]
    - [125, 77.153]
  - - [1024, 1280, 1, 4096, 1024, 1024, 4096, 4096]
    - [115, 64.454]
  - - [1024, 5248, 1, 1024, 1024, 1024, 1024, 1024]
    - [85, 79.288]
  - - [6400, 8976, 1, 256, 6400, 6400, 256, 256]
    - [22, 77.998]
  - - [33, 33, 1600, 32, 33, 33, 32, 32]
    - [10, 3.201]
  - - [5888, 8976, 1, 256, 5888, 5888, 256, 256]
    - [36, 78.595]
  - - [256, 23296, 1, 1024, 256, 256, 1024, 1024]
    - [120, 75.999]
  - - [512, 32768, 1, 1024, 512, 512, 1024, 1024]
    - [52, 86.276]
  - - [512, 512, 128, 64, 512, 512, 64, 64]
    - [29, 38.648]
  - - [512, 512, 16, 64, 512, 512, 64, 64]
    - [40, 22.837]
  - - [1024, 9600, 1, 1024, 1024, 1024, 1024, 1024]
    - [98, 85.291]
  - - [2, 6, 1, 1024, 2, 2, 1024, 1024]
    - [0, 0.001]
  - - [4096, 7200, 1, 1024, 4096, 4096, 1024, 1024]
    - [105, 87.685]
  - - [2, 2048, 1, 1024, 2, 2, 1024, 1024]
    - [27, 0.553]
  - - [2048, 960, 1, 74, 2048, 2048, 74, 74]
    - [9, 15.298]
  - - [512, 1600, 1, 512, 512, 512, 512, 512]
    - [84, 41.102]
  - - [1024, 385, 1, 1024, 1024, 1024, 1024, 1024]
    - [67, 35.641]
  - - [1024, 960, 1, 1024, 1024, 1024, 1024, 1024]
    - [41, 58.694]
  - - [3328, 8976, 1, 256, 3328, 3328, 256, 256]
    - [40, 76.953]
  - - [256, 18176, 1, 1024, 256, 256, 1024, 1024]
    - [120, 79.2]
  - - [1024, 2048, 1, 1024, 1024, 1024, 1024, 1024]
    - [59, 59.813]
  - - [64, 128, 512, 128, 64, 64, 128, 128]
    - [6, 25.832]
  - - [256, 8192, 1, 1024, 256, 256, 1024, 1024]
    - [121, 57.915]
  - - [64, 512, 64, 512, 64, 64, 512, 512]
    - [5, 41.267]
  - - [1024, 4992, 1, 1024, 1024, 1024, 1024, 1024]
    - [85, 75.479]
  - - [33712, 9600, 1, 1024, 33712, 33712, 1024, 1024]
    - [117, 92.893]
  - - [256, 3584, 1, 1024, 256, 256, 1024, 1024]
    - [77, 56.361]
  - - [18688, 8976, 1, 256, 18688, 18688, 256, 256]
    - [105, 79.601]
  - - [1024, 32768, 1, 1024, 1024, 1024, 1024, 1024]
    - [52, 89.943]
  - - [4096, 7104, 1, 1024, 4096, 4096, 1024, 1024]
    - [102, 88.663]
  - - [1024, 512, 1, 4096, 1024, 1024, 4096, 4096]
    - [26, 44.91]
  - - [14, 14, 10880, 64, 14, 14, 696320, 696320]
    - [4, 2.86]
  - - [1024, 9600, 1, 4096, 1024, 1024, 4096, 4096]
    - [87, 93.202]
  - - [6144, 8976, 1, 256, 6144, 6144, 256, 256]
    - [65, 77.902]
  - - [30528, 2048, 1, 1024, 30528, 30528, 1024, 1024]
    - [117, 91.773]
  - - [1024, 6, 1, 1024, 1024, 1024, 1024, 1024]
    - [15, 0.892]
  - - [17, 15, 7680, 64, 17, 17, 491520, 491520]
    - [4, 3.309]
  - - [23552, 8976, 1, 256, 23552, 23552, 256, 256]
    - [114, 77.2]
  - - [1024, 308, 1, 1024, 1024, 1024, 1024, 1024]
    - [96, 27.728]
  - - [3840, 4096, 1, 4096, 4192, 4192, 4192, 4192]
    - [35, 94.729]
  - - [256, 15104, 1, 1024, 256, 256, 1024, 1024]
    - [86, 79.771]
  - - [2, 41, 1, 1024, 2, 2, 1024, 1024]
    - [14, 0.012]
  - - [256, 5376, 1, 1024, 256, 256, 1024, 1024]
    - [95, 56.002]
  - - [1024, 3968, 1, 1024, 1024, 1024, 1024, 1024]
    - [72, 70.412]
  - - [512, 512, 1, 64, 512, 512, 64, 64]
    - [5, 4.362]
  - - [1024, 8064, 1, 4096, 1024, 1024, 4096, 4096]
    - [119, 87.281]
  - - [256, 2816, 1, 1024, 256, 256, 1024, 1024]
    - [78, 47.644]
  - - [256, 5888, 1, 1024, 256, 256, 1024, 1024]
    - [86, 60.564]
  - - [4096, 1152, 1, 1024, 4096, 4096, 1024, 1024]
    - [85, 80.964]
  - - [7936, 8976, 1, 256, 7936, 7936, 256, 256]
    - [105, 77.378]
  - - [2048, 960, 1, 2048, 2048, 2048, 2048, 2048]
    - [125, 80.004]
  - - [5120, 8976, 1, 256, 5120, 5120, 256, 256]
    - [72, 78.841]
  - - [1024, 512, 1, 1024, 1024, 1024, 1024, 1024]
    - [103, 36.408]
  - - [4096, 6528, 1, 1024, 4096, 4096, 1024, 1024]
    - [98, 88.94]
  - - [4096, 9600, 1, 1024, 4096, 4096, 1024, 1024]
    - [98, 90.288]
  - - [4096, 10080, 1, 1024, 4096, 4096, 1024, 1024]
    - [117, 89.698]
  - - [256, 11776, 1, 1024, 256, 256, 1024, 1024]
    - [52, 64.63]
  - - [30522, 200, 1, 1024, 30522, 30522, 1024, 1024]
    - [99, 64.496]
  - - [128, 32768, 1, 256, 128, 128, 256, 256]
    - [65, 51.931]
  - - [4096, 4992, 1, 1024, 4096, 4096, 1024, 1024]
    - [117, 88.945]
  - - [256, 22344, 1, 1024, 256, 256, 1024, 1024]
    - [39, 78.814]
  - - [1024, 8192, 1, 1024, 1024, 1024, 1024, 1024]
    - [52, 83.217]
  - - [128, 128, 512, 64, 128, 128, 64, 64]
    - [11, 25.832]
  - - [4096, 3968, 1, 1024, 4096, 4096, 1024, 1024]
    - [117, 87.452]
  - - [4096, 10064, 1, 1024, 4096, 4096, 1024, 1024]
    - [117, 89.607]
  - - [2048, 684, 1, 512, 2048, 2048, 512, 512]
    - [100, 46.131]
  - - [31, 31, 2048, 64, 31, 31, 131072, 131072]
    - [20, 6.549]
  - - [30522, 780, 1, 1024, 30522, 30522, 1024, 1024]
    - [79, 83.309]
  - - [17152, 8976, 1, 256, 17152, 17152, 256, 256]
    - [105, 79.5]
  - - [4096, 512, 1, 1024, 4096, 4096, 1024, 1024]
    - [105, 58.252]
  - - [4096, 8976, 1, 256, 4096, 4096, 256, 256]
    - [36, 75.801]
  - - [1024, 1280, 1, 1024, 1024, 1024, 1024, 1024]
    - [59, 53.909]
  - - [256, 21248, 1, 1024, 256, 256, 1024, 1024]
    - [120, 78.98]
  - - [1920, 2048, 1, 2048, 2080, 2080, 2080, 2080]
    - [86, 89.03]
  - - [1024, 32, 1, 1024, 1024, 1024, 1024, 1024]
    - [16, 5.065]
  - - [2048, 256, 1, 768, 2048, 2048, 768, 768]
    - [21, 33.054]
  - - [1024, 3072, 1, 1024, 1024, 1024, 1024, 1024]
    - [7, 68.512]
  - - [1024, 9216, 1, 4096, 1024, 1024, 4096, 4096]
    - [13, 89.717]
  - - [15872, 8976, 1, 256, 15872, 15872, 256, 256]
    - [121, 77.063]
  - - [1024, 8192, 1, 4096, 1024, 1024, 4096, 4096]
    - [119, 88.217]
  - - [256, 32768, 1, 512, 256, 256, 512, 512]
    - [86, 76.632]
  - - [15, 15, 7680, 64, 15, 15, 491520, 491520]
    - [4, 2.969]
  - - [1792, 8976, 1, 256, 1792, 1792, 256, 256]
    - [121, 72.503]
  - - [1024, 512, 1, 1600, 1024, 1024, 1600, 1600]
    - [48, 39.95]
  - - [256, 6400, 1, 1024, 256, 256, 1024, 1024]
    - [86, 64.88]
  - - [10496, 8976, 1, 256, 10496, 10496, 256, 256]
    - [105, 78.411]
  - - [128, 128, 144, 64, 128, 128, 64, 64]
    - [54, 16.823]
  - - [1024, 10080, 1, 4096, 1024, 1024, 4096, 4096]
    - [124, 88.822]
  - - [512, 480, 1, 512, 544, 544, 544, 544]
    - [116, 20.659]
  - - [31488, 8976, 1, 256, 31488, 31488, 256, 256]
    - [105, 79.6]
  - - [256, 20480, 1, 1024, 256, 256, 1024, 1024]
    - [52, 76.706]
  - - [44505, 8976, 1, 256, 44505, 44505, 256, 256]
    - [121, 76.192]
  - - [2048, 114, 1, 768, 2048, 2048, 768, 768]
    - [5, 20.588]
  - - [30522, 800, 1, 1024, 30522, 30522, 1024, 1024]
    - [99, 84.596]
  - - [256, 4608, 1, 1024, 256, 256, 1024, 1024]
    - [95, 50.354]
  - - [1024, 4, 1, 1024, 1024, 1024, 1024, 1024]
    - [90, 0.608]
  - - [42720, 7104, 1, 1024, 42720, 42720, 1024, 1024]
    - [79, 92.197]
  - - [1024, 3968, 1, 4096, 1024, 1024, 4096, 4096]
    - [64, 75.06]
  - - [42720, 9520, 1, 1024, 42720, 42720, 1024, 1024]
    - [117, 92.236]
  - - [1024, 10064, 1, 4096, 1024, 1024, 4096, 4096]
    - [108, 88.542]
  - - [10240, 8976, 1, 256, 10240, 10240, 256, 256]
    - [125, 75.906]
  - - [30522, 77, 1, 1024, 30522, 30522, 1024, 1024]
    - [69, 45.637]
- null
