TRAIN_3.7/build/3_LibraryLogic_eff/arcturus_Cijk_Ailk_Bljk_HBH.yaml
- {MinimumRequiredVersion: 4.20.0}
- arcturus
- gfx908
- [Device 7380, Device 7388, Device 738c, Device 7390]
- - - [1024, 8192, 1, 256, 1024, 1024, 1024, 256]
    - [20, 37.494]
  - - [1024, 9728, 1, 256, 1024, 1024, 1024, 256]
    - [20, 38.123]
  - - [64, 128, 624, 128, 64, 64, 64, 128]
    - [20, 15.27]
  - - [1024, 10, 1, 1024, 1024, 1024, 1024, 1024]
    - [36, 0.642]
  - - [1024, 22016, 1, 256, 1024, 1024, 1024, 256]
    - [67, 44.198]
  - - [2048, 2048, 1, 2048, 2080, 2080, 2080, 2080]
    - [46, 47.482]
  - - [1024, 10080, 1, 1024, 1024, 1024, 1024, 1024]
    - [115, 54.922]
  - - [1024, 7936, 1, 256, 1024, 1024, 1024, 256]
    - [38, 36.459]
  - - [1024, 1600, 1, 1, 1024, 1024, 1024, 1]
    - [101, 0.129]
  - - [1024, 10, 1, 2, 1024, 1024, 1024, 2]
    - [7, 0.003]
  - - [256, 8976, 1, 4352, 256, 256, 256, 4352]
    - [90, 47.724]
  - - [1024, 15104, 1, 256, 1024, 1024, 1024, 256]
    - [133, 41.964]
  - - [1024, 5, 1, 2, 1024, 1024, 1024, 2]
    - [1, 0.001]
  - - [1024, 9216, 1, 1024, 1024, 1024, 1024, 1024]
    - [105, 56.843]
  - - [74, 512, 1, 2048, 74, 74, 74, 2048]
    - [36, 3.286]
  - - [1024, 512, 1, 1024, 1024, 1024, 1024, 1024]
    - [48, 19.781]
  - - [512, 200, 1, 32, 512, 512, 512, 32]
    - [26, 0.432]
  - - [1024, 5, 1, 1024, 1024, 1024, 1024, 1024]
    - [121, 0.307]
  - - [512, 256, 1, 2048, 512, 512, 512, 2048]
    - [51, 10.338]
  - - [1024, 21504, 1, 256, 1024, 1024, 1024, 256]
    - [83, 43.563]
  - - [256, 8976, 1, 9984, 256, 256, 256, 9984]
    - [27, 52.086]
  - - [64, 5, 960, 5, 64, 64, 64, 5]
    - [5, 0.092]
  - - [64, 512, 16, 512, 64, 64, 64, 512]
    - [52, 13.956]
  - - [1024, 512, 1, 64, 1024, 1024, 1024, 64]
    - [102, 4.132]
  - - [1024, 1024, 1, 1024, 1056, 1056, 1056, 1056]
    - [46, 31.401]
  - - [1024, 9600, 1, 4096, 1024, 1024, 1024, 4096]
    - [105, 71.953]
  - - [1024, 3328, 1, 256, 1024, 1024, 1024, 256]
    - [20, 31.401]
  - - [1024, 1600, 1, 1024, 1024, 1024, 1024, 1024]
    - [16, 36.943]
  - - [64, 24, 4736, 24, 64, 64, 303104, 24]
    - [12, 2.314]
  - - [64, 15, 7680, 17, 64, 64, 491520, 17]
    - [96, 1.173]
  - - [256, 8976, 1, 9728, 256, 256, 256, 9728]
    - [57, 52.337]
  - - [1024, 4096, 1, 1024, 1024, 1024, 1024, 1024]
    - [21, 44.024]
  - - [512, 512, 64, 64, 512, 512, 512, 64]
    - [38, 21.022]
  - - [1024, 8192, 1, 1024, 1024, 1024, 1024, 1024]
    - [18, 51.007]
  - - [64, 5, 512, 5, 64, 64, 64, 5]
    - [91, 0.061]
  - - [1024, 7680, 1, 256, 1024, 1024, 1024, 256]
    - [133, 37.682]
  - - [1024, 1280, 1, 4096, 1024, 1024, 1024, 4096]
    - [17, 40.649]
  - - [512, 512, 1, 512, 544, 544, 544, 544]
    - [76, 9.444]
  - - [1024, 18944, 1, 256, 1024, 1024, 1024, 256]
    - [131, 43.272]
  - - [1024, 1152, 1, 1024, 1024, 1024, 1024, 1024]
    - [73, 31.489]
  - - [1024, 5248, 1, 2, 1024, 1024, 1024, 2]
    - [63, 0.445]
  - - [256, 8976, 1, 15872, 256, 256, 256, 15872]
    - [41, 53.835]
  - - [256, 8976, 1, 6144, 256, 256, 256, 6144]
    - [49, 50.046]
  - - [1024, 28672, 1, 256, 1024, 1024, 1024, 256]
    - [67, 44.859]
  - - [1024, 820, 1, 1024, 1024, 1024, 1024, 1024]
    - [23, 26.469]
  - - [1024, 6528, 1, 4096, 1024, 1024, 1024, 4096]
    - [105, 71.996]
  - - [1024, 10064, 1, 1024, 1024, 1024, 1024, 1024]
    - [118, 54.502]
  - - [4096, 1152, 1, 1024, 4096, 4096, 4096, 1024]
    - [117, 43.271]
  - - [256, 8976, 1, 33536, 256, 256, 256, 33536]
    - [113, 54.186]
  - - [1024, 308, 1, 30522, 1024, 1024, 1024, 30522]
    - [119, 22.755]
  - - [256, 8976, 1, 19968, 256, 256, 256, 19968]
    - [27, 53.93]
  - - [1024, 39, 1, 1024, 1024, 1024, 1024, 1024]
    - [24, 2.438]
  - - [1024, 616, 1, 1024, 1024, 1024, 1024, 1024]
    - [106, 19.69]
  - - [768, 215, 1, 2048, 768, 768, 768, 2048]
    - [123, 12.033]
  - - [64, 17, 6144, 17, 64, 64, 393216, 17]
    - [12, 1.279]
  - - [64, 512, 96, 512, 64, 64, 64, 512]
    - [43, 26.63]
  - - [1024, 39, 1, 2, 1024, 1024, 1024, 2]
    - [58, 0.01]
  - - [1024, 20992, 1, 256, 1024, 1024, 1024, 256]
    - [70, 42.702]
  - - [128, 128, 1, 64, 128, 128, 128, 64]
    - [10, 0.158]
  - - [1024, 3072, 1, 256, 1024, 1024, 1024, 256]
    - [15, 29.67]
  - - [3200, 1024, 1, 2048, 3200, 3200, 3200, 2048]
    - [37, 60.272]
  - - [1024, 160, 1, 30522, 1024, 1024, 1024, 30522]
    - [124, 17.359]
  - - [1024, 23552, 1, 256, 1024, 1024, 1024, 256]
    - [74, 42.704]
  - - [1024, 2560, 1, 1024, 1024, 1024, 1024, 1024]
    - [125, 42.22]
  - - [4096, 1024, 1, 1, 4096, 4096, 4096, 1]
    - [61, 0.189]
  - - [1024, 2560, 1, 256, 1024, 1024, 1024, 256]
    - [107, 26.168]
  - - [4096, 9600, 1, 1024, 4096, 4096, 4096, 1024]
    - [14, 70.617]
  - - [1024, 8, 1, 2, 1024, 1024, 1024, 2]
    - [1, 0.002]
  - - [1024, 800, 1, 1024, 1024, 1024, 1024, 1024]
    - [137, 26.611]
  - - [64, 128, 640, 128, 64, 64, 64, 128]
    - [63, 15.393]
  - - [4096, 3840, 1, 1024, 4096, 4096, 4096, 1024]
    - [79, 61.296]
  - - [560, 1600, 1, 1024, 560, 560, 560, 1024]
    - [23, 27.877]
  - - [256, 8976, 1, 14336, 256, 256, 256, 14336]
    - [40, 53.429]
  - - [4096, 1024, 1, 1024, 4096, 4096, 4096, 1024]
    - [86, 40.477]
  - - [256, 8976, 1, 3072, 256, 256, 256, 3072]
    - [41, 44.726]
  - - [1024, 8, 1, 1024, 1024, 1024, 1024, 1024]
    - [64, 0.51]
  - - [1024, 4608, 1, 256, 1024, 1024, 1024, 256]
    - [20, 32.862]
  - - [256, 8976, 1, 9472, 256, 256, 256, 9472]
    - [27, 52.121]
  - - [480, 32768, 1, 1024, 480, 480, 480, 1024]
    - [105, 56.158]
  - - [1024, 1024, 1, 2, 1024, 1024, 1024, 2]
    - [13, 0.174]
  - - [256, 8976, 1, 1536, 256, 256, 256, 1536]
    - [92, 37.663]
  - - [128, 27, 32768, 27, 128, 128, 128, 27]
    - [12, 3.438]
  - - [256, 8976, 1, 2816, 256, 256, 256, 2816]
    - [57, 43.881]
  - - [1024, 8064, 1, 1024, 1024, 1024, 1024, 1024]
    - [105, 50.403]
  - - [4096, 5248, 1, 1024, 4096, 4096, 4096, 1024]
    - [82, 67.472]
  - - [256, 8976, 1, 20992, 256, 256, 256, 20992]
    - [49, 53.829]
  - - [1024, 2048, 1, 30528, 1024, 1024, 1024, 30528]
    - [99, 50.882]
  - - [1024, 9520, 1, 1024, 1024, 1024, 1024, 1024]
    - [131, 51.842]
  - - [4096, 4096, 1, 4096, 4192, 4192, 4192, 4192]
    - [84, 77.557]
  - - [1024, 77, 1, 30522, 1024, 1024, 1024, 30522]
    - [72, 10.431]
  - - [1024, 8448, 1, 256, 1024, 1024, 1024, 256]
    - [38, 38.027]
  - - [1024, 9, 1, 2, 1024, 1024, 1024, 2]
    - [1, 0.002]
  - - [256, 8976, 1, 2304, 256, 256, 256, 2304]
    - [41, 41.811]
  - - [1024, 1024, 1, 4096, 1024, 1024, 1024, 4096]
    - [11, 34.74]
  - - [1024, 9, 1, 1024, 1024, 1024, 1024, 1024]
    - [36, 0.57]
  - - [64, 31, 2048, 31, 64, 64, 131072, 31]
    - [12, 2.999]
  - - [4096, 6528, 1, 1024, 4096, 4096, 4096, 1024]
    - [80, 65.702]
  - - [2048, 960, 1, 2048, 2048, 2048, 2048, 2048]
    - [108, 40.561]
  - - [1024, 14848, 1, 256, 1024, 1024, 1024, 256]
    - [70, 41.112]
  - - [1024, 780, 1, 1024, 1024, 1024, 1024, 1024]
    - [85, 26.951]
  - - [64, 4, 38400, 4, 64, 64, 2457600, 4]
    - [3, 0.105]
  - - [4096, 8160, 1, 1024, 4096, 4096, 4096, 1024]
    - [81, 67.802]
  - - [1024, 7104, 1, 1024, 1024, 1024, 1024, 1024]
    - [18, 52.257]
  - - [1024, 4096, 1, 2, 1024, 1024, 1024, 2]
    - [61, 0.383]
  - - [4096, 2560, 1, 1024, 4096, 4096, 4096, 1024]
    - [44, 62.685]
  - - [64, 128, 144, 128, 64, 64, 64, 128]
    - [20, 10.954]
  - - [1024, 780, 1, 30522, 1024, 1024, 1024, 30522]
    - [120, 34.646]
  - - [256, 8976, 1, 5888, 256, 256, 256, 5888]
    - [4, 49.79]
  - - [8192, 7680, 1, 8192, 8384, 8384, 8384, 8384]
    - [65, 91.082]
  - - [1024, 7200, 1, 42720, 1024, 1024, 1024, 42720]
    - [116, 85.005]
  - - [64, 34, 4736, 34, 64, 64, 303104, 34]
    - [3, 3.076]
  - - [1024, 3840, 1, 4096, 1024, 1024, 1024, 4096]
    - [109, 74.359]
  - - [64, 32, 4608, 32, 64, 64, 294912, 32]
    - [8, 6.337]
  - - [2048, 1024, 1, 1, 2048, 2048, 2048, 1]
    - [19, 0.127]
  - - [256, 8976, 1, 2560, 256, 256, 256, 2560]
    - [41, 43.042]
  - - [512, 215, 1, 2048, 512, 512, 512, 2048]
    - [122, 9.254]
  - - [4096, 4096, 1, 1024, 4096, 4096, 4096, 1024]
    - [80, 64.284]
  - - [256, 8976, 1, 26112, 256, 256, 256, 26112]
    - [35, 54.622]
  - - [64, 512, 64, 512, 64, 64, 64, 512]
    - [60, 21.066]
  - - [1024, 4864, 1, 256, 1024, 1024, 1024, 256]
    - [20, 34.388]
  - - [100, 512, 1, 2048, 100, 100, 100, 2048]
    - [24, 4.695]
  - - [1024, 11008, 1, 256, 1024, 1024, 1024, 256]
    - [87, 39.772]
  - - [1024, 13312, 1, 256, 1024, 1024, 1024, 256]
    - [38, 39.633]
  - - [1024, 960, 1, 1024, 1056, 1056, 1056, 1056]
    - [140, 33.765]
  - - [1024, 12288, 1, 256, 1024, 1024, 1024, 256]
    - [87, 40.409]
  - - [1024, 33536, 1, 256, 1024, 1024, 1024, 256]
    - [70, 46.324]
  - - [256, 8976, 1, 11008, 256, 256, 256, 11008]
    - [35, 52.568]
  - - [256, 1024, 1, 1, 256, 256, 256, 1]
    - [1, 0.033]
  - - [1024, 3072, 1, 2, 1024, 1024, 1024, 2]
    - [17, 0.347]
  - - [8192, 8192, 1, 8192, 8384, 8384, 8384, 8384]
    - [84, 88.745]
  - - [1024, 180, 1, 1024, 1024, 1024, 1024, 1024]
    - [28, 9.923]
  - - [2048, 1024, 1, 256, 2048, 2048, 2048, 256]
    - [63, 22.231]
  - - [256, 8976, 1, 2048, 256, 256, 256, 2048]
    - [6, 40.553]
  - - [1024, 1024, 1, 1024, 1024, 1024, 1024, 1024]
    - [114, 28.958]
  - - [4096, 10080, 1, 1024, 4096, 4096, 4096, 1024]
    - [126, 67.38]
  - - [1024, 14592, 1, 256, 1024, 1024, 1024, 256]
    - [87, 41.529]
  - - [1024, 180, 1, 30522, 1024, 1024, 1024, 30522]
    - [136, 18.743]
  - - [1024, 200, 1, 1, 1024, 1024, 1024, 1]
    - [89, 0.025]
  - - [256, 8976, 1, 5376, 256, 256, 256, 5376]
    - [57, 49.362]
  - - [1024, 2048, 1, 4096, 1024, 1024, 1024, 4096]
    - [62, 45.315]
  - - [1024, 512, 1, 2, 1024, 1024, 1024, 2]
    - [110, 0.115]
  - - [1024, 8192, 1, 4096, 1024, 1024, 1024, 4096]
    - [62, 62.123]
  - - [74, 960, 1, 2048, 74, 74, 74, 2048]
    - [34, 5.769]
  - - [1024, 385, 1, 30522, 1024, 1024, 1024, 30522]
    - [93, 24.395]
  - - [512, 512, 1, 64, 512, 512, 512, 64]
    - [58, 2.243]
  - - [1024, 7104, 1, 42720, 1024, 1024, 1024, 42720]
    - [25, 84.9]
  - - [1024, 14336, 1, 256, 1024, 1024, 1024, 256]
    - [74, 41.376]
  - - [1024, 20480, 1, 256, 1024, 1024, 1024, 256]
    - [53, 41.523]
  - - [1024, 10200, 1, 4096, 1024, 1024, 1024, 4096]
    - [18, 72.9]
  - - [4096, 512, 1, 1024, 4096, 4096, 4096, 1024]
    - [75, 34.353]
  - - [32, 33, 1600, 33, 32, 32, 32, 33]
    - [1, 1.818]
  - - [1024, 8160, 1, 1024, 1024, 1024, 1024, 1024]
    - [54, 48.179]
  - - [1024, 160, 1, 1024, 1024, 1024, 1024, 1024]
    - [32, 9.458]
  - - [1024, 5120, 1, 4096, 1024, 1024, 1024, 4096]
    - [105, 57.949]
  - - [1024, 2048, 1, 256, 1024, 1024, 1024, 256]
    - [69, 22.429]
  - - [1024, 3840, 1, 1024, 1024, 1024, 1024, 1024]
    - [105, 59.155]
  - - [1024, 32768, 1, 1024, 1024, 1024, 1024, 1024]
    - [105, 70.92]
  - - [2048, 1920, 1, 2048, 2080, 2080, 2080, 2080]
    - [99, 74.25]
  - - [1024, 462, 1, 1024, 1024, 1024, 1024, 1024]
    - [130, 16.307]
  - - [128, 128, 512, 64, 128, 128, 128, 64]
    - [17, 14.437]
  - - [1024, 462, 1, 30522, 1024, 1024, 1024, 30522]
    - [47, 28.575]
  - - [256, 8976, 1, 44505, 256, 256, 256, 44505]
    - [4, 55.356]
  - - [1024, 5632, 1, 256, 1024, 1024, 1024, 256]
    - [87, 34.979]
  - - [1024, 77, 1, 1024, 1024, 1024, 1024, 1024]
    - [122, 4.782]
  - - [960, 1024, 1, 1024, 1056, 1056, 1056, 1056]
    - [55, 35.549]
  - - [1024, 4096, 1, 256, 1024, 1024, 1024, 256]
    - [20, 30.823]
  - - [1024, 40, 1, 2, 1024, 1024, 1024, 2]
    - [7, 0.01]
  - - [64, 5, 1, 5, 64, 64, 64, 5]
    - [1, 0.0]
  - - [1024, 512, 1, 1, 1024, 1024, 1024, 1]
    - [7, 0.058]
  - - [1024, 40, 1, 1024, 1024, 1024, 1024, 1024]
    - [36, 2.516]
  - - [1600, 512, 1, 1024, 1600, 1600, 1600, 1024]
    - [127, 29.736]
  - - [4096, 5120, 1, 1024, 4096, 4096, 4096, 1024]
    - [80, 67.281]
  - - [4096, 9216, 1, 1024, 4096, 4096, 4096, 1024]
    - [67, 68.72]
  - - [4096, 3968, 1, 1024, 4096, 4096, 4096, 1024]
    - [80, 62.676]
  - - [256, 8976, 1, 7168, 256, 256, 256, 7168]
    - [90, 51.023]
  - - [1024, 9520, 1, 4096, 1024, 1024, 1024, 4096]
    - [126, 69.097]
  - - [1024, 10064, 1, 4096, 1024, 1024, 1024, 4096]
    - [105, 71.836]
  - - [1024, 1792, 1, 256, 1024, 1024, 1024, 256]
    - [101, 25.86]
  - - [256, 8976, 1, 7424, 256, 256, 256, 7424]
    - [77, 50.826]
  - - [256, 8976, 1, 12288, 256, 256, 256, 12288]
    - [4, 53.221]
  - - [67, 512, 1, 2048, 67, 67, 67, 2048]
    - [36, 2.962]
  - - [1024, 5120, 1, 256, 1024, 1024, 1024, 256]
    - [20, 35.382]
  - - [256, 32768, 1, 128, 256, 256, 256, 128]
    - [20, 26.443]
  - - [1024, 6144, 1, 256, 1024, 1024, 1024, 256]
    - [20, 35.217]
  - - [512, 200, 1, 1, 512, 512, 512, 1]
    - [56, 0.013]
  - - [256, 8976, 1, 4864, 256, 256, 256, 4864]
    - [90, 48.672]
  - - [4096, 7104, 1, 1024, 4096, 4096, 4096, 1024]
    - [59, 65.921]
  - - [1024, 200, 1, 30522, 1024, 1024, 1024, 30522]
    - [135, 19.918]
  - - [1024, 11520, 1, 256, 1024, 1024, 1024, 256]
    - [39, 39.974]
  - - [1024, 10496, 1, 256, 1024, 1024, 1024, 256]
    - [74, 39.736]
  - - [1024, 41, 1, 2, 1024, 1024, 1024, 2]
    - [7, 0.011]
  - - [256, 8976, 1, 5632, 256, 256, 256, 5632]
    - [57, 49.453]
  - - [1024, 200, 1, 1024, 1024, 1024, 1024, 1024]
    - [42, 10.552]
  - - [4096, 8192, 1, 1024, 4096, 4096, 4096, 1024]
    - [81, 69.705]
  - - [4096, 9520, 1, 1024, 4096, 4096, 4096, 1024]
    - [81, 67.402]
  - - [1024, 41, 1, 1024, 1024, 1024, 1024, 1024]
    - [50, 2.579]
  - - [1024, 4992, 1, 4096, 1024, 1024, 1024, 4096]
    - [62, 56.289]
  - - [1024, 10200, 1, 1024, 1024, 1024, 1024, 1024]
    - [131, 55.086]
  - - [4096, 1280, 1, 1024, 4096, 4096, 4096, 1024]
    - [18, 47.22]
  - - [256, 8976, 1, 11520, 256, 256, 256, 11520]
    - [49, 52.451]
  - - [1024, 2560, 1, 4096, 1024, 1024, 1024, 4096]
    - [105, 55.09]
  - - [1024, 4992, 1, 2, 1024, 1024, 1024, 2]
    - [17, 0.435]
  - - [64, 35, 4608, 35, 64, 64, 294912, 35]
    - [129, 2.917]
  - - [64, 3, 512, 3, 64, 64, 64, 3]
    - [1, 0.022]
  - - [1024, 6528, 1, 1024, 1024, 1024, 1024, 1024]
    - [105, 57.815]
  - - [64, 30, 2048, 30, 64, 64, 131072, 30]
    - [96, 2.89]
  - - [1024, 4096, 1, 30528, 1024, 1024, 1024, 30528]
    - [99, 50.912]
  - - [768, 256, 1, 2048, 768, 768, 768, 2048]
    - [51, 14.383]
  - - [256, 8976, 1, 8448, 256, 256, 256, 8448]
    - [90, 51.757]
  - - [512, 32768, 1, 256, 512, 512, 512, 256]
    - [30, 41.782]
  - - [1024, 40448, 1, 256, 1024, 1024, 1024, 256]
    - [81, 46.784]
  - - [256, 8976, 1, 22016, 256, 256, 256, 22016]
    - [78, 53.811]
  - - [32, 33, 1, 33, 32, 32, 32, 33]
    - [58, 0.004]
  - - [7680, 8192, 1, 8192, 8384, 8384, 8384, 8384]
    - [82, 91.768]
  - - [4096, 3072, 1, 1024, 4096, 4096, 4096, 1024]
    - [132, 59.902]
  - - [1024, 8064, 1, 4096, 1024, 1024, 1024, 4096]
    - [62, 61.2]
  - - [64, 14, 10880, 14, 64, 64, 696320, 14]
    - [12, 1.023]
  - - [1024, 19712, 1, 256, 1024, 1024, 1024, 256]
    - [87, 42.087]
  - - [64, 31, 2048, 30, 64, 64, 131072, 30]
    - [12, 2.91]
  - - [1024, 32, 1, 2, 1024, 1024, 1024, 2]
    - [7, 0.009]
  - - [1024, 9984, 1, 256, 1024, 1024, 1024, 256]
    - [38, 38.633]
  - - [2048, 512, 1, 2048, 2048, 2048, 2048, 2048]
    - [38, 32.155]
  - - [1024, 16128, 1, 256, 1024, 1024, 1024, 256]
    - [74, 41.561]
  - - [256, 8976, 1, 20480, 256, 256, 256, 20480]
    - [49, 54.197]
  - - [256, 8976, 1, 15104, 256, 256, 256, 15104]
    - [27, 53.219]
  - - [1024, 9600, 1, 1024, 1024, 1024, 1024, 1024]
    - [105, 59.548]
  - - [1024, 10080, 1, 42720, 1024, 1024, 1024, 42720]
    - [99, 82.998]
  - - [4096, 7200, 1, 1024, 4096, 4096, 4096, 1024]
    - [81, 64.245]
  - - [2048, 512, 1, 1, 2048, 2048, 2048, 1]
    - [17, 0.088]
  - - [512, 1600, 1, 512, 512, 512, 512, 512]
    - [100, 21.567]
  - - [1024, 385, 1, 1024, 1024, 1024, 1024, 1024]
    - [9, 17.095]
  - - [1024, 960, 1, 1024, 1024, 1024, 1024, 1024]
    - [134, 30.487]
  - - [256, 8976, 1, 8192, 256, 256, 256, 8192]
    - [57, 51.63]
  - - [4096, 2048, 1, 1024, 4096, 4096, 4096, 1024]
    - [68, 52.37]
  - - [64, 4, 32768, 4, 64, 64, 2097152, 4]
    - [3, 0.104]
  - - [1024, 2048, 1, 1024, 1024, 1024, 1024, 1024]
    - [88, 34.71]
  - - [64, 128, 656, 128, 64, 64, 64, 128]
    - [20, 15.777]
  - - [64, 512, 128, 512, 64, 64, 64, 512]
    - [61, 25.343]
  - - [1024, 4992, 1, 1024, 1024, 1024, 1024, 1024]
    - [21, 47.698]
  - - [1024, 1152, 1, 2, 1024, 1024, 1024, 2]
    - [17, 0.194]
  - - [256, 8976, 1, 10496, 256, 256, 256, 10496]
    - [27, 52.393]
  - - [1024, 5248, 1, 4096, 1024, 1024, 1024, 4096]
    - [105, 59.007]
  - - [1024, 17152, 1, 256, 1024, 1024, 1024, 256]
    - [30, 41.011]
  - - [1024, 9600, 1, 33712, 1024, 1024, 1024, 33712]
    - [18, 77.558]
  - - [1024, 3072, 1, 4096, 1024, 1024, 1024, 4096]
    - [18, 65.321]
  - - [64, 17, 6144, 21, 64, 64, 393216, 21]
    - [12, 1.547]
  - - [1024, 9216, 1, 4096, 1024, 1024, 1024, 4096]
    - [62, 69.26]
  - - [1024, 32768, 1, 512, 1024, 1024, 1024, 512]
    - [105, 59.436]
  - - [1024, 7200, 1, 1024, 1024, 1024, 1024, 1024]
    - [133, 53.934]
  - - [4096, 3840, 1, 4096, 4192, 4192, 4192, 4192]
    - [31, 88.977]
  - - [1024, 6, 1, 1024, 1024, 1024, 1024, 1024]
    - [34, 0.365]
  - - [256, 8976, 1, 19712, 256, 256, 256, 19712]
    - [41, 53.848]
  - - [1024, 5120, 1, 1024, 1024, 1024, 1024, 1024]
    - [101, 47.176]
  - - [1024, 8192, 1, 33712, 1024, 1024, 1024, 33712]
    - [14, 66.706]
  - - [1024, 308, 1, 1024, 1024, 1024, 1024, 1024]
    - [138, 14.324]
  - - [3840, 4096, 1, 4096, 4192, 4192, 4192, 4192]
    - [70, 89.134]
  - - [1024, 2560, 1, 2, 1024, 1024, 1024, 2]
    - [61, 0.307]
  - - [1024, 6, 1, 2, 1024, 1024, 1024, 2]
    - [1, 0.001]
  - - [64, 128, 160, 128, 64, 64, 64, 128]
    - [15, 11.985]
  - - [4096, 8064, 1, 1024, 4096, 4096, 4096, 1024]
    - [82, 68.011]
  - - [256, 8976, 1, 6656, 256, 256, 256, 6656]
    - [57, 50.523]
  - - [64, 15, 10880, 15, 64, 64, 696320, 15]
    - [12, 1.168]
  - - [1024, 960, 1, 64, 1024, 1024, 1024, 64]
    - [103, 7.009]
  - - [1024, 7104, 1, 4096, 1024, 1024, 1024, 4096]
    - [116, 73.671]
  - - [1024, 512, 1, 4096, 1024, 1024, 1024, 4096]
    - [22, 24.842]
  - - [1024, 8960, 1, 256, 1024, 1024, 1024, 256]
    - [74, 38.563]
  - - [1024, 3968, 1, 4096, 1024, 1024, 1024, 4096]
    - [101, 45.782]
  - - [1024, 10080, 1, 4096, 1024, 1024, 1024, 4096]
    - [116, 71.963]
  - - [1024, 7424, 1, 256, 1024, 1024, 1024, 256]
    - [87, 37.398]
  - - [32, 200, 1, 1, 32, 32, 32, 1]
    - [0, 0.001]
  - - [257, 1024, 1, 4096, 257, 257, 257, 4096]
    - [33, 15.52]
  - - [1024, 4096, 1, 4096, 1024, 1024, 1024, 4096]
    - [62, 46.227]
  - - [64, 512, 1, 512, 64, 64, 64, 512]
    - [36, 1.454]
  - - [64, 128, 128, 128, 64, 64, 64, 128]
    - [15, 9.662]
  - - [64, 35, 4608, 32, 64, 64, 294912, 32]
    - [8, 4.719]
  - - [4096, 10064, 1, 1024, 4096, 4096, 4096, 1024]
    - [126, 66.977]
  - - [64, 14, 10880, 15, 64, 64, 696320, 15]
    - [12, 1.089]
  - - [256, 8976, 1, 8960, 256, 256, 256, 8960]
    - [27, 51.753]
  - - [1024, 5248, 1, 1024, 1024, 1024, 1024, 1024]
    - [105, 47.596]
  - - [1024, 820, 1, 30522, 1024, 1024, 1024, 30522]
    - [98, 36.825]
  - - [1024, 1280, 1, 2, 1024, 1024, 1024, 2]
    - [104, 0.213]
  - - [1024, 11264, 1, 256, 1024, 1024, 1024, 256]
    - [133, 39.646]
  - - [4096, 10200, 1, 1024, 4096, 4096, 4096, 1024]
    - [81, 67.687]
  - - [64, 24, 4736, 34, 64, 64, 303104, 34]
    - [12, 2.847]
  - - [64, 15, 7680, 15, 64, 64, 491520, 15]
    - [12, 1.114]
  - - [1024, 7200, 1, 4096, 1024, 1024, 1024, 4096]
    - [105, 72.132]
  - - [1024, 1280, 1, 1024, 1024, 1024, 1024, 1024]
    - [17, 35.086]
  - - [1024, 6400, 1, 256, 1024, 1024, 1024, 256]
    - [38, 36.011]
  - - [64, 9, 512, 9, 64, 64, 64, 9]
    - [1, 0.189]
  - - [1024, 10240, 1, 256, 1024, 1024, 1024, 256]
    - [20, 39.499]
  - - [1920, 2048, 1, 2048, 2080, 2080, 2080, 2080]
    - [133, 75.971]
  - - [1024, 32, 1, 1024, 1024, 1024, 1024, 1024]
    - [128, 2.227]
  - - [560, 200, 1, 1024, 560, 560, 560, 1024]
    - [42, 6.063]
  - - [1024, 3968, 1, 1024, 1024, 1024, 1024, 1024]
    - [21, 42.883]
  - - [1024, 3072, 1, 1024, 1024, 1024, 1024, 1024]
    - [62, 48.779]
  - - [256, 8976, 1, 10240, 256, 256, 256, 10240]
    - [57, 52.429]
  - - [256, 8976, 1, 17152, 256, 256, 256, 17152]
    - [27, 53.587]
  - - [1024, 9520, 1, 42720, 1024, 1024, 1024, 42720]
    - [99, 78.582]
  - - [1024, 19968, 1, 256, 1024, 1024, 1024, 256]
    - [87, 42.303]
  - - [1024, 3840, 1, 256, 1024, 1024, 1024, 256]
    - [39, 33.17]
  - - [64, 21, 6144, 21, 64, 64, 393216, 21]
    - [12, 1.891]
  - - [1024, 7168, 1, 256, 1024, 1024, 1024, 256]
    - [30, 37.574]
  - - [1024, 800, 1, 30522, 1024, 1024, 1024, 30522]
    - [97, 35.214]
  - - [1024, 2048, 1, 2, 1024, 1024, 1024, 2]
    - [111, 0.249]
  - - [64, 128, 1, 128, 64, 64, 64, 128]
    - [24, 0.144]
  - - [256, 8976, 1, 14848, 256, 256, 256, 14848]
    - [49, 53.599]
  - - [512, 1600, 1, 32, 512, 512, 512, 32]
    - [8, 3.361]
  - - [64, 512, 80, 512, 64, 64, 64, 512]
    - [45, 24.389]
  - - [480, 512, 1, 512, 544, 544, 544, 544]
    - [94, 9.979]
  - - [512, 480, 1, 512, 544, 544, 544, 544]
    - [112, 9.813]
  - - [1024, 8160, 1, 4096, 1024, 1024, 1024, 4096]
    - [139, 59.347]
  - - [1024, 13568, 1, 256, 1024, 1024, 1024, 256]
    - [46, 40.151]
  - - [1024, 4, 1, 2, 1024, 1024, 1024, 2]
    - [0, 0.001]
  - - [64, 17, 7680, 17, 64, 64, 491520, 17]
    - [12, 1.332]
  - - [1024, 6528, 1, 42720, 1024, 1024, 1024, 42720]
    - [99, 80.705]
  - - [1024, 8704, 1, 256, 1024, 1024, 1024, 256]
    - [30, 38.753]
  - - [64, 512, 1, 1, 64, 64, 64, 1]
    - [2, 0.004]
  - - [1024, 4, 1, 1024, 1024, 1024, 1024, 1024]
    - [71, 0.244]
  - - [4096, 4992, 1, 1024, 4096, 4096, 4096, 1024]
    - [66, 65.997]
  - - [479, 32768, 1, 1024, 479, 479, 479, 1024]
    - [139, 52.628]
  - - [64, 128, 512, 128, 64, 64, 64, 128]
    - [29, 14.479]
  - - [1024, 1152, 1, 4096, 1024, 1024, 1024, 4096]
    - [95, 35.831]
  - - [1024, 3968, 1, 42720, 1024, 1024, 1024, 42720]
    - [59, 49.562]
  - - [1024, 5120, 1, 2, 1024, 1024, 1024, 2]
    - [17, 0.44]
- null
