TRAIN_3.7/build/3_LibraryLogic_eff/arcturus_Cijk_Alik_Bljk_HBH.yaml
- {MinimumRequiredVersion: 4.20.0}
- arcturus
- gfx908
- [Device 7380, Device 7388, Device 738c, Device 7390]
- - - [33536, 8976, 1, 256, 33536, 33536, 256, 256]
    - [82, 49.708]
  - - [5, 5, 960, 64, 5, 5, 64, 64]
    - [0, 0.142]
  - - [256, 44505, 1, 1024, 256, 256, 1024, 1024]
    - [104, 59.76]
  - - [1024, 10, 1, 1024, 1024, 1024, 1024, 1024]
    - [58, 0.811]
  - - [256, 14592, 1, 1024, 256, 256, 1024, 1024]
    - [38, 58.303]
  - - [2048, 2048, 1, 2048, 2080, 2080, 2080, 2080]
    - [18, 57.215]
  - - [1024, 10080, 1, 1024, 1024, 1024, 1024, 1024]
    - [117, 56.137]
  - - [2, 32, 1, 1024, 2, 2, 1024, 1024]
    - [25, 0.004]
  - - [1024, 32768, 1, 479, 1024, 1024, 479, 479]
    - [56, 42.062]
  - - [18944, 8976, 1, 256, 18944, 18944, 256, 256]
    - [82, 48.857]
  - - [1024, 9216, 1, 1024, 1024, 1024, 1024, 1024]
    - [117, 61.354]
  - - [256, 16128, 1, 1024, 256, 256, 1024, 1024]
    - [117, 45.9]
  - - [1024, 4992, 1, 4096, 1024, 1024, 4096, 4096]
    - [101, 66.332]
  - - [5632, 8976, 1, 256, 5632, 5632, 256, 256]
    - [116, 44.412]
  - - [1024, 5, 1, 1024, 1024, 1024, 1024, 1024]
    - [92, 0.38]
  - - [256, 14848, 1, 1024, 256, 256, 1024, 1024]
    - [61, 59.037]
  - - [256, 14336, 1, 1024, 256, 256, 1024, 1024]
    - [32, 57.467]
  - - [2, 5, 1, 1024, 2, 2, 1024, 1024]
    - [0, 0.001]
  - - [8192, 7680, 1, 8192, 8384, 8384, 8384, 8384]
    - [54, 94.138]
  - - [64, 960, 1, 1024, 64, 64, 1024, 1024]
    - [93, 4.748]
  - - [2, 40, 1, 1024, 2, 2, 1024, 1024]
    - [25, 0.006]
  - - [11264, 8976, 1, 256, 11264, 11264, 256, 256]
    - [91, 47.813]
  - - [1024, 1024, 1, 1024, 1056, 1056, 1056, 1056]
    - [48, 34.413]
  - - [42720, 6528, 1, 1024, 42720, 42720, 1024, 1024]
    - [82, 74.687]
  - - [30, 31, 2048, 64, 30, 30, 131072, 131072]
    - [79, 4.088]
  - - [2048, 215, 1, 768, 2048, 2048, 768, 768]
    - [119, 15.903]
  - - [15, 14, 10880, 64, 15, 15, 696320, 696320]
    - [6, 2.483]
  - - [64, 512, 1, 512, 64, 64, 512, 512]
    - [93, 1.962]
  - - [1024, 4096, 1, 1024, 1024, 1024, 1024, 1024]
    - [117, 47.176]
  - - [18176, 8976, 1, 256, 18176, 18176, 256, 256]
    - [82, 48.493]
  - - [128, 128, 128, 64, 128, 128, 64, 64]
    - [1, 8.908]
  - - [1024, 200, 1, 560, 1024, 1024, 560, 560]
    - [111, 7.015]
  - - [512, 512, 1, 512, 544, 544, 544, 544]
    - [28, 10.922]
  - - [42720, 3968, 1, 1024, 42720, 42720, 1024, 1024]
    - [52, 73.093]
  - - [2, 4, 1, 1024, 2, 2, 1024, 1024]
    - [0, 0.001]
  - - [64, 128, 1, 128, 64, 64, 128, 128]
    - [26, 0.163]
  - - [1024, 2560, 1, 4096, 1024, 1024, 4096, 4096]
    - [59, 54.375]
  - - [30522, 462, 1, 1024, 30522, 30522, 1024, 1024]
    - [65, 54.204]
  - - [1024, 820, 1, 1024, 1024, 1024, 1024, 1024]
    - [99, 31.432]
  - - [34, 34, 4736, 64, 34, 34, 303104, 303104]
    - [10, 3.876]
  - - [19712, 8976, 1, 256, 19712, 19712, 256, 256]
    - [82, 48.852]
  - - [1024, 10064, 1, 1024, 1024, 1024, 1024, 1024]
    - [104, 56.017]
  - - [4096, 5248, 1, 1024, 4096, 4096, 1024, 1024]
    - [52, 66.968]
  - - [256, 21504, 1, 1024, 256, 256, 1024, 1024]
    - [117, 59.208]
  - - [4096, 3840, 1, 4096, 4192, 4192, 4192, 4192]
    - [50, 91.308]
  - - [2048, 512, 1, 100, 2048, 2048, 100, 100]
    - [22, 7.009]
  - - [1024, 39, 1, 1024, 1024, 1024, 1024, 1024]
    - [73, 2.99]
  - - [256, 31488, 1, 1024, 256, 256, 1024, 1024]
    - [107, 55.255]
  - - [256, 8960, 1, 1024, 256, 256, 1024, 1024]
    - [99, 39.965]
  - - [256, 13312, 1, 1024, 256, 256, 1024, 1024]
    - [46, 53.362]
  - - [128, 128, 160, 64, 128, 128, 64, 64]
    - [16, 10.195]
  - - [11776, 8976, 1, 256, 11776, 11776, 256, 256]
    - [116, 47.484]
  - - [7168, 8976, 1, 256, 7168, 7168, 256, 256]
    - [116, 46.667]
  - - [4096, 1280, 1, 1024, 4096, 4096, 1024, 1024]
    - [77, 57.354]
  - - [15, 15, 10880, 64, 15, 15, 696320, 696320]
    - [3, 2.642]
  - - [1024, 2048, 1, 4096, 1024, 1024, 4096, 4096]
    - [51, 43.903]
  - - [64, 512, 1, 1024, 64, 64, 1024, 1024]
    - [26, 2.804]
  - - [32, 32, 4608, 64, 32, 32, 294912, 294912]
    - [19, 5.876]
  - - [1024, 2560, 1, 1024, 1024, 1024, 1024, 1024]
    - [67, 42.796]
  - - [21248, 8976, 1, 256, 21248, 21248, 256, 256]
    - [82, 48.869]
  - - [256, 2304, 1, 1024, 256, 256, 1024, 1024]
    - [99, 26.788]
  - - [1024, 7200, 1, 1024, 1024, 1024, 1024, 1024]
    - [117, 56.074]
  - - [1024, 800, 1, 1024, 1024, 1024, 1024, 1024]
    - [99, 31.029]
  - - [3840, 8976, 1, 256, 3840, 3840, 256, 256]
    - [34, 44.158]
  - - [1024, 3840, 1, 1024, 1024, 1024, 1024, 1024]
    - [61, 63.013]
  - - [1024, 8, 1, 1024, 1024, 1024, 1024, 1024]
    - [26, 0.66]
  - - [30522, 160, 1, 1024, 30522, 30522, 1024, 1024]
    - [125, 38.017]
  - - [2, 1024, 1, 1024, 2, 2, 1024, 1024]
    - [64, 0.151]
  - - [2048, 512, 1, 2048, 2048, 2048, 2048, 2048]
    - [40, 36.606]
  - - [32, 1600, 1, 512, 32, 32, 512, 512]
    - [26, 2.852]
  - - [30522, 308, 1, 1024, 30522, 30522, 1024, 1024]
    - [107, 49.772]
  - - [2560, 8976, 1, 256, 2560, 2560, 256, 256]
    - [45, 42.249]
  - - [30528, 4096, 1, 1024, 30528, 30528, 1024, 1024]
    - [81, 74.631]
  - - [256, 9984, 1, 1024, 256, 256, 1024, 1024]
    - [100, 42.597]
  - - [32, 35, 4608, 64, 32, 32, 294912, 294912]
    - [9, 5.01]
  - - [15104, 8976, 1, 256, 15104, 15104, 256, 256]
    - [82, 48.441]
  - - [17, 17, 6144, 64, 17, 17, 393216, 393216]
    - [6, 2.184]
  - - [4096, 2560, 1, 1024, 4096, 4096, 1024, 1024]
    - [52, 62.142]
  - - [3072, 8976, 1, 256, 3072, 3072, 256, 256]
    - [45, 43.633]
  - - [512, 32768, 1, 13, 512, 512, 13, 13]
    - [70, 3.442]
  - - [2048, 215, 1, 512, 2048, 2048, 512, 512]
    - [78, 13.186]
  - - [1024, 9520, 1, 4096, 1024, 1024, 4096, 4096]
    - [13, 68.028]
  - - [4096, 4096, 1, 4096, 4192, 4192, 4192, 4192]
    - [107, 81.924]
  - - [4096, 8192, 1, 1024, 4096, 4096, 1024, 1024]
    - [52, 70.841]
  - - [4096, 3840, 1, 1024, 4096, 4096, 1024, 1024]
    - [61, 69.878]
  - - [2304, 8976, 1, 256, 2304, 2304, 256, 256]
    - [45, 42.383]
  - - [33, 33, 1, 32, 33, 33, 32, 32]
    - [0, 0.006]
  - - [12544, 8976, 1, 256, 12544, 12544, 256, 256]
    - [103, 47.853]
  - - [1024, 1600, 1, 1024, 1024, 1024, 1024, 1024]
    - [125, 38.863]
  - - [15360, 8976, 1, 256, 15360, 15360, 256, 256]
    - [116, 48.248]
  - - [1024, 5120, 1, 1024, 1024, 1024, 1024, 1024]
    - [117, 56.452]
  - - [1024, 9, 1, 1024, 1024, 1024, 1024, 1024]
    - [93, 0.736]
  - - [256, 2560, 1, 1024, 256, 256, 1024, 1024]
    - [99, 29.485]
  - - [1024, 780, 1, 1024, 1024, 1024, 1024, 1024]
    - [99, 30.373]
  - - [2816, 8976, 1, 256, 2816, 2816, 256, 256]
    - [45, 43.039]
  - - [16128, 8976, 1, 256, 16128, 16128, 256, 256]
    - [103, 48.452]
  - - [256, 4864, 1, 1024, 256, 256, 1024, 1024]
    - [65, 37.289]
  - - [512, 512, 64, 64, 512, 512, 64, 64]
    - [86, 21.289]
  - - [512, 512, 80, 64, 512, 512, 64, 64]
    - [11, 21.997]
  - - [4096, 3072, 1, 1024, 4096, 4096, 1024, 1024]
    - [117, 63.331]
  - - [480, 512, 1, 512, 544, 544, 544, 544]
    - [31, 10.904]
  - - [256, 6144, 1, 1024, 256, 256, 1024, 1024]
    - [104, 45.953]
  - - [1024, 3072, 1, 4096, 1024, 1024, 4096, 4096]
    - [81, 64.759]
  - - [20480, 8976, 1, 256, 20480, 20480, 256, 256]
    - [116, 49.339]
  - - [4096, 1024, 1, 1024, 4096, 4096, 1024, 1024]
    - [40, 47.01]
  - - [1024, 1152, 1, 1024, 1024, 1024, 1024, 1024]
    - [37, 35.327]
  - - [128, 128, 656, 64, 128, 128, 64, 64]
    - [80, 15.512]
  - - [1024, 1024, 1, 4096, 1024, 1024, 4096, 4096]
    - [124, 40.234]
  - - [256, 7936, 1, 1024, 256, 256, 1024, 1024]
    - [29, 36.873]
  - - [684, 8976, 1, 256, 684, 684, 256, 256]
    - [87, 32.686]
  - - [3, 3, 512, 64, 3, 3, 64, 64]
    - [30, 0.037]
  - - [27, 27, 32768, 128, 27, 27, 128, 128]
    - [118, 8.088]
  - - [2048, 684, 1, 768, 2048, 2048, 768, 768]
    - [122, 32.688]
  - - [1024, 960, 1, 1024, 1056, 1056, 1056, 1056]
    - [88, 38.451]
  - - [30522, 820, 1, 1024, 30522, 30522, 1024, 1024]
    - [89, 61.482]
  - - [2, 10, 1, 1024, 2, 2, 1024, 1024]
    - [2, 0.001]
  - - [8960, 8976, 1, 256, 8960, 8960, 256, 256]
    - [103, 47.236]
  - - [1024, 7104, 1, 4096, 1024, 1024, 4096, 4096]
    - [51, 72.881]
  - - [21, 17, 6144, 64, 21, 21, 393216, 393216]
    - [6, 2.456]
  - - [8192, 8192, 1, 8192, 8384, 8384, 8384, 8384]
    - [53, 89.723]
  - - [1024, 32768, 1, 480, 1024, 1024, 480, 480]
    - [56, 66.079]
  - - [1024, 180, 1, 1024, 1024, 1024, 1024, 1024]
    - [108, 11.544]
  - - [128, 128, 624, 64, 128, 128, 64, 64]
    - [12, 15.232]
  - - [5, 5, 512, 64, 5, 5, 64, 64]
    - [44, 0.105]
  - - [1024, 1600, 1, 560, 1024, 1024, 560, 560]
    - [22, 25.328]
  - - [1024, 4096, 1, 4096, 1024, 1024, 4096, 4096]
    - [69, 56.176]
  - - [256, 8448, 1, 1024, 256, 256, 1024, 1024]
    - [99, 38.666]
  - - [1024, 3840, 1, 4096, 1024, 1024, 4096, 4096]
    - [82, 79.539]
  - - [34, 24, 4736, 64, 34, 34, 303104, 303104]
    - [20, 4.695]
  - - [256, 11264, 1, 1024, 256, 256, 1024, 1024]
    - [35, 46.209]
  - - [2048, 512, 1, 67, 2048, 2048, 67, 67]
    - [84, 4.943]
  - - [256, 10496, 1, 1024, 256, 256, 1024, 1024]
    - [100, 44.016]
  - - [4096, 2048, 1, 1024, 4096, 4096, 1024, 1024]
    - [104, 57.833]
  - - [256, 22016, 1, 1024, 256, 256, 1024, 1024]
    - [71, 60.078]
  - - [30, 30, 2048, 64, 30, 30, 131072, 131072]
    - [15, 3.985]
  - - [1024, 960, 1, 1600, 1024, 1024, 1600, 1600]
    - [88, 39.044]
  - - [2048, 1536, 1, 512, 2048, 2048, 512, 512]
    - [35, 40.194]
  - - [1024, 7200, 1, 4096, 1024, 1024, 4096, 4096]
    - [51, 73.983]
  - - [42720, 10080, 1, 1024, 42720, 42720, 1024, 1024]
    - [82, 74.775]
  - - [9984, 8976, 1, 256, 9984, 9984, 256, 256]
    - [90, 46.785]
  - - [4096, 10200, 1, 1024, 4096, 4096, 1024, 1024]
    - [52, 69.592]
  - - [1024, 1024, 1, 1024, 1024, 1024, 1024, 1024]
    - [106, 32.104]
  - - [1024, 10200, 1, 4096, 1024, 1024, 4096, 4096]
    - [81, 72.255]
  - - [256, 33536, 1, 1024, 256, 256, 1024, 1024]
    - [117, 58.225]
  - - [21, 21, 6144, 64, 21, 21, 393216, 393216]
    - [15, 2.755]
  - - [4608, 8976, 1, 256, 4608, 4608, 256, 256]
    - [103, 44.818]
  - - [1024, 8160, 1, 4096, 1024, 1024, 4096, 4096]
    - [101, 65.553]
  - - [1024, 160, 1, 1024, 1024, 1024, 1024, 1024]
    - [97, 10.828]
  - - [256, 19200, 1, 1024, 256, 256, 1024, 1024]
    - [117, 53.708]
  - - [4096, 5120, 1, 1024, 4096, 4096, 1024, 1024]
    - [77, 66.834]
  - - [256, 7424, 1, 1024, 256, 256, 1024, 1024]
    - [104, 54.205]
  - - [4, 4, 38400, 64, 4, 4, 2457600, 2457600]
    - [0, 0.227]
  - - [2048, 114, 1, 512, 2048, 2048, 512, 512]
    - [62, 8.348]
  - - [256, 11520, 1, 1024, 256, 256, 1024, 1024]
    - [102, 47.024]
  - - [2048, 1920, 1, 2048, 2080, 2080, 2080, 2080]
    - [23, 79.33]
  - - [2, 39, 1, 1024, 2, 2, 1024, 1024]
    - [25, 0.006]
  - - [1024, 462, 1, 1024, 1024, 1024, 1024, 1024]
    - [47, 18.657]
  - - [2, 9, 1, 1024, 2, 2, 1024, 1024]
    - [25, 0.001]
  - - [13312, 8976, 1, 256, 13312, 13312, 256, 256]
    - [82, 48.233]
  - - [35, 35, 4608, 64, 35, 35, 294912, 294912]
    - [10, 3.593]
  - - [30522, 180, 1, 1024, 30522, 30522, 1024, 1024]
    - [100, 41.423]
  - - [33712, 8192, 1, 1024, 33712, 33712, 1024, 1024]
    - [74, 75.358]
  - - [2048, 1536, 1, 768, 2048, 2048, 768, 768]
    - [76, 47.598]
  - - [4096, 4096, 1, 1024, 4096, 4096, 1024, 1024]
    - [117, 65.435]
  - - [2048, 512, 1, 74, 2048, 2048, 74, 74]
    - [16, 5.301]
  - - [1024, 77, 1, 1024, 1024, 1024, 1024, 1024]
    - [96, 5.359]
  - - [256, 1280, 1, 1024, 256, 256, 1024, 1024]
    - [98, 20.129]
  - - [8192, 8976, 1, 256, 8192, 8192, 256, 256]
    - [52, 45.239]
  - - [960, 1024, 1, 1024, 1056, 1056, 1056, 1056]
    - [36, 37.531]
  - - [2048, 8976, 1, 256, 2048, 2048, 256, 256]
    - [34, 41.353]
  - - [20992, 8976, 1, 256, 20992, 20992, 256, 256]
    - [103, 49.104]
  - - [256, 7168, 1, 1024, 256, 256, 1024, 1024]
    - [117, 53.287]
  - - [5, 5, 1, 64, 5, 5, 64, 64]
    - [5, 0.0]
  - - [28672, 8976, 1, 256, 28672, 28672, 256, 256]
    - [82, 49.599]
  - - [8448, 8976, 1, 256, 8448, 8448, 256, 256]
    - [91, 46.701]
  - - [1024, 40, 1, 1024, 1024, 1024, 1024, 1024]
    - [26, 3.091]
  - - [2, 8, 1, 1024, 2, 2, 1024, 1024]
    - [25, 0.001]
  - - [24, 24, 4736, 64, 24, 24, 303104, 303104]
    - [55, 4.416]
  - - [512, 512, 96, 64, 512, 512, 64, 64]
    - [21, 22.631]
  - - [1024, 8064, 1, 1024, 1024, 1024, 1024, 1024]
    - [104, 57.383]
  - - [13824, 8976, 1, 256, 13824, 13824, 256, 256]
    - [116, 48.219]
  - - [1024, 9520, 1, 1024, 1024, 1024, 1024, 1024]
    - [117, 60.741]
  - - [256, 6656, 1, 1024, 256, 256, 1024, 1024]
    - [63, 49.783]
  - - [1024, 1152, 1, 4096, 1024, 1024, 4096, 4096]
    - [89, 44.949]
  - - [256, 3328, 1, 1024, 256, 256, 1024, 1024]
    - [99, 33.877]
  - - [4352, 8976, 1, 256, 4352, 4352, 256, 256]
    - [34, 44.29]
  - - [30522, 385, 1, 1024, 30522, 30522, 1024, 1024]
    - [120, 47.275]
  - - [256, 1536, 1, 1024, 256, 256, 1024, 1024]
    - [95, 21.169]
  - - [17, 17, 7680, 64, 17, 17, 491520, 491520]
    - [6, 2.935]
  - - [5376, 8976, 1, 256, 5376, 5376, 256, 256]
    - [103, 44.948]
  - - [1024, 7104, 1, 1024, 1024, 1024, 1024, 1024]
    - [104, 55.724]
  - - [1024, 8160, 1, 1024, 1024, 1024, 1024, 1024]
    - [104, 53.064]
  - - [9472, 8976, 1, 256, 9472, 9472, 256, 256]
    - [116, 47.358]
  - - [256, 23552, 1, 1024, 256, 256, 1024, 1024]
    - [107, 51.313]
  - - [13568, 8976, 1, 256, 13568, 13568, 256, 256]
    - [82, 47.964]
  - - [1024, 200, 1, 1024, 1024, 1024, 1024, 1024]
    - [97, 12.19]
  - - [1024, 5120, 1, 4096, 1024, 1024, 4096, 4096]
    - [101, 66.9]
  - - [30522, 616, 1, 1024, 30522, 30522, 1024, 1024]
    - [124, 61.201]
  - - [1024, 41, 1, 1024, 1024, 1024, 1024, 1024]
    - [105, 3.193]
  - - [4096, 8064, 1, 1024, 4096, 4096, 1024, 1024]
    - [52, 69.658]
  - - [1024, 10200, 1, 1024, 1024, 1024, 1024, 1024]
    - [117, 57.098]
  - - [128, 128, 1, 64, 128, 128, 64, 64]
    - [2, 0.172]
  - - [256, 684, 1, 1024, 256, 256, 1024, 1024]
    - [94, 11.112]
  - - [1024, 5248, 1, 4096, 1024, 1024, 4096, 4096]
    - [85, 67.011]
  - - [4, 4, 32768, 64, 4, 4, 2097152, 2097152]
    - [0, 0.223]
  - - [1280, 8976, 1, 256, 1280, 1280, 256, 256]
    - [87, 39.322]
  - - [2048, 256, 1, 512, 2048, 2048, 512, 512]
    - [43, 16.103]
  - - [4864, 8976, 1, 256, 4864, 4864, 256, 256]
    - [103, 44.115]
  - - [256, 20992, 1, 1024, 256, 256, 1024, 1024]
    - [117, 58.059]
  - - [256, 18944, 1, 1024, 256, 256, 1024, 1024]
    - [117, 53.357]
  - - [1024, 6528, 1, 1024, 1024, 1024, 1024, 1024]
    - [104, 56.891]
  - - [1024, 6528, 1, 4096, 1024, 1024, 4096, 4096]
    - [14, 71.534]
  - - [9728, 8976, 1, 256, 9728, 9728, 256, 256]
    - [116, 47.674]
  - - [256, 12544, 1, 1024, 256, 256, 1024, 1024]
    - [104, 50.865]
  - - [42720, 7200, 1, 1024, 42720, 42720, 1024, 1024]
    - [82, 73.957]
  - - [9, 9, 512, 64, 9, 9, 64, 64]
    - [3, 0.34]
  - - [128, 128, 640, 64, 128, 128, 64, 64]
    - [12, 15.469]
  - - [7680, 8192, 1, 8192, 8384, 8384, 8384, 8384]
    - [54, 94.239]
  - - [4096, 9520, 1, 1024, 4096, 4096, 1024, 1024]
    - [75, 69.212]
  - - [4096, 8160, 1, 1024, 4096, 4096, 1024, 1024]
    - [52, 67.063]
  - - [4096, 9216, 1, 1024, 4096, 4096, 1024, 1024]
    - [52, 71.817]
  - - [19968, 8976, 1, 256, 19968, 19968, 256, 256]
    - [116, 48.89]
  - - [1024, 1280, 1, 4096, 1024, 1024, 4096, 4096]
    - [124, 48.922]
  - - [1024, 5248, 1, 1024, 1024, 1024, 1024, 1024]
    - [104, 58.124]
  - - [6400, 8976, 1, 256, 6400, 6400, 256, 256]
    - [103, 46.277]
  - - [33, 33, 1600, 32, 33, 33, 32, 32]
    - [33, 1.905]
  - - [5888, 8976, 1, 256, 5888, 5888, 256, 256]
    - [103, 45.204]
  - - [256, 23296, 1, 1024, 256, 256, 1024, 1024]
    - [124, 50.71]
  - - [512, 32768, 1, 1024, 512, 512, 1024, 1024]
    - [117, 65.515]
  - - [512, 512, 128, 64, 512, 512, 64, 64]
    - [49, 22.994]
  - - [512, 512, 16, 64, 512, 512, 64, 64]
    - [83, 13.879]
  - - [1024, 9600, 1, 1024, 1024, 1024, 1024, 1024]
    - [89, 62.181]
  - - [2, 6, 1, 1024, 2, 2, 1024, 1024]
    - [0, 0.001]
  - - [4096, 7200, 1, 1024, 4096, 4096, 1024, 1024]
    - [112, 66.45]
  - - [2, 2048, 1, 1024, 2, 2, 1024, 1024]
    - [72, 0.299]
  - - [2048, 960, 1, 74, 2048, 2048, 74, 74]
    - [17, 9.077]
  - - [512, 1600, 1, 512, 512, 512, 512, 512]
    - [100, 23.934]
  - - [1024, 385, 1, 1024, 1024, 1024, 1024, 1024]
    - [98, 20.421]
  - - [1024, 960, 1, 1024, 1024, 1024, 1024, 1024]
    - [121, 34.507]
  - - [3328, 8976, 1, 256, 3328, 3328, 256, 256]
    - [45, 44.258]
  - - [256, 18176, 1, 1024, 256, 256, 1024, 1024]
    - [117, 51.253]
  - - [1024, 2048, 1, 1024, 1024, 1024, 1024, 1024]
    - [42, 37.919]
  - - [64, 128, 512, 128, 64, 64, 128, 128]
    - [86, 14.437]
  - - [256, 8192, 1, 1024, 256, 256, 1024, 1024]
    - [29, 37.355]
  - - [64, 512, 64, 512, 64, 64, 512, 512]
    - [98, 23.644]
  - - [1024, 4992, 1, 1024, 1024, 1024, 1024, 1024]
    - [117, 56.113]
  - - [33712, 9600, 1, 1024, 33712, 33712, 1024, 1024]
    - [60, 75.068]
  - - [256, 3584, 1, 1024, 256, 256, 1024, 1024]
    - [99, 34.48]
  - - [18688, 8976, 1, 256, 18688, 18688, 256, 256]
    - [116, 49.23]
  - - [1024, 32768, 1, 1024, 1024, 1024, 1024, 1024]
    - [13, 71.108]
  - - [4096, 7104, 1, 1024, 4096, 4096, 1024, 1024]
    - [82, 65.719]
  - - [1024, 512, 1, 4096, 1024, 1024, 4096, 4096]
    - [110, 32.002]
  - - [14, 14, 10880, 64, 14, 14, 696320, 696320]
    - [0, 2.326]
  - - [1024, 9600, 1, 4096, 1024, 1024, 4096, 4096]
    - [52, 71.353]
  - - [6144, 8976, 1, 256, 6144, 6144, 256, 256]
    - [116, 45.574]
  - - [30528, 2048, 1, 1024, 30528, 30528, 1024, 1024]
    - [81, 72.623]
  - - [1024, 6, 1, 1024, 1024, 1024, 1024, 1024]
    - [57, 0.46]
  - - [17, 15, 7680, 64, 17, 17, 491520, 491520]
    - [3, 2.584]
  - - [23552, 8976, 1, 256, 23552, 23552, 256, 256]
    - [116, 49.44]
  - - [1024, 308, 1, 1024, 1024, 1024, 1024, 1024]
    - [66, 16.426]
  - - [3840, 4096, 1, 4096, 4192, 4192, 4192, 4192]
    - [50, 91.253]
  - - [256, 15104, 1, 1024, 256, 256, 1024, 1024]
    - [38, 60.447]
  - - [2, 41, 1, 1024, 2, 2, 1024, 1024]
    - [25, 0.006]
  - - [256, 5376, 1, 1024, 256, 256, 1024, 1024]
    - [117, 40.58]
  - - [1024, 3968, 1, 1024, 1024, 1024, 1024, 1024]
    - [104, 45.595]
  - - [512, 512, 1, 64, 512, 512, 64, 64]
    - [7, 2.379]
  - - [1024, 8064, 1, 4096, 1024, 1024, 4096, 4096]
    - [120, 65.71]
  - - [256, 2816, 1, 1024, 256, 256, 1024, 1024]
    - [100, 31.118]
  - - [256, 5888, 1, 1024, 256, 256, 1024, 1024]
    - [63, 44.72]
  - - [4096, 1152, 1, 1024, 4096, 4096, 1024, 1024]
    - [117, 52.336]
  - - [7936, 8976, 1, 256, 7936, 7936, 256, 256]
    - [91, 46.261]
  - - [2048, 960, 1, 2048, 2048, 2048, 2048, 2048]
    - [68, 42.675]
  - - [5120, 8976, 1, 256, 5120, 5120, 256, 256]
    - [103, 45.647]
  - - [1024, 512, 1, 1024, 1024, 1024, 1024, 1024]
    - [109, 23.368]
  - - [4096, 6528, 1, 1024, 4096, 4096, 1024, 1024]
    - [52, 71.255]
  - - [4096, 9600, 1, 1024, 4096, 4096, 1024, 1024]
    - [60, 72.201]
  - - [4096, 10080, 1, 1024, 4096, 4096, 1024, 1024]
    - [52, 68.762]
  - - [256, 11776, 1, 1024, 256, 256, 1024, 1024]
    - [32, 47.751]
  - - [30522, 200, 1, 1024, 30522, 30522, 1024, 1024]
    - [63, 41.934]
  - - [128, 32768, 1, 256, 128, 128, 256, 256]
    - [12, 27.085]
  - - [4096, 4992, 1, 1024, 4096, 4096, 1024, 1024]
    - [117, 66.332]
  - - [256, 22344, 1, 1024, 256, 256, 1024, 1024]
    - [117, 54.597]
  - - [1024, 8192, 1, 1024, 1024, 1024, 1024, 1024]
    - [18, 58.21]
  - - [128, 128, 512, 64, 128, 128, 64, 64]
    - [12, 14.605]
  - - [4096, 3968, 1, 1024, 4096, 4096, 1024, 1024]
    - [117, 63.78]
  - - [4096, 10064, 1, 1024, 4096, 4096, 1024, 1024]
    - [52, 68.593]
  - - [2048, 684, 1, 512, 2048, 2048, 512, 512]
    - [115, 27.621]
  - - [31, 31, 2048, 64, 31, 31, 131072, 131072]
    - [8, 4.121]
  - - [30522, 780, 1, 1024, 30522, 30522, 1024, 1024]
    - [104, 59.211]
  - - [17152, 8976, 1, 256, 17152, 17152, 256, 256]
    - [82, 48.73]
  - - [4096, 512, 1, 1024, 4096, 4096, 1024, 1024]
    - [110, 37.847]
  - - [4096, 8976, 1, 256, 4096, 4096, 256, 256]
    - [116, 43.756]
  - - [1024, 1280, 1, 1024, 1024, 1024, 1024, 1024]
    - [117, 38.648]
  - - [256, 21248, 1, 1024, 256, 256, 1024, 1024]
    - [104, 59.033]
  - - [1920, 2048, 1, 2048, 2080, 2080, 2080, 2080]
    - [56, 78.504]
  - - [1024, 32, 1, 1024, 1024, 1024, 1024, 1024]
    - [41, 2.553]
  - - [2048, 256, 1, 768, 2048, 2048, 768, 768]
    - [68, 20.368]
  - - [1024, 3072, 1, 1024, 1024, 1024, 1024, 1024]
    - [114, 51.094]
  - - [1024, 9216, 1, 4096, 1024, 1024, 4096, 4096]
    - [13, 69.022]
  - - [15872, 8976, 1, 256, 15872, 15872, 256, 256]
    - [91, 48.448]
  - - [1024, 8192, 1, 4096, 1024, 1024, 4096, 4096]
    - [113, 66.258]
  - - [256, 32768, 1, 512, 256, 256, 512, 512]
    - [24, 47.907]
  - - [15, 15, 7680, 64, 15, 15, 491520, 491520]
    - [3, 2.358]
  - - [1792, 8976, 1, 256, 1792, 1792, 256, 256]
    - [87, 41.66]
  - - [1024, 512, 1, 1600, 1024, 1024, 1600, 1600]
    - [123, 28.037]
  - - [256, 6400, 1, 1024, 256, 256, 1024, 1024]
    - [104, 47.578]
  - - [10496, 8976, 1, 256, 10496, 10496, 256, 256]
    - [91, 47.269]
  - - [128, 128, 144, 64, 128, 128, 64, 64]
    - [4, 9.745]
  - - [1024, 10080, 1, 4096, 1024, 1024, 4096, 4096]
    - [51, 71.522]
  - - [512, 480, 1, 512, 544, 544, 544, 544]
    - [27, 10.609]
  - - [31488, 8976, 1, 256, 31488, 31488, 256, 256]
    - [82, 49.45]
  - - [256, 20480, 1, 1024, 256, 256, 1024, 1024]
    - [117, 56.579]
  - - [44505, 8976, 1, 256, 44505, 44505, 256, 256]
    - [103, 48.145]
  - - [2048, 114, 1, 768, 2048, 2048, 768, 768]
    - [39, 10.967]
  - - [30522, 800, 1, 1024, 30522, 30522, 1024, 1024]
    - [89, 60.23]
  - - [256, 4608, 1, 1024, 256, 256, 1024, 1024]
    - [37, 34.89]
  - - [1024, 4, 1, 1024, 1024, 1024, 1024, 1024]
    - [57, 0.309]
  - - [42720, 7104, 1, 1024, 42720, 42720, 1024, 1024]
    - [82, 74.521]
  - - [1024, 3968, 1, 4096, 1024, 1024, 4096, 4096]
    - [63, 54.439]
  - - [42720, 9520, 1, 1024, 42720, 42720, 1024, 1024]
    - [82, 74.469]
  - - [1024, 10064, 1, 4096, 1024, 1024, 4096, 4096]
    - [13, 71.511]
  - - [10240, 8976, 1, 256, 10240, 10240, 256, 256]
    - [91, 47.725]
  - - [30522, 77, 1, 1024, 30522, 30522, 1024, 1024]
    - [91, 29.402]
- null
