TRAIN_3.7/build/3_LibraryLogic_eff/arcturus_Cijk_Ailk_Bljk_HBH.yaml
- {MinimumRequiredVersion: 4.20.0}
- arcturus
- gfx908
- [Device 7380, Device 7388, Device 738c, Device 7390]
- - - [7680, 8192, 1, 8192, 8384, 8384, 8384, 8384]
    - [95, 91.189]
  - - [3840, 4096, 1, 4096, 4192, 4192, 4192, 4192]
    - [80, 89.798]
  - - [1920, 2048, 1, 2048, 2080, 2080, 2080, 2080]
    - [71, 80.089]
  - - [960, 1024, 1, 1024, 1056, 1056, 1056, 1056]
    - [159, 40.606]
  - - [480, 512, 1, 512, 544, 544, 544, 544]
    - [61, 12.799]
  - - [8192, 7680, 1, 8192, 8384, 8384, 8384, 8384]
    - [77, 90.828]
  - - [4096, 3840, 1, 4096, 4192, 4192, 4192, 4192]
    - [80, 89.732]
  - - [2048, 1920, 1, 2048, 2080, 2080, 2080, 2080]
    - [123, 79.834]
  - - [1024, 960, 1, 1024, 1056, 1056, 1056, 1056]
    - [111, 38.928]
  - - [512, 480, 1, 512, 544, 544, 544, 544]
    - [140, 12.527]
  - - [8192, 8192, 1, 8192, 8384, 8384, 8384, 8384]
    - [98, 88.811]
  - - [4096, 4096, 1, 4096, 4192, 4192, 4192, 4192]
    - [98, 78.008]
  - - [2048, 2048, 1, 2048, 2080, 2080, 2080, 2080]
    - [73, 47.878]
  - - [1024, 1024, 1, 1024, 1056, 1056, 1056, 1056]
    - [79, 36.276]
  - - [512, 512, 1, 512, 544, 544, 544, 544]
    - [116, 12.314]
  - - [64, 512, 16, 512, 64, 64, 64, 512]
    - [18, 17.206]
  - - [64, 512, 128, 512, 64, 64, 64, 512]
    - [110, 26.374]
  - - [1024, 8, 1, 1024, 1024, 1024, 1024, 1024]
    - [74, 0.755]
  - - [1024, 77, 1, 1024, 1024, 1024, 1024, 1024]
    - [101, 6.746]
  - - [1024, 77, 1, 30522, 1024, 1024, 1024, 30522]
    - [83, 10.699]
  - - [1024, 512, 1, 2, 1024, 1024, 1024, 2]
    - [51, 0.136]
  - - [1024, 512, 1, 1024, 1024, 1024, 1024, 1024]
    - [40, 25.765]
  - - [1024, 512, 1, 4096, 1024, 1024, 1024, 4096]
    - [153, 27.305]
  - - [1024, 616, 1, 1024, 1024, 1024, 1024, 1024]
    - [32, 25.399]
  - - [1024, 4096, 1, 2, 1024, 1024, 1024, 2]
    - [122, 0.427]
  - - [1024, 4096, 1, 1024, 1024, 1024, 1024, 1024]
    - [15, 44.96]
  - - [1024, 4096, 1, 4096, 1024, 1024, 1024, 4096]
    - [72, 47.107]
  - - [4096, 512, 1, 1024, 4096, 4096, 4096, 1024]
    - [31, 38.574]
  - - [4096, 4096, 1, 1024, 4096, 4096, 4096, 1024]
    - [76, 66.381]
  - - [64, 128, 128, 128, 64, 64, 64, 128]
    - [91, 11.739]
  - - [64, 128, 160, 128, 64, 64, 64, 128]
    - [143, 14.145]
  - - [1024, 10, 1, 2, 1024, 1024, 1024, 2]
    - [0, 0.004]
  - - [1024, 10, 1, 1024, 1024, 1024, 1024, 1024]
    - [35, 0.917]
  - - [1024, 160, 1, 1024, 1024, 1024, 1024, 1024]
    - [45, 11.544]
  - - [1024, 200, 1, 1024, 1024, 1024, 1024, 1024]
    - [42, 12.998]
  - - [1024, 200, 1, 30522, 1024, 1024, 1024, 30522]
    - [99, 19.857]
  - - [1024, 1024, 1, 2, 1024, 1024, 1024, 2]
    - [11, 0.237]
  - - [1024, 1024, 1, 1024, 1024, 1024, 1024, 1024]
    - [14, 33.948]
  - - [1024, 1024, 1, 4096, 1024, 1024, 1024, 4096]
    - [46, 34.266]
  - - [1024, 1280, 1, 2, 1024, 1024, 1024, 2]
    - [134, 0.292]
  - - [1024, 1280, 1, 1024, 1024, 1024, 1024, 1024]
    - [147, 34.602]
  - - [1024, 1280, 1, 4096, 1024, 1024, 1024, 4096]
    - [10, 41.729]
  - - [4096, 1024, 1, 1024, 4096, 4096, 4096, 1024]
    - [81, 41.565]
  - - [4096, 1280, 1, 1024, 4096, 4096, 4096, 1024]
    - [28, 50.142]
  - - [64, 128, 624, 128, 64, 64, 64, 128]
    - [57, 15.864]
  - - [1024, 39, 1, 2, 1024, 1024, 1024, 2]
    - [62, 0.015]
  - - [1024, 39, 1, 1024, 1024, 1024, 1024, 1024]
    - [35, 3.576]
  - - [1024, 780, 1, 1024, 1024, 1024, 1024, 1024]
    - [110, 32.432]
  - - [1024, 780, 1, 30522, 1024, 1024, 1024, 30522]
    - [132, 34.582]
  - - [1024, 4992, 1, 2, 1024, 1024, 1024, 2]
    - [131, 0.481]
  - - [1024, 4992, 1, 1024, 1024, 1024, 1024, 1024]
    - [123, 48.405]
  - - [1024, 4992, 1, 4096, 1024, 1024, 1024, 4096]
    - [123, 57.428]
  - - [4096, 4992, 1, 1024, 4096, 4096, 4096, 1024]
    - [92, 67.73]
  - - [64, 512, 64, 512, 64, 64, 64, 512]
    - [81, 22.28]
  - - [1024, 4, 1, 2, 1024, 1024, 1024, 2]
    - [0, 0.001]
  - - [1024, 4, 1, 1024, 1024, 1024, 1024, 1024]
    - [129, 0.374]
  - - [1024, 308, 1, 1024, 1024, 1024, 1024, 1024]
    - [17, 16.791]
  - - [1024, 308, 1, 30522, 1024, 1024, 1024, 30522]
    - [90, 22.847]
  - - [1024, 2048, 1, 2, 1024, 1024, 1024, 2]
    - [69, 0.314]
  - - [1024, 2048, 1, 1024, 1024, 1024, 1024, 1024]
    - [106, 37.847]
  - - [1024, 2048, 1, 4096, 1024, 1024, 1024, 4096]
    - [123, 46.387]
  - - [4096, 2048, 1, 1024, 4096, 4096, 4096, 1024]
    - [133, 55.097]
  - - [64, 128, 640, 128, 64, 64, 64, 128]
    - [26, 16.062]
  - - [1024, 40, 1, 2, 1024, 1024, 1024, 2]
    - [152, 0.015]
  - - [1024, 40, 1, 1024, 1024, 1024, 1024, 1024]
    - [35, 3.774]
  - - [1024, 800, 1, 1024, 1024, 1024, 1024, 1024]
    - [18, 32.574]
  - - [1024, 800, 1, 30522, 1024, 1024, 1024, 30522]
    - [117, 35.566]
  - - [1024, 5120, 1, 2, 1024, 1024, 1024, 2]
    - [37, 0.49]
  - - [1024, 5120, 1, 1024, 1024, 1024, 1024, 1024]
    - [12, 49.161]
  - - [1024, 5120, 1, 4096, 1024, 1024, 1024, 4096]
    - [12, 58.404]
  - - [4096, 5120, 1, 1024, 4096, 4096, 4096, 1024]
    - [95, 69.157]
  - - [64, 128, 656, 128, 64, 64, 64, 128]
    - [60, 16.297]
  - - [1024, 41, 1, 2, 1024, 1024, 1024, 2]
    - [5, 0.015]
  - - [1024, 41, 1, 1024, 1024, 1024, 1024, 1024]
    - [101, 3.868]
  - - [1024, 820, 1, 1024, 1024, 1024, 1024, 1024]
    - [128, 33.251]
  - - [1024, 820, 1, 30522, 1024, 1024, 1024, 30522]
    - [112, 37.041]
  - - [1024, 5248, 1, 2, 1024, 1024, 1024, 2]
    - [11, 0.498]
  - - [1024, 5248, 1, 1024, 1024, 1024, 1024, 1024]
    - [123, 50.489]
  - - [1024, 5248, 1, 4096, 1024, 1024, 1024, 4096]
    - [123, 60.214]
  - - [4096, 5248, 1, 1024, 4096, 4096, 4096, 1024]
    - [76, 69.947]
  - - [64, 512, 80, 512, 64, 64, 64, 512]
    - [159, 26.005]
  - - [1024, 5, 1, 2, 1024, 1024, 1024, 2]
    - [3, 0.002]
  - - [1024, 5, 1, 1024, 1024, 1024, 1024, 1024]
    - [33, 0.467]
  - - [1024, 385, 1, 1024, 1024, 1024, 1024, 1024]
    - [138, 21.466]
  - - [1024, 385, 1, 30522, 1024, 1024, 1024, 30522]
    - [154, 24.651]
  - - [1024, 2560, 1, 2, 1024, 1024, 1024, 2]
    - [131, 0.366]
  - - [1024, 2560, 1, 1024, 1024, 1024, 1024, 1024]
    - [144, 45.758]
  - - [1024, 2560, 1, 4096, 1024, 1024, 1024, 4096]
    - [123, 57.159]
  - - [4096, 2560, 1, 1024, 4096, 4096, 4096, 1024]
    - [78, 66.327]
  - - [64, 512, 96, 512, 64, 64, 64, 512]
    - [156, 27.455]
  - - [1024, 6, 1, 2, 1024, 1024, 1024, 2]
    - [0, 0.002]
  - - [1024, 6, 1, 1024, 1024, 1024, 1024, 1024]
    - [33, 0.55]
  - - [1024, 462, 1, 1024, 1024, 1024, 1024, 1024]
    - [158, 20.989]
  - - [1024, 462, 1, 30522, 1024, 1024, 1024, 30522]
    - [44, 28.193]
  - - [1024, 3072, 1, 2, 1024, 1024, 1024, 2]
    - [118, 0.415]
  - - [1024, 3072, 1, 1024, 1024, 1024, 1024, 1024]
    - [119, 53.831]
  - - [1024, 3072, 1, 4096, 1024, 1024, 1024, 4096]
    - [123, 67.629]
  - - [4096, 3072, 1, 1024, 4096, 4096, 4096, 1024]
    - [137, 62.124]
  - - [1024, 8, 1, 2, 1024, 1024, 1024, 2]
    - [0, 0.003]
  - - [1024, 160, 1, 30522, 1024, 1024, 1024, 30522]
    - [141, 17.613]
  - - [64, 128, 144, 128, 64, 64, 64, 128]
    - [118, 12.505]
  - - [1024, 9, 1, 2, 1024, 1024, 1024, 2]
    - [62, 0.004]
  - - [1024, 9, 1, 1024, 1024, 1024, 1024, 1024]
    - [129, 0.833]
  - - [1024, 180, 1, 1024, 1024, 1024, 1024, 1024]
    - [130, 12.098]
  - - [1024, 180, 1, 30522, 1024, 1024, 1024, 30522]
    - [155, 19.477]
  - - [1024, 1152, 1, 2, 1024, 1024, 1024, 2]
    - [47, 0.27]
  - - [1024, 1152, 1, 1024, 1024, 1024, 1024, 1024]
    - [148, 34.36]
  - - [1024, 1152, 1, 4096, 1024, 1024, 1024, 4096]
    - [122, 36.262]
  - - [4096, 1152, 1, 1024, 4096, 4096, 4096, 1024]
    - [25, 45.907]
  - - [256, 32768, 1, 128, 256, 256, 256, 128]
    - [70, 28.547]
  - - [479, 32768, 1, 1024, 479, 479, 479, 1024]
    - [151, 53.509]
  - - [512, 32768, 1, 256, 512, 512, 512, 256]
    - [50, 42.805]
  - - [1024, 32768, 1, 512, 1024, 1024, 1024, 512]
    - [123, 61.061]
  - - [1024, 32768, 1, 1024, 1024, 1024, 1024, 1024]
    - [123, 72.161]
  - - [64, 128, 512, 128, 64, 64, 64, 128]
    - [47, 15.225]
  - - [128, 128, 512, 64, 128, 128, 128, 64]
    - [14, 15.603]
  - - [1024, 32, 1, 2, 1024, 1024, 1024, 2]
    - [89, 0.013]
  - - [1024, 32, 1, 1024, 1024, 1024, 1024, 1024]
    - [101, 3.204]
  - - [1024, 4096, 1, 30528, 1024, 1024, 1024, 30528]
    - [119, 51.04]
  - - [512, 512, 64, 64, 512, 512, 512, 64]
    - [149, 22.133]
  - - [1024, 2048, 1, 30528, 1024, 1024, 1024, 30528]
    - [7, 50.847]
  - - [64, 4, 32768, 4, 64, 64, 2097152, 4]
    - [1, 0.106]
  - - [64, 4, 38400, 4, 64, 64, 2457600, 4]
    - [1, 0.106]
  - - [1024, 8192, 1, 1024, 1024, 1024, 1024, 1024]
    - [12, 53.915]
  - - [1024, 8192, 1, 4096, 1024, 1024, 1024, 4096]
    - [28, 62.656]
  - - [1024, 8192, 1, 33712, 1024, 1024, 1024, 33712]
    - [7, 66.794]
  - - [1024, 9600, 1, 1024, 1024, 1024, 1024, 1024]
    - [123, 61.895]
  - - [1024, 9600, 1, 4096, 1024, 1024, 1024, 4096]
    - [123, 73.31]
  - - [1024, 9600, 1, 33712, 1024, 1024, 1024, 33712]
    - [28, 77.292]
  - - [4096, 8192, 1, 1024, 4096, 4096, 4096, 1024]
    - [107, 72.032]
  - - [4096, 9600, 1, 1024, 4096, 4096, 4096, 1024]
    - [76, 71.34]
  - - [1024, 10064, 1, 1024, 1024, 1024, 1024, 1024]
    - [150, 58.819]
  - - [1024, 10064, 1, 4096, 1024, 1024, 1024, 4096]
    - [123, 73.893]
  - - [1024, 10080, 1, 1024, 1024, 1024, 1024, 1024]
    - [150, 59.266]
  - - [1024, 10080, 1, 4096, 1024, 1024, 1024, 4096]
    - [123, 73.913]
  - - [1024, 10080, 1, 42720, 1024, 1024, 1024, 42720]
    - [119, 82.946]
  - - [1024, 10200, 1, 1024, 1024, 1024, 1024, 1024]
    - [145, 59.331]
  - - [1024, 10200, 1, 4096, 1024, 1024, 1024, 4096]
    - [123, 74.64]
  - - [1024, 3840, 1, 1024, 1024, 1024, 1024, 1024]
    - [123, 64.523]
  - - [1024, 3840, 1, 4096, 1024, 1024, 1024, 4096]
    - [123, 77.895]
  - - [1024, 3968, 1, 1024, 1024, 1024, 1024, 1024]
    - [8, 44.551]
  - - [1024, 3968, 1, 4096, 1024, 1024, 1024, 4096]
    - [125, 46.368]
  - - [1024, 3968, 1, 42720, 1024, 1024, 1024, 42720]
    - [119, 49.636]
  - - [1024, 6528, 1, 1024, 1024, 1024, 1024, 1024]
    - [123, 61.892]
  - - [1024, 6528, 1, 4096, 1024, 1024, 1024, 4096]
    - [123, 72.732]
  - - [1024, 6528, 1, 42720, 1024, 1024, 1024, 42720]
    - [119, 80.748]
  - - [1024, 7104, 1, 1024, 1024, 1024, 1024, 1024]
    - [142, 58.434]
  - - [1024, 7104, 1, 4096, 1024, 1024, 1024, 4096]
    - [145, 76.083]
  - - [1024, 7104, 1, 42720, 1024, 1024, 1024, 42720]
    - [119, 86.02]
  - - [1024, 7200, 1, 1024, 1024, 1024, 1024, 1024]
    - [157, 59.124]
  - - [1024, 7200, 1, 4096, 1024, 1024, 1024, 4096]
    - [123, 74.099]
  - - [1024, 7200, 1, 42720, 1024, 1024, 1024, 42720]
    - [7, 84.206]
  - - [1024, 8064, 1, 1024, 1024, 1024, 1024, 1024]
    - [123, 53.18]
  - - [1024, 8064, 1, 4096, 1024, 1024, 1024, 4096]
    - [12, 62.064]
  - - [1024, 8160, 1, 1024, 1024, 1024, 1024, 1024]
    - [30, 49.185]
  - - [1024, 8160, 1, 4096, 1024, 1024, 1024, 4096]
    - [137, 61.102]
  - - [1024, 9216, 1, 1024, 1024, 1024, 1024, 1024]
    - [12, 59.302]
  - - [1024, 9216, 1, 4096, 1024, 1024, 1024, 4096]
    - [12, 70.296]
  - - [1024, 9520, 1, 1024, 1024, 1024, 1024, 1024]
    - [133, 56.652]
  - - [1024, 9520, 1, 4096, 1024, 1024, 1024, 4096]
    - [145, 70.852]
  - - [1024, 9520, 1, 42720, 1024, 1024, 1024, 42720]
    - [119, 78.547]
  - - [4096, 10064, 1, 1024, 4096, 4096, 4096, 1024]
    - [84, 69.892]
  - - [4096, 10080, 1, 1024, 4096, 4096, 4096, 1024]
    - [78, 69.134]
  - - [4096, 10200, 1, 1024, 4096, 4096, 4096, 1024]
    - [95, 69.017]
  - - [4096, 3840, 1, 1024, 4096, 4096, 4096, 1024]
    - [75, 66.224]
  - - [4096, 3968, 1, 1024, 4096, 4096, 4096, 1024]
    - [92, 64.546]
  - - [4096, 6528, 1, 1024, 4096, 4096, 4096, 1024]
    - [102, 68.512]
  - - [4096, 7104, 1, 1024, 4096, 4096, 4096, 1024]
    - [76, 69.468]
  - - [4096, 7200, 1, 1024, 4096, 4096, 4096, 1024]
    - [92, 68.662]
  - - [4096, 8064, 1, 1024, 4096, 4096, 4096, 1024]
    - [107, 71.905]
  - - [4096, 8160, 1, 1024, 4096, 4096, 4096, 1024]
    - [78, 70.179]
  - - [4096, 9216, 1, 1024, 4096, 4096, 4096, 1024]
    - [86, 70.337]
  - - [4096, 9520, 1, 1024, 4096, 4096, 4096, 1024]
    - [92, 69.059]
  - - [64, 14, 10880, 14, 64, 64, 696320, 14]
    - [6, 1.051]
  - - [64, 14, 10880, 15, 64, 64, 696320, 15]
    - [6, 1.121]
  - - [64, 15, 7680, 15, 64, 64, 491520, 15]
    - [6, 1.151]
  - - [64, 15, 10880, 15, 64, 64, 696320, 15]
    - [6, 1.191]
  - - [64, 15, 7680, 17, 64, 64, 491520, 17]
    - [6, 1.216]
  - - [64, 17, 6144, 17, 64, 64, 393216, 17]
    - [6, 1.333]
  - - [64, 17, 7680, 17, 64, 64, 491520, 17]
    - [6, 1.355]
  - - [64, 17, 6144, 21, 64, 64, 393216, 21]
    - [6, 1.589]
  - - [64, 21, 6144, 21, 64, 64, 393216, 21]
    - [6, 1.937]
  - - [64, 24, 4736, 24, 64, 64, 303104, 24]
    - [6, 2.45]
  - - [64, 24, 4736, 34, 64, 64, 303104, 34]
    - [6, 3.014]
  - - [64, 30, 2048, 30, 64, 64, 131072, 30]
    - [6, 3.154]
  - - [64, 31, 2048, 30, 64, 64, 131072, 30]
    - [6, 3.213]
  - - [64, 31, 2048, 31, 64, 64, 131072, 31]
    - [6, 3.302]
  - - [64, 32, 4608, 32, 64, 64, 294912, 32]
    - [39, 6.826]
  - - [64, 34, 4736, 34, 64, 64, 303104, 34]
    - [1, 3.174]
  - - [64, 35, 4608, 32, 64, 64, 294912, 32]
    - [64, 4.914]
  - - [64, 35, 4608, 35, 64, 64, 294912, 35]
    - [100, 3.113]
  - - [64, 512, 1, 512, 64, 64, 64, 512]
    - [20, 2.243]
  - - [512, 512, 1, 64, 512, 512, 512, 64]
    - [104, 2.962]
  - - [128, 128, 1, 64, 128, 128, 128, 64]
    - [66, 0.28]
  - - [64, 128, 1, 128, 64, 64, 64, 128]
    - [20, 0.228]
  - - [1024, 512, 1, 64, 1024, 1024, 1024, 64]
    - [13, 5.322]
  - - [74, 512, 1, 2048, 74, 74, 74, 2048]
    - [129, 4.482]
  - - [64, 5, 1, 5, 64, 64, 64, 5]
    - [62, 0.0]
  - - [2048, 512, 1, 2048, 2048, 2048, 2048, 2048]
    - [105, 33.833]
  - - [512, 1600, 1, 512, 512, 512, 512, 512]
    - [108, 25.824]
  - - [32, 33, 1, 33, 32, 32, 32, 33]
    - [0, 0.006]
  - - [560, 1600, 1, 1024, 560, 560, 560, 1024]
    - [40, 33.938]
  - - [512, 1600, 1, 32, 512, 512, 512, 32]
    - [59, 4.81]
  - - [1024, 1600, 1, 1024, 1024, 1024, 1024, 1024]
    - [8, 39.951]
  - - [32, 33, 1600, 33, 32, 32, 32, 33]
    - [56, 2.054]
  - - [32, 200, 1, 1, 32, 32, 32, 1]
    - [0, 0.001]
  - - [64, 3, 512, 3, 64, 64, 64, 3]
    - [146, 0.031]
  - - [64, 5, 512, 5, 64, 64, 64, 5]
    - [23, 0.086]
  - - [64, 5, 960, 5, 64, 64, 64, 5]
    - [1, 0.119]
  - - [64, 9, 512, 9, 64, 64, 64, 9]
    - [3, 0.256]
  - - [64, 512, 1, 1, 64, 64, 64, 1]
    - [62, 0.007]
  - - [67, 512, 1, 2048, 67, 67, 67, 2048]
    - [35, 3.937]
  - - [74, 960, 1, 2048, 74, 74, 74, 2048]
    - [19, 6.808]
  - - [100, 512, 1, 2048, 100, 100, 100, 2048]
    - [52, 5.911]
  - - [128, 27, 32768, 27, 128, 128, 128, 27]
    - [6, 3.451]
  - - [256, 1024, 1, 1, 256, 256, 256, 1]
    - [139, 0.042]
  - - [256, 8976, 1, 1536, 256, 256, 256, 1536]
    - [114, 41.031]
  - - [256, 8976, 1, 2048, 256, 256, 256, 2048]
    - [4, 43.691]
  - - [256, 8976, 1, 2304, 256, 256, 256, 2304]
    - [65, 45.041]
  - - [256, 8976, 1, 2560, 256, 256, 256, 2560]
    - [2, 46.106]
  - - [256, 8976, 1, 2816, 256, 256, 256, 2816]
    - [2, 46.725]
  - - [256, 8976, 1, 3072, 256, 256, 256, 3072]
    - [2, 47.355]
  - - [256, 8976, 1, 4352, 256, 256, 256, 4352]
    - [54, 49.7]
  - - [256, 8976, 1, 4864, 256, 256, 256, 4864]
    - [2, 50.384]
  - - [256, 8976, 1, 5376, 256, 256, 256, 5376]
    - [43, 50.704]
  - - [256, 8976, 1, 5632, 256, 256, 256, 5632]
    - [34, 50.759]
  - - [256, 8976, 1, 5888, 256, 256, 256, 5888]
    - [34, 50.891]
  - - [256, 8976, 1, 6144, 256, 256, 256, 6144]
    - [34, 51.309]
  - - [256, 8976, 1, 6656, 256, 256, 256, 6656]
    - [65, 51.56]
  - - [256, 8976, 1, 7168, 256, 256, 256, 7168]
    - [54, 51.865]
  - - [256, 8976, 1, 7424, 256, 256, 256, 7424]
    - [2, 52.121]
  - - [256, 8976, 1, 8192, 256, 256, 256, 8192]
    - [54, 52.104]
  - - [256, 8976, 1, 8448, 256, 256, 256, 8448]
    - [24, 52.565]
  - - [256, 8976, 1, 8960, 256, 256, 256, 8960]
    - [63, 52.601]
  - - [256, 8976, 1, 9472, 256, 256, 256, 9472]
    - [65, 52.783]
  - - [256, 8976, 1, 9728, 256, 256, 256, 9728]
    - [113, 53.068]
  - - [256, 8976, 1, 9984, 256, 256, 256, 9984]
    - [43, 52.816]
  - - [256, 8976, 1, 10240, 256, 256, 256, 10240]
    - [2, 53.048]
  - - [256, 8976, 1, 10496, 256, 256, 256, 10496]
    - [65, 53.083]
  - - [256, 8976, 1, 11008, 256, 256, 256, 11008]
    - [34, 53.291]
  - - [256, 8976, 1, 11520, 256, 256, 256, 11520]
    - [43, 53.24]
  - - [256, 8976, 1, 12288, 256, 256, 256, 12288]
    - [4, 53.588]
  - - [256, 8976, 1, 14336, 256, 256, 256, 14336]
    - [43, 53.754]
  - - [256, 8976, 1, 14848, 256, 256, 256, 14848]
    - [2, 53.771]
  - - [256, 8976, 1, 15104, 256, 256, 256, 15104]
    - [4, 53.721]
  - - [256, 8976, 1, 15872, 256, 256, 256, 15872]
    - [43, 54.031]
  - - [256, 8976, 1, 17152, 256, 256, 256, 17152]
    - [65, 53.814]
  - - [256, 8976, 1, 19712, 256, 256, 256, 19712]
    - [49, 54.213]
  - - [256, 8976, 1, 19968, 256, 256, 256, 19968]
    - [119, 54.175]
  - - [256, 8976, 1, 20480, 256, 256, 256, 20480]
    - [34, 54.331]
  - - [256, 8976, 1, 20992, 256, 256, 256, 20992]
    - [7, 54.355]
  - - [256, 8976, 1, 22016, 256, 256, 256, 22016]
    - [58, 54.399]
  - - [256, 8976, 1, 26112, 256, 256, 256, 26112]
    - [34, 54.606]
  - - [256, 8976, 1, 33536, 256, 256, 256, 33536]
    - [28, 54.725]
  - - [256, 8976, 1, 44505, 256, 256, 256, 44505]
    - [63, 55.327]
  - - [257, 1024, 1, 4096, 257, 257, 257, 4096]
    - [41, 16.647]
  - - [480, 32768, 1, 1024, 480, 480, 480, 1024]
    - [123, 57.617]
  - - [512, 200, 1, 1, 512, 512, 512, 1]
    - [115, 0.017]
  - - [512, 200, 1, 32, 512, 512, 512, 32]
    - [139, 0.59]
  - - [512, 215, 1, 2048, 512, 512, 512, 2048]
    - [55, 11.466]
  - - [512, 256, 1, 2048, 512, 512, 512, 2048]
    - [21, 13.153]
  - - [560, 200, 1, 1024, 560, 560, 560, 1024]
    - [135, 8.07]
  - - [768, 215, 1, 2048, 768, 768, 768, 2048]
    - [22, 14.32]
  - - [768, 256, 1, 2048, 768, 768, 768, 2048]
    - [53, 17.051]
  - - [1024, 200, 1, 1, 1024, 1024, 1024, 1]
    - [115, 0.034]
  - - [1024, 512, 1, 1, 1024, 1024, 1024, 1]
    - [9, 0.078]
  - - [1024, 960, 1, 64, 1024, 1024, 1024, 64]
    - [96, 9.813]
  - - [1024, 960, 1, 1024, 1024, 1024, 1024, 1024]
    - [121, 36.233]
  - - [1024, 1600, 1, 1, 1024, 1024, 1024, 1]
    - [11, 0.176]
  - - [1024, 1792, 1, 256, 1024, 1024, 1024, 256]
    - [8, 29.114]
  - - [1024, 2048, 1, 256, 1024, 1024, 1024, 256]
    - [68, 27.758]
  - - [1024, 2560, 1, 256, 1024, 1024, 1024, 256]
    - [120, 30.194]
  - - [1024, 3072, 1, 256, 1024, 1024, 1024, 256]
    - [124, 34.256]
  - - [1024, 3328, 1, 256, 1024, 1024, 1024, 256]
    - [126, 35.652]
  - - [1024, 3840, 1, 256, 1024, 1024, 1024, 256]
    - [16, 37.986]
  - - [1024, 4096, 1, 256, 1024, 1024, 1024, 256]
    - [60, 33.273]
  - - [1024, 4608, 1, 256, 1024, 1024, 1024, 256]
    - [36, 34.676]
  - - [1024, 4864, 1, 256, 1024, 1024, 1024, 256]
    - [38, 36.491]
  - - [1024, 5120, 1, 256, 1024, 1024, 1024, 256]
    - [87, 37.494]
  - - [1024, 5632, 1, 256, 1024, 1024, 1024, 256]
    - [85, 36.264]
  - - [1024, 6144, 1, 256, 1024, 1024, 1024, 256]
    - [14, 36.319]
  - - [1024, 6400, 1, 256, 1024, 1024, 1024, 256]
    - [29, 37.117]
  - - [1024, 7168, 1, 256, 1024, 1024, 1024, 256]
    - [87, 39.164]
  - - [1024, 7424, 1, 256, 1024, 1024, 1024, 256]
    - [80, 39.941]
  - - [1024, 7680, 1, 256, 1024, 1024, 1024, 256]
    - [93, 40.431]
  - - [1024, 7936, 1, 256, 1024, 1024, 1024, 256]
    - [14, 38.476]
  - - [1024, 8192, 1, 256, 1024, 1024, 1024, 256]
    - [14, 38.426]
  - - [1024, 8448, 1, 256, 1024, 1024, 1024, 256]
    - [14, 39.551]
  - - [1024, 8704, 1, 256, 1024, 1024, 1024, 256]
    - [109, 40.062]
  - - [1024, 8960, 1, 256, 1024, 1024, 1024, 256]
    - [103, 39.748]
  - - [1024, 9728, 1, 256, 1024, 1024, 1024, 256]
    - [50, 39.381]
  - - [1024, 9984, 1, 256, 1024, 1024, 1024, 256]
    - [38, 39.633]
  - - [1024, 10240, 1, 256, 1024, 1024, 1024, 256]
    - [60, 40.715]
  - - [1024, 10496, 1, 256, 1024, 1024, 1024, 256]
    - [87, 40.743]
  - - [1024, 11008, 1, 256, 1024, 1024, 1024, 256]
    - [150, 42.394]
  - - [1024, 11264, 1, 256, 1024, 1024, 1024, 256]
    - [127, 42.188]
  - - [1024, 11520, 1, 256, 1024, 1024, 1024, 256]
    - [142, 42.691]
  - - [1024, 12288, 1, 256, 1024, 1024, 1024, 256]
    - [109, 41.695]
  - - [1024, 13312, 1, 256, 1024, 1024, 1024, 256]
    - [97, 41.079]
  - - [1024, 13568, 1, 256, 1024, 1024, 1024, 256]
    - [72, 41.711]
  - - [1024, 14336, 1, 256, 1024, 1024, 1024, 256]
    - [150, 43.047]
  - - [1024, 14592, 1, 256, 1024, 1024, 1024, 256]
    - [123, 43.286]
  - - [1024, 14848, 1, 256, 1024, 1024, 1024, 256]
    - [123, 43.834]
  - - [1024, 15104, 1, 256, 1024, 1024, 1024, 256]
    - [136, 43.85]
  - - [1024, 16128, 1, 256, 1024, 1024, 1024, 256]
    - [87, 42.271]
  - - [1024, 17152, 1, 256, 1024, 1024, 1024, 256]
    - [72, 42.937]
  - - [1024, 18944, 1, 256, 1024, 1024, 1024, 256]
    - [123, 45.607]
  - - [1024, 19712, 1, 256, 1024, 1024, 1024, 256]
    - [87, 42.947]
  - - [1024, 19968, 1, 256, 1024, 1024, 1024, 256]
    - [109, 43.16]
  - - [1024, 20480, 1, 256, 1024, 1024, 1024, 256]
    - [48, 43.349]
  - - [1024, 20992, 1, 256, 1024, 1024, 1024, 256]
    - [77, 44.091]
  - - [1024, 21504, 1, 256, 1024, 1024, 1024, 256]
    - [77, 44.898]
  - - [1024, 22016, 1, 256, 1024, 1024, 1024, 256]
    - [123, 45.694]
  - - [1024, 23552, 1, 256, 1024, 1024, 1024, 256]
    - [27, 43.706]
  - - [1024, 28672, 1, 256, 1024, 1024, 1024, 256]
    - [77, 46.155]
  - - [1024, 33536, 1, 256, 1024, 1024, 1024, 256]
    - [77, 48.056]
  - - [1024, 40448, 1, 256, 1024, 1024, 1024, 256]
    - [94, 48.146]
  - - [1600, 512, 1, 1024, 1600, 1600, 1600, 1024]
    - [88, 34.281]
  - - [2048, 512, 1, 1, 2048, 2048, 2048, 1]
    - [67, 0.121]
  - - [2048, 960, 1, 2048, 2048, 2048, 2048, 2048]
    - [82, 42.626]
  - - [2048, 1024, 1, 1, 2048, 2048, 2048, 1]
    - [11, 0.161]
  - - [2048, 1024, 1, 256, 2048, 2048, 2048, 256]
    - [109, 27.606]
  - - [3200, 1024, 1, 2048, 3200, 3200, 3200, 2048]
    - [144, 62.74]
  - - [4096, 1024, 1, 1, 4096, 4096, 4096, 1]
    - [37, 0.212]
- null
