TRAIN_3.7/build/3_LibraryLogic_eff/fp16_eff/top_gemm/arcturus_Cijk_Ailk_Bjlk_HBH.yaml
- {MinimumRequiredVersion: 4.20.0}
- arcturus
- gfx908
- [Device 7380, Device 7388, Device 738c, Device 7390]
- - - [7680, 8192, 1, 8192, 8384, 8384, 8384, 8384]
    - [100, 91.427]
  - - [3840, 4096, 1, 4096, 4192, 4192, 4192, 4192]
    - [34, 87.352]
  - - [1920, 2048, 1, 2048, 2080, 2080, 2080, 2080]
    - [51, 77.059]
  - - [960, 1024, 1, 1024, 1056, 1056, 1056, 1056]
    - [101, 38.608]
  - - [480, 512, 1, 512, 544, 544, 544, 544]
    - [25, 11.323]
  - - [8192, 7680, 1, 8192, 8384, 8384, 8384, 8384]
    - [160, 91.406]
  - - [4096, 3840, 1, 4096, 4192, 4192, 4192, 4192]
    - [140, 86.216]
  - - [2048, 1920, 1, 2048, 2080, 2080, 2080, 2080]
    - [128, 78.016]
  - - [1024, 960, 1, 1024, 1056, 1056, 1056, 1056]
    - [167, 38.768]
  - - [512, 480, 1, 512, 544, 544, 544, 544]
    - [133, 11.109]
  - - [8192, 8192, 1, 8192, 8384, 8384, 8384, 8384]
    - [128, 88.201]
  - - [4096, 4096, 1, 4096, 4192, 4192, 4192, 4192]
    - [86, 78.427]
  - - [2048, 2048, 1, 2048, 2080, 2080, 2080, 2080]
    - [139, 54.279]
  - - [1024, 1024, 1, 1024, 1056, 1056, 1056, 1056]
    - [125, 31.799]
  - - [512, 512, 1, 512, 544, 544, 544, 544]
    - [77, 10.736]
  - - [64, 512, 16, 512, 64, 64, 64, 512]
    - [121, 18.073]
  - - [1024, 2, 1, 1, 1024, 1024, 1024, 2]
    - [1, 0.001]
  - - [1024, 2, 1, 512, 1024, 1024, 1024, 2]
    - [55, 0.099]
  - - [1024, 1024, 1, 1, 1024, 1024, 1024, 1024]
    - [14, 0.163]
  - - [1024, 1024, 1, 77, 1024, 1024, 1024, 1024]
    - [117, 8.685]
  - - [1024, 1024, 1, 512, 1024, 1024, 1024, 1024]
    - [85, 25.765]
  - - [1024, 4096, 1, 512, 1024, 1024, 1024, 4096]
    - [36, 43.689]
  - - [1024, 30522, 1, 77, 1024, 1024, 1024, 30522]
    - [10, 24.776]
  - - [4096, 1024, 1, 512, 4096, 4096, 4096, 1024]
    - [99, 44.364]
  - - [64, 128, 160, 128, 64, 64, 64, 128]
    - [125, 14.953]
  - - [1024, 2, 1, 10, 1024, 1024, 1024, 2]
    - [28, 0.004]
  - - [1024, 2, 1, 1280, 1024, 1024, 1024, 2]
    - [26, 0.158]
  - - [1024, 1024, 1, 10, 1024, 1024, 1024, 1024]
    - [9, 1.487]
  - - [1024, 1024, 1, 200, 1024, 1024, 1024, 1024]
    - [118, 17.216]
  - - [1024, 1024, 1, 1280, 1024, 1024, 1024, 1024]
    - [87, 32.289]
  - - [1024, 4096, 1, 1280, 1024, 1024, 1024, 4096]
    - [36, 50.343]
  - - [1024, 30522, 1, 200, 1024, 1024, 1024, 30522]
    - [137, 44.689]
  - - [4096, 1024, 1, 1280, 4096, 4096, 4096, 1024]
    - [139, 52.172]
  - - [64, 128, 624, 128, 64, 64, 64, 128]
    - [70, 17.749]
  - - [1024, 2, 1, 39, 1024, 1024, 1024, 2]
    - [1, 0.013]
  - - [1024, 2, 1, 4992, 1024, 1024, 1024, 2]
    - [26, 0.234]
  - - [1024, 1024, 1, 39, 1024, 1024, 1024, 1024]
    - [59, 5.036]
  - - [1024, 1024, 1, 780, 1024, 1024, 1024, 1024]
    - [138, 26.669]
  - - [1024, 1024, 1, 4992, 1024, 1024, 1024, 1024]
    - [161, 42.449]
  - - [1024, 4096, 1, 4992, 1024, 1024, 1024, 4096]
    - [87, 56.713]
  - - [1024, 30522, 1, 780, 1024, 1024, 1024, 30522]
    - [82, 61.577]
  - - [4096, 1024, 1, 4992, 4096, 4096, 4096, 1024]
    - [149, 58.213]
  - - [64, 512, 64, 512, 64, 64, 64, 512]
    - [122, 29.468]
  - - [1024, 2, 1, 4, 1024, 1024, 1024, 2]
    - [0, 0.001]
  - - [1024, 2, 1, 2048, 1024, 1024, 1024, 2]
    - [26, 0.191]
  - - [1024, 1024, 1, 4, 1024, 1024, 1024, 1024]
    - [14, 0.633]
  - - [1024, 1024, 1, 308, 1024, 1024, 1024, 1024]
    - [153, 20.016]
  - - [1024, 1024, 1, 2048, 1024, 1024, 1024, 1024]
    - [46, 36.943]
  - - [1024, 4096, 1, 2048, 1024, 1024, 1024, 4096]
    - [19, 53.307]
  - - [1024, 30522, 1, 308, 1024, 1024, 1024, 30522]
    - [146, 52.437]
  - - [4096, 1024, 1, 2048, 4096, 4096, 4096, 1024]
    - [148, 54.648]
  - - [64, 128, 640, 128, 64, 64, 64, 128]
    - [63, 18.099]
  - - [1024, 2, 1, 40, 1024, 1024, 1024, 2]
    - [1, 0.013]
  - - [1024, 2, 1, 5120, 1024, 1024, 1024, 2]
    - [142, 0.233]
  - - [1024, 1024, 1, 40, 1024, 1024, 1024, 1024]
    - [88, 5.528]
  - - [1024, 1024, 1, 800, 1024, 1024, 1024, 1024]
    - [65, 29.184]
  - - [1024, 1024, 1, 5120, 1024, 1024, 1024, 1024]
    - [111, 43.015]
  - - [1024, 4096, 1, 5120, 1024, 1024, 1024, 4096]
    - [24, 56.675]
  - - [1024, 30522, 1, 800, 1024, 1024, 1024, 30522]
    - [156, 65.034]
  - - [4096, 1024, 1, 5120, 4096, 4096, 4096, 1024]
    - [102, 57.999]
  - - [64, 128, 656, 128, 64, 64, 64, 128]
    - [96, 18.34]
  - - [1024, 2, 1, 41, 1024, 1024, 1024, 2]
    - [1, 0.015]
  - - [1024, 2, 1, 5248, 1024, 1024, 1024, 2]
    - [26, 0.234]
  - - [1024, 1024, 1, 41, 1024, 1024, 1024, 1024]
    - [9, 5.092]
  - - [1024, 1024, 1, 820, 1024, 1024, 1024, 1024]
    - [154, 27.463]
  - - [1024, 1024, 1, 5248, 1024, 1024, 1024, 1024]
    - [168, 42.667]
  - - [1024, 4096, 1, 5248, 1024, 1024, 1024, 4096]
    - [102, 56.669]
  - - [1024, 30522, 1, 820, 1024, 1024, 1024, 30522]
    - [109, 62.671]
  - - [4096, 1024, 1, 5248, 4096, 4096, 4096, 1024]
    - [168, 58.338]
  - - [64, 512, 80, 512, 64, 64, 64, 512]
    - [32, 31.323]
  - - [1024, 2, 1, 5, 1024, 1024, 1024, 2]
    - [1, 0.002]
  - - [1024, 2, 1, 2560, 1024, 1024, 1024, 2]
    - [26, 0.206]
  - - [1024, 1024, 1, 5, 1024, 1024, 1024, 1024]
    - [14, 0.818]
  - - [1024, 1024, 1, 385, 1024, 1024, 1024, 1024]
    - [157, 22.623]
  - - [1024, 1024, 1, 2560, 1024, 1024, 1024, 1024]
    - [141, 38.648]
  - - [1024, 4096, 1, 2560, 1024, 1024, 1024, 4096]
    - [53, 53.908]
  - - [1024, 30522, 1, 385, 1024, 1024, 1024, 30522]
    - [123, 55.664]
  - - [4096, 1024, 1, 2560, 4096, 4096, 4096, 1024]
    - [166, 55.516]
  - - [64, 512, 96, 512, 64, 64, 64, 512]
    - [162, 30.327]
  - - [1024, 2, 1, 6, 1024, 1024, 1024, 2]
    - [1, 0.002]
  - - [1024, 2, 1, 3072, 1024, 1024, 1024, 2]
    - [56, 0.216]
  - - [1024, 1024, 1, 6, 1024, 1024, 1024, 1024]
    - [72, 0.934]
  - - [1024, 1024, 1, 462, 1024, 1024, 1024, 1024]
    - [125, 23.369]
  - - [1024, 1024, 1, 3072, 1024, 1024, 1024, 1024]
    - [111, 40.034]
  - - [1024, 4096, 1, 3072, 1024, 1024, 1024, 4096]
    - [39, 54.835]
  - - [1024, 30522, 1, 462, 1024, 1024, 1024, 30522]
    - [107, 56.73]
  - - [4096, 1024, 1, 3072, 4096, 4096, 4096, 1024]
    - [159, 56.137]
  - - [64, 128, 128, 128, 64, 64, 64, 128]
    - [147, 14.273]
  - - [1024, 2, 1, 8, 1024, 1024, 1024, 2]
    - [1, 0.003]
  - - [1024, 2, 1, 1024, 1024, 1024, 1024, 2]
    - [5, 0.143]
  - - [1024, 1024, 1, 8, 1024, 1024, 1024, 1024]
    - [18, 1.402]
  - - [1024, 1024, 1, 160, 1024, 1024, 1024, 1024]
    - [120, 15.859]
  - - [1024, 1024, 1, 1024, 1024, 1024, 1024, 1024]
    - [24, 29.906]
  - - [1024, 4096, 1, 1024, 1024, 1024, 1024, 4096]
    - [66, 49.257]
  - - [1024, 30522, 1, 160, 1024, 1024, 1024, 30522]
    - [155, 43.942]
  - - [4096, 1024, 1, 1024, 4096, 4096, 4096, 1024]
    - [139, 50.814]
  - - [64, 128, 144, 128, 64, 64, 64, 128]
    - [64, 14.419]
  - - [1024, 2, 1, 9, 1024, 1024, 1024, 2]
    - [1, 0.004]
  - - [1024, 2, 1, 1152, 1024, 1024, 1024, 2]
    - [56, 0.151]
  - - [1024, 1024, 1, 9, 1024, 1024, 1024, 1024]
    - [9, 1.359]
  - - [1024, 1024, 1, 180, 1024, 1024, 1024, 1024]
    - [118, 15.913]
  - - [1024, 1024, 1, 1152, 1024, 1024, 1024, 1024]
    - [46, 30.886]
  - - [1024, 4096, 1, 1152, 1024, 1024, 1024, 4096]
    - [19, 49.8]
  - - [1024, 30522, 1, 180, 1024, 1024, 1024, 30522]
    - [155, 42.838]
  - - [4096, 1024, 1, 1152, 4096, 4096, 4096, 1024]
    - [99, 51.796]
  - - [13, 512, 1, 32768, 13, 13, 13, 512]
    - [79, 0.755]
  - - [256, 128, 1, 32768, 256, 256, 256, 128]
    - [56, 3.916]
  - - [256, 32768, 1, 1, 256, 256, 256, 32768]
    - [9, 0.446]
  - - [479, 1024, 1, 32768, 479, 479, 479, 1024]
    - [8, 28.348]
  - - [512, 256, 1, 32768, 512, 512, 512, 256]
    - [105, 12.56]
  - - [1024, 512, 1, 32768, 1024, 1024, 1024, 512]
    - [45, 31.512]
  - - [1024, 1024, 1, 32768, 1024, 1024, 1024, 1024]
    - [161, 47.694]
  - - [64, 128, 512, 128, 64, 64, 64, 128]
    - [44, 16.917]
  - - [128, 64, 512, 128, 128, 128, 128, 64]
    - [13, 16.803]
  - - [1024, 2, 1, 32, 1024, 1024, 1024, 2]
    - [4, 0.013]
  - - [1024, 1024, 1, 32, 1024, 1024, 1024, 1024]
    - [120, 5.148]
  - - [1024, 1024, 1, 4096, 1024, 1024, 1024, 1024]
    - [87, 42.0]
  - - [1024, 4096, 1, 4096, 1024, 1024, 1024, 4096]
    - [24, 55.98]
  - - [1024, 30528, 1, 4096, 1024, 1024, 1024, 30528]
    - [119, 82.35]
  - - [4096, 1024, 1, 4096, 4096, 4096, 4096, 1024]
    - [53, 57.256]
  - - [512, 64, 64, 512, 512, 512, 512, 64]
    - [49, 28.958]
  - - [1024, 30528, 1, 2048, 1024, 1024, 1024, 30528]
    - [124, 80.152]
  - - [4, 64, 32768, 4, 4, 4, 4, 2097152]
    - [6, 0.172]
  - - [4, 64, 38400, 4, 4, 4, 4, 2457600]
    - [6, 0.174]
  - - [64, 4, 32768, 4, 64, 64, 2097152, 4]
    - [3, 0.173]
  - - [64, 4, 38400, 4, 64, 64, 2457600, 4]
    - [3, 0.174]
  - - [1024, 1024, 1, 8192, 1024, 1024, 1024, 1024]
    - [111, 44.684]
  - - [1024, 1024, 1, 9600, 1024, 1024, 1024, 1024]
    - [168, 45.575]
  - - [1024, 4096, 1, 8192, 1024, 1024, 1024, 4096]
    - [24, 58.22]
  - - [1024, 4096, 1, 9600, 1024, 1024, 1024, 4096]
    - [53, 58.204]
  - - [1024, 33712, 1, 8192, 1024, 1024, 1024, 33712]
    - [98, 86.734]
  - - [1024, 33712, 1, 9600, 1024, 1024, 1024, 33712]
    - [84, 86.694]
  - - [4096, 1024, 1, 8192, 4096, 4096, 4096, 1024]
    - [102, 59.109]
  - - [4096, 1024, 1, 9600, 4096, 4096, 4096, 1024]
    - [39, 59.341]
  - - [1024, 1024, 1, 10064, 1024, 1024, 1024, 1024]
    - [168, 43.814]
  - - [1024, 1024, 1, 10080, 1024, 1024, 1024, 1024]
    - [168, 43.864]
  - - [1024, 1024, 1, 10200, 1024, 1024, 1024, 1024]
    - [87, 43.996]
  - - [1024, 1024, 1, 3840, 1024, 1024, 1024, 1024]
    - [161, 40.825]
  - - [1024, 1024, 1, 3968, 1024, 1024, 1024, 1024]
    - [149, 41.645]
  - - [1024, 1024, 1, 6528, 1024, 1024, 1024, 1024]
    - [87, 43.726]
  - - [1024, 1024, 1, 7104, 1024, 1024, 1024, 1024]
    - [102, 44.065]
  - - [1024, 1024, 1, 7200, 1024, 1024, 1024, 1024]
    - [102, 42.384]
  - - [1024, 1024, 1, 8064, 1024, 1024, 1024, 1024]
    - [141, 44.531]
  - - [1024, 1024, 1, 8160, 1024, 1024, 1024, 1024]
    - [141, 42.912]
  - - [1024, 1024, 1, 9216, 1024, 1024, 1024, 1024]
    - [87, 44.904]
  - - [1024, 1024, 1, 9520, 1024, 1024, 1024, 1024]
    - [87, 43.391]
  - - [1024, 4096, 1, 10064, 1024, 1024, 1024, 4096]
    - [24, 56.97]
  - - [1024, 4096, 1, 10080, 1024, 1024, 1024, 4096]
    - [24, 56.709]
  - - [1024, 4096, 1, 10200, 1024, 1024, 1024, 4096]
    - [102, 56.87]
  - - [1024, 4096, 1, 3840, 1024, 1024, 1024, 4096]
    - [87, 55.824]
  - - [1024, 4096, 1, 3968, 1024, 1024, 1024, 4096]
    - [102, 56.37]
  - - [1024, 4096, 1, 6528, 1024, 1024, 1024, 4096]
    - [24, 57.477]
  - - [1024, 4096, 1, 7104, 1024, 1024, 1024, 4096]
    - [24, 57.84]
  - - [1024, 4096, 1, 7200, 1024, 1024, 1024, 4096]
    - [19, 55.523]
  - - [1024, 4096, 1, 8064, 1024, 1024, 1024, 4096]
    - [24, 58.163]
  - - [1024, 4096, 1, 8160, 1024, 1024, 1024, 4096]
    - [24, 55.917]
  - - [1024, 4096, 1, 9216, 1024, 1024, 1024, 4096]
    - [24, 58.478]
  - - [1024, 4096, 1, 9520, 1024, 1024, 1024, 4096]
    - [39, 55.931]
  - - [1024, 42720, 1, 10080, 1024, 1024, 1024, 42720]
    - [21, 86.118]
  - - [1024, 42720, 1, 3968, 1024, 1024, 1024, 42720]
    - [21, 83.113]
  - - [1024, 42720, 1, 6528, 1024, 1024, 1024, 42720]
    - [21, 85.013]
  - - [1024, 42720, 1, 7104, 1024, 1024, 1024, 42720]
    - [21, 85.131]
  - - [1024, 42720, 1, 7200, 1024, 1024, 1024, 42720]
    - [21, 85.219]
  - - [1024, 42720, 1, 9520, 1024, 1024, 1024, 42720]
    - [21, 84.453]
  - - [4096, 1024, 1, 10064, 4096, 4096, 4096, 1024]
    - [87, 57.863]
  - - [4096, 1024, 1, 10080, 4096, 4096, 4096, 1024]
    - [102, 57.794]
  - - [4096, 1024, 1, 10200, 4096, 4096, 4096, 1024]
    - [39, 57.69]
  - - [4096, 1024, 1, 3840, 4096, 4096, 4096, 1024]
    - [102, 57.115]
  - - [4096, 1024, 1, 3968, 4096, 4096, 4096, 1024]
    - [141, 57.473]
  - - [4096, 1024, 1, 6528, 4096, 4096, 4096, 1024]
    - [168, 58.904]
  - - [4096, 1024, 1, 7104, 4096, 4096, 4096, 1024]
    - [39, 59.027]
  - - [4096, 1024, 1, 7200, 4096, 4096, 4096, 1024]
    - [139, 56.658]
  - - [4096, 1024, 1, 8064, 4096, 4096, 4096, 1024]
    - [87, 59.186]
  - - [4096, 1024, 1, 8160, 4096, 4096, 4096, 1024]
    - [168, 56.891]
  - - [4096, 1024, 1, 9216, 4096, 4096, 4096, 1024]
    - [87, 59.439]
  - - [4096, 1024, 1, 9520, 4096, 4096, 4096, 1024]
    - [39, 57.251]
  - - [14, 64, 10880, 14, 14, 14, 14, 696320]
    - [2, 1.784]
  - - [15, 64, 10880, 14, 15, 15, 15, 696320]
    - [2, 1.867]
  - - [15, 64, 7680, 15, 15, 15, 15, 491520]
    - [2, 1.927]
  - - [15, 64, 10880, 15, 15, 15, 15, 696320]
    - [68, 2.0]
  - - [17, 64, 7680, 15, 17, 17, 17, 491520]
    - [113, 2.087]
  - - [17, 64, 6144, 17, 17, 17, 17, 393216]
    - [54, 1.962]
  - - [17, 64, 7680, 17, 17, 17, 17, 491520]
    - [57, 2.064]
  - - [21, 64, 6144, 17, 21, 21, 21, 393216]
    - [108, 2.292]
  - - [21, 64, 6144, 21, 21, 21, 21, 393216]
    - [61, 2.784]
  - - [24, 64, 4736, 24, 24, 24, 24, 303104]
    - [135, 3.476]
  - - [30, 64, 2048, 30, 30, 30, 30, 131072]
    - [80, 3.887]
  - - [30, 64, 2048, 31, 30, 30, 30, 131072]
    - [42, 4.031]
  - - [31, 64, 2048, 31, 31, 31, 31, 131072]
    - [60, 3.916]
  - - [32, 64, 4608, 32, 32, 32, 32, 294912]
    - [15, 7.284]
  - - [32, 64, 4608, 35, 32, 32, 32, 294912]
    - [11, 5.651]
  - - [34, 64, 4736, 24, 34, 34, 34, 303104]
    - [83, 4.335]
  - - [34, 64, 4736, 34, 34, 34, 34, 303104]
    - [83, 5.045]
  - - [35, 64, 4608, 35, 35, 35, 35, 294912]
    - [145, 5.122]
  - - [64, 14, 10880, 14, 64, 64, 696320, 14]
    - [71, 1.595]
  - - [64, 15, 10880, 14, 64, 64, 696320, 15]
    - [31, 1.693]
  - - [64, 15, 7680, 15, 64, 64, 491520, 15]
    - [116, 1.76]
  - - [64, 15, 10880, 15, 64, 64, 696320, 15]
    - [71, 1.817]
  - - [64, 17, 7680, 15, 64, 64, 491520, 17]
    - [43, 1.965]
  - - [64, 17, 6144, 17, 64, 64, 393216, 17]
    - [62, 1.973]
  - - [64, 17, 7680, 17, 64, 64, 491520, 17]
    - [91, 2.061]
  - - [64, 21, 6144, 17, 64, 64, 393216, 21]
    - [89, 2.376]
  - - [64, 21, 6144, 21, 64, 64, 393216, 21]
    - [143, 2.903]
  - - [64, 24, 4736, 24, 64, 64, 303104, 24]
    - [136, 3.462]
  - - [64, 30, 2048, 30, 64, 64, 131072, 30]
    - [136, 3.971]
  - - [64, 30, 2048, 31, 64, 64, 131072, 30]
    - [143, 3.989]
  - - [64, 31, 2048, 31, 64, 64, 131072, 31]
    - [163, 4.051]
  - - [64, 32, 4608, 32, 64, 64, 294912, 32]
    - [152, 7.457]
  - - [64, 32, 4608, 35, 64, 64, 294912, 32]
    - [143, 5.651]
  - - [64, 34, 4736, 24, 64, 64, 303104, 34]
    - [164, 3.97]
  - - [64, 34, 4736, 34, 64, 64, 303104, 34]
    - [106, 4.664]
  - - [64, 35, 4608, 35, 64, 64, 294912, 35]
    - [95, 4.742]
  - - [512, 64, 1, 512, 512, 512, 512, 64]
    - [41, 1.988]
  - - [64, 512, 1, 512, 64, 64, 64, 512]
    - [41, 2.013]
  - - [64, 128, 1, 128, 64, 64, 64, 128]
    - [27, 0.209]
  - - [128, 64, 1, 128, 128, 128, 128, 64]
    - [4, 0.204]
  - - [74, 2048, 1, 512, 74, 74, 74, 2048]
    - [69, 6.787]
  - - [2048, 2048, 1, 512, 2048, 2048, 2048, 2048]
    - [86, 44.364]
  - - [1024, 64, 1, 512, 1024, 1024, 1024, 64]
    - [58, 4.078]
  - - [5, 64, 1, 5, 5, 5, 5, 64]
    - [29, 0.0]
  - - [2048, 512, 1, 1, 2048, 2048, 2048, 512]
    - [14, 0.166]
  - - [1600, 1024, 1, 512, 1600, 1600, 1600, 1024]
    - [33, 32.574]
  - - [512, 32, 1, 1600, 512, 512, 512, 32]
    - [48, 1.524]
  - - [33, 32, 1, 33, 33, 33, 33, 32]
    - [1, 0.006]
  - - [560, 1024, 1, 1600, 560, 560, 560, 1024]
    - [93, 24.255]
  - - [1024, 1600, 1, 1, 1024, 1024, 1024, 1600]
    - [72, 0.229]
  - - [1024, 1024, 1, 1600, 1024, 1024, 1024, 1024]
    - [168, 35.203]
  - - [512, 512, 1, 1600, 512, 512, 512, 512]
    - [77, 17.368]
  - - [3, 64, 512, 3, 3, 3, 3, 64]
    - [68, 0.039]
  - - [5, 64, 512, 5, 5, 5, 5, 64]
    - [6, 0.109]
  - - [5, 64, 960, 5, 5, 5, 5, 64]
    - [6, 0.15]
  - - [9, 64, 512, 9, 9, 9, 9, 64]
    - [68, 0.345]
  - - [27, 128, 32768, 27, 27, 27, 27, 128]
    - [151, 5.317]
  - - [33, 32, 200, 33, 33, 33, 33, 32]
    - [114, 0.988]
  - - [33, 32, 1600, 33, 33, 33, 33, 32]
    - [12, 2.79]
  - - [67, 2048, 1, 512, 67, 67, 67, 2048]
    - [104, 6.087]
  - - [74, 2048, 1, 960, 74, 74, 74, 2048]
    - [40, 8.353]
  - - [100, 2048, 1, 512, 100, 100, 100, 2048]
    - [30, 7.727]
  - - [256, 1280, 1, 8976, 256, 256, 256, 1280]
    - [90, 25.869]
  - - [256, 2560, 1, 8976, 256, 256, 256, 2560]
    - [52, 36.971]
  - - [256, 2816, 1, 8976, 256, 256, 256, 2816]
    - [38, 39.971]
  - - [256, 3328, 1, 8976, 256, 256, 256, 3328]
    - [23, 44.149]
  - - [256, 3584, 1, 8976, 256, 256, 256, 3584]
    - [22, 45.685]
  - - [256, 3840, 1, 8976, 256, 256, 256, 3840]
    - [81, 43.143]
  - - [256, 4096, 1, 8976, 256, 256, 256, 4096]
    - [78, 43.325]
  - - [256, 4352, 1, 8976, 256, 256, 256, 4352]
    - [46, 46.238]
  - - [256, 4864, 1, 8976, 256, 256, 256, 4864]
    - [131, 51.525]
  - - [256, 5120, 1, 8976, 256, 256, 256, 5120]
    - [131, 54.29]
  - - [256, 5632, 1, 8976, 256, 256, 256, 5632]
    - [131, 59.837]
  - - [256, 5888, 1, 8976, 256, 256, 256, 5888]
    - [78, 61.405]
  - - [256, 6144, 1, 8976, 256, 256, 256, 6144]
    - [74, 61.595]
  - - [256, 7168, 1, 8976, 256, 256, 256, 7168]
    - [131, 65.315]
  - - [256, 8192, 1, 8976, 256, 256, 256, 8192]
    - [17, 48.132]
  - - [256, 8960, 1, 8976, 256, 256, 256, 8960]
    - [16, 52.458]
  - - [256, 9728, 1, 8976, 256, 256, 256, 9728]
    - [21, 56.846]
  - - [256, 9984, 1, 8976, 256, 256, 256, 9984]
    - [16, 58.357]
  - - [256, 10240, 1, 8976, 256, 256, 256, 10240]
    - [16, 59.935]
  - - [256, 10496, 1, 8976, 256, 256, 256, 10496]
    - [17, 61.118]
  - - [256, 11008, 1, 8976, 256, 256, 256, 11008]
    - [21, 64.378]
  - - [256, 11264, 1, 8976, 256, 256, 256, 11264]
    - [21, 65.483]
  - - [256, 11520, 1, 8976, 256, 256, 256, 11520]
    - [21, 67.117]
  - - [256, 11776, 1, 8976, 256, 256, 256, 11776]
    - [21, 68.423]
  - - [256, 12544, 1, 8976, 256, 256, 256, 12544]
    - [21, 72.885]
  - - [256, 12800, 1, 8976, 256, 256, 256, 12800]
    - [76, 74.192]
  - - [256, 13312, 1, 8976, 256, 256, 256, 13312]
    - [21, 77.16]
  - - [256, 13568, 1, 8976, 256, 256, 256, 13568]
    - [21, 78.475]
  - - [256, 14336, 1, 8976, 256, 256, 256, 14336]
    - [165, 82.694]
  - - [256, 14848, 1, 8976, 256, 256, 256, 14848]
    - [127, 85.648]
  - - [256, 15104, 1, 8976, 256, 256, 256, 15104]
    - [127, 86.428]
  - - [256, 15872, 1, 8976, 256, 256, 256, 15872]
    - [24, 55.752]
  - - [256, 16128, 1, 8976, 256, 256, 256, 16128]
    - [24, 56.329]
  - - [256, 17152, 1, 8976, 256, 256, 256, 17152]
    - [24, 59.586]
  - - [256, 17408, 1, 8976, 256, 256, 256, 17408]
    - [24, 60.534]
  - - [256, 18688, 1, 8976, 256, 256, 256, 18688]
    - [24, 64.734]
  - - [256, 19968, 1, 8976, 256, 256, 256, 19968]
    - [39, 67.739]
  - - [256, 20480, 1, 8976, 256, 256, 256, 20480]
    - [141, 67.817]
  - - [256, 20992, 1, 8976, 256, 256, 256, 20992]
    - [78, 69.759]
  - - [256, 21248, 1, 8976, 256, 256, 256, 21248]
    - [75, 69.167]
  - - [256, 22016, 1, 8976, 256, 256, 256, 22016]
    - [126, 69.983]
  - - [256, 26112, 1, 8976, 256, 256, 256, 26112]
    - [20, 76.521]
  - - [256, 32512, 1, 8976, 256, 256, 256, 32512]
    - [19, 69.085]
  - - [256, 33536, 1, 8976, 256, 256, 256, 33536]
    - [19, 71.106]
  - - [256, 44505, 1, 8976, 256, 256, 256, 44505]
    - [34, 84.836]
  - - [257, 4096, 1, 1024, 257, 257, 257, 4096]
    - [35, 25.866]
  - - [480, 1024, 1, 32768, 480, 480, 480, 1024]
    - [23, 30.4]
  - - [512, 32, 1, 200, 512, 512, 512, 32]
    - [7, 0.409]
  - - [512, 512, 1, 200, 512, 512, 512, 512]
    - [7, 5.772]
  - - [512, 2048, 1, 256, 512, 512, 512, 2048]
    - [144, 20.591]
  - - [560, 1024, 1, 200, 560, 560, 560, 1024]
    - [129, 8.87]
  - - [768, 2048, 1, 256, 768, 768, 768, 2048]
    - [73, 27.505]
  - - [1024, 64, 1, 960, 1024, 1024, 1024, 64]
    - [115, 5.165]
  - - [1024, 256, 1, 1024, 1024, 1024, 1024, 256]
    - [130, 14.865]
  - - [1024, 256, 1, 1280, 1024, 1024, 1024, 256]
    - [130, 16.103]
  - - [1024, 256, 1, 2304, 1024, 1024, 1024, 256]
    - [134, 18.904]
  - - [1024, 256, 1, 2816, 1024, 1024, 1024, 256]
    - [134, 19.351]
  - - [1024, 256, 1, 3072, 1024, 1024, 1024, 256]
    - [112, 19.99]
  - - [1024, 256, 1, 3328, 1024, 1024, 1024, 256]
    - [150, 20.259]
  - - [1024, 256, 1, 3584, 1024, 1024, 1024, 256]
    - [94, 20.688]
  - - [1024, 256, 1, 4096, 1024, 1024, 1024, 256]
    - [132, 20.633]
  - - [1024, 256, 1, 4352, 1024, 1024, 1024, 256]
    - [94, 20.812]
  - - [1024, 256, 1, 4608, 1024, 1024, 1024, 256]
    - [169, 21.091]
  - - [1024, 256, 1, 5120, 1024, 1024, 1024, 256]
    - [112, 21.471]
  - - [1024, 256, 1, 5376, 1024, 1024, 1024, 256]
    - [112, 21.514]
  - - [1024, 256, 1, 5632, 1024, 1024, 1024, 256]
    - [67, 21.488]
  - - [1024, 256, 1, 6144, 1024, 1024, 1024, 256]
    - [150, 22.004]
  - - [1024, 256, 1, 6400, 1024, 1024, 1024, 256]
    - [112, 21.898]
  - - [1024, 256, 1, 7680, 1024, 1024, 1024, 256]
    - [169, 22.429]
  - - [1024, 256, 1, 7936, 1024, 1024, 1024, 256]
    - [112, 22.404]
  - - [1024, 256, 1, 8192, 1024, 1024, 1024, 256]
    - [94, 22.405]
  - - [1024, 256, 1, 8448, 1024, 1024, 1024, 256]
    - [169, 22.725]
  - - [1024, 256, 1, 9728, 1024, 1024, 1024, 256]
    - [150, 22.882]
  - - [1024, 256, 1, 9984, 1024, 1024, 1024, 256]
    - [169, 22.934]
  - - [1024, 256, 1, 10496, 1024, 1024, 1024, 256]
    - [103, 22.908]
  - - [1024, 256, 1, 11520, 1024, 1024, 1024, 256]
    - [169, 22.995]
  - - [1024, 256, 1, 12032, 1024, 1024, 1024, 256]
    - [150, 23.151]
  - - [1024, 256, 1, 13568, 1024, 1024, 1024, 256]
    - [112, 23.358]
  - - [1024, 256, 1, 14336, 1024, 1024, 1024, 256]
    - [47, 23.525]
  - - [1024, 256, 1, 14848, 1024, 1024, 1024, 256]
    - [112, 23.638]
  - - [1024, 256, 1, 15104, 1024, 1024, 1024, 256]
    - [169, 23.348]
  - - [1024, 256, 1, 15872, 1024, 1024, 1024, 256]
    - [112, 23.599]
  - - [1024, 256, 1, 16128, 1024, 1024, 1024, 256]
    - [94, 23.551]
  - - [1024, 256, 1, 17152, 1024, 1024, 1024, 256]
    - [169, 23.586]
  - - [1024, 256, 1, 17408, 1024, 1024, 1024, 256]
    - [150, 23.725]
  - - [1024, 256, 1, 18944, 1024, 1024, 1024, 256]
    - [67, 23.748]
  - - [1024, 256, 1, 19712, 1024, 1024, 1024, 256]
    - [169, 23.751]
  - - [1024, 256, 1, 19968, 1024, 1024, 1024, 256]
    - [112, 23.826]
  - - [1024, 256, 1, 21248, 1024, 1024, 1024, 256]
    - [169, 24.043]
  - - [1024, 256, 1, 21504, 1024, 1024, 1024, 256]
    - [150, 24.001]
  - - [1024, 256, 1, 22016, 1024, 1024, 1024, 256]
    - [94, 24.026]
  - - [1024, 256, 1, 28672, 1024, 1024, 1024, 256]
    - [169, 24.381]
  - - [1024, 256, 1, 33536, 1024, 1024, 1024, 256]
    - [103, 24.449]
  - - [1024, 1024, 1, 960, 1024, 1024, 1024, 1024]
    - [65, 30.194]
  - - [1600, 1024, 1, 960, 1600, 1600, 1600, 1024]
    - [158, 38.133]
  - - [2048, 256, 1, 1024, 2048, 2048, 2048, 256]
    - [37, 21.656]
  - - [2048, 960, 1, 1, 2048, 2048, 2048, 960]
    - [72, 0.275]
  - - [2048, 2048, 1, 960, 2048, 2048, 2048, 2048]
    - [92, 49.386]
  - - [2048, 2048, 1, 1024, 2048, 2048, 2048, 2048]
    - [110, 50.305]
  - - [3200, 2048, 1, 1024, 3200, 3200, 3200, 2048]
    - [50, 62.366]
  - - [4096, 4096, 1, 1024, 4096, 4096, 4096, 4096]
    - [97, 65.622]
- null
