TRAIN_3.7/build/_3_LibraryLogic/arcturus_Cijk_Ailk_Bjlk_BBH.yaml
- {MinimumRequiredVersion: 4.20.0}
- arcturus
- gfx908
- [Device 7380, Device 7388, Device 738c, Device 7390]
- - - [1024, 256, 1, 18944, 1024, 1024, 1024, 256]
    - [51, 29687.0]
  - - [64, 128, 624, 128, 64, 64, 64, 128]
    - [11, 21869.0]
  - - [1024, 256, 1, 15872, 1024, 1024, 1024, 256]
    - [131, 29088.0]
  - - [1024, 256, 1, 10496, 1024, 1024, 1024, 256]
    - [169, 27670.0]
  - - [1024, 1024, 1, 1024, 1056, 1056, 1056, 1056]
    - [98, 34152.0]
  - - [1024, 1024, 1, 1280, 1024, 1024, 1024, 1024]
    - [141, 34169.0]
  - - [1024, 1024, 1, 39, 1024, 1024, 1024, 1024]
    - [151, 4733.0]
  - - [256, 11520, 1, 8976, 256, 256, 256, 11520]
    - [156, 59385.0]
  - - [256, 9728, 1, 8976, 256, 256, 256, 9728]
    - [27, 51956.0]
  - - [1024, 256, 1, 7680, 1024, 1024, 1024, 256]
    - [56, 26546.0]
  - - [1024, 4096, 1, 2560, 1024, 1024, 1024, 4096]
    - [190, 51642.0]
  - - [1024, 4096, 1, 1024, 1024, 1024, 1024, 4096]
    - [172, 48107.0]
  - - [74, 2048, 1, 512, 74, 74, 74, 2048]
    - [79, 6928.0]
  - - [33, 32, 1, 33, 33, 33, 33, 32]
    - [90, 6.0]
  - - [1024, 256, 1, 6144, 1024, 1024, 1024, 256]
    - [51, 25229.0]
  - - [1024, 4096, 1, 10080, 1024, 1024, 1024, 4096]
    - [181, 53199.0]
  - - [1024, 2, 1, 4992, 1024, 1024, 1024, 2]
    - [188, 287.0]
  - - [256, 13568, 1, 8976, 256, 256, 256, 13568]
    - [19, 56538.0]
  - - [1024, 4096, 1, 7104, 1024, 1024, 1024, 4096]
    - [61, 52950.0]
  - - [100, 2048, 1, 512, 100, 100, 100, 2048]
    - [9, 8511.0]
  - - [2048, 2048, 1, 512, 2048, 2048, 2048, 2048]
    - [113, 43507.0]
  - - [64, 32, 4608, 35, 64, 64, 294912, 32]
    - [3, 6916.0]
  - - [1600, 1024, 1, 960, 1600, 1600, 1600, 1024]
    - [34, 40706.0]
  - - [64, 128, 144, 128, 64, 64, 64, 128]
    - [16, 14519.0]
  - - [15, 64, 10880, 15, 15, 15, 15, 696320]
    - [41, 2382.0]
  - - [512, 512, 1, 512, 544, 544, 544, 544]
    - [93, 11336.0]
  - - [4096, 1024, 1, 10064, 4096, 4096, 4096, 1024]
    - [122, 53330.0]
  - - [256, 33536, 1, 8976, 256, 256, 256, 33536]
    - [27, 60916.0]
  - - [256, 2560, 1, 8976, 256, 256, 256, 2560]
    - [114, 38079.0]
  - - [1024, 2, 1, 39, 1024, 1024, 1024, 2]
    - [57, 12.0]
  - - [64, 21, 6144, 17, 64, 64, 393216, 21]
    - [130, 2679.0]
  - - [64, 24, 4736, 24, 64, 64, 303104, 24]
    - [121, 3750.0]
  - - [4096, 1024, 1, 6528, 4096, 4096, 4096, 1024]
    - [61, 53203.0]
  - - [4096, 1024, 1, 7200, 4096, 4096, 4096, 1024]
    - [135, 53461.0]
  - - [1024, 1024, 1, 8192, 1024, 1024, 1024, 1024]
    - [128, 40005.0]
  - - [256, 21248, 1, 8976, 256, 256, 256, 21248]
    - [104, 59253.0]
  - - [512, 64, 64, 512, 512, 512, 512, 64]
    - [118, 30855.0]
  - - [1024, 960, 1, 1024, 1056, 1056, 1056, 1056]
    - [123, 39445.0]
  - - [4096, 1024, 1, 3840, 4096, 4096, 4096, 1024]
    - [172, 52828.0]
  - - [17, 64, 7680, 17, 17, 17, 17, 491520]
    - [168, 2619.0]
  - - [1024, 1024, 1, 308, 1024, 1024, 1024, 1024]
    - [109, 20287.0]
  - - [1024, 2, 1, 5, 1024, 1024, 1024, 2]
    - [1, 2.0]
  - - [1024, 1024, 1, 3968, 1024, 1024, 1024, 1024]
    - [117, 38497.0]
  - - [1024, 256, 1, 2816, 1024, 1024, 1024, 256]
    - [70, 20689.0]
  - - [4096, 4096, 1, 1024, 4096, 4096, 4096, 4096]
    - [40, 58900.0]
  - - [34, 64, 4736, 24, 34, 34, 34, 303104]
    - [46, 4987.0]
  - - [21, 64, 6144, 21, 21, 21, 21, 393216]
    - [162, 3309.0]
  - - [1024, 4096, 1, 9520, 1024, 1024, 1024, 4096]
    - [166, 52739.0]
  - - [1024, 1024, 1, 4992, 1024, 1024, 1024, 1024]
    - [128, 38994.0]
  - - [1024, 256, 1, 3072, 1024, 1024, 1024, 256]
    - [70, 21103.0]
  - - [4096, 3840, 1, 4096, 4192, 4192, 4192, 4192]
    - [19, 64198.0]
  - - [1024, 256, 1, 4096, 1024, 1024, 1024, 256]
    - [80, 22787.0]
  - - [1024, 256, 1, 12032, 1024, 1024, 1024, 256]
    - [175, 28324.0]
  - - [256, 6144, 1, 8976, 256, 256, 256, 6144]
    - [7, 49103.0]
  - - [4096, 1024, 1, 3072, 4096, 4096, 4096, 1024]
    - [135, 52429.0]
  - - [2048, 2048, 1, 960, 2048, 2048, 2048, 2048]
    - [39, 47753.0]
  - - [64, 17, 6144, 17, 64, 64, 393216, 17]
    - [54, 2209.0]
  - - [64, 512, 96, 512, 64, 64, 64, 512]
    - [101, 35570.0]
  - - [1024, 1024, 1, 5248, 1024, 1024, 1024, 1024]
    - [117, 38995.0]
  - - [4096, 1024, 1, 10200, 4096, 4096, 4096, 1024]
    - [122, 53185.0]
  - - [1024, 256, 1, 5120, 1024, 1024, 1024, 256]
    - [80, 24280.0]
  - - [4096, 1024, 1, 4992, 4096, 4096, 4096, 1024]
    - [187, 53088.0]
  - - [1024, 1024, 1, 180, 1024, 1024, 1024, 1024]
    - [24, 14386.0]
  - - [5, 64, 1, 5, 5, 5, 5, 64]
    - [5, 0.27]
  - - [4096, 1024, 1, 2560, 4096, 4096, 4096, 1024]
    - [142, 52144.0]
  - - [4096, 1024, 1, 9216, 4096, 4096, 4096, 1024]
    - [135, 53574.0]
  - - [1024, 256, 1, 14336, 1024, 1024, 1024, 256]
    - [80, 28855.0]
  - - [1024, 1024, 1, 10080, 1024, 1024, 1024, 1024]
    - [128, 39427.0]
  - - [1024, 33712, 1, 9600, 1024, 1024, 1024, 33712]
    - [28, 63186.0]
  - - [64, 128, 640, 128, 64, 64, 64, 128]
    - [73, 22251.0]
  - - [1024, 256, 1, 5376, 1024, 1024, 1024, 256]
    - [80, 24433.0]
  - - [5, 64, 512, 5, 5, 5, 5, 64]
    - [85, 100.0]
  - - [2048, 256, 1, 1024, 2048, 2048, 2048, 256]
    - [29, 22826.0]
  - - [1024, 1024, 1, 5, 1024, 1024, 1024, 1024]
    - [13, 683.0]
  - - [1024, 42720, 1, 3968, 1024, 1024, 1024, 42720]
    - [129, 62601.0]
  - - [4, 64, 32768, 4, 4, 4, 4, 2097152]
    - [6, 222.0]
  - - [4096, 1024, 1, 2048, 4096, 4096, 4096, 1024]
    - [122, 51597.0]
  - - [256, 3328, 1, 8976, 256, 256, 256, 3328]
    - [100, 48971.0]
  - - [1024, 1024, 1, 4096, 1024, 1024, 1024, 1024]
    - [128, 38430.0]
  - - [1024, 2, 1, 40, 1024, 1024, 1024, 2]
    - [1, 12.0]
  - - [1024, 30522, 1, 160, 1024, 1024, 1024, 30522]
    - [180, 44809.0]
  - - [1024, 1024, 1, 800, 1024, 1024, 1024, 1024]
    - [116, 31584.0]
  - - [256, 4864, 1, 8976, 256, 256, 256, 4864]
    - [191, 46835.0]
  - - [1024, 1024, 1, 41, 1024, 1024, 1024, 1024]
    - [149, 4976.0]
  - - [4096, 1024, 1, 8064, 4096, 4096, 4096, 1024]
    - [122, 53551.0]
  - - [1024, 256, 1, 14848, 1024, 1024, 1024, 256]
    - [192, 28892.0]
  - - [1024, 2, 1, 5248, 1024, 1024, 1024, 2]
    - [30, 299.0]
  - - [4096, 4096, 1, 4096, 4192, 4192, 4192, 4192]
    - [28, 61151.0]
  - - [1024, 30522, 1, 385, 1024, 1024, 1024, 30522]
    - [157, 53527.0]
  - - [1024, 256, 1, 8448, 1024, 1024, 1024, 256]
    - [52, 26824.0]
  - - [64, 30, 2048, 31, 64, 64, 131072, 30]
    - [13, 4631.0]
  - - [1024, 4096, 1, 9600, 1024, 1024, 1024, 4096]
    - [22, 53357.0]
  - - [256, 22016, 1, 8976, 256, 256, 256, 22016]
    - [69, 61270.0]
  - - [2048, 512, 1, 1, 2048, 2048, 2048, 512]
    - [12, 151.0]
  - - [2048, 960, 1, 1, 2048, 2048, 2048, 960]
    - [23, 230.0]
  - - [64, 32, 4608, 32, 64, 64, 294912, 32]
    - [81, 9140.0]
  - - [1024, 4096, 1, 1152, 1024, 1024, 1024, 4096]
    - [177, 48826.0]
  - - [1024, 1024, 1, 960, 1024, 1024, 1024, 1024]
    - [55, 32683.0]
  - - [1024, 2, 1, 512, 1024, 1024, 1024, 2]
    - [193, 95.0]
  - - [1024, 256, 1, 15104, 1024, 1024, 1024, 256]
    - [51, 28994.0]
  - - [1024, 1024, 1, 8160, 1024, 1024, 1024, 1024]
    - [111, 38992.0]
  - - [4096, 1024, 1, 7104, 4096, 4096, 4096, 1024]
    - [142, 53368.0]
  - - [64, 4, 38400, 4, 64, 64, 2457600, 4]
    - [3, 226.0]
  - - [1024, 256, 1, 22016, 1024, 1024, 1024, 256]
    - [178, 29885.0]
  - - [1024, 30522, 1, 180, 1024, 1024, 1024, 30522]
    - [186, 44906.0]
  - - [1024, 64, 1, 512, 1024, 1024, 1024, 64]
    - [58, 3525.0]
  - - [4096, 1024, 1, 512, 4096, 4096, 4096, 1024]
    - [181, 43719.0]
  - - [1024, 256, 1, 5632, 1024, 1024, 1024, 256]
    - [72, 24705.0]
  - - [1024, 256, 1, 33536, 1024, 1024, 1024, 256]
    - [169, 30610.0]
  - - [4096, 1024, 1, 1024, 4096, 4096, 4096, 1024]
    - [160, 48586.0]
  - - [1024, 1024, 1, 7200, 1024, 1024, 1024, 1024]
    - [185, 38598.0]
  - - [64, 34, 4736, 34, 64, 64, 303104, 34]
    - [3, 5943.0]
  - - [256, 12800, 1, 8976, 256, 256, 256, 12800]
    - [104, 53540.0]
  - - [480, 1024, 1, 32768, 480, 480, 480, 1024]
    - [158, 32404.0]
  - - [4, 64, 38400, 4, 4, 4, 4, 2457600]
    - [6, 224.0]
  - - [1024, 1024, 1, 6528, 1024, 1024, 1024, 1024]
    - [111, 39613.0]
  - - [256, 11008, 1, 8976, 256, 256, 256, 11008]
    - [155, 58047.0]
  - - [32, 64, 4608, 35, 32, 32, 32, 294912]
    - [88, 6927.0]
  - - [1024, 4096, 1, 10200, 1024, 1024, 1024, 4096]
    - [39, 52791.0]
  - - [64, 512, 64, 512, 64, 64, 64, 512]
    - [15, 31286.0]
  - - [31, 64, 2048, 31, 31, 31, 31, 131072]
    - [12, 4757.0]
  - - [1024, 2, 1, 32, 1024, 1024, 1024, 2]
    - [4, 11.0]
  - - [256, 15104, 1, 8976, 256, 256, 256, 15104]
    - [104, 62629.0]
  - - [1024, 4096, 1, 3840, 1024, 1024, 1024, 4096]
    - [160, 52049.0]
  - - [1024, 2, 1, 9, 1024, 1024, 1024, 2]
    - [1, 3.0]
  - - [8192, 8192, 1, 8192, 8384, 8384, 8384, 8384]
    - [173, 63523.0]
  - - [21, 64, 6144, 17, 21, 21, 21, 393216]
    - [140, 2716.0]
  - - [256, 8192, 1, 8976, 256, 256, 256, 8192]
    - [136, 45390.0]
  - - [30, 64, 2048, 30, 30, 30, 30, 131072]
    - [12, 4666.0]
  - - [1024, 30528, 1, 2048, 1024, 1024, 1024, 30528]
    - [182, 62698.0]
  - - [1024, 4096, 1, 3968, 1024, 1024, 1024, 4096]
    - [160, 52140.0]
  - - [4096, 1024, 1, 1280, 4096, 4096, 4096, 1024]
    - [181, 49895.0]
  - - [256, 11776, 1, 8976, 256, 256, 256, 11776]
    - [92, 51444.0]
  - - [1024, 1024, 1, 7104, 1024, 1024, 1024, 1024]
    - [111, 39606.0]
  - - [1024, 256, 1, 9984, 1024, 1024, 1024, 256]
    - [120, 27562.0]
  - - [1024, 256, 1, 17152, 1024, 1024, 1024, 256]
    - [51, 29334.0]
  - - [1024, 2, 1, 2048, 1024, 1024, 1024, 2]
    - [47, 200.0]
  - - [1024, 1024, 1, 3072, 1024, 1024, 1024, 1024]
    - [111, 37561.0]
  - - [64, 128, 656, 128, 64, 64, 64, 128]
    - [97, 22568.0]
  - - [1600, 1024, 1, 512, 1600, 1600, 1600, 1024]
    - [165, 35187.0]
  - - [1024, 256, 1, 17408, 1024, 1024, 1024, 256]
    - [174, 29434.0]
  - - [1024, 1024, 1, 9216, 1024, 1024, 1024, 1024]
    - [185, 40065.0]
  - - [256, 4352, 1, 8976, 256, 256, 256, 4352]
    - [105, 42217.0]
  - - [33, 32, 200, 33, 33, 33, 33, 32]
    - [91, 1001.0]
  - - [2048, 2048, 1, 1024, 2048, 2048, 2048, 2048]
    - [122, 48542.0]
  - - [1024, 4096, 1, 4992, 1024, 1024, 1024, 4096]
    - [166, 52534.0]
  - - [9, 64, 512, 9, 9, 9, 9, 64]
    - [85, 313.0]
  - - [4096, 1024, 1, 4096, 4096, 4096, 4096, 1024]
    - [125, 52764.0]
  - - [1024, 1024, 1, 9, 1024, 1024, 1024, 1024]
    - [32, 1192.0]
  - - [1024, 4096, 1, 512, 1024, 1024, 1024, 4096]
    - [190, 43226.0]
  - - [64, 512, 16, 512, 64, 64, 64, 512]
    - [89, 18040.0]
  - - [256, 17152, 1, 8976, 256, 256, 256, 17152]
    - [27, 55832.0]
  - - [1024, 4096, 1, 10064, 1024, 1024, 1024, 4096]
    - [181, 52769.0]
  - - [1024, 2, 1, 6, 1024, 1024, 1024, 2]
    - [1, 2.0]
  - - [256, 7168, 1, 8976, 256, 256, 256, 7168]
    - [139, 56734.0]
  - - [256, 9984, 1, 8976, 256, 256, 256, 9984]
    - [27, 53195.0]
  - - [1024, 4096, 1, 6528, 1024, 1024, 1024, 4096]
    - [61, 52760.0]
  - - [2048, 1920, 1, 2048, 2080, 2080, 2080, 2080]
    - [157, 60604.0]
  - - [1024, 4096, 1, 7200, 1024, 1024, 1024, 4096]
    - [68, 52817.0]
  - - [1024, 1024, 1, 2048, 1024, 1024, 1024, 1024]
    - [98, 36129.0]
  - - [1024, 256, 1, 19712, 1024, 1024, 1024, 256]
    - [175, 29725.0]
  - - [1024, 30522, 1, 780, 1024, 1024, 1024, 30522]
    - [157, 58670.0]
  - - [64, 128, 128, 128, 64, 64, 64, 128]
    - [152, 13210.0]
  - - [560, 1024, 1, 200, 560, 560, 560, 1024]
    - [1, 9752.0]
  - - [1024, 30522, 1, 800, 1024, 1024, 1024, 30522]
    - [161, 59794.0]
  - - [256, 13312, 1, 8976, 256, 256, 256, 13312]
    - [157, 55519.0]
  - - [256, 3840, 1, 8976, 256, 256, 256, 3840]
    - [153, 56418.0]
  - - [1024, 256, 1, 6400, 1024, 1024, 1024, 256]
    - [84, 25420.0]
  - - [1024, 42720, 1, 6528, 1024, 1024, 1024, 42720]
    - [129, 62916.0]
  - - [30, 64, 2048, 31, 30, 30, 30, 131072]
    - [12, 4777.0]
  - - [256, 14336, 1, 8976, 256, 256, 256, 14336]
    - [104, 59557.0]
  - - [33, 32, 1600, 33, 33, 33, 33, 32]
    - [18, 3084.0]
  - - [960, 1024, 1, 1024, 1056, 1056, 1056, 1056]
    - [60, 41255.0]
  - - [256, 1280, 1, 8976, 256, 256, 256, 1280]
    - [52, 31859.0]
  - - [1024, 1024, 1, 6, 1024, 1024, 1024, 1024]
    - [95, 819.0]
  - - [1024, 4096, 1, 8064, 1024, 1024, 1024, 4096]
    - [22, 53134.0]
  - - [1024, 1024, 1, 10200, 1024, 1024, 1024, 1024]
    - [128, 39322.0]
  - - [8192, 7680, 1, 8192, 8384, 8384, 8384, 8384]
    - [167, 64866.0]
  - - [1024, 256, 1, 3328, 1024, 1024, 1024, 256]
    - [52, 21258.0]
  - - [1024, 256, 1, 3584, 1024, 1024, 1024, 256]
    - [194, 21993.0]
  - - [14, 64, 10880, 14, 14, 14, 14, 696320]
    - [2, 2114.0]
  - - [1024, 2, 1, 1152, 1024, 1024, 1024, 2]
    - [87, 154.0]
  - - [257, 4096, 1, 1024, 257, 257, 257, 4096]
    - [48, 27782.0]
  - - [1024, 2, 1, 4, 1024, 1024, 1024, 2]
    - [0, 1.0]
  - - [1024, 1024, 1, 2560, 1024, 1024, 1024, 1024]
    - [143, 36954.0]
  - - [1024, 256, 1, 11520, 1024, 1024, 1024, 256]
    - [84, 28192.0]
  - - [1024, 256, 1, 19968, 1024, 1024, 1024, 256]
    - [120, 29647.0]
  - - [1024, 1024, 1, 77, 1024, 1024, 1024, 1024]
    - [148, 8341.0]
  - - [1024, 42720, 1, 7104, 1024, 1024, 1024, 42720]
    - [39, 62851.0]
  - - [1024, 1024, 1, 160, 1024, 1024, 1024, 1024]
    - [152, 16913.0]
  - - [256, 3584, 1, 8976, 256, 256, 256, 3584]
    - [21, 52657.0]
  - - [256, 19968, 1, 8976, 256, 256, 256, 19968]
    - [35, 55830.0]
  - - [1024, 64, 1, 960, 1024, 1024, 1024, 64]
    - [115, 4795.0]
  - - [256, 10240, 1, 8976, 256, 256, 256, 10240]
    - [27, 54167.0]
  - - [1024, 4096, 1, 8192, 1024, 1024, 1024, 4096]
    - [34, 53162.0]
  - - [256, 18688, 1, 8976, 256, 256, 256, 18688]
    - [155, 60244.0]
  - - [1024, 256, 1, 7936, 1024, 1024, 1024, 256]
    - [169, 26617.0]
  - - [1024, 42720, 1, 9520, 1024, 1024, 1024, 42720]
    - [17, 62828.0]
  - - [3, 64, 512, 3, 3, 3, 3, 64]
    - [144, 37.0]
  - - [1024, 2, 1, 41, 1024, 1024, 1024, 2]
    - [4, 12.0]
  - - [128, 64, 1, 128, 128, 128, 128, 64]
    - [10, 162.0]
  - - [256, 10496, 1, 8976, 256, 256, 256, 10496]
    - [155, 55654.0]
  - - [480, 512, 1, 512, 544, 544, 544, 544]
    - [147, 12385.0]
  - - [1024, 1024, 1, 462, 1024, 1024, 1024, 1024]
    - [184, 23935.0]
  - - [17, 64, 7680, 15, 17, 17, 17, 491520]
    - [2, 2515.0]
  - - [1024, 1024, 1, 780, 1024, 1024, 1024, 1024]
    - [116, 29210.0]
  - - [64, 15, 10880, 15, 64, 64, 696320, 15]
    - [81, 2083.0]
  - - [64, 30, 2048, 30, 64, 64, 131072, 30]
    - [81, 4523.0]
  - - [1024, 4096, 1, 5248, 1024, 1024, 1024, 4096]
    - [34, 52519.0]
  - - [1024, 4096, 1, 1280, 1024, 1024, 1024, 4096]
    - [172, 49020.0]
  - - [1024, 1024, 1, 4, 1024, 1024, 1024, 1024]
    - [149, 546.0]
  - - [4096, 1024, 1, 9600, 4096, 4096, 4096, 1024]
    - [122, 53601.0]
  - - [256, 44505, 1, 8976, 256, 256, 256, 44505]
    - [28, 61877.0]
  - - [768, 2048, 1, 256, 768, 768, 768, 2048]
    - [154, 26915.0]
  - - [1024, 1024, 1, 32768, 1024, 1024, 1024, 1024]
    - [124, 40862.0]
  - - [74, 2048, 1, 960, 74, 74, 74, 2048]
    - [115, 9232.0]
  - - [64, 512, 80, 512, 64, 64, 64, 512]
    - [66, 36631.0]
  - - [4096, 1024, 1, 1152, 4096, 4096, 4096, 1024]
    - [172, 49224.0]
  - - [64, 14, 10880, 14, 64, 64, 696320, 14]
    - [53, 1830.0]
  - - [1024, 256, 1, 1280, 1024, 1024, 1024, 256]
    - [37, 15364.0]
  - - [4096, 1024, 1, 9520, 4096, 4096, 4096, 1024]
    - [122, 53251.0]
  - - [1024, 1600, 1, 1, 1024, 1024, 1024, 1600]
    - [95, 209.0]
  - - [512, 32, 1, 1600, 512, 512, 512, 32]
    - [63, 1524.0]
  - - [1024, 1024, 1, 820, 1024, 1024, 1024, 1024]
    - [48, 29446.0]
  - - [1024, 2, 1, 2560, 1024, 1024, 1024, 2]
    - [30, 227.0]
  - - [1024, 4096, 1, 9216, 1024, 1024, 1024, 4096]
    - [22, 53408.0]
  - - [1024, 1024, 1, 512, 1024, 1024, 1024, 1024]
    - [76, 27731.0]
  - - [4096, 1024, 1, 5248, 4096, 4096, 4096, 1024]
    - [122, 53271.0]
  - - [1024, 256, 1, 16128, 1024, 1024, 1024, 256]
    - [45, 29117.0]
  - - [512, 256, 1, 32768, 512, 512, 512, 256]
    - [106, 17180.0]
  - - [1024, 33712, 1, 8192, 1024, 1024, 1024, 33712]
    - [28, 63131.0]
  - - [4096, 1024, 1, 10080, 4096, 4096, 4096, 1024]
    - [135, 53517.0]
  - - [1024, 1024, 1, 385, 1024, 1024, 1024, 1024]
    - [163, 22629.0]
  - - [1024, 256, 1, 13568, 1024, 1024, 1024, 256]
    - [174, 28684.0]
  - - [1024, 1024, 1, 1, 1024, 1024, 1024, 1024]
    - [102, 147.0]
  - - [1024, 2, 1, 10, 1024, 1024, 1024, 2]
    - [1, 3.0]
  - - [64, 21, 6144, 21, 64, 64, 393216, 21]
    - [159, 3235.0]
  - - [64, 4, 32768, 4, 64, 64, 2097152, 4]
    - [3, 223.0]
  - - [1024, 256, 1, 28672, 1024, 1024, 1024, 256]
    - [169, 30474.0]
  - - [34, 64, 4736, 34, 34, 34, 34, 303104]
    - [74, 5778.0]
  - - [128, 64, 512, 128, 128, 128, 128, 64]
    - [83, 21578.0]
  - - [256, 20992, 1, 8976, 256, 256, 256, 20992]
    - [104, 58630.0]
  - - [1024, 256, 1, 4352, 1024, 1024, 1024, 256]
    - [169, 23113.0]
  - - [256, 5888, 1, 8976, 256, 256, 256, 5888]
    - [119, 47122.0]
  - - [64, 31, 2048, 31, 64, 64, 131072, 31]
    - [75, 4672.0]
  - - [512, 64, 1, 512, 512, 512, 512, 64]
    - [44, 1762.0]
  - - [1024, 1024, 1, 10, 1024, 1024, 1024, 1024]
    - [149, 1337.0]
  - - [512, 32, 1, 200, 512, 512, 512, 32]
    - [31, 376.0]
  - - [5, 64, 960, 5, 5, 5, 5, 64]
    - [85, 141.0]
  - - [64, 35, 4608, 35, 64, 64, 294912, 35]
    - [3, 5989.0]
  - - [1024, 2, 1, 5120, 1024, 1024, 1024, 2]
    - [78, 290.0]
  - - [1920, 2048, 1, 2048, 2080, 2080, 2080, 2080]
    - [49, 60750.0]
  - - [2048, 2048, 1, 2048, 2080, 2080, 2080, 2080]
    - [134, 52123.0]
  - - [1024, 256, 1, 9728, 1024, 1024, 1024, 256]
    - [131, 27409.0]
  - - [4096, 1024, 1, 8160, 4096, 4096, 4096, 1024]
    - [113, 53517.0]
  - - [64, 34, 4736, 24, 64, 64, 303104, 34]
    - [67, 4720.0]
  - - [256, 26112, 1, 8976, 256, 256, 256, 26112]
    - [25, 60364.0]
  - - [3840, 4096, 1, 4096, 4192, 4192, 4192, 4192]
    - [110, 64147.0]
  - - [1024, 4096, 1, 5120, 1024, 1024, 1024, 4096]
    - [34, 52583.0]
  - - [64, 128, 160, 128, 64, 64, 64, 128]
    - [152, 15888.0]
  - - [1024, 1024, 1, 10064, 1024, 1024, 1024, 1024]
    - [128, 39471.0]
  - - [256, 5120, 1, 8976, 256, 256, 256, 5120]
    - [99, 48360.0]
  - - [35, 64, 4608, 35, 35, 35, 35, 294912]
    - [74, 5797.0]
  - - [1024, 30522, 1, 308, 1024, 1024, 1024, 30522]
    - [176, 51599.0]
  - - [1024, 30522, 1, 820, 1024, 1024, 1024, 30522]
    - [157, 58835.0]
  - - [1024, 30522, 1, 200, 1024, 1024, 1024, 30522]
    - [164, 45882.0]
  - - [15, 64, 10880, 14, 15, 15, 15, 696320]
    - [144, 2237.0]
  - - [1024, 30522, 1, 462, 1024, 1024, 1024, 30522]
    - [167, 54333.0]
  - - [256, 8960, 1, 8976, 256, 256, 256, 8960]
    - [189, 49683.0]
  - - [15, 64, 7680, 15, 15, 15, 15, 491520]
    - [64, 2255.0]
  - - [1024, 1024, 1, 8064, 1024, 1024, 1024, 1024]
    - [128, 39946.0]
  - - [13, 512, 1, 32768, 13, 13, 13, 512]
    - [42, 986.0]
  - - [256, 5632, 1, 8976, 256, 256, 256, 5632]
    - [170, 48477.0]
  - - [256, 32512, 1, 8976, 256, 256, 256, 32512]
    - [27, 59168.0]
  - - [64, 17, 7680, 15, 64, 64, 491520, 17]
    - [59, 2225.0]
  - - [17, 64, 6144, 17, 17, 17, 17, 393216]
    - [137, 2445.0]
  - - [1024, 2, 1, 1024, 1024, 1024, 1024, 2]
    - [77, 150.0]
  - - [1024, 4096, 1, 4096, 1024, 1024, 1024, 4096]
    - [68, 52085.0]
  - - [64, 512, 1, 512, 64, 64, 64, 512]
    - [183, 1840.0]
  - - [1024, 30522, 1, 77, 1024, 1024, 1024, 30522]
    - [150, 26481.0]
  - - [256, 11264, 1, 8976, 256, 256, 256, 11264]
    - [27, 59191.0]
  - - [1024, 1024, 1, 40, 1024, 1024, 1024, 1024]
    - [96, 5243.0]
  - - [1024, 1024, 1, 9520, 1024, 1024, 1024, 1024]
    - [128, 39313.0]
  - - [1024, 2, 1, 1, 1024, 1024, 1024, 2]
    - [86, 0.37]
  - - [1024, 1024, 1, 3840, 1024, 1024, 1024, 1024]
    - [179, 38188.0]
  - - [512, 512, 1, 1600, 512, 512, 512, 512]
    - [70, 17134.0]
  - - [1024, 512, 1, 32768, 1024, 1024, 1024, 512]
    - [127, 34098.0]
  - - [256, 15872, 1, 8976, 256, 256, 256, 15872]
    - [8, 53647.0]
  - - [1024, 2, 1, 8, 1024, 1024, 1024, 2]
    - [1, 3.0]
  - - [3200, 2048, 1, 1024, 3200, 3200, 3200, 2048]
    - [62, 54720.0]
  - - [1024, 1024, 1, 8, 1024, 1024, 1024, 1024]
    - [94, 1295.0]
  - - [1024, 42720, 1, 7200, 1024, 1024, 1024, 42720]
    - [113, 62822.0]
  - - [1024, 30528, 1, 4096, 1024, 1024, 1024, 30528]
    - [161, 63660.0]
  - - [27, 128, 32768, 27, 27, 27, 27, 128]
    - [132, 6361.0]
  - - [1024, 256, 1, 1024, 1024, 1024, 1024, 256]
    - [43, 14040.0]
  - - [64, 15, 7680, 15, 64, 64, 491520, 15]
    - [65, 1983.0]
  - - [560, 1024, 1, 1600, 560, 560, 560, 1024]
    - [50, 26672.0]
  - - [256, 128, 1, 32768, 256, 256, 256, 128]
    - [82, 5129.0]
  - - [512, 2048, 1, 256, 512, 512, 512, 2048]
    - [103, 22075.0]
  - - [1024, 256, 1, 21248, 1024, 1024, 1024, 256]
    - [72, 29793.0]
  - - [256, 12544, 1, 8976, 256, 256, 256, 12544]
    - [145, 52668.0]
  - - [1024, 1024, 1, 9600, 1024, 1024, 1024, 1024]
    - [128, 40227.0]
  - - [4096, 1024, 1, 5120, 4096, 4096, 4096, 1024]
    - [125, 53019.0]
  - - [1024, 4096, 1, 3072, 1024, 1024, 1024, 4096]
    - [68, 51838.0]
  - - [1024, 256, 1, 21504, 1024, 1024, 1024, 256]
    - [51, 29820.0]
  - - [32, 64, 4608, 32, 32, 32, 32, 294912]
    - [133, 9031.0]
  - - [1024, 1024, 1, 1152, 1024, 1024, 1024, 1024]
    - [195, 33259.0]
  - - [512, 480, 1, 512, 544, 544, 544, 544]
    - [93, 11916.0]
  - - [1024, 1024, 1, 1024, 1024, 1024, 1024, 1024]
    - [112, 32736.0]
  - - [1024, 4096, 1, 8160, 1024, 1024, 1024, 4096]
    - [172, 52935.0]
  - - [67, 2048, 1, 512, 67, 67, 67, 2048]
    - [36, 6318.0]
  - - [1024, 256, 1, 8192, 1024, 1024, 1024, 256]
    - [72, 26657.0]
  - - [64, 15, 10880, 14, 64, 64, 696320, 15]
    - [38, 1951.0]
  - - [64, 128, 1, 128, 64, 64, 64, 128]
    - [71, 164.0]
  - - [1024, 256, 1, 4608, 1024, 1024, 1024, 256]
    - [45, 23483.0]
  - - [1024, 1024, 1, 5120, 1024, 1024, 1024, 1024]
    - [111, 39176.0]
  - - [256, 17408, 1, 8976, 256, 256, 256, 17408]
    - [27, 56543.0]
  - - [1024, 1024, 1, 32, 1024, 1024, 1024, 1024]
    - [171, 5053.0]
  - - [1024, 42720, 1, 10080, 1024, 1024, 1024, 42720]
    - [28, 62751.0]
  - - [256, 32768, 1, 1, 256, 256, 256, 32768]
    - [14, 474.0]
  - - [256, 4096, 1, 8976, 256, 256, 256, 4096]
    - [20, 38561.0]
  - - [256, 14848, 1, 8976, 256, 256, 256, 14848]
    - [40, 61550.0]
  - - [24, 64, 4736, 24, 24, 24, 24, 303104]
    - [162, 4262.0]
  - - [64, 17, 7680, 17, 64, 64, 491520, 17]
    - [108, 2446.0]
  - - [1024, 2, 1, 3072, 1024, 1024, 1024, 2]
    - [30, 243.0]
  - - [256, 20480, 1, 8976, 256, 256, 256, 20480]
    - [104, 57223.0]
  - - [1024, 4096, 1, 2048, 1024, 1024, 1024, 4096]
    - [190, 51058.0]
  - - [7680, 8192, 1, 8192, 8384, 8384, 8384, 8384]
    - [28, 64865.0]
  - - [4096, 1024, 1, 8192, 4096, 4096, 4096, 1024]
    - [61, 53360.0]
  - - [512, 512, 1, 200, 512, 512, 512, 512]
    - [31, 5554.0]
  - - [1024, 2, 1, 1280, 1024, 1024, 1024, 2]
    - [107, 162.0]
  - - [256, 2816, 1, 8976, 256, 256, 256, 2816]
    - [146, 41909.0]
  - - [1024, 1024, 1, 1600, 1024, 1024, 1024, 1024]
    - [126, 35069.0]
  - - [479, 1024, 1, 32768, 479, 479, 479, 1024]
    - [138, 31348.0]
  - - [64, 128, 512, 128, 64, 64, 64, 128]
    - [33, 21648.0]
  - - [4096, 1024, 1, 3968, 4096, 4096, 4096, 1024]
    - [122, 52748.0]
  - - [1024, 256, 1, 2304, 1024, 1024, 1024, 256]
    - [70, 19712.0]
  - - [1024, 1024, 1, 200, 1024, 1024, 1024, 1024]
    - [26, 15511.0]
  - - [256, 16128, 1, 8976, 256, 256, 256, 16128]
    - [20, 54783.0]
- null
