TRAIN_3.7/build/_3_LibraryLogic/arcturus_Cijk_Ailk_Bljk_HBH.yaml
- {MinimumRequiredVersion: 4.20.0}
- arcturus
- gfx908
- [Device 7380, Device 7388, Device 738c, Device 7390]
- - - [1024, 8192, 1, 256, 1024, 1024, 1024, 256]
    - [20, 50081.0]
  - - [1024, 9728, 1, 256, 1024, 1024, 1024, 256]
    - [20, 50921.0]
  - - [64, 128, 624, 128, 64, 64, 64, 128]
    - [20, 20396.0]
  - - [1024, 10, 1, 1024, 1024, 1024, 1024, 1024]
    - [36, 857.0]
  - - [1024, 22016, 1, 256, 1024, 1024, 1024, 256]
    - [67, 59036.0]
  - - [2048, 2048, 1, 2048, 2080, 2080, 2080, 2080]
    - [46, 63422.0]
  - - [1024, 10080, 1, 1024, 1024, 1024, 1024, 1024]
    - [115, 73360.0]
  - - [1024, 7936, 1, 256, 1024, 1024, 1024, 256]
    - [38, 48698.0]
  - - [1024, 1600, 1, 1, 1024, 1024, 1024, 1]
    - [101, 172.0]
  - - [1024, 10, 1, 2, 1024, 1024, 1024, 2]
    - [7, 4.0]
  - - [256, 8976, 1, 4352, 256, 256, 256, 4352]
    - [90, 63745.0]
  - - [1024, 15104, 1, 256, 1024, 1024, 1024, 256]
    - [133, 56051.0]
  - - [1024, 5, 1, 2, 1024, 1024, 1024, 2]
    - [1, 2.0]
  - - [1024, 9216, 1, 1024, 1024, 1024, 1024, 1024]
    - [105, 75925.0]
  - - [74, 512, 1, 2048, 74, 74, 74, 2048]
    - [36, 4389.0]
  - - [1024, 512, 1, 1024, 1024, 1024, 1024, 1024]
    - [48, 26421.0]
  - - [512, 200, 1, 32, 512, 512, 512, 32]
    - [26, 577.0]
  - - [1024, 5, 1, 1024, 1024, 1024, 1024, 1024]
    - [121, 410.0]
  - - [512, 256, 1, 2048, 512, 512, 512, 2048]
    - [51, 13808.0]
  - - [1024, 21504, 1, 256, 1024, 1024, 1024, 256]
    - [83, 58187.0]
  - - [256, 8976, 1, 9984, 256, 256, 256, 9984]
    - [27, 69571.0]
  - - [64, 5, 960, 5, 64, 64, 64, 5]
    - [5, 123.0]
  - - [64, 512, 16, 512, 64, 64, 64, 512]
    - [52, 18641.0]
  - - [1024, 512, 1, 64, 1024, 1024, 1024, 64]
    - [102, 5519.0]
  - - [1024, 1024, 1, 1024, 1056, 1056, 1056, 1056]
    - [46, 41943.0]
  - - [1024, 9600, 1, 4096, 1024, 1024, 1024, 4096]
    - [105, 96108.0]
  - - [1024, 3328, 1, 256, 1024, 1024, 1024, 256]
    - [20, 41943.0]
  - - [1024, 1600, 1, 1024, 1024, 1024, 1024, 1024]
    - [16, 49345.0]
  - - [64, 24, 4736, 24, 64, 64, 303104, 24]
    - [12, 3091.0]
  - - [64, 15, 7680, 17, 64, 64, 491520, 17]
    - [96, 1567.0]
  - - [256, 8976, 1, 9728, 256, 256, 256, 9728]
    - [57, 69907.0]
  - - [1024, 4096, 1, 1024, 1024, 1024, 1024, 1024]
    - [21, 58803.0]
  - - [512, 512, 64, 64, 512, 512, 512, 64]
    - [38, 28079.0]
  - - [1024, 8192, 1, 1024, 1024, 1024, 1024, 1024]
    - [18, 68131.0]
  - - [64, 5, 512, 5, 64, 64, 64, 5]
    - [91, 81.0]
  - - [1024, 7680, 1, 256, 1024, 1024, 1024, 256]
    - [133, 50332.0]
  - - [1024, 1280, 1, 4096, 1024, 1024, 1024, 4096]
    - [17, 54295.0]
  - - [512, 512, 1, 512, 544, 544, 544, 544]
    - [76, 12614.0]
  - - [1024, 18944, 1, 256, 1024, 1024, 1024, 256]
    - [131, 57799.0]
  - - [1024, 1152, 1, 1024, 1024, 1024, 1024, 1024]
    - [73, 42060.0]
  - - [1024, 5248, 1, 2, 1024, 1024, 1024, 2]
    - [63, 594.0]
  - - [256, 8976, 1, 15872, 256, 256, 256, 15872]
    - [41, 71908.0]
  - - [256, 8976, 1, 6144, 256, 256, 256, 6144]
    - [49, 66847.0]
  - - [1024, 28672, 1, 256, 1024, 1024, 1024, 256]
    - [67, 59919.0]
  - - [1024, 820, 1, 1024, 1024, 1024, 1024, 1024]
    - [23, 35355.0]
  - - [1024, 6528, 1, 4096, 1024, 1024, 1024, 4096]
    - [105, 96166.0]
  - - [1024, 10064, 1, 1024, 1024, 1024, 1024, 1024]
    - [118, 72798.0]
  - - [4096, 1152, 1, 1024, 4096, 4096, 4096, 1024]
    - [117, 57797.0]
  - - [256, 8976, 1, 33536, 256, 256, 256, 33536]
    - [113, 72377.0]
  - - [1024, 308, 1, 30522, 1024, 1024, 1024, 30522]
    - [119, 30394.0]
  - - [256, 8976, 1, 19968, 256, 256, 256, 19968]
    - [27, 72035.0]
  - - [1024, 39, 1, 1024, 1024, 1024, 1024, 1024]
    - [24, 3256.0]
  - - [1024, 616, 1, 1024, 1024, 1024, 1024, 1024]
    - [106, 26300.0]
  - - [768, 215, 1, 2048, 768, 768, 768, 2048]
    - [123, 16073.0]
  - - [64, 17, 6144, 17, 64, 64, 393216, 17]
    - [12, 1709.0]
  - - [64, 512, 96, 512, 64, 64, 64, 512]
    - [43, 35570.0]
  - - [1024, 39, 1, 2, 1024, 1024, 1024, 2]
    - [58, 14.0]
  - - [1024, 20992, 1, 256, 1024, 1024, 1024, 256]
    - [70, 57037.0]
  - - [128, 128, 1, 64, 128, 128, 128, 64]
    - [10, 211.0]
  - - [1024, 3072, 1, 256, 1024, 1024, 1024, 256]
    - [15, 39631.0]
  - - [3200, 1024, 1, 2048, 3200, 3200, 3200, 2048]
    - [37, 80505.0]
  - - [1024, 160, 1, 30522, 1024, 1024, 1024, 30522]
    - [124, 23186.0]
  - - [1024, 23552, 1, 256, 1024, 1024, 1024, 256]
    - [74, 57040.0]
  - - [1024, 2560, 1, 1024, 1024, 1024, 1024, 1024]
    - [125, 56394.0]
  - - [4096, 1024, 1, 1, 4096, 4096, 4096, 1]
    - [61, 253.0]
  - - [1024, 2560, 1, 256, 1024, 1024, 1024, 256]
    - [107, 34953.0]
  - - [4096, 9600, 1, 1024, 4096, 4096, 4096, 1024]
    - [14, 94324.0]
  - - [1024, 8, 1, 2, 1024, 1024, 1024, 2]
    - [1, 3.0]
  - - [1024, 800, 1, 1024, 1024, 1024, 1024, 1024]
    - [137, 35545.0]
  - - [64, 128, 640, 128, 64, 64, 64, 128]
    - [63, 20560.0]
  - - [4096, 3840, 1, 1024, 4096, 4096, 4096, 1024]
    - [79, 81873.0]
  - - [560, 1600, 1, 1024, 560, 560, 560, 1024]
    - [23, 37236.0]
  - - [256, 8976, 1, 14336, 256, 256, 256, 14336]
    - [40, 71365.0]
  - - [4096, 1024, 1, 1024, 4096, 4096, 4096, 1024]
    - [86, 54066.0]
  - - [256, 8976, 1, 3072, 256, 256, 256, 3072]
    - [41, 59741.0]
  - - [1024, 8, 1, 1024, 1024, 1024, 1024, 1024]
    - [64, 681.0]
  - - [1024, 4608, 1, 256, 1024, 1024, 1024, 256]
    - [20, 43894.0]
  - - [256, 8976, 1, 9472, 256, 256, 256, 9472]
    - [27, 69618.0]
  - - [480, 32768, 1, 1024, 480, 480, 480, 1024]
    - [105, 75010.0]
  - - [1024, 1024, 1, 2, 1024, 1024, 1024, 2]
    - [13, 232.0]
  - - [256, 8976, 1, 1536, 256, 256, 256, 1536]
    - [92, 50307.0]
  - - [128, 27, 32768, 27, 128, 128, 128, 27]
    - [12, 4592.0]
  - - [256, 8976, 1, 2816, 256, 256, 256, 2816]
    - [57, 58612.0]
  - - [1024, 8064, 1, 1024, 1024, 1024, 1024, 1024]
    - [105, 67323.0]
  - - [4096, 5248, 1, 1024, 4096, 4096, 4096, 1024]
    - [82, 90123.0]
  - - [256, 8976, 1, 20992, 256, 256, 256, 20992]
    - [49, 71900.0]
  - - [1024, 2048, 1, 30528, 1024, 1024, 1024, 30528]
    - [99, 67964.0]
  - - [1024, 9520, 1, 1024, 1024, 1024, 1024, 1024]
    - [131, 69246.0]
  - - [4096, 4096, 1, 4096, 4192, 4192, 4192, 4192]
    - [84, 103593.0]
  - - [1024, 77, 1, 30522, 1024, 1024, 1024, 30522]
    - [72, 13933.0]
  - - [1024, 8448, 1, 256, 1024, 1024, 1024, 256]
    - [38, 50793.0]
  - - [1024, 9, 1, 2, 1024, 1024, 1024, 2]
    - [1, 3.0]
  - - [256, 8976, 1, 2304, 256, 256, 256, 2304]
    - [41, 55847.0]
  - - [1024, 1024, 1, 4096, 1024, 1024, 1024, 4096]
    - [11, 46402.0]
  - - [1024, 9, 1, 1024, 1024, 1024, 1024, 1024]
    - [36, 761.0]
  - - [64, 31, 2048, 31, 64, 64, 131072, 31]
    - [12, 4006.0]
  - - [4096, 6528, 1, 1024, 4096, 4096, 4096, 1024]
    - [80, 87758.0]
  - - [2048, 960, 1, 2048, 2048, 2048, 2048, 2048]
    - [108, 54178.0]
  - - [1024, 14848, 1, 256, 1024, 1024, 1024, 256]
    - [70, 54914.0]
  - - [1024, 780, 1, 1024, 1024, 1024, 1024, 1024]
    - [85, 35999.0]
  - - [64, 4, 38400, 4, 64, 64, 2457600, 4]
    - [3, 140.0]
  - - [4096, 8160, 1, 1024, 4096, 4096, 4096, 1024]
    - [81, 90563.0]
  - - [1024, 7104, 1, 1024, 1024, 1024, 1024, 1024]
    - [18, 69800.0]
  - - [1024, 4096, 1, 2, 1024, 1024, 1024, 2]
    - [61, 512.0]
  - - [4096, 2560, 1, 1024, 4096, 4096, 4096, 1024]
    - [44, 83729.0]
  - - [64, 128, 144, 128, 64, 64, 64, 128]
    - [20, 14631.0]
  - - [1024, 780, 1, 30522, 1024, 1024, 1024, 30522]
    - [120, 46277.0]
  - - [256, 8976, 1, 5888, 256, 256, 256, 5888]
    - [4, 66505.0]
  - - [8192, 7680, 1, 8192, 8384, 8384, 8384, 8384]
    - [65, 121659.0]
  - - [1024, 7200, 1, 42720, 1024, 1024, 1024, 42720]
    - [116, 113542.0]
  - - [64, 34, 4736, 34, 64, 64, 303104, 34]
    - [3, 4109.0]
  - - [1024, 3840, 1, 4096, 1024, 1024, 1024, 4096]
    - [109, 99322.0]
  - - [64, 32, 4608, 32, 64, 64, 294912, 32]
    - [8, 8464.0]
  - - [2048, 1024, 1, 1, 2048, 2048, 2048, 1]
    - [19, 169.0]
  - - [256, 8976, 1, 2560, 256, 256, 256, 2560]
    - [41, 57491.0]
  - - [512, 215, 1, 2048, 512, 512, 512, 2048]
    - [122, 12360.0]
  - - [4096, 4096, 1, 1024, 4096, 4096, 4096, 1024]
    - [80, 85865.0]
  - - [256, 8976, 1, 26112, 256, 256, 256, 26112]
    - [35, 72959.0]
  - - [64, 512, 64, 512, 64, 64, 64, 512]
    - [60, 28138.0]
  - - [1024, 4864, 1, 256, 1024, 1024, 1024, 256]
    - [20, 45932.0]
  - - [100, 512, 1, 2048, 100, 100, 100, 2048]
    - [24, 6271.0]
  - - [1024, 11008, 1, 256, 1024, 1024, 1024, 256]
    - [87, 53124.0]
  - - [1024, 13312, 1, 256, 1024, 1024, 1024, 256]
    - [38, 52938.0]
  - - [1024, 960, 1, 1024, 1056, 1056, 1056, 1056]
    - [140, 45100.0]
  - - [1024, 12288, 1, 256, 1024, 1024, 1024, 256]
    - [87, 53975.0]
  - - [1024, 33536, 1, 256, 1024, 1024, 1024, 256]
    - [70, 61875.0]
  - - [256, 8976, 1, 11008, 256, 256, 256, 11008]
    - [35, 70216.0]
  - - [256, 1024, 1, 1, 256, 256, 256, 1]
    - [1, 44.0]
  - - [1024, 3072, 1, 2, 1024, 1024, 1024, 2]
    - [17, 463.0]
  - - [8192, 8192, 1, 8192, 8384, 8384, 8384, 8384]
    - [84, 118537.0]
  - - [1024, 180, 1, 1024, 1024, 1024, 1024, 1024]
    - [28, 13254.0]
  - - [2048, 1024, 1, 256, 2048, 2048, 2048, 256]
    - [63, 29694.0]
  - - [256, 8976, 1, 2048, 256, 256, 256, 2048]
    - [6, 54167.0]
  - - [1024, 1024, 1, 1024, 1024, 1024, 1024, 1024]
    - [114, 38679.0]
  - - [4096, 10080, 1, 1024, 4096, 4096, 4096, 1024]
    - [126, 90000.0]
  - - [1024, 14592, 1, 256, 1024, 1024, 1024, 256]
    - [87, 55470.0]
  - - [1024, 180, 1, 30522, 1024, 1024, 1024, 30522]
    - [136, 25035.0]
  - - [1024, 200, 1, 1, 1024, 1024, 1024, 1]
    - [89, 34.0]
  - - [256, 8976, 1, 5376, 256, 256, 256, 5376]
    - [57, 65933.0]
  - - [1024, 2048, 1, 4096, 1024, 1024, 1024, 4096]
    - [62, 60527.0]
  - - [1024, 512, 1, 2, 1024, 1024, 1024, 2]
    - [110, 154.0]
  - - [1024, 8192, 1, 4096, 1024, 1024, 1024, 4096]
    - [62, 82978.0]
  - - [74, 960, 1, 2048, 74, 74, 74, 2048]
    - [34, 7706.0]
  - - [1024, 385, 1, 30522, 1024, 1024, 1024, 30522]
    - [93, 32585.0]
  - - [512, 512, 1, 64, 512, 512, 512, 64]
    - [58, 2996.0]
  - - [1024, 7104, 1, 42720, 1024, 1024, 1024, 42720]
    - [25, 113402.0]
  - - [1024, 14336, 1, 256, 1024, 1024, 1024, 256]
    - [74, 55266.0]
  - - [1024, 20480, 1, 256, 1024, 1024, 1024, 256]
    - [53, 55462.0]
  - - [1024, 10200, 1, 4096, 1024, 1024, 1024, 4096]
    - [18, 97373.0]
  - - [4096, 512, 1, 1024, 4096, 4096, 4096, 1024]
    - [75, 45886.0]
  - - [32, 33, 1600, 33, 32, 32, 32, 33]
    - [1, 2428.0]
  - - [1024, 8160, 1, 1024, 1024, 1024, 1024, 1024]
    - [54, 64353.0]
  - - [1024, 160, 1, 1024, 1024, 1024, 1024, 1024]
    - [32, 12633.0]
  - - [1024, 5120, 1, 4096, 1024, 1024, 1024, 4096]
    - [105, 77403.0]
  - - [1024, 2048, 1, 256, 1024, 1024, 1024, 256]
    - [69, 29959.0]
  - - [1024, 3840, 1, 1024, 1024, 1024, 1024, 1024]
    - [105, 79014.0]
  - - [1024, 32768, 1, 1024, 1024, 1024, 1024, 1024]
    - [105, 94728.0]
  - - [2048, 1920, 1, 2048, 2080, 2080, 2080, 2080]
    - [99, 99176.0]
  - - [1024, 462, 1, 1024, 1024, 1024, 1024, 1024]
    - [130, 21782.0]
  - - [128, 128, 512, 64, 128, 128, 128, 64]
    - [17, 19284.0]
  - - [1024, 462, 1, 30522, 1024, 1024, 1024, 30522]
    - [47, 38168.0]
  - - [256, 8976, 1, 44505, 256, 256, 256, 44505]
    - [4, 73939.0]
  - - [1024, 5632, 1, 256, 1024, 1024, 1024, 256]
    - [87, 46721.0]
  - - [1024, 77, 1, 1024, 1024, 1024, 1024, 1024]
    - [122, 6388.0]
  - - [960, 1024, 1, 1024, 1056, 1056, 1056, 1056]
    - [55, 47483.0]
  - - [1024, 4096, 1, 256, 1024, 1024, 1024, 256]
    - [20, 41171.0]
  - - [1024, 40, 1, 2, 1024, 1024, 1024, 2]
    - [7, 14.0]
  - - [64, 5, 1, 5, 64, 64, 64, 5]
    - [1, 0.26]
  - - [1024, 512, 1, 1, 1024, 1024, 1024, 1]
    - [7, 77.0]
  - - [1024, 40, 1, 1024, 1024, 1024, 1024, 1024]
    - [36, 3361.0]
  - - [1600, 512, 1, 1024, 1600, 1600, 1600, 1024]
    - [127, 39719.0]
  - - [4096, 5120, 1, 1024, 4096, 4096, 4096, 1024]
    - [80, 89868.0]
  - - [4096, 9216, 1, 1024, 4096, 4096, 4096, 1024]
    - [67, 91790.0]
  - - [4096, 3968, 1, 1024, 4096, 4096, 4096, 1024]
    - [80, 83717.0]
  - - [256, 8976, 1, 7168, 256, 256, 256, 7168]
    - [90, 68152.0]
  - - [1024, 9520, 1, 4096, 1024, 1024, 1024, 4096]
    - [126, 92293.0]
  - - [1024, 10064, 1, 4096, 1024, 1024, 1024, 4096]
    - [105, 95952.0]
  - - [1024, 1792, 1, 256, 1024, 1024, 1024, 256]
    - [101, 34541.0]
  - - [256, 8976, 1, 7424, 256, 256, 256, 7424]
    - [77, 67889.0]
  - - [256, 8976, 1, 12288, 256, 256, 256, 12288]
    - [4, 71088.0]
  - - [67, 512, 1, 2048, 67, 67, 67, 2048]
    - [36, 3956.0]
  - - [1024, 5120, 1, 256, 1024, 1024, 1024, 256]
    - [20, 47260.0]
  - - [256, 32768, 1, 128, 256, 256, 256, 128]
    - [20, 35320.0]
  - - [1024, 6144, 1, 256, 1024, 1024, 1024, 256]
    - [20, 47039.0]
  - - [512, 200, 1, 1, 512, 512, 512, 1]
    - [56, 17.0]
  - - [256, 8976, 1, 4864, 256, 256, 256, 4864]
    - [90, 65011.0]
  - - [4096, 7104, 1, 1024, 4096, 4096, 4096, 1024]
    - [59, 88051.0]
  - - [1024, 200, 1, 30522, 1024, 1024, 1024, 30522]
    - [135, 26604.0]
  - - [1024, 11520, 1, 256, 1024, 1024, 1024, 256]
    - [39, 53393.0]
  - - [1024, 10496, 1, 256, 1024, 1024, 1024, 256]
    - [74, 53076.0]
  - - [1024, 41, 1, 2, 1024, 1024, 1024, 2]
    - [7, 15.0]
  - - [256, 8976, 1, 5632, 256, 256, 256, 5632]
    - [57, 66055.0]
  - - [1024, 200, 1, 1024, 1024, 1024, 1024, 1024]
    - [42, 14094.0]
  - - [4096, 8192, 1, 1024, 4096, 4096, 4096, 1024]
    - [81, 93106.0]
  - - [4096, 9520, 1, 1024, 4096, 4096, 4096, 1024]
    - [81, 90029.0]
  - - [1024, 41, 1, 1024, 1024, 1024, 1024, 1024]
    - [50, 3445.0]
  - - [1024, 4992, 1, 4096, 1024, 1024, 1024, 4096]
    - [62, 75186.0]
  - - [1024, 10200, 1, 1024, 1024, 1024, 1024, 1024]
    - [131, 73579.0]
  - - [4096, 1280, 1, 1024, 4096, 4096, 4096, 1024]
    - [18, 63072.0]
  - - [256, 8976, 1, 11520, 256, 256, 256, 11520]
    - [49, 70059.0]
  - - [1024, 2560, 1, 4096, 1024, 1024, 1024, 4096]
    - [105, 73584.0]
  - - [1024, 4992, 1, 2, 1024, 1024, 1024, 2]
    - [17, 581.0]
  - - [64, 35, 4608, 35, 64, 64, 294912, 35]
    - [129, 3896.0]
  - - [64, 3, 512, 3, 64, 64, 64, 3]
    - [1, 29.0]
  - - [1024, 6528, 1, 1024, 1024, 1024, 1024, 1024]
    - [105, 77224.0]
  - - [64, 30, 2048, 30, 64, 64, 131072, 30]
    - [96, 3860.0]
  - - [1024, 4096, 1, 30528, 1024, 1024, 1024, 30528]
    - [99, 68004.0]
  - - [768, 256, 1, 2048, 768, 768, 768, 2048]
    - [51, 19211.0]
  - - [256, 8976, 1, 8448, 256, 256, 256, 8448]
    - [90, 69132.0]
  - - [512, 32768, 1, 256, 512, 512, 512, 256]
    - [30, 55808.0]
  - - [1024, 40448, 1, 256, 1024, 1024, 1024, 256]
    - [81, 62489.0]
  - - [256, 8976, 1, 22016, 256, 256, 256, 22016]
    - [78, 71876.0]
  - - [32, 33, 1, 33, 32, 32, 32, 33]
    - [58, 6.0]
  - - [7680, 8192, 1, 8192, 8384, 8384, 8384, 8384]
    - [82, 122575.0]
  - - [4096, 3072, 1, 1024, 4096, 4096, 4096, 1024]
    - [132, 80011.0]
  - - [1024, 8064, 1, 4096, 1024, 1024, 1024, 4096]
    - [62, 81745.0]
  - - [64, 14, 10880, 14, 64, 64, 696320, 14]
    - [12, 1367.0]
  - - [1024, 19712, 1, 256, 1024, 1024, 1024, 256]
    - [87, 56216.0]
  - - [64, 31, 2048, 30, 64, 64, 131072, 30]
    - [12, 3887.0]
  - - [1024, 32, 1, 2, 1024, 1024, 1024, 2]
    - [7, 12.0]
  - - [1024, 9984, 1, 256, 1024, 1024, 1024, 256]
    - [38, 51602.0]
  - - [2048, 512, 1, 2048, 2048, 2048, 2048, 2048]
    - [38, 42950.0]
  - - [1024, 16128, 1, 256, 1024, 1024, 1024, 256]
    - [74, 55513.0]
  - - [256, 8976, 1, 20480, 256, 256, 256, 20480]
    - [49, 72391.0]
  - - [256, 8976, 1, 15104, 256, 256, 256, 15104]
    - [27, 71085.0]
  - - [1024, 9600, 1, 1024, 1024, 1024, 1024, 1024]
    - [105, 79538.0]
  - - [1024, 10080, 1, 42720, 1024, 1024, 1024, 42720]
    - [99, 110861.0]
  - - [4096, 7200, 1, 1024, 4096, 4096, 4096, 1024]
    - [81, 85812.0]
  - - [2048, 512, 1, 1, 2048, 2048, 2048, 1]
    - [17, 117.0]
  - - [512, 1600, 1, 512, 512, 512, 512, 512]
    - [100, 28807.0]
  - - [1024, 385, 1, 1024, 1024, 1024, 1024, 1024]
    - [9, 22834.0]
  - - [1024, 960, 1, 1024, 1024, 1024, 1024, 1024]
    - [134, 40721.0]
  - - [256, 8976, 1, 8192, 256, 256, 256, 8192]
    - [57, 68962.0]
  - - [4096, 2048, 1, 1024, 4096, 4096, 4096, 1024]
    - [68, 69951.0]
  - - [64, 4, 32768, 4, 64, 64, 2097152, 4]
    - [3, 139.0]
  - - [1024, 2048, 1, 1024, 1024, 1024, 1024, 1024]
    - [88, 46362.0]
  - - [64, 128, 656, 128, 64, 64, 64, 128]
    - [20, 21074.0]
  - - [64, 512, 128, 512, 64, 64, 64, 512]
    - [61, 33851.0]
  - - [1024, 4992, 1, 1024, 1024, 1024, 1024, 1024]
    - [21, 63711.0]
  - - [1024, 1152, 1, 2, 1024, 1024, 1024, 2]
    - [17, 259.0]
  - - [256, 8976, 1, 10496, 256, 256, 256, 10496]
    - [27, 69981.0]
  - - [1024, 5248, 1, 4096, 1024, 1024, 1024, 4096]
    - [105, 78816.0]
  - - [1024, 17152, 1, 256, 1024, 1024, 1024, 256]
    - [30, 54779.0]
  - - [1024, 9600, 1, 33712, 1024, 1024, 1024, 33712]
    - [18, 103594.0]
  - - [1024, 3072, 1, 4096, 1024, 1024, 1024, 4096]
    - [18, 87249.0]
  - - [64, 17, 6144, 21, 64, 64, 393216, 21]
    - [12, 2067.0]
  - - [1024, 9216, 1, 4096, 1024, 1024, 1024, 4096]
    - [62, 92511.0]
  - - [1024, 32768, 1, 512, 1024, 1024, 1024, 512]
    - [105, 79389.0]
  - - [1024, 7200, 1, 1024, 1024, 1024, 1024, 1024]
    - [133, 72040.0]
  - - [4096, 3840, 1, 4096, 4192, 4192, 4192, 4192]
    - [31, 118847.0]
  - - [1024, 6, 1, 1024, 1024, 1024, 1024, 1024]
    - [34, 488.0]
  - - [256, 8976, 1, 19712, 256, 256, 256, 19712]
    - [41, 71925.0]
  - - [1024, 5120, 1, 1024, 1024, 1024, 1024, 1024]
    - [101, 63013.0]
  - - [1024, 8192, 1, 33712, 1024, 1024, 1024, 33712]
    - [14, 89100.0]
  - - [1024, 308, 1, 1024, 1024, 1024, 1024, 1024]
    - [138, 19133.0]
  - - [3840, 4096, 1, 4096, 4192, 4192, 4192, 4192]
    - [70, 119057.0]
  - - [1024, 2560, 1, 2, 1024, 1024, 1024, 2]
    - [61, 410.0]
  - - [1024, 6, 1, 2, 1024, 1024, 1024, 2]
    - [1, 2.0]
  - - [64, 128, 160, 128, 64, 64, 64, 128]
    - [15, 16009.0]
  - - [4096, 8064, 1, 1024, 4096, 4096, 4096, 1024]
    - [82, 90843.0]
  - - [256, 8976, 1, 6656, 256, 256, 256, 6656]
    - [57, 67484.0]
  - - [64, 15, 10880, 15, 64, 64, 696320, 15]
    - [12, 1560.0]
  - - [1024, 960, 1, 64, 1024, 1024, 1024, 64]
    - [103, 9362.0]
  - - [1024, 7104, 1, 4096, 1024, 1024, 1024, 4096]
    - [116, 98403.0]
  - - [1024, 512, 1, 4096, 1024, 1024, 1024, 4096]
    - [22, 33181.0]
  - - [1024, 8960, 1, 256, 1024, 1024, 1024, 256]
    - [74, 51509.0]
  - - [1024, 3968, 1, 4096, 1024, 1024, 1024, 4096]
    - [101, 61151.0]
  - - [1024, 10080, 1, 4096, 1024, 1024, 1024, 4096]
    - [116, 96122.0]
  - - [1024, 7424, 1, 256, 1024, 1024, 1024, 256]
    - [87, 49953.0]
  - - [32, 200, 1, 1, 32, 32, 32, 1]
    - [0, 1.0]
  - - [257, 1024, 1, 4096, 257, 257, 257, 4096]
    - [33, 20730.0]
  - - [1024, 4096, 1, 4096, 1024, 1024, 1024, 4096]
    - [62, 61745.0]
  - - [64, 512, 1, 512, 64, 64, 64, 512]
    - [36, 1942.0]
  - - [64, 128, 128, 128, 64, 64, 64, 128]
    - [15, 12906.0]
  - - [64, 35, 4608, 32, 64, 64, 294912, 32]
    - [8, 6303.0]
  - - [4096, 10064, 1, 1024, 4096, 4096, 4096, 1024]
    - [126, 89461.0]
  - - [64, 14, 10880, 15, 64, 64, 696320, 15]
    - [12, 1455.0]
  - - [256, 8976, 1, 8960, 256, 256, 256, 8960]
    - [27, 69127.0]
  - - [1024, 5248, 1, 1024, 1024, 1024, 1024, 1024]
    - [105, 63574.0]
  - - [1024, 820, 1, 30522, 1024, 1024, 1024, 30522]
    - [98, 49188.0]
  - - [1024, 1280, 1, 2, 1024, 1024, 1024, 2]
    - [104, 285.0]
  - - [1024, 11264, 1, 256, 1024, 1024, 1024, 256]
    - [133, 52955.0]
  - - [4096, 10200, 1, 1024, 4096, 4096, 4096, 1024]
    - [81, 90410.0]
  - - [64, 24, 4736, 34, 64, 64, 303104, 34]
    - [12, 3803.0]
  - - [64, 15, 7680, 15, 64, 64, 491520, 15]
    - [12, 1488.0]
  - - [1024, 7200, 1, 4096, 1024, 1024, 1024, 4096]
    - [105, 96347.0]
  - - [1024, 1280, 1, 1024, 1024, 1024, 1024, 1024]
    - [17, 46864.0]
  - - [1024, 6400, 1, 256, 1024, 1024, 1024, 256]
    - [38, 48100.0]
  - - [64, 9, 512, 9, 64, 64, 64, 9]
    - [1, 253.0]
  - - [1024, 10240, 1, 256, 1024, 1024, 1024, 256]
    - [20, 52759.0]
  - - [1920, 2048, 1, 2048, 2080, 2080, 2080, 2080]
    - [133, 101475.0]
  - - [1024, 32, 1, 1024, 1024, 1024, 1024, 1024]
    - [128, 2975.0]
  - - [560, 200, 1, 1024, 560, 560, 560, 1024]
    - [42, 8099.0]
  - - [1024, 3968, 1, 1024, 1024, 1024, 1024, 1024]
    - [21, 57279.0]
  - - [1024, 3072, 1, 1024, 1024, 1024, 1024, 1024]
    - [62, 65154.0]
  - - [256, 8976, 1, 10240, 256, 256, 256, 10240]
    - [57, 70030.0]
  - - [256, 8976, 1, 17152, 256, 256, 256, 17152]
    - [27, 71576.0]
  - - [1024, 9520, 1, 42720, 1024, 1024, 1024, 42720]
    - [99, 104962.0]
  - - [1024, 19968, 1, 256, 1024, 1024, 1024, 256]
    - [87, 56504.0]
  - - [1024, 3840, 1, 256, 1024, 1024, 1024, 256]
    - [39, 44306.0]
  - - [64, 21, 6144, 21, 64, 64, 393216, 21]
    - [12, 2526.0]
  - - [1024, 7168, 1, 256, 1024, 1024, 1024, 256]
    - [30, 50188.0]
  - - [1024, 800, 1, 30522, 1024, 1024, 1024, 30522]
    - [97, 47035.0]
  - - [1024, 2048, 1, 2, 1024, 1024, 1024, 2]
    - [111, 332.0]
  - - [64, 128, 1, 128, 64, 64, 64, 128]
    - [24, 193.0]
  - - [256, 8976, 1, 14848, 256, 256, 256, 14848]
    - [49, 71593.0]
  - - [512, 1600, 1, 32, 512, 512, 512, 32]
    - [8, 4489.0]
  - - [64, 512, 80, 512, 64, 64, 64, 512]
    - [45, 32577.0]
  - - [480, 512, 1, 512, 544, 544, 544, 544]
    - [94, 13329.0]
  - - [512, 480, 1, 512, 544, 544, 544, 544]
    - [112, 13107.0]
  - - [1024, 8160, 1, 4096, 1024, 1024, 1024, 4096]
    - [139, 79270.0]
  - - [1024, 13568, 1, 256, 1024, 1024, 1024, 256]
    - [46, 53630.0]
  - - [1024, 4, 1, 2, 1024, 1024, 1024, 2]
    - [0, 1.0]
  - - [64, 17, 7680, 17, 64, 64, 491520, 17]
    - [12, 1779.0]
  - - [1024, 6528, 1, 42720, 1024, 1024, 1024, 42720]
    - [99, 107798.0]
  - - [1024, 8704, 1, 256, 1024, 1024, 1024, 256]
    - [30, 51763.0]
  - - [64, 512, 1, 1, 64, 64, 64, 1]
    - [2, 6.0]
  - - [1024, 4, 1, 1024, 1024, 1024, 1024, 1024]
    - [71, 326.0]
  - - [4096, 4992, 1, 1024, 4096, 4096, 4096, 1024]
    - [66, 88152.0]
  - - [479, 32768, 1, 1024, 479, 479, 479, 1024]
    - [139, 70296.0]
  - - [64, 128, 512, 128, 64, 64, 64, 128]
    - [29, 19340.0]
  - - [1024, 1152, 1, 4096, 1024, 1024, 1024, 4096]
    - [95, 47859.0]
  - - [1024, 3968, 1, 42720, 1024, 1024, 1024, 42720]
    - [59, 66200.0]
  - - [1024, 5120, 1, 2, 1024, 1024, 1024, 2]
    - [17, 588.0]
- null
