TRAIN_3.7/build/_3_LibraryLogic/arcturus_Cijk_Alik_Bljk_HBH.yaml
- {MinimumRequiredVersion: 4.20.0}
- arcturus
- gfx908
- [Device 7380, Device 7388, Device 738c, Device 7390]
- - - [33536, 8976, 1, 256, 33536, 33536, 256, 256]
    - [82, 66395.0]
  - - [5, 5, 960, 64, 5, 5, 64, 64]
    - [0, 190.0]
  - - [256, 44505, 1, 1024, 256, 256, 1024, 1024]
    - [104, 79822.0]
  - - [1024, 10, 1, 1024, 1024, 1024, 1024, 1024]
    - [58, 1083.0]
  - - [256, 14592, 1, 1024, 256, 256, 1024, 1024]
    - [38, 77875.0]
  - - [2048, 2048, 1, 2048, 2080, 2080, 2080, 2080]
    - [18, 76423.0]
  - - [1024, 10080, 1, 1024, 1024, 1024, 1024, 1024]
    - [117, 74983.0]
  - - [2, 32, 1, 1024, 2, 2, 1024, 1024]
    - [25, 6.0]
  - - [1024, 32768, 1, 479, 1024, 1024, 479, 479]
    - [56, 56182.0]
  - - [18944, 8976, 1, 256, 18944, 18944, 256, 256]
    - [82, 65259.0]
  - - [1024, 9216, 1, 1024, 1024, 1024, 1024, 1024]
    - [117, 81951.0]
  - - [256, 16128, 1, 1024, 256, 256, 1024, 1024]
    - [117, 61309.0]
  - - [1024, 4992, 1, 4096, 1024, 1024, 4096, 4096]
    - [101, 88600.0]
  - - [5632, 8976, 1, 256, 5632, 5632, 256, 256]
    - [116, 59321.0]
  - - [1024, 5, 1, 1024, 1024, 1024, 1024, 1024]
    - [92, 508.0]
  - - [256, 14848, 1, 1024, 256, 256, 1024, 1024]
    - [61, 78856.0]
  - - [256, 14336, 1, 1024, 256, 256, 1024, 1024]
    - [32, 76759.0]
  - - [2, 5, 1, 1024, 2, 2, 1024, 1024]
    - [0, 1.0]
  - - [8192, 7680, 1, 8192, 8384, 8384, 8384, 8384]
    - [54, 125740.0]
  - - [64, 960, 1, 1024, 64, 64, 1024, 1024]
    - [93, 6342.0]
  - - [2, 40, 1, 1024, 2, 2, 1024, 1024]
    - [25, 8.0]
  - - [11264, 8976, 1, 256, 11264, 11264, 256, 256]
    - [91, 63864.0]
  - - [1024, 1024, 1, 1024, 1056, 1056, 1056, 1056]
    - [48, 45965.0]
  - - [42720, 6528, 1, 1024, 42720, 42720, 1024, 1024]
    - [82, 99760.0]
  - - [30, 31, 2048, 64, 30, 30, 131072, 131072]
    - [79, 5461.0]
  - - [2048, 215, 1, 768, 2048, 2048, 768, 768]
    - [119, 21242.0]
  - - [15, 14, 10880, 64, 15, 15, 696320, 696320]
    - [6, 3317.0]
  - - [64, 512, 1, 512, 64, 64, 512, 512]
    - [93, 2621.0]
  - - [1024, 4096, 1, 1024, 1024, 1024, 1024, 1024]
    - [117, 63013.0]
  - - [18176, 8976, 1, 256, 18176, 18176, 256, 256]
    - [82, 64773.0]
  - - [128, 128, 128, 64, 128, 128, 64, 64]
    - [1, 11899.0]
  - - [1024, 200, 1, 560, 1024, 1024, 560, 560]
    - [111, 9370.0]
  - - [512, 512, 1, 512, 544, 544, 544, 544]
    - [28, 14589.0]
  - - [42720, 3968, 1, 1024, 42720, 42720, 1024, 1024]
    - [52, 97631.0]
  - - [2, 4, 1, 1024, 2, 2, 1024, 1024]
    - [0, 1.0]
  - - [64, 128, 1, 128, 64, 64, 128, 128]
    - [26, 218.0]
  - - [1024, 2560, 1, 4096, 1024, 1024, 4096, 4096]
    - [59, 72629.0]
  - - [30522, 462, 1, 1024, 30522, 30522, 1024, 1024]
    - [65, 72401.0]
  - - [1024, 820, 1, 1024, 1024, 1024, 1024, 1024]
    - [99, 41984.0]
  - - [34, 34, 4736, 64, 34, 34, 303104, 303104]
    - [10, 5177.0]
  - - [19712, 8976, 1, 256, 19712, 19712, 256, 256]
    - [82, 65252.0]
  - - [1024, 10064, 1, 1024, 1024, 1024, 1024, 1024]
    - [104, 74822.0]
  - - [4096, 5248, 1, 1024, 4096, 4096, 1024, 1024]
    - [52, 89449.0]
  - - [256, 21504, 1, 1024, 256, 256, 1024, 1024]
    - [117, 79085.0]
  - - [4096, 3840, 1, 4096, 4192, 4192, 4192, 4192]
    - [50, 121960.0]
  - - [2048, 512, 1, 100, 2048, 2048, 100, 100]
    - [22, 9362.0]
  - - [1024, 39, 1, 1024, 1024, 1024, 1024, 1024]
    - [73, 3994.0]
  - - [256, 31488, 1, 1024, 256, 256, 1024, 1024]
    - [107, 73805.0]
  - - [256, 8960, 1, 1024, 256, 256, 1024, 1024]
    - [99, 53382.0]
  - - [256, 13312, 1, 1024, 256, 256, 1024, 1024]
    - [46, 71276.0]
  - - [128, 128, 160, 64, 128, 128, 64, 64]
    - [16, 13618.0]
  - - [11776, 8976, 1, 256, 11776, 11776, 256, 256]
    - [116, 63425.0]
  - - [7168, 8976, 1, 256, 7168, 7168, 256, 256]
    - [116, 62333.0]
  - - [4096, 1280, 1, 1024, 4096, 4096, 1024, 1024]
    - [77, 76608.0]
  - - [15, 15, 10880, 64, 15, 15, 696320, 696320]
    - [3, 3529.0]
  - - [1024, 2048, 1, 4096, 1024, 1024, 4096, 4096]
    - [51, 58642.0]
  - - [64, 512, 1, 1024, 64, 64, 1024, 1024]
    - [26, 3745.0]
  - - [32, 32, 4608, 64, 32, 32, 294912, 294912]
    - [19, 7848.0]
  - - [1024, 2560, 1, 1024, 1024, 1024, 1024, 1024]
    - [67, 57163.0]
  - - [21248, 8976, 1, 256, 21248, 21248, 256, 256]
    - [82, 65274.0]
  - - [256, 2304, 1, 1024, 256, 256, 1024, 1024]
    - [99, 35781.0]
  - - [1024, 7200, 1, 1024, 1024, 1024, 1024, 1024]
    - [117, 74898.0]
  - - [1024, 800, 1, 1024, 1024, 1024, 1024, 1024]
    - [99, 41446.0]
  - - [3840, 8976, 1, 256, 3840, 3840, 256, 256]
    - [34, 58982.0]
  - - [1024, 3840, 1, 1024, 1024, 1024, 1024, 1024]
    - [61, 84167.0]
  - - [1024, 8, 1, 1024, 1024, 1024, 1024, 1024]
    - [26, 881.0]
  - - [30522, 160, 1, 1024, 30522, 30522, 1024, 1024]
    - [125, 50779.0]
  - - [2, 1024, 1, 1024, 2, 2, 1024, 1024]
    - [64, 202.0]
  - - [2048, 512, 1, 2048, 2048, 2048, 2048, 2048]
    - [40, 48895.0]
  - - [32, 1600, 1, 512, 32, 32, 512, 512]
    - [26, 3810.0]
  - - [30522, 308, 1, 1024, 30522, 30522, 1024, 1024]
    - [107, 66481.0]
  - - [2560, 8976, 1, 256, 2560, 2560, 256, 256]
    - [45, 56432.0]
  - - [30528, 4096, 1, 1024, 30528, 30528, 1024, 1024]
    - [81, 99685.0]
  - - [256, 9984, 1, 1024, 256, 256, 1024, 1024]
    - [100, 56897.0]
  - - [32, 35, 4608, 64, 32, 32, 294912, 294912]
    - [9, 6692.0]
  - - [15104, 8976, 1, 256, 15104, 15104, 256, 256]
    - [82, 64703.0]
  - - [17, 17, 6144, 64, 17, 17, 393216, 393216]
    - [6, 2917.0]
  - - [4096, 2560, 1, 1024, 4096, 4096, 1024, 1024]
    - [52, 83004.0]
  - - [3072, 8976, 1, 256, 3072, 3072, 256, 256]
    - [45, 58281.0]
  - - [512, 32768, 1, 13, 512, 512, 13, 13]
    - [70, 4597.0]
  - - [2048, 215, 1, 512, 2048, 2048, 512, 512]
    - [78, 17613.0]
  - - [1024, 9520, 1, 4096, 1024, 1024, 4096, 4096]
    - [13, 90865.0]
  - - [4096, 4096, 1, 4096, 4192, 4192, 4192, 4192]
    - [107, 109426.0]
  - - [4096, 8192, 1, 1024, 4096, 4096, 1024, 1024]
    - [52, 94623.0]
  - - [4096, 3840, 1, 1024, 4096, 4096, 1024, 1024]
    - [61, 93336.0]
  - - [2304, 8976, 1, 256, 2304, 2304, 256, 256]
    - [45, 56611.0]
  - - [33, 33, 1, 32, 33, 33, 32, 32]
    - [0, 8.0]
  - - [12544, 8976, 1, 256, 12544, 12544, 256, 256]
    - [103, 63918.0]
  - - [1024, 1600, 1, 1024, 1024, 1024, 1024, 1024]
    - [125, 51910.0]
  - - [15360, 8976, 1, 256, 15360, 15360, 256, 256]
    - [116, 64445.0]
  - - [1024, 5120, 1, 1024, 1024, 1024, 1024, 1024]
    - [117, 75403.0]
  - - [1024, 9, 1, 1024, 1024, 1024, 1024, 1024]
    - [93, 983.0]
  - - [256, 2560, 1, 1024, 256, 256, 1024, 1024]
    - [99, 39383.0]
  - - [1024, 780, 1, 1024, 1024, 1024, 1024, 1024]
    - [99, 40570.0]
  - - [2816, 8976, 1, 256, 2816, 2816, 256, 256]
    - [45, 57487.0]
  - - [16128, 8976, 1, 256, 16128, 16128, 256, 256]
    - [103, 64717.0]
  - - [256, 4864, 1, 1024, 256, 256, 1024, 1024]
    - [65, 49807.0]
  - - [512, 512, 64, 64, 512, 512, 64, 64]
    - [86, 28436.0]
  - - [512, 512, 80, 64, 512, 512, 64, 64]
    - [11, 29382.0]
  - - [4096, 3072, 1, 1024, 4096, 4096, 1024, 1024]
    - [117, 84591.0]
  - - [480, 512, 1, 512, 544, 544, 544, 544]
    - [31, 14564.0]
  - - [256, 6144, 1, 1024, 256, 256, 1024, 1024]
    - [104, 61380.0]
  - - [1024, 3072, 1, 4096, 1024, 1024, 4096, 4096]
    - [81, 86499.0]
  - - [20480, 8976, 1, 256, 20480, 20480, 256, 256]
    - [116, 65903.0]
  - - [4096, 1024, 1, 1024, 4096, 4096, 1024, 1024]
    - [40, 62792.0]
  - - [1024, 1152, 1, 1024, 1024, 1024, 1024, 1024]
    - [37, 47186.0]
  - - [128, 128, 656, 64, 128, 128, 64, 64]
    - [80, 20719.0]
  - - [1024, 1024, 1, 4096, 1024, 1024, 4096, 4096]
    - [124, 53741.0]
  - - [256, 7936, 1, 1024, 256, 256, 1024, 1024]
    - [29, 49251.0]
  - - [684, 8976, 1, 256, 684, 684, 256, 256]
    - [87, 43659.0]
  - - [3, 3, 512, 64, 3, 3, 64, 64]
    - [30, 49.0]
  - - [27, 27, 32768, 128, 27, 27, 128, 128]
    - [118, 10803.0]
  - - [2048, 684, 1, 768, 2048, 2048, 768, 768]
    - [122, 43662.0]
  - - [1024, 960, 1, 1024, 1056, 1056, 1056, 1056]
    - [88, 51359.0]
  - - [30522, 820, 1, 1024, 30522, 30522, 1024, 1024]
    - [89, 82122.0]
  - - [2, 10, 1, 1024, 2, 2, 1024, 1024]
    - [2, 2.0]
  - - [8960, 8976, 1, 256, 8960, 8960, 256, 256]
    - [103, 63094.0]
  - - [1024, 7104, 1, 4096, 1024, 1024, 4096, 4096]
    - [51, 97348.0]
  - - [21, 17, 6144, 64, 21, 21, 393216, 393216]
    - [6, 3280.0]
  - - [8192, 8192, 1, 8192, 8384, 8384, 8384, 8384]
    - [53, 119843.0]
  - - [1024, 32768, 1, 480, 1024, 1024, 480, 480]
    - [56, 88262.0]
  - - [1024, 180, 1, 1024, 1024, 1024, 1024, 1024]
    - [108, 15420.0]
  - - [128, 128, 624, 64, 128, 128, 64, 64]
    - [12, 20346.0]
  - - [5, 5, 512, 64, 5, 5, 64, 64]
    - [44, 140.0]
  - - [1024, 1600, 1, 560, 1024, 1024, 560, 560]
    - [22, 33831.0]
  - - [1024, 4096, 1, 4096, 1024, 1024, 4096, 4096]
    - [69, 75034.0]
  - - [256, 8448, 1, 1024, 256, 256, 1024, 1024]
    - [99, 51646.0]
  - - [1024, 3840, 1, 4096, 1024, 1024, 4096, 4096]
    - [82, 106241.0]
  - - [34, 24, 4736, 64, 34, 34, 303104, 303104]
    - [20, 6271.0]
  - - [256, 11264, 1, 1024, 256, 256, 1024, 1024]
    - [35, 61722.0]
  - - [2048, 512, 1, 67, 2048, 2048, 67, 67]
    - [84, 6603.0]
  - - [256, 10496, 1, 1024, 256, 256, 1024, 1024]
    - [100, 58792.0]
  - - [4096, 2048, 1, 1024, 4096, 4096, 1024, 1024]
    - [104, 77248.0]
  - - [256, 22016, 1, 1024, 256, 256, 1024, 1024]
    - [71, 80247.0]
  - - [30, 30, 2048, 64, 30, 30, 131072, 131072]
    - [15, 5323.0]
  - - [1024, 960, 1, 1600, 1024, 1024, 1600, 1600]
    - [88, 52151.0]
  - - [2048, 1536, 1, 512, 2048, 2048, 512, 512]
    - [35, 53687.0]
  - - [1024, 7200, 1, 4096, 1024, 1024, 4096, 4096]
    - [51, 98819.0]
  - - [42720, 10080, 1, 1024, 42720, 42720, 1024, 1024]
    - [82, 99877.0]
  - - [9984, 8976, 1, 256, 9984, 9984, 256, 256]
    - [90, 62491.0]
  - - [4096, 10200, 1, 1024, 4096, 4096, 1024, 1024]
    - [52, 92955.0]
  - - [1024, 1024, 1, 1024, 1024, 1024, 1024, 1024]
    - [106, 42881.0]
  - - [1024, 10200, 1, 4096, 1024, 1024, 4096, 4096]
    - [81, 96512.0]
  - - [256, 33536, 1, 1024, 256, 256, 1024, 1024]
    - [117, 77771.0]
  - - [21, 21, 6144, 64, 21, 21, 393216, 393216]
    - [15, 3680.0]
  - - [4608, 8976, 1, 256, 4608, 4608, 256, 256]
    - [103, 59863.0]
  - - [1024, 8160, 1, 4096, 1024, 1024, 4096, 4096]
    - [101, 87560.0]
  - - [1024, 160, 1, 1024, 1024, 1024, 1024, 1024]
    - [97, 14463.0]
  - - [256, 19200, 1, 1024, 256, 256, 1024, 1024]
    - [117, 71738.0]
  - - [4096, 5120, 1, 1024, 4096, 4096, 1024, 1024]
    - [77, 89270.0]
  - - [256, 7424, 1, 1024, 256, 256, 1024, 1024]
    - [104, 72402.0]
  - - [4, 4, 38400, 64, 4, 4, 2457600, 2457600]
    - [0, 303.0]
  - - [2048, 114, 1, 512, 2048, 2048, 512, 512]
    - [62, 11151.0]
  - - [256, 11520, 1, 1024, 256, 256, 1024, 1024]
    - [102, 62810.0]
  - - [2048, 1920, 1, 2048, 2080, 2080, 2080, 2080]
    - [23, 105961.0]
  - - [2, 39, 1, 1024, 2, 2, 1024, 1024]
    - [25, 8.0]
  - - [1024, 462, 1, 1024, 1024, 1024, 1024, 1024]
    - [47, 24920.0]
  - - [2, 9, 1, 1024, 2, 2, 1024, 1024]
    - [25, 2.0]
  - - [13312, 8976, 1, 256, 13312, 13312, 256, 256]
    - [82, 64425.0]
  - - [35, 35, 4608, 64, 35, 35, 294912, 294912]
    - [10, 4799.0]
  - - [30522, 180, 1, 1024, 30522, 30522, 1024, 1024]
    - [100, 55329.0]
  - - [33712, 8192, 1, 1024, 33712, 33712, 1024, 1024]
    - [74, 100656.0]
  - - [2048, 1536, 1, 768, 2048, 2048, 768, 768]
    - [76, 63577.0]
  - - [4096, 4096, 1, 1024, 4096, 4096, 1024, 1024]
    - [117, 87402.0]
  - - [2048, 512, 1, 74, 2048, 2048, 74, 74]
    - [16, 7080.0]
  - - [1024, 77, 1, 1024, 1024, 1024, 1024, 1024]
    - [96, 7158.0]
  - - [256, 1280, 1, 1024, 256, 256, 1024, 1024]
    - [98, 26887.0]
  - - [8192, 8976, 1, 256, 8192, 8192, 256, 256]
    - [52, 60426.0]
  - - [960, 1024, 1, 1024, 1056, 1056, 1056, 1056]
    - [36, 50131.0]
  - - [2048, 8976, 1, 256, 2048, 2048, 256, 256]
    - [34, 55235.0]
  - - [20992, 8976, 1, 256, 20992, 20992, 256, 256]
    - [103, 65589.0]
  - - [256, 7168, 1, 1024, 256, 256, 1024, 1024]
    - [117, 71176.0]
  - - [5, 5, 1, 64, 5, 5, 64, 64]
    - [5, 0.31]
  - - [28672, 8976, 1, 256, 28672, 28672, 256, 256]
    - [82, 66250.0]
  - - [8448, 8976, 1, 256, 8448, 8448, 256, 256]
    - [91, 62379.0]
  - - [1024, 40, 1, 1024, 1024, 1024, 1024, 1024]
    - [26, 4128.0]
  - - [2, 8, 1, 1024, 2, 2, 1024, 1024]
    - [25, 2.0]
  - - [24, 24, 4736, 64, 24, 24, 303104, 303104]
    - [55, 5898.0]
  - - [512, 512, 96, 64, 512, 512, 64, 64]
    - [21, 30229.0]
  - - [1024, 8064, 1, 1024, 1024, 1024, 1024, 1024]
    - [104, 76647.0]
  - - [13824, 8976, 1, 256, 13824, 13824, 256, 256]
    - [116, 64407.0]
  - - [1024, 9520, 1, 1024, 1024, 1024, 1024, 1024]
    - [117, 81132.0]
  - - [256, 6656, 1, 1024, 256, 256, 1024, 1024]
    - [63, 66495.0]
  - - [1024, 1152, 1, 4096, 1024, 1024, 4096, 4096]
    - [89, 60038.0]
  - - [256, 3328, 1, 1024, 256, 256, 1024, 1024]
    - [99, 45250.0]
  - - [4352, 8976, 1, 256, 4352, 4352, 256, 256]
    - [34, 59159.0]
  - - [30522, 385, 1, 1024, 30522, 30522, 1024, 1024]
    - [120, 63145.0]
  - - [256, 1536, 1, 1024, 256, 256, 1024, 1024]
    - [95, 28276.0]
  - - [17, 17, 7680, 64, 17, 17, 491520, 491520]
    - [6, 3920.0]
  - - [5376, 8976, 1, 256, 5376, 5376, 256, 256]
    - [103, 60037.0]
  - - [1024, 7104, 1, 1024, 1024, 1024, 1024, 1024]
    - [104, 74431.0]
  - - [1024, 8160, 1, 1024, 1024, 1024, 1024, 1024]
    - [104, 70878.0]
  - - [9472, 8976, 1, 256, 9472, 9472, 256, 256]
    - [116, 63256.0]
  - - [256, 23552, 1, 1024, 256, 256, 1024, 1024]
    - [107, 68539.0]
  - - [13568, 8976, 1, 256, 13568, 13568, 256, 256]
    - [82, 64066.0]
  - - [1024, 200, 1, 1024, 1024, 1024, 1024, 1024]
    - [97, 16282.0]
  - - [1024, 5120, 1, 4096, 1024, 1024, 4096, 4096]
    - [101, 89359.0]
  - - [30522, 616, 1, 1024, 30522, 30522, 1024, 1024]
    - [124, 81746.0]
  - - [1024, 41, 1, 1024, 1024, 1024, 1024, 1024]
    - [105, 4265.0]
  - - [4096, 8064, 1, 1024, 4096, 4096, 1024, 1024]
    - [52, 93043.0]
  - - [1024, 10200, 1, 1024, 1024, 1024, 1024, 1024]
    - [117, 76266.0]
  - - [128, 128, 1, 64, 128, 128, 64, 64]
    - [2, 230.0]
  - - [256, 684, 1, 1024, 256, 256, 1024, 1024]
    - [94, 14843.0]
  - - [1024, 5248, 1, 4096, 1024, 1024, 4096, 4096]
    - [85, 89507.0]
  - - [4, 4, 32768, 64, 4, 4, 2097152, 2097152]
    - [0, 298.0]
  - - [1280, 8976, 1, 256, 1280, 1280, 256, 256]
    - [87, 52522.0]
  - - [2048, 256, 1, 512, 2048, 2048, 512, 512]
    - [43, 21509.0]
  - - [4864, 8976, 1, 256, 4864, 4864, 256, 256]
    - [103, 58924.0]
  - - [256, 20992, 1, 1024, 256, 256, 1024, 1024]
    - [117, 77550.0]
  - - [256, 18944, 1, 1024, 256, 256, 1024, 1024]
    - [117, 71269.0]
  - - [1024, 6528, 1, 1024, 1024, 1024, 1024, 1024]
    - [104, 75989.0]
  - - [1024, 6528, 1, 4096, 1024, 1024, 4096, 4096]
    - [14, 95548.0]
  - - [9728, 8976, 1, 256, 9728, 9728, 256, 256]
    - [116, 63678.0]
  - - [256, 12544, 1, 1024, 256, 256, 1024, 1024]
    - [104, 67941.0]
  - - [42720, 7200, 1, 1024, 42720, 42720, 1024, 1024]
    - [82, 98785.0]
  - - [9, 9, 512, 64, 9, 9, 64, 64]
    - [3, 454.0]
  - - [128, 128, 640, 64, 128, 128, 64, 64]
    - [12, 20662.0]
  - - [7680, 8192, 1, 8192, 8384, 8384, 8384, 8384]
    - [54, 125876.0]
  - - [4096, 9520, 1, 1024, 4096, 4096, 1024, 1024]
    - [75, 92447.0]
  - - [4096, 8160, 1, 1024, 4096, 4096, 1024, 1024]
    - [52, 89577.0]
  - - [4096, 9216, 1, 1024, 4096, 4096, 1024, 1024]
    - [52, 95927.0]
  - - [19968, 8976, 1, 256, 19968, 19968, 256, 256]
    - [116, 65302.0]
  - - [1024, 1280, 1, 4096, 1024, 1024, 4096, 4096]
    - [124, 65345.0]
  - - [1024, 5248, 1, 1024, 1024, 1024, 1024, 1024]
    - [104, 77637.0]
  - - [6400, 8976, 1, 256, 6400, 6400, 256, 256]
    - [103, 61812.0]
  - - [33, 33, 1600, 32, 33, 33, 32, 32]
    - [33, 2544.0]
  - - [5888, 8976, 1, 256, 5888, 5888, 256, 256]
    - [103, 60379.0]
  - - [256, 23296, 1, 1024, 256, 256, 1024, 1024]
    - [124, 67734.0]
  - - [512, 32768, 1, 1024, 512, 512, 1024, 1024]
    - [117, 87509.0]
  - - [512, 512, 128, 64, 512, 512, 64, 64]
    - [49, 30713.0]
  - - [512, 512, 16, 64, 512, 512, 64, 64]
    - [83, 18538.0]
  - - [1024, 9600, 1, 1024, 1024, 1024, 1024, 1024]
    - [89, 83056.0]
  - - [2, 6, 1, 1024, 2, 2, 1024, 1024]
    - [0, 1.0]
  - - [4096, 7200, 1, 1024, 4096, 4096, 1024, 1024]
    - [112, 88758.0]
  - - [2, 2048, 1, 1024, 2, 2, 1024, 1024]
    - [72, 400.0]
  - - [2048, 960, 1, 74, 2048, 2048, 74, 74]
    - [17, 12124.0]
  - - [512, 1600, 1, 512, 512, 512, 512, 512]
    - [100, 31969.0]
  - - [1024, 385, 1, 1024, 1024, 1024, 1024, 1024]
    - [98, 27277.0]
  - - [1024, 960, 1, 1024, 1024, 1024, 1024, 1024]
    - [121, 46091.0]
  - - [3328, 8976, 1, 256, 3328, 3328, 256, 256]
    - [45, 59116.0]
  - - [256, 18176, 1, 1024, 256, 256, 1024, 1024]
    - [117, 68459.0]
  - - [1024, 2048, 1, 1024, 1024, 1024, 1024, 1024]
    - [42, 50648.0]
  - - [64, 128, 512, 128, 64, 64, 128, 128]
    - [86, 19284.0]
  - - [256, 8192, 1, 1024, 256, 256, 1024, 1024]
    - [29, 49895.0]
  - - [64, 512, 64, 512, 64, 64, 512, 512]
    - [98, 31581.0]
  - - [1024, 4992, 1, 1024, 1024, 1024, 1024, 1024]
    - [117, 74950.0]
  - - [33712, 9600, 1, 1024, 33712, 33712, 1024, 1024]
    - [60, 100269.0]
  - - [256, 3584, 1, 1024, 256, 256, 1024, 1024]
    - [99, 46055.0]
  - - [18688, 8976, 1, 256, 18688, 18688, 256, 256]
    - [116, 65757.0]
  - - [1024, 32768, 1, 1024, 1024, 1024, 1024, 1024]
    - [13, 94979.0]
  - - [4096, 7104, 1, 1024, 4096, 4096, 1024, 1024]
    - [82, 87781.0]
  - - [1024, 512, 1, 4096, 1024, 1024, 4096, 4096]
    - [110, 42745.0]
  - - [14, 14, 10880, 64, 14, 14, 696320, 696320]
    - [0, 3107.0]
  - - [1024, 9600, 1, 4096, 1024, 1024, 4096, 4096]
    - [52, 95307.0]
  - - [6144, 8976, 1, 256, 6144, 6144, 256, 256]
    - [116, 60874.0]
  - - [30528, 2048, 1, 1024, 30528, 30528, 1024, 1024]
    - [81, 97003.0]
  - - [1024, 6, 1, 1024, 1024, 1024, 1024, 1024]
    - [57, 614.0]
  - - [17, 15, 7680, 64, 17, 17, 491520, 491520]
    - [3, 3451.0]
  - - [23552, 8976, 1, 256, 23552, 23552, 256, 256]
    - [116, 66037.0]
  - - [1024, 308, 1, 1024, 1024, 1024, 1024, 1024]
    - [66, 21940.0]
  - - [3840, 4096, 1, 4096, 4192, 4192, 4192, 4192]
    - [50, 121887.0]
  - - [256, 15104, 1, 1024, 256, 256, 1024, 1024]
    - [38, 80739.0]
  - - [2, 41, 1, 1024, 2, 2, 1024, 1024]
    - [25, 8.0]
  - - [256, 5376, 1, 1024, 256, 256, 1024, 1024]
    - [117, 54203.0]
  - - [1024, 3968, 1, 1024, 1024, 1024, 1024, 1024]
    - [104, 60901.0]
  - - [512, 512, 1, 64, 512, 512, 64, 64]
    - [7, 3178.0]
  - - [1024, 8064, 1, 4096, 1024, 1024, 4096, 4096]
    - [120, 87769.0]
  - - [256, 2816, 1, 1024, 256, 256, 1024, 1024]
    - [100, 41565.0]
  - - [256, 5888, 1, 1024, 256, 256, 1024, 1024]
    - [63, 59733.0]
  - - [4096, 1152, 1, 1024, 4096, 4096, 1024, 1024]
    - [117, 69905.0]
  - - [7936, 8976, 1, 256, 7936, 7936, 256, 256]
    - [91, 61791.0]
  - - [2048, 960, 1, 2048, 2048, 2048, 2048, 2048]
    - [68, 57001.0]
  - - [5120, 8976, 1, 256, 5120, 5120, 256, 256]
    - [103, 60971.0]
  - - [1024, 512, 1, 1024, 1024, 1024, 1024, 1024]
    - [109, 31213.0]
  - - [4096, 6528, 1, 1024, 4096, 4096, 1024, 1024]
    - [52, 95176.0]
  - - [4096, 9600, 1, 1024, 4096, 4096, 1024, 1024]
    - [60, 96439.0]
  - - [4096, 10080, 1, 1024, 4096, 4096, 1024, 1024]
    - [52, 91846.0]
  - - [256, 11776, 1, 1024, 256, 256, 1024, 1024]
    - [32, 63781.0]
  - - [30522, 200, 1, 1024, 30522, 30522, 1024, 1024]
    - [63, 56012.0]
  - - [128, 32768, 1, 256, 128, 128, 256, 256]
    - [12, 36177.0]
  - - [4096, 4992, 1, 1024, 4096, 4096, 1024, 1024]
    - [117, 88600.0]
  - - [256, 22344, 1, 1024, 256, 256, 1024, 1024]
    - [117, 72925.0]
  - - [1024, 8192, 1, 1024, 1024, 1024, 1024, 1024]
    - [18, 77751.0]
  - - [128, 128, 512, 64, 128, 128, 64, 64]
    - [12, 19508.0]
  - - [4096, 3968, 1, 1024, 4096, 4096, 1024, 1024]
    - [117, 85191.0]
  - - [4096, 10064, 1, 1024, 4096, 4096, 1024, 1024]
    - [52, 91620.0]
  - - [2048, 684, 1, 512, 2048, 2048, 512, 512]
    - [115, 36894.0]
  - - [31, 31, 2048, 64, 31, 31, 131072, 131072]
    - [8, 5505.0]
  - - [30522, 780, 1, 1024, 30522, 30522, 1024, 1024]
    - [104, 79089.0]
  - - [17152, 8976, 1, 256, 17152, 17152, 256, 256]
    - [82, 65089.0]
  - - [4096, 512, 1, 1024, 4096, 4096, 1024, 1024]
    - [110, 50553.0]
  - - [4096, 8976, 1, 256, 4096, 4096, 256, 256]
    - [116, 58445.0]
  - - [1024, 1280, 1, 1024, 1024, 1024, 1024, 1024]
    - [117, 51622.0]
  - - [256, 21248, 1, 1024, 256, 256, 1024, 1024]
    - [104, 78851.0]
  - - [1920, 2048, 1, 2048, 2080, 2080, 2080, 2080]
    - [56, 104858.0]
  - - [1024, 32, 1, 1024, 1024, 1024, 1024, 1024]
    - [41, 3410.0]
  - - [2048, 256, 1, 768, 2048, 2048, 768, 768]
    - [68, 27206.0]
  - - [1024, 3072, 1, 1024, 1024, 1024, 1024, 1024]
    - [114, 68246.0]
  - - [1024, 9216, 1, 4096, 1024, 1024, 4096, 4096]
    - [13, 92193.0]
  - - [15872, 8976, 1, 256, 15872, 15872, 256, 256]
    - [91, 64712.0]
  - - [1024, 8192, 1, 4096, 1024, 1024, 4096, 4096]
    - [113, 88501.0]
  - - [256, 32768, 1, 512, 256, 256, 512, 512]
    - [24, 63989.0]
  - - [15, 15, 7680, 64, 15, 15, 491520, 491520]
    - [3, 3149.0]
  - - [1792, 8976, 1, 256, 1792, 1792, 256, 256]
    - [87, 55645.0]
  - - [1024, 512, 1, 1600, 1024, 1024, 1600, 1600]
    - [123, 37449.0]
  - - [256, 6400, 1, 1024, 256, 256, 1024, 1024]
    - [104, 63550.0]
  - - [10496, 8976, 1, 256, 10496, 10496, 256, 256]
    - [91, 63137.0]
  - - [128, 128, 144, 64, 128, 128, 64, 64]
    - [4, 13017.0]
  - - [1024, 10080, 1, 4096, 1024, 1024, 4096, 4096]
    - [51, 95532.0]
  - - [512, 480, 1, 512, 544, 544, 544, 544]
    - [27, 14170.0]
  - - [31488, 8976, 1, 256, 31488, 31488, 256, 256]
    - [82, 66051.0]
  - - [256, 20480, 1, 1024, 256, 256, 1024, 1024]
    - [117, 75573.0]
  - - [44505, 8976, 1, 256, 44505, 44505, 256, 256]
    - [103, 64308.0]
  - - [2048, 114, 1, 768, 2048, 2048, 768, 768]
    - [39, 14649.0]
  - - [30522, 800, 1, 1024, 30522, 30522, 1024, 1024]
    - [89, 80449.0]
  - - [256, 4608, 1, 1024, 256, 256, 1024, 1024]
    - [37, 46603.0]
  - - [1024, 4, 1, 1024, 1024, 1024, 1024, 1024]
    - [57, 413.0]
  - - [42720, 7104, 1, 1024, 42720, 42720, 1024, 1024]
    - [82, 99538.0]
  - - [1024, 3968, 1, 4096, 1024, 1024, 4096, 4096]
    - [63, 72715.0]
  - - [42720, 9520, 1, 1024, 42720, 42720, 1024, 1024]
    - [82, 99468.0]
  - - [1024, 10064, 1, 4096, 1024, 1024, 4096, 4096]
    - [13, 95518.0]
  - - [10240, 8976, 1, 256, 10240, 10240, 256, 256]
    - [91, 63746.0]
  - - [30522, 77, 1, 1024, 30522, 30522, 1024, 1024]
    - [91, 39272.0]
- null
