TRAIN_3.7/build/_3_LibraryLogic/arcturus_Cijk_Alik_Bljk_BBH.yaml
- {MinimumRequiredVersion: 4.20.0}
- arcturus
- gfx908
- [Device 7380, Device 7388, Device 738c, Device 7390]
- - - [33536, 8976, 1, 256, 33536, 33536, 256, 256]
    - [105, 53345.0]
  - - [5, 5, 960, 64, 5, 5, 64, 64]
    - [3, 144.0]
  - - [256, 44505, 1, 1024, 256, 256, 1024, 1024]
    - [70, 55854.0]
  - - [1024, 10, 1, 1024, 1024, 1024, 1024, 1024]
    - [58, 1049.0]
  - - [256, 14592, 1, 1024, 256, 256, 1024, 1024]
    - [61, 51860.0]
  - - [2048, 2048, 1, 2048, 2080, 2080, 2080, 2080]
    - [114, 52123.0]
  - - [1024, 10080, 1, 1024, 1024, 1024, 1024, 1024]
    - [104, 55630.0]
  - - [2, 32, 1, 1024, 2, 2, 1024, 1024]
    - [14, 6.0]
  - - [1024, 32768, 1, 479, 1024, 1024, 479, 479]
    - [88, 38123.0]
  - - [18944, 8976, 1, 256, 18944, 18944, 256, 256]
    - [125, 51411.0]
  - - [1024, 9216, 1, 1024, 1024, 1024, 1024, 1024]
    - [52, 56738.0]
  - - [256, 16128, 1, 1024, 256, 256, 1024, 1024]
    - [121, 47913.0]
  - - [1024, 4992, 1, 4096, 1024, 1024, 4096, 4096]
    - [87, 53853.0]
  - - [5632, 8976, 1, 256, 5632, 5632, 256, 256]
    - [74, 52848.0]
  - - [1024, 5, 1, 1024, 1024, 1024, 1024, 1024]
    - [15, 496.0]
  - - [256, 14848, 1, 1024, 256, 256, 1024, 1024]
    - [61, 52656.0]
  - - [256, 14336, 1, 1024, 256, 256, 1024, 1024]
    - [24, 51117.0]
  - - [2, 5, 1, 1024, 2, 2, 1024, 1024]
    - [1, 1.0]
  - - [8192, 7680, 1, 8192, 8384, 8384, 8384, 8384]
    - [81, 64471.0]
  - - [64, 960, 1, 1024, 64, 64, 1024, 1024]
    - [110, 6446.0]
  - - [2, 40, 1, 1024, 2, 2, 1024, 1024]
    - [73, 8.0]
  - - [11264, 8976, 1, 256, 11264, 11264, 256, 256]
    - [125, 50959.0]
  - - [1024, 1024, 1, 1024, 1056, 1056, 1056, 1056]
    - [51, 30926.0]
  - - [42720, 6528, 1, 1024, 42720, 42720, 1024, 1024]
    - [117, 61849.0]
  - - [30, 31, 2048, 64, 30, 30, 131072, 131072]
    - [37, 4292.0]
  - - [2048, 215, 1, 768, 2048, 2048, 768, 768]
    - [76, 20225.0]
  - - [15, 14, 10880, 64, 15, 15, 696320, 696320]
    - [4, 2042.0]
  - - [64, 512, 1, 512, 64, 64, 512, 512]
    - [91, 2497.0]
  - - [1024, 4096, 1, 1024, 1024, 1024, 1024, 1024]
    - [124, 48498.0]
  - - [18176, 8976, 1, 256, 18176, 18176, 256, 256]
    - [105, 52986.0]
  - - [128, 128, 128, 64, 128, 128, 64, 64]
    - [10, 10421.0]
  - - [1024, 200, 1, 560, 1024, 1024, 560, 560]
    - [75, 9249.0]
  - - [512, 512, 1, 512, 544, 544, 544, 544]
    - [34, 13107.0]
  - - [42720, 3968, 1, 1024, 42720, 42720, 1024, 1024]
    - [117, 61758.0]
  - - [2, 4, 1, 1024, 2, 2, 1024, 1024]
    - [1, 1.0]
  - - [64, 128, 1, 128, 64, 64, 128, 128]
    - [58, 199.0]
  - - [1024, 2560, 1, 4096, 1024, 1024, 4096, 4096]
    - [86, 51982.0]
  - - [30522, 462, 1, 1024, 30522, 30522, 1024, 1024]
    - [122, 52242.0]
  - - [1024, 820, 1, 1024, 1024, 1024, 1024, 1024]
    - [71, 34120.0]
  - - [34, 34, 4736, 64, 34, 34, 303104, 303104]
    - [6, 4797.0]
  - - [19712, 8976, 1, 256, 19712, 19712, 256, 256]
    - [105, 53163.0]
  - - [1024, 10064, 1, 1024, 1024, 1024, 1024, 1024]
    - [98, 55425.0]
  - - [4096, 5248, 1, 1024, 4096, 4096, 1024, 1024]
    - [117, 59158.0]
  - - [256, 21504, 1, 1024, 256, 256, 1024, 1024]
    - [70, 53342.0]
  - - [4096, 3840, 1, 4096, 4192, 4192, 4192, 4192]
    - [117, 63171.0]
  - - [2048, 512, 1, 100, 2048, 2048, 100, 100]
    - [83, 8244.0]
  - - [1024, 39, 1, 1024, 1024, 1024, 1024, 1024]
    - [16, 3902.0]
  - - [256, 31488, 1, 1024, 256, 256, 1024, 1024]
    - [102, 53796.0]
  - - [256, 8960, 1, 1024, 256, 256, 1024, 1024]
    - [121, 42367.0]
  - - [256, 13312, 1, 1024, 256, 256, 1024, 1024]
    - [52, 48200.0]
  - - [128, 128, 160, 64, 128, 128, 64, 64]
    - [6, 12053.0]
  - - [11776, 8976, 1, 256, 11776, 11776, 256, 256]
    - [125, 51249.0]
  - - [7168, 8976, 1, 256, 7168, 7168, 256, 256]
    - [74, 51408.0]
  - - [4096, 1280, 1, 1024, 4096, 4096, 1024, 1024]
    - [124, 51385.0]
  - - [15, 15, 10880, 64, 15, 15, 696320, 696320]
    - [4, 2193.0]
  - - [1024, 2048, 1, 4096, 1024, 1024, 4096, 4096]
    - [42, 44096.0]
  - - [64, 512, 1, 1024, 64, 64, 1024, 1024]
    - [45, 3616.0]
  - - [32, 32, 4608, 64, 32, 32, 294912, 294912]
    - [4, 5772.0]
  - - [1024, 2560, 1, 1024, 1024, 1024, 1024, 1024]
    - [124, 48072.0]
  - - [21248, 8976, 1, 256, 21248, 21248, 256, 256]
    - [121, 52786.0]
  - - [256, 2304, 1, 1024, 256, 256, 1024, 1024]
    - [78, 26398.0]
  - - [1024, 7200, 1, 1024, 1024, 1024, 1024, 1024]
    - [85, 54362.0]
  - - [1024, 800, 1, 1024, 1024, 1024, 1024, 1024]
    - [123, 33934.0]
  - - [3840, 8976, 1, 256, 3840, 3840, 256, 256]
    - [72, 51444.0]
  - - [1024, 3840, 1, 1024, 1024, 1024, 1024, 1024]
    - [85, 54004.0]
  - - [1024, 8, 1, 1024, 1024, 1024, 1024, 1024]
    - [17, 813.0]
  - - [30522, 160, 1, 1024, 30522, 30522, 1024, 1024]
    - [79, 44239.0]
  - - [2, 1024, 1, 1024, 2, 2, 1024, 1024]
    - [27, 197.0]
  - - [2048, 512, 1, 2048, 2048, 2048, 2048, 2048]
    - [44, 35887.0]
  - - [32, 1600, 1, 512, 32, 32, 512, 512]
    - [30, 3562.0]
  - - [30522, 308, 1, 1024, 30522, 30522, 1024, 1024]
    - [99, 53009.0]
  - - [2560, 8976, 1, 256, 2560, 2560, 256, 256]
    - [40, 49650.0]
  - - [30528, 4096, 1, 1024, 30528, 30528, 1024, 1024]
    - [117, 61962.0]
  - - [256, 9984, 1, 1024, 256, 256, 1024, 1024]
    - [61, 46670.0]
  - - [32, 35, 4608, 64, 32, 32, 294912, 294912]
    - [2, 4840.0]
  - - [15104, 8976, 1, 256, 15104, 15104, 256, 256]
    - [121, 52836.0]
  - - [17, 17, 6144, 64, 17, 17, 393216, 393216]
    - [4, 2032.0]
  - - [4096, 2560, 1, 1024, 4096, 4096, 1024, 1024]
    - [98, 57555.0]
  - - [3072, 8976, 1, 256, 3072, 3072, 256, 256]
    - [62, 50740.0]
  - - [512, 32768, 1, 13, 512, 512, 13, 13]
    - [12, 3545.0]
  - - [2048, 215, 1, 512, 2048, 2048, 512, 512]
    - [80, 17079.0]
  - - [1024, 9520, 1, 4096, 1024, 1024, 4096, 4096]
    - [87, 60632.0]
  - - [4096, 4096, 1, 4096, 4192, 4192, 4192, 4192]
    - [117, 60603.0]
  - - [4096, 8192, 1, 1024, 4096, 4096, 1024, 1024]
    - [98, 60019.0]
  - - [4096, 3840, 1, 1024, 4096, 4096, 1024, 1024]
    - [60, 57489.0]
  - - [2304, 8976, 1, 256, 2304, 2304, 256, 256]
    - [105, 49498.0]
  - - [33, 33, 1, 32, 33, 33, 32, 32]
    - [3, 6.0]
  - - [12544, 8976, 1, 256, 12544, 12544, 256, 256]
    - [121, 52408.0]
  - - [1024, 1600, 1, 1024, 1024, 1024, 1024, 1024]
    - [79, 43509.0]
  - - [15360, 8976, 1, 256, 15360, 15360, 256, 256]
    - [125, 50846.0]
  - - [1024, 5120, 1, 1024, 1024, 1024, 1024, 1024]
    - [56, 51702.0]
  - - [1024, 9, 1, 1024, 1024, 1024, 1024, 1024]
    - [58, 914.0]
  - - [256, 2560, 1, 1024, 256, 256, 1024, 1024]
    - [78, 29537.0]
  - - [1024, 780, 1, 1024, 1024, 1024, 1024, 1024]
    - [78, 33966.0]
  - - [2816, 8976, 1, 256, 2816, 2816, 256, 256]
    - [36, 50584.0]
  - - [16128, 8976, 1, 256, 16128, 16128, 256, 256]
    - [121, 52684.0]
  - - [256, 4864, 1, 1024, 256, 256, 1024, 1024]
    - [95, 34573.0]
  - - [512, 512, 64, 64, 512, 512, 64, 64]
    - [11, 23797.0]
  - - [512, 512, 80, 64, 512, 512, 64, 64]
    - [36, 24855.0]
  - - [4096, 3072, 1, 1024, 4096, 4096, 1024, 1024]
    - [98, 58061.0]
  - - [480, 512, 1, 512, 544, 544, 544, 544]
    - [33, 13797.0]
  - - [256, 6144, 1, 1024, 256, 256, 1024, 1024]
    - [86, 41683.0]
  - - [1024, 3072, 1, 4096, 1024, 1024, 4096, 4096]
    - [57, 49360.0]
  - - [20480, 8976, 1, 256, 20480, 20480, 256, 256]
    - [114, 51371.0]
  - - [4096, 1024, 1, 1024, 4096, 4096, 1024, 1024]
    - [107, 48940.0]
  - - [1024, 1152, 1, 1024, 1024, 1024, 1024, 1024]
    - [32, 33113.0]
  - - [128, 128, 656, 64, 128, 128, 64, 64]
    - [8, 18294.0]
  - - [1024, 1024, 1, 4096, 1024, 1024, 4096, 4096]
    - [66, 38293.0]
  - - [256, 7936, 1, 1024, 256, 256, 1024, 1024]
    - [97, 37417.0]
  - - [684, 8976, 1, 256, 684, 684, 256, 256]
    - [25, 37422.0]
  - - [3, 3, 512, 64, 3, 3, 64, 64]
    - [50, 36.0]
  - - [27, 27, 32768, 128, 27, 27, 128, 128]
    - [4, 9758.0]
  - - [2048, 684, 1, 768, 2048, 2048, 768, 768]
    - [113, 34132.0]
  - - [1024, 960, 1, 1024, 1056, 1056, 1056, 1056]
    - [82, 42367.0]
  - - [30522, 820, 1, 1024, 30522, 30522, 1024, 1024]
    - [79, 57858.0]
  - - [2, 10, 1, 1024, 2, 2, 1024, 1024]
    - [1, 2.0]
  - - [8960, 8976, 1, 256, 8960, 8960, 256, 256]
    - [121, 52055.0]
  - - [1024, 7104, 1, 4096, 1024, 1024, 4096, 4096]
    - [86, 57664.0]
  - - [21, 17, 6144, 64, 21, 21, 393216, 393216]
    - [4, 2321.0]
  - - [8192, 8192, 1, 8192, 8384, 8384, 8384, 8384]
    - [112, 63933.0]
  - - [1024, 32768, 1, 480, 1024, 1024, 480, 480]
    - [25, 58103.0]
  - - [1024, 180, 1, 1024, 1024, 1024, 1024, 1024]
    - [111, 14654.0]
  - - [128, 128, 624, 64, 128, 128, 64, 64]
    - [55, 18175.0]
  - - [5, 5, 512, 64, 5, 5, 64, 64]
    - [3, 97.0]
  - - [1024, 1600, 1, 560, 1024, 1024, 560, 560]
    - [49, 30102.0]
  - - [1024, 4096, 1, 4096, 1024, 1024, 4096, 4096]
    - [86, 52314.0]
  - - [256, 8448, 1, 1024, 256, 256, 1024, 1024]
    - [102, 40003.0]
  - - [1024, 3840, 1, 4096, 1024, 1024, 4096, 4096]
    - [87, 61045.0]
  - - [34, 24, 4736, 64, 34, 34, 303104, 303104]
    - [5, 4923.0]
  - - [256, 11264, 1, 1024, 256, 256, 1024, 1024]
    - [61, 51193.0]
  - - [2048, 512, 1, 67, 2048, 2048, 67, 67]
    - [8, 5666.0]
  - - [256, 10496, 1, 1024, 256, 256, 1024, 1024]
    - [70, 48578.0]
  - - [4096, 2048, 1, 1024, 4096, 4096, 1024, 1024]
    - [68, 55548.0]
  - - [256, 22016, 1, 1024, 256, 256, 1024, 1024]
    - [61, 54365.0]
  - - [30, 30, 2048, 64, 30, 30, 131072, 131072]
    - [75, 4237.0]
  - - [1024, 960, 1, 1600, 1024, 1024, 1600, 1600]
    - [77, 46152.0]
  - - [2048, 1536, 1, 512, 2048, 2048, 512, 512]
    - [31, 41340.0]
  - - [1024, 7200, 1, 4096, 1024, 1024, 4096, 4096]
    - [124, 57386.0]
  - - [42720, 10080, 1, 1024, 42720, 42720, 1024, 1024]
    - [117, 61803.0]
  - - [9984, 8976, 1, 256, 9984, 9984, 256, 256]
    - [121, 52235.0]
  - - [4096, 10200, 1, 1024, 4096, 4096, 1024, 1024]
    - [117, 60073.0]
  - - [1024, 1024, 1, 1024, 1024, 1024, 1024, 1024]
    - [18, 30161.0]
  - - [1024, 10200, 1, 4096, 1024, 1024, 4096, 4096]
    - [124, 58993.0]
  - - [256, 33536, 1, 1024, 256, 256, 1024, 1024]
    - [120, 56296.0]
  - - [21, 21, 6144, 64, 21, 21, 393216, 393216]
    - [4, 2643.0]
  - - [4608, 8976, 1, 256, 4608, 4608, 256, 256]
    - [62, 52837.0]
  - - [1024, 8160, 1, 4096, 1024, 1024, 4096, 4096]
    - [101, 58501.0]
  - - [1024, 160, 1, 1024, 1024, 1024, 1024, 1024]
    - [109, 13707.0]
  - - [256, 19200, 1, 1024, 256, 256, 1024, 1024]
    - [85, 54143.0]
  - - [4096, 5120, 1, 1024, 4096, 4096, 1024, 1024]
    - [63, 58572.0]
  - - [256, 7424, 1, 1024, 256, 256, 1024, 1024]
    - [85, 49345.0]
  - - [4, 4, 38400, 64, 4, 4, 2457600, 2457600]
    - [1, 170.0]
  - - [2048, 114, 1, 512, 2048, 2048, 512, 512]
    - [96, 10828.0]
  - - [256, 11520, 1, 1024, 256, 256, 1024, 1024]
    - [70, 52139.0]
  - - [2048, 1920, 1, 2048, 2080, 2080, 2080, 2080]
    - [86, 59812.0]
  - - [2, 39, 1, 1024, 2, 2, 1024, 1024]
    - [14, 7.0]
  - - [1024, 462, 1, 1024, 1024, 1024, 1024, 1024]
    - [89, 22595.0]
  - - [2, 9, 1, 1024, 2, 2, 1024, 1024]
    - [14, 2.0]
  - - [13312, 8976, 1, 256, 13312, 13312, 256, 256]
    - [114, 51029.0]
  - - [35, 35, 4608, 64, 35, 35, 294912, 294912]
    - [78, 4305.0]
  - - [30522, 180, 1, 1024, 30522, 30522, 1024, 1024]
    - [118, 48398.0]
  - - [33712, 8192, 1, 1024, 33712, 33712, 1024, 1024]
    - [117, 61945.0]
  - - [2048, 1536, 1, 768, 2048, 2048, 768, 768]
    - [56, 44022.0]
  - - [4096, 4096, 1, 1024, 4096, 4096, 1024, 1024]
    - [98, 57759.0]
  - - [2048, 512, 1, 74, 2048, 2048, 74, 74]
    - [8, 5987.0]
  - - [1024, 77, 1, 1024, 1024, 1024, 1024, 1024]
    - [94, 7009.0]
  - - [256, 1280, 1, 1024, 256, 256, 1024, 1024]
    - [93, 21960.0]
  - - [8192, 8976, 1, 256, 8192, 8192, 256, 256]
    - [36, 50032.0]
  - - [960, 1024, 1, 1024, 1056, 1056, 1056, 1056]
    - [47, 43092.0]
  - - [2048, 8976, 1, 256, 2048, 2048, 256, 256]
    - [36, 47401.0]
  - - [20992, 8976, 1, 256, 20992, 20992, 256, 256]
    - [114, 51583.0]
  - - [256, 7168, 1, 1024, 256, 256, 1024, 1024]
    - [85, 47837.0]
  - - [5, 5, 1, 64, 5, 5, 64, 64]
    - [1, 0.29]
  - - [28672, 8976, 1, 256, 28672, 28672, 256, 256]
    - [114, 51822.0]
  - - [8448, 8976, 1, 256, 8448, 8448, 256, 256]
    - [121, 51993.0]
  - - [1024, 40, 1, 1024, 1024, 1024, 1024, 1024]
    - [16, 3942.0]
  - - [2, 8, 1, 1024, 2, 2, 1024, 1024]
    - [0, 1.0]
  - - [24, 24, 4736, 64, 24, 24, 303104, 303104]
    - [4, 4356.0]
  - - [512, 512, 96, 64, 512, 512, 64, 64]
    - [86, 25197.0]
  - - [1024, 8064, 1, 1024, 1024, 1024, 1024, 1024]
    - [52, 55223.0]
  - - [13824, 8976, 1, 256, 13824, 13824, 256, 256]
    - [125, 51050.0]
  - - [1024, 9520, 1, 1024, 1024, 1024, 1024, 1024]
    - [117, 56411.0]
  - - [256, 6656, 1, 1024, 256, 256, 1024, 1024]
    - [86, 44785.0]
  - - [1024, 1152, 1, 4096, 1024, 1024, 4096, 4096]
    - [28, 42031.0]
  - - [256, 3328, 1, 1024, 256, 256, 1024, 1024]
    - [78, 35991.0]
  - - [4352, 8976, 1, 256, 4352, 4352, 256, 256]
    - [23, 52500.0]
  - - [30522, 385, 1, 1024, 30522, 30522, 1024, 1024]
    - [79, 50188.0]
  - - [256, 1536, 1, 1024, 256, 256, 1024, 1024]
    - [95, 25944.0]
  - - [17, 17, 7680, 64, 17, 17, 491520, 491520]
    - [4, 2473.0]
  - - [5376, 8976, 1, 256, 5376, 5376, 256, 256]
    - [43, 52702.0]
  - - [1024, 7104, 1, 1024, 1024, 1024, 1024, 1024]
    - [52, 54357.0]
  - - [1024, 8160, 1, 1024, 1024, 1024, 1024, 1024]
    - [46, 54154.0]
  - - [9472, 8976, 1, 256, 9472, 9472, 256, 256]
    - [105, 52210.0]
  - - [256, 23552, 1, 1024, 256, 256, 1024, 1024]
    - [102, 51177.0]
  - - [13568, 8976, 1, 256, 13568, 13568, 256, 256]
    - [105, 52522.0]
  - - [1024, 200, 1, 1024, 1024, 1024, 1024, 1024]
    - [92, 15697.0]
  - - [1024, 5120, 1, 4096, 1024, 1024, 4096, 4096]
    - [57, 55245.0]
  - - [30522, 616, 1, 1024, 30522, 30522, 1024, 1024]
    - [106, 55993.0]
  - - [1024, 41, 1, 1024, 1024, 1024, 1024, 1024]
    - [16, 4166.0]
  - - [4096, 8064, 1, 1024, 4096, 4096, 1024, 1024]
    - [98, 60346.0]
  - - [1024, 10200, 1, 1024, 1024, 1024, 1024, 1024]
    - [98, 56244.0]
  - - [128, 128, 1, 64, 128, 128, 64, 64]
    - [19, 211.0]
  - - [256, 684, 1, 1024, 256, 256, 1024, 1024]
    - [92, 14186.0]
  - - [1024, 5248, 1, 4096, 1024, 1024, 4096, 4096]
    - [57, 56568.0]
  - - [4, 4, 32768, 64, 4, 4, 2097152, 2097152]
    - [1, 167.0]
  - - [1280, 8976, 1, 256, 1280, 1280, 256, 256]
    - [105, 44564.0]
  - - [2048, 256, 1, 512, 2048, 2048, 512, 512]
    - [84, 19396.0]
  - - [4864, 8976, 1, 256, 4864, 4864, 256, 256]
    - [22, 52840.0]
  - - [256, 20992, 1, 1024, 256, 256, 1024, 1024]
    - [120, 52230.0]
  - - [256, 18944, 1, 1024, 256, 256, 1024, 1024]
    - [102, 53560.0]
  - - [1024, 6528, 1, 1024, 1024, 1024, 1024, 1024]
    - [86, 55597.0]
  - - [1024, 6528, 1, 4096, 1024, 1024, 4096, 4096]
    - [119, 58475.0]
  - - [9728, 8976, 1, 256, 9728, 9728, 256, 256]
    - [125, 50647.0]
  - - [256, 12544, 1, 1024, 256, 256, 1024, 1024]
    - [52, 46029.0]
  - - [42720, 7200, 1, 1024, 42720, 42720, 1024, 1024]
    - [79, 61093.0]
  - - [9, 9, 512, 64, 9, 9, 64, 64]
    - [38, 307.0]
  - - [128, 128, 640, 64, 128, 128, 64, 64]
    - [8, 18157.0]
  - - [7680, 8192, 1, 8192, 8384, 8384, 8384, 8384]
    - [53, 64429.0]
  - - [4096, 9520, 1, 1024, 4096, 4096, 1024, 1024]
    - [117, 59604.0]
  - - [4096, 8160, 1, 1024, 4096, 4096, 1024, 1024]
    - [117, 59279.0]
  - - [4096, 9216, 1, 1024, 4096, 4096, 1024, 1024]
    - [68, 59785.0]
  - - [19968, 8976, 1, 256, 19968, 19968, 256, 256]
    - [125, 51527.0]
  - - [1024, 1280, 1, 4096, 1024, 1024, 4096, 4096]
    - [115, 43046.0]
  - - [1024, 5248, 1, 1024, 1024, 1024, 1024, 1024]
    - [85, 52953.0]
  - - [6400, 8976, 1, 256, 6400, 6400, 256, 256]
    - [22, 52091.0]
  - - [33, 33, 1600, 32, 33, 33, 32, 32]
    - [10, 2138.0]
  - - [5888, 8976, 1, 256, 5888, 5888, 256, 256]
    - [36, 52490.0]
  - - [256, 23296, 1, 1024, 256, 256, 1024, 1024]
    - [120, 50756.0]
  - - [512, 32768, 1, 1024, 512, 512, 1024, 1024]
    - [52, 57620.0]
  - - [512, 512, 128, 64, 512, 512, 64, 64]
    - [29, 25811.0]
  - - [512, 512, 16, 64, 512, 512, 64, 64]
    - [40, 15252.0]
  - - [1024, 9600, 1, 1024, 1024, 1024, 1024, 1024]
    - [98, 56962.0]
  - - [2, 6, 1, 1024, 2, 2, 1024, 1024]
    - [0, 1.0]
  - - [4096, 7200, 1, 1024, 4096, 4096, 1024, 1024]
    - [105, 58561.0]
  - - [2, 2048, 1, 1024, 2, 2, 1024, 1024]
    - [27, 369.0]
  - - [2048, 960, 1, 74, 2048, 2048, 74, 74]
    - [9, 10217.0]
  - - [512, 1600, 1, 512, 512, 512, 512, 512]
    - [84, 27450.0]
  - - [1024, 385, 1, 1024, 1024, 1024, 1024, 1024]
    - [67, 23803.0]
  - - [1024, 960, 1, 1024, 1024, 1024, 1024, 1024]
    - [41, 39199.0]
  - - [3328, 8976, 1, 256, 3328, 3328, 256, 256]
    - [40, 51393.0]
  - - [256, 18176, 1, 1024, 256, 256, 1024, 1024]
    - [120, 52894.0]
  - - [1024, 2048, 1, 1024, 1024, 1024, 1024, 1024]
    - [59, 39946.0]
  - - [64, 128, 512, 128, 64, 64, 128, 128]
    - [6, 17252.0]
  - - [256, 8192, 1, 1024, 256, 256, 1024, 1024]
    - [121, 38679.0]
  - - [64, 512, 64, 512, 64, 64, 512, 512]
    - [5, 27560.0]
  - - [1024, 4992, 1, 1024, 1024, 1024, 1024, 1024]
    - [85, 50409.0]
  - - [33712, 9600, 1, 1024, 33712, 33712, 1024, 1024]
    - [117, 62039.0]
  - - [256, 3584, 1, 1024, 256, 256, 1024, 1024]
    - [77, 37641.0]
  - - [18688, 8976, 1, 256, 18688, 18688, 256, 256]
    - [105, 53162.0]
  - - [1024, 32768, 1, 1024, 1024, 1024, 1024, 1024]
    - [52, 60069.0]
  - - [4096, 7104, 1, 1024, 4096, 4096, 1024, 1024]
    - [102, 59214.0]
  - - [1024, 512, 1, 4096, 1024, 1024, 4096, 4096]
    - [26, 29993.0]
  - - [14, 14, 10880, 64, 14, 14, 696320, 696320]
    - [4, 1910.0]
  - - [1024, 9600, 1, 4096, 1024, 1024, 4096, 4096]
    - [87, 62245.0]
  - - [6144, 8976, 1, 256, 6144, 6144, 256, 256]
    - [65, 52027.0]
  - - [30528, 2048, 1, 1024, 30528, 30528, 1024, 1024]
    - [117, 61291.0]
  - - [1024, 6, 1, 1024, 1024, 1024, 1024, 1024]
    - [15, 596.0]
  - - [17, 15, 7680, 64, 17, 17, 491520, 491520]
    - [4, 2210.0]
  - - [23552, 8976, 1, 256, 23552, 23552, 256, 256]
    - [114, 51558.0]
  - - [1024, 308, 1, 1024, 1024, 1024, 1024, 1024]
    - [96, 18518.0]
  - - [3840, 4096, 1, 4096, 4192, 4192, 4192, 4192]
    - [35, 63265.0]
  - - [256, 15104, 1, 1024, 256, 256, 1024, 1024]
    - [86, 53275.0]
  - - [2, 41, 1, 1024, 2, 2, 1024, 1024]
    - [14, 8.0]
  - - [256, 5376, 1, 1024, 256, 256, 1024, 1024]
    - [95, 37401.0]
  - - [1024, 3968, 1, 1024, 1024, 1024, 1024, 1024]
    - [72, 47025.0]
  - - [512, 512, 1, 64, 512, 512, 64, 64]
    - [5, 2913.0]
  - - [1024, 8064, 1, 4096, 1024, 1024, 4096, 4096]
    - [119, 58291.0]
  - - [256, 2816, 1, 1024, 256, 256, 1024, 1024]
    - [78, 31819.0]
  - - [256, 5888, 1, 1024, 256, 256, 1024, 1024]
    - [86, 40448.0]
  - - [4096, 1152, 1, 1024, 4096, 4096, 1024, 1024]
    - [85, 54072.0]
  - - [7936, 8976, 1, 256, 7936, 7936, 256, 256]
    - [105, 51677.0]
  - - [2048, 960, 1, 2048, 2048, 2048, 2048, 2048]
    - [125, 53431.0]
  - - [5120, 8976, 1, 256, 5120, 5120, 256, 256]
    - [72, 52654.0]
  - - [1024, 512, 1, 1024, 1024, 1024, 1024, 1024]
    - [103, 24315.0]
  - - [4096, 6528, 1, 1024, 4096, 4096, 1024, 1024]
    - [98, 59399.0]
  - - [4096, 9600, 1, 1024, 4096, 4096, 1024, 1024]
    - [98, 60299.0]
  - - [4096, 10080, 1, 1024, 4096, 4096, 1024, 1024]
    - [117, 59905.0]
  - - [256, 11776, 1, 1024, 256, 256, 1024, 1024]
    - [52, 43163.0]
  - - [30522, 200, 1, 1024, 30522, 30522, 1024, 1024]
    - [99, 43074.0]
  - - [128, 32768, 1, 256, 128, 128, 256, 256]
    - [65, 34682.0]
  - - [4096, 4992, 1, 1024, 4096, 4096, 1024, 1024]
    - [117, 59402.0]
  - - [256, 22344, 1, 1024, 256, 256, 1024, 1024]
    - [39, 52636.0]
  - - [1024, 8192, 1, 1024, 1024, 1024, 1024, 1024]
    - [52, 55577.0]
  - - [128, 128, 512, 64, 128, 128, 64, 64]
    - [11, 17252.0]
  - - [4096, 3968, 1, 1024, 4096, 4096, 1024, 1024]
    - [117, 58405.0]
  - - [4096, 10064, 1, 1024, 4096, 4096, 1024, 1024]
    - [117, 59844.0]
  - - [2048, 684, 1, 512, 2048, 2048, 512, 512]
    - [100, 30809.0]
  - - [31, 31, 2048, 64, 31, 31, 131072, 131072]
    - [20, 4374.0]
  - - [30522, 780, 1, 1024, 30522, 30522, 1024, 1024]
    - [79, 55638.0]
  - - [17152, 8976, 1, 256, 17152, 17152, 256, 256]
    - [105, 53094.0]
  - - [4096, 512, 1, 1024, 4096, 4096, 1024, 1024]
    - [105, 38904.0]
  - - [4096, 8976, 1, 256, 4096, 4096, 256, 256]
    - [36, 50624.0]
  - - [1024, 1280, 1, 1024, 1024, 1024, 1024, 1024]
    - [59, 36003.0]
  - - [256, 21248, 1, 1024, 256, 256, 1024, 1024]
    - [120, 52747.0]
  - - [1920, 2048, 1, 2048, 2080, 2080, 2080, 2080]
    - [86, 59459.0]
  - - [1024, 32, 1, 1024, 1024, 1024, 1024, 1024]
    - [16, 3383.0]
  - - [2048, 256, 1, 768, 2048, 2048, 768, 768]
    - [21, 22075.0]
  - - [1024, 3072, 1, 1024, 1024, 1024, 1024, 1024]
    - [7, 45756.0]
  - - [1024, 9216, 1, 4096, 1024, 1024, 4096, 4096]
    - [13, 59918.0]
  - - [15872, 8976, 1, 256, 15872, 15872, 256, 256]
    - [121, 51467.0]
  - - [1024, 8192, 1, 4096, 1024, 1024, 4096, 4096]
    - [119, 58916.0]
  - - [256, 32768, 1, 512, 256, 256, 512, 512]
    - [86, 51179.0]
  - - [15, 15, 7680, 64, 15, 15, 491520, 491520]
    - [4, 1983.0]
  - - [1792, 8976, 1, 256, 1792, 1792, 256, 256]
    - [121, 48421.0]
  - - [1024, 512, 1, 1600, 1024, 1024, 1600, 1600]
    - [48, 26681.0]
  - - [256, 6400, 1, 1024, 256, 256, 1024, 1024]
    - [86, 43330.0]
  - - [10496, 8976, 1, 256, 10496, 10496, 256, 256]
    - [105, 52367.0]
  - - [128, 128, 144, 64, 128, 128, 64, 64]
    - [54, 11235.0]
  - - [1024, 10080, 1, 4096, 1024, 1024, 4096, 4096]
    - [124, 59320.0]
  - - [512, 480, 1, 512, 544, 544, 544, 544]
    - [116, 13797.0]
  - - [31488, 8976, 1, 256, 31488, 31488, 256, 256]
    - [105, 53161.0]
  - - [256, 20480, 1, 1024, 256, 256, 1024, 1024]
    - [52, 51228.0]
  - - [44505, 8976, 1, 256, 44505, 44505, 256, 256]
    - [121, 50885.0]
  - - [2048, 114, 1, 768, 2048, 2048, 768, 768]
    - [5, 13750.0]
  - - [30522, 800, 1, 1024, 30522, 30522, 1024, 1024]
    - [99, 56498.0]
  - - [256, 4608, 1, 1024, 256, 256, 1024, 1024]
    - [95, 33629.0]
  - - [1024, 4, 1, 1024, 1024, 1024, 1024, 1024]
    - [90, 406.0]
  - - [42720, 7104, 1, 1024, 42720, 42720, 1024, 1024]
    - [79, 61574.0]
  - - [1024, 3968, 1, 4096, 1024, 1024, 4096, 4096]
    - [64, 50129.0]
  - - [42720, 9520, 1, 1024, 42720, 42720, 1024, 1024]
    - [117, 61600.0]
  - - [1024, 10064, 1, 4096, 1024, 1024, 4096, 4096]
    - [108, 59133.0]
  - - [10240, 8976, 1, 256, 10240, 10240, 256, 256]
    - [125, 50694.0]
  - - [30522, 77, 1, 1024, 30522, 30522, 1024, 1024]
    - [69, 30479.0]
- null
