TRAIN_3.7/build/_3_LibraryLogic/arcturus_Cijk_Ailk_Bjlk_HBH.yaml
- {MinimumRequiredVersion: 4.20.0}
- arcturus
- gfx908
- [Device 7380, Device 7388, Device 738c, Device 7390]
- - - [1024, 256, 1, 18944, 1024, 1024, 1024, 256]
    - [164, 31241.0]
  - - [64, 128, 624, 128, 64, 64, 64, 128]
    - [14, 23570.0]
  - - [1024, 256, 1, 15872, 1024, 1024, 1024, 256]
    - [146, 30648.0]
  - - [1024, 256, 1, 10496, 1024, 1024, 1024, 256]
    - [112, 29221.0]
  - - [1024, 1024, 1, 1024, 1056, 1056, 1056, 1056]
    - [150, 39360.0]
  - - [1024, 1024, 1, 1280, 1024, 1024, 1024, 1024]
    - [130, 38657.0]
  - - [1024, 1024, 1, 39, 1024, 1024, 1024, 1024]
    - [122, 4868.0]
  - - [256, 11520, 1, 8976, 256, 256, 256, 11520]
    - [26, 88167.0]
  - - [256, 9728, 1, 8976, 256, 256, 256, 9728]
    - [26, 74751.0]
  - - [1024, 256, 1, 7680, 1024, 1024, 1024, 256]
    - [170, 28118.0]
  - - [1024, 4096, 1, 2560, 1024, 1024, 1024, 4096]
    - [24, 70308.0]
  - - [1024, 4096, 1, 1024, 1024, 1024, 1024, 4096]
    - [53, 64296.0]
  - - [74, 2048, 1, 512, 74, 74, 74, 2048]
    - [33, 6879.0]
  - - [33, 32, 1, 33, 33, 33, 33, 32]
    - [2, 5.0]
  - - [1024, 256, 1, 6144, 1024, 1024, 1024, 256]
    - [57, 27096.0]
  - - [1024, 4096, 1, 10080, 1024, 1024, 1024, 4096]
    - [28, 74824.0]
  - - [1024, 2, 1, 4992, 1024, 1024, 1024, 2]
    - [31, 279.0]
  - - [256, 13568, 1, 8976, 256, 256, 256, 13568]
    - [26, 103593.0]
  - - [1024, 4096, 1, 7104, 1024, 1024, 1024, 4096]
    - [28, 76369.0]
  - - [100, 2048, 1, 512, 100, 100, 100, 2048]
    - [29, 8402.0]
  - - [2048, 2048, 1, 512, 2048, 2048, 2048, 2048]
    - [115, 55808.0]
  - - [64, 32, 4608, 35, 64, 64, 294912, 32]
    - [165, 7094.0]
  - - [1600, 1024, 1, 960, 1600, 1600, 1600, 1024]
    - [131, 47262.0]
  - - [64, 128, 144, 128, 64, 64, 64, 128]
    - [130, 15995.0]
  - - [15, 64, 10880, 15, 15, 15, 15, 696320]
    - [3, 2553.0]
  - - [512, 512, 1, 512, 544, 544, 544, 544]
    - [120, 11260.0]
  - - [4096, 1024, 1, 10064, 4096, 4096, 4096, 1024]
    - [41, 76759.0]
  - - [256, 33536, 1, 8976, 256, 256, 256, 33536]
    - [85, 94613.0]
  - - [256, 2560, 1, 8976, 256, 256, 256, 2560]
    - [40, 47105.0]
  - - [1024, 2, 1, 39, 1024, 1024, 1024, 2]
    - [2, 12.0]
  - - [64, 21, 6144, 17, 64, 64, 393216, 21]
    - [138, 2803.0]
  - - [64, 24, 4736, 24, 64, 64, 303104, 24]
    - [81, 3918.0]
  - - [4096, 1024, 1, 6528, 4096, 4096, 4096, 1024]
    - [41, 77521.0]
  - - [4096, 1024, 1, 7200, 4096, 4096, 4096, 1024]
    - [158, 75347.0]
  - - [1024, 1024, 1, 8192, 1024, 1024, 1024, 1024]
    - [110, 58419.0]
  - - [256, 21248, 1, 8976, 256, 256, 256, 21248]
    - [85, 92261.0]
  - - [512, 64, 64, 512, 512, 512, 512, 64]
    - [37, 36373.0]
  - - [1024, 960, 1, 1024, 1056, 1056, 1056, 1056]
    - [135, 44779.0]
  - - [4096, 1024, 1, 3840, 4096, 4096, 4096, 1024]
    - [41, 74538.0]
  - - [17, 64, 7680, 17, 17, 17, 17, 491520]
    - [162, 2577.0]
  - - [1024, 1024, 1, 308, 1024, 1024, 1024, 1024]
    - [124, 21026.0]
  - - [1024, 2, 1, 5, 1024, 1024, 1024, 2]
    - [2, 2.0]
  - - [1024, 1024, 1, 3968, 1024, 1024, 1024, 1024]
    - [151, 52009.0]
  - - [1024, 256, 1, 2816, 1024, 1024, 1024, 256]
    - [117, 23069.0]
  - - [4096, 4096, 1, 1024, 4096, 4096, 4096, 4096]
    - [109, 85693.0]
  - - [34, 64, 4736, 24, 34, 34, 34, 303104]
    - [113, 5303.0]
  - - [21, 64, 6144, 21, 21, 21, 21, 393216]
    - [153, 3446.0]
  - - [1024, 4096, 1, 9520, 1024, 1024, 1024, 4096]
    - [96, 74562.0]
  - - [1024, 1024, 1, 4992, 1024, 1024, 1024, 1024]
    - [116, 54892.0]
  - - [1024, 256, 1, 3072, 1024, 1024, 1024, 256]
    - [170, 23248.0]
  - - [4096, 3840, 1, 4096, 4192, 4192, 4192, 4192]
    - [159, 114618.0]
  - - [1024, 256, 1, 4096, 1024, 1024, 1024, 256]
    - [47, 24994.0]
  - - [1024, 256, 1, 12032, 1024, 1024, 1024, 256]
    - [112, 29823.0]
  - - [256, 6144, 1, 8976, 256, 256, 256, 6144]
    - [106, 79386.0]
  - - [4096, 1024, 1, 3072, 4096, 4096, 4096, 1024]
    - [143, 74153.0]
  - - [2048, 2048, 1, 960, 2048, 2048, 2048, 2048]
    - [64, 63630.0]
  - - [64, 17, 6144, 17, 64, 64, 393216, 17]
    - [165, 2340.0]
  - - [64, 512, 96, 512, 64, 64, 64, 512]
    - [70, 38866.0]
  - - [1024, 1024, 1, 5248, 1024, 1024, 1024, 1024]
    - [96, 54377.0]
  - - [4096, 1024, 1, 10200, 4096, 4096, 4096, 1024]
    - [110, 76857.0]
  - - [1024, 256, 1, 5120, 1024, 1024, 1024, 256]
    - [75, 25971.0]
  - - [4096, 1024, 1, 4992, 4096, 4096, 4096, 1024]
    - [41, 76617.0]
  - - [1024, 1024, 1, 180, 1024, 1024, 1024, 1024]
    - [124, 15124.0]
  - - [5, 64, 1, 5, 5, 5, 5, 64]
    - [76, 0.27]
  - - [4096, 1024, 1, 2560, 4096, 4096, 4096, 1024]
    - [167, 72707.0]
  - - [4096, 1024, 1, 9216, 4096, 4096, 4096, 1024]
    - [65, 78848.0]
  - - [1024, 256, 1, 14336, 1024, 1024, 1024, 256]
    - [98, 30445.0]
  - - [1024, 1024, 1, 10080, 1024, 1024, 1024, 1024]
    - [151, 57121.0]
  - - [1024, 33712, 1, 9600, 1024, 1024, 1024, 33712]
    - [38, 115371.0]
  - - [64, 128, 640, 128, 64, 64, 64, 128]
    - [69, 23630.0]
  - - [1024, 256, 1, 5376, 1024, 1024, 1024, 256]
    - [152, 26732.0]
  - - [5, 64, 512, 5, 5, 5, 5, 64]
    - [77, 100.0]
  - - [2048, 256, 1, 1024, 2048, 2048, 2048, 256]
    - [160, 24855.0]
  - - [1024, 1024, 1, 5, 1024, 1024, 1024, 1024]
    - [126, 720.0]
  - - [1024, 42720, 1, 3968, 1024, 1024, 1024, 42720]
    - [26, 110095.0]
  - - [4, 64, 32768, 4, 4, 4, 4, 2097152]
    - [7, 227.0]
  - - [4096, 1024, 1, 2048, 4096, 4096, 4096, 1024]
    - [143, 71487.0]
  - - [256, 3328, 1, 8976, 256, 256, 256, 3328]
    - [9, 55934.0]
  - - [1024, 1024, 1, 4096, 1024, 1024, 1024, 1024]
    - [116, 52738.0]
  - - [1024, 2, 1, 40, 1024, 1024, 1024, 2]
    - [2, 12.0]
  - - [1024, 30522, 1, 160, 1024, 1024, 1024, 30522]
    - [154, 55812.0]
  - - [1024, 1024, 1, 800, 1024, 1024, 1024, 1024]
    - [124, 34953.0]
  - - [256, 4864, 1, 8976, 256, 256, 256, 4864]
    - [88, 66592.0]
  - - [1024, 1024, 1, 41, 1024, 1024, 1024, 1024]
    - [123, 4976.0]
  - - [4096, 1024, 1, 8064, 4096, 4096, 4096, 1024]
    - [96, 78236.0]
  - - [1024, 256, 1, 14848, 1024, 1024, 1024, 256]
    - [170, 30581.0]
  - - [1024, 2, 1, 5248, 1024, 1024, 1024, 2]
    - [163, 282.0]
  - - [4096, 4096, 1, 4096, 4192, 4192, 4192, 4192]
    - [94, 104411.0]
  - - [1024, 30522, 1, 385, 1024, 1024, 1024, 30522]
    - [127, 72945.0]
  - - [1024, 256, 1, 8448, 1024, 1024, 1024, 256]
    - [75, 28806.0]
  - - [64, 30, 2048, 31, 64, 64, 131072, 30]
    - [59, 4732.0]
  - - [1024, 4096, 1, 9600, 1024, 1024, 1024, 4096]
    - [28, 77445.0]
  - - [256, 22016, 1, 8976, 256, 256, 256, 22016]
    - [108, 93352.0]
  - - [2048, 512, 1, 1, 2048, 2048, 2048, 512]
    - [12, 156.0]
  - - [2048, 960, 1, 1, 2048, 2048, 2048, 960]
    - [12, 264.0]
  - - [64, 32, 4608, 32, 64, 64, 294912, 32]
    - [62, 9581.0]
  - - [1024, 4096, 1, 1152, 1024, 1024, 1024, 4096]
    - [72, 64185.0]
  - - [1024, 1024, 1, 960, 1024, 1024, 1024, 1024]
    - [156, 35345.0]
  - - [1024, 2, 1, 512, 1024, 1024, 1024, 2]
    - [137, 98.0]
  - - [1024, 256, 1, 15104, 1024, 1024, 1024, 256]
    - [57, 30476.0]
  - - [1024, 1024, 1, 8160, 1024, 1024, 1024, 1024]
    - [116, 55245.0]
  - - [4096, 1024, 1, 7104, 4096, 4096, 4096, 1024]
    - [41, 78017.0]
  - - [64, 4, 38400, 4, 64, 64, 2457600, 4]
    - [4, 229.0]
  - - [1024, 256, 1, 22016, 1024, 1024, 1024, 256]
    - [57, 31517.0]
  - - [1024, 30522, 1, 180, 1024, 1024, 1024, 30522]
    - [154, 54053.0]
  - - [1024, 64, 1, 512, 1024, 1024, 1024, 64]
    - [46, 3495.0]
  - - [4096, 1024, 1, 512, 4096, 4096, 4096, 1024]
    - [141, 55348.0]
  - - [1024, 256, 1, 5632, 1024, 1024, 1024, 256]
    - [104, 26592.0]
  - - [1024, 256, 1, 33536, 1024, 1024, 1024, 256]
    - [104, 32169.0]
  - - [4096, 1024, 1, 1024, 4096, 4096, 4096, 1024]
    - [143, 65154.0]
  - - [1024, 1024, 1, 7200, 1024, 1024, 1024, 1024]
    - [28, 54237.0]
  - - [64, 34, 4736, 34, 64, 64, 303104, 34]
    - [4, 5943.0]
  - - [256, 12800, 1, 8976, 256, 256, 256, 12800]
    - [26, 97573.0]
  - - [480, 1024, 1, 32768, 480, 480, 480, 1024]
    - [10, 40121.0]
  - - [4, 64, 38400, 4, 4, 4, 4, 2457600]
    - [7, 229.0]
  - - [1024, 1024, 1, 6528, 1024, 1024, 1024, 1024]
    - [145, 56292.0]
  - - [256, 11008, 1, 8976, 256, 256, 256, 11008]
    - [18, 84226.0]
  - - [32, 64, 4608, 35, 32, 32, 32, 294912]
    - [60, 7082.0]
  - - [1024, 4096, 1, 10200, 1024, 1024, 1024, 4096]
    - [28, 75331.0]
  - - [64, 512, 64, 512, 64, 64, 64, 512]
    - [70, 35602.0]
  - - [31, 64, 2048, 31, 31, 31, 31, 131072]
    - [34, 4830.0]
  - - [1024, 2, 1, 32, 1024, 1024, 1024, 2]
    - [32, 12.0]
  - - [256, 15104, 1, 8976, 256, 256, 256, 15104]
    - [133, 114077.0]
  - - [1024, 4096, 1, 3840, 1024, 1024, 1024, 4096]
    - [110, 72839.0]
  - - [1024, 2, 1, 9, 1024, 1024, 1024, 2]
    - [2, 3.0]
  - - [8192, 8192, 1, 8192, 8384, 8384, 8384, 8384]
    - [86, 117916.0]
  - - [21, 64, 6144, 17, 21, 21, 21, 393216]
    - [49, 2830.0]
  - - [256, 8192, 1, 8976, 256, 256, 256, 8192]
    - [51, 62881.0]
  - - [30, 64, 2048, 30, 30, 30, 30, 131072]
    - [61, 4757.0]
  - - [1024, 30528, 1, 2048, 1024, 1024, 1024, 30528]
    - [129, 104216.0]
  - - [1024, 4096, 1, 3968, 1024, 1024, 1024, 4096]
    - [96, 72919.0]
  - - [4096, 1024, 1, 1280, 4096, 4096, 4096, 1024]
    - [102, 67514.0]
  - - [256, 11776, 1, 8976, 256, 256, 256, 11776]
    - [19, 89767.0]
  - - [1024, 1024, 1, 7104, 1024, 1024, 1024, 1024]
    - [151, 56915.0]
  - - [1024, 256, 1, 9984, 1024, 1024, 1024, 256]
    - [117, 29473.0]
  - - [1024, 256, 1, 17152, 1024, 1024, 1024, 256]
    - [117, 30898.0]
  - - [1024, 2, 1, 2048, 1024, 1024, 1024, 2]
    - [44, 202.0]
  - - [1024, 1024, 1, 3072, 1024, 1024, 1024, 1024]
    - [96, 49284.0]
  - - [64, 128, 656, 128, 64, 64, 64, 128]
    - [105, 23752.0]
  - - [1600, 1024, 1, 512, 1600, 1600, 1600, 1024]
    - [157, 38409.0]
  - - [1024, 256, 1, 17408, 1024, 1024, 1024, 256]
    - [146, 31018.0]
  - - [1024, 1024, 1, 9216, 1024, 1024, 1024, 1024]
    - [110, 58781.0]
  - - [256, 4352, 1, 8976, 256, 256, 256, 4352]
    - [28, 60098.0]
  - - [33, 32, 200, 33, 33, 33, 33, 32]
    - [6, 990.0]
  - - [2048, 2048, 1, 1024, 2048, 2048, 2048, 2048]
    - [39, 63761.0]
  - - [1024, 4096, 1, 4992, 1024, 1024, 1024, 4096]
    - [28, 74587.0]
  - - [9, 64, 512, 9, 9, 9, 9, 64]
    - [3, 316.0]
  - - [4096, 1024, 1, 4096, 4096, 4096, 4096, 1024]
    - [65, 75087.0]
  - - [1024, 1024, 1, 9, 1024, 1024, 1024, 1024]
    - [83, 1255.0]
  - - [1024, 4096, 1, 512, 1024, 1024, 1024, 4096]
    - [21, 57236.0]
  - - [64, 512, 16, 512, 64, 64, 64, 512]
    - [73, 18538.0]
  - - [256, 17152, 1, 8976, 256, 256, 256, 17152]
    - [24, 78952.0]
  - - [1024, 4096, 1, 10064, 1024, 1024, 1024, 4096]
    - [28, 75216.0]
  - - [1024, 2, 1, 6, 1024, 1024, 1024, 2]
    - [1, 2.0]
  - - [256, 7168, 1, 8976, 256, 256, 256, 7168]
    - [134, 85148.0]
  - - [256, 9984, 1, 8976, 256, 256, 256, 9984]
    - [26, 76554.0]
  - - [1024, 4096, 1, 6528, 1024, 1024, 1024, 4096]
    - [28, 75804.0]
  - - [2048, 1920, 1, 2048, 2080, 2080, 2080, 2080]
    - [125, 96421.0]
  - - [1024, 4096, 1, 7200, 1024, 1024, 1024, 4096]
    - [24, 73915.0]
  - - [1024, 1024, 1, 2048, 1024, 1024, 1024, 1024]
    - [65, 44591.0]
  - - [1024, 256, 1, 19712, 1024, 1024, 1024, 256]
    - [170, 31114.0]
  - - [1024, 30522, 1, 780, 1024, 1024, 1024, 30522]
    - [92, 81895.0]
  - - [64, 128, 128, 128, 64, 64, 64, 128]
    - [82, 14340.0]
  - - [560, 1024, 1, 200, 560, 560, 560, 1024]
    - [78, 9752.0]
  - - [1024, 30522, 1, 800, 1024, 1024, 1024, 30522]
    - [129, 84380.0]
  - - [256, 13312, 1, 8976, 256, 256, 256, 13312]
    - [26, 101665.0]
  - - [256, 3840, 1, 8976, 256, 256, 256, 3840]
    - [139, 55649.0]
  - - [1024, 256, 1, 6400, 1024, 1024, 1024, 256]
    - [104, 27307.0]
  - - [1024, 42720, 1, 6528, 1024, 1024, 1024, 42720]
    - [26, 113127.0]
  - - [30, 64, 2048, 31, 30, 30, 30, 131072]
    - [128, 4915.0]
  - - [256, 14336, 1, 8976, 256, 256, 256, 14336]
    - [19, 109080.0]
  - - [33, 32, 1600, 33, 33, 33, 33, 32]
    - [71, 3125.0]
  - - [960, 1024, 1, 1024, 1056, 1056, 1056, 1056]
    - [87, 45100.0]
  - - [256, 1280, 1, 8976, 256, 256, 256, 1280]
    - [152, 32623.0]
  - - [1024, 1024, 1, 6, 1024, 1024, 1024, 1024]
    - [12, 855.0]
  - - [1024, 4096, 1, 8064, 1024, 1024, 1024, 4096]
    - [28, 76982.0]
  - - [1024, 1024, 1, 10200, 1024, 1024, 1024, 1024]
    - [41, 57379.0]
  - - [8192, 7680, 1, 8192, 8384, 8384, 8384, 8384]
    - [95, 121698.0]
  - - [1024, 256, 1, 3328, 1024, 1024, 1024, 256]
    - [104, 24342.0]
  - - [1024, 256, 1, 3584, 1024, 1024, 1024, 256]
    - [117, 24467.0]
  - - [14, 64, 10880, 14, 14, 14, 14, 696320]
    - [3, 2275.0]
  - - [1024, 2, 1, 1152, 1024, 1024, 1024, 2]
    - [89, 148.0]
  - - [257, 4096, 1, 1024, 257, 257, 257, 4096]
    - [111, 31704.0]
  - - [1024, 2, 1, 4, 1024, 1024, 1024, 2]
    - [0, 1.0]
  - - [1024, 1024, 1, 2560, 1024, 1024, 1024, 1024]
    - [169, 47326.0]
  - - [1024, 256, 1, 11520, 1024, 1024, 1024, 256]
    - [117, 29983.0]
  - - [1024, 256, 1, 19968, 1024, 1024, 1024, 256]
    - [57, 31337.0]
  - - [1024, 1024, 1, 77, 1024, 1024, 1024, 1024]
    - [16, 8626.0]
  - - [1024, 42720, 1, 7104, 1024, 1024, 1024, 42720]
    - [26, 113438.0]
  - - [1024, 1024, 1, 160, 1024, 1024, 1024, 1024]
    - [124, 18559.0]
  - - [256, 3584, 1, 8976, 256, 256, 256, 3584]
    - [27, 59231.0]
  - - [256, 19968, 1, 8976, 256, 256, 256, 19968]
    - [28, 90393.0]
  - - [1024, 64, 1, 960, 1024, 1024, 1024, 64]
    - [58, 4626.0]
  - - [256, 10240, 1, 8976, 256, 256, 256, 10240]
    - [26, 78371.0]
  - - [1024, 4096, 1, 8192, 1024, 1024, 1024, 4096]
    - [28, 77040.0]
  - - [256, 18688, 1, 8976, 256, 256, 256, 18688]
    - [136, 85652.0]
  - - [1024, 256, 1, 7936, 1024, 1024, 1024, 256]
    - [57, 28452.0]
  - - [1024, 42720, 1, 9520, 1024, 1024, 1024, 42720]
    - [26, 112560.0]
  - - [3, 64, 512, 3, 3, 3, 3, 64]
    - [3, 36.0]
  - - [1024, 2, 1, 41, 1024, 1024, 1024, 2]
    - [5, 13.0]
  - - [128, 64, 1, 128, 128, 128, 128, 64]
    - [11, 172.0]
  - - [256, 10496, 1, 8976, 256, 256, 256, 10496]
    - [19, 80351.0]
  - - [480, 512, 1, 512, 544, 544, 544, 544]
    - [11, 12385.0]
  - - [1024, 1024, 1, 462, 1024, 1024, 1024, 1024]
    - [142, 26794.0]
  - - [17, 64, 7680, 15, 17, 17, 17, 491520]
    - [42, 2607.0]
  - - [1024, 1024, 1, 780, 1024, 1024, 1024, 1024]
    - [130, 32251.0]
  - - [64, 15, 10880, 15, 64, 64, 696320, 15]
    - [81, 2362.0]
  - - [64, 30, 2048, 30, 64, 64, 131072, 30]
    - [61, 4565.0]
  - - [1024, 4096, 1, 5248, 1024, 1024, 1024, 4096]
    - [169, 74565.0]
  - - [1024, 4096, 1, 1280, 1024, 1024, 1024, 4096]
    - [94, 65600.0]
  - - [1024, 1024, 1, 4, 1024, 1024, 1024, 1024]
    - [20, 583.0]
  - - [4096, 1024, 1, 9600, 4096, 4096, 4096, 1024]
    - [96, 78766.0]
  - - [256, 44505, 1, 8976, 256, 256, 256, 44505]
    - [38, 111683.0]
  - - [768, 2048, 1, 256, 768, 768, 768, 2048]
    - [166, 29607.0]
  - - [1024, 1024, 1, 32768, 1024, 1024, 1024, 1024]
    - [79, 63752.0]
  - - [74, 2048, 1, 960, 74, 74, 74, 2048]
    - [90, 9139.0]
  - - [64, 512, 80, 512, 64, 64, 64, 512]
    - [101, 39383.0]
  - - [4096, 1024, 1, 1152, 4096, 4096, 4096, 1024]
    - [167, 66812.0]
  - - [64, 14, 10880, 14, 64, 64, 696320, 14]
    - [122, 2065.0]
  - - [1024, 256, 1, 1280, 1024, 1024, 1024, 256]
    - [144, 15768.0]
  - - [4096, 1024, 1, 9520, 4096, 4096, 4096, 1024]
    - [41, 75728.0]
  - - [1024, 1600, 1, 1, 1024, 1024, 1024, 1600]
    - [13, 225.0]
  - - [512, 32, 1, 1600, 512, 512, 512, 32]
    - [11, 1365.0]
  - - [1024, 1024, 1, 820, 1024, 1024, 1024, 1024]
    - [124, 32373.0]
  - - [1024, 2, 1, 2560, 1024, 1024, 1024, 2]
    - [30, 225.0]
  - - [1024, 4096, 1, 9216, 1024, 1024, 1024, 4096]
    - [28, 77384.0]
  - - [1024, 1024, 1, 512, 1024, 1024, 1024, 1024]
    - [130, 31213.0]
  - - [4096, 1024, 1, 5248, 4096, 4096, 4096, 1024]
    - [169, 76600.0]
  - - [1024, 256, 1, 16128, 1024, 1024, 1024, 256]
    - [117, 30833.0]
  - - [512, 256, 1, 32768, 512, 512, 512, 256]
    - [48, 16611.0]
  - - [1024, 33712, 1, 8192, 1024, 1024, 1024, 33712]
    - [107, 115510.0]
  - - [4096, 1024, 1, 10080, 4096, 4096, 4096, 1024]
    - [28, 76238.0]
  - - [1024, 1024, 1, 385, 1024, 1024, 1024, 1024]
    - [130, 25616.0]
  - - [1024, 256, 1, 13568, 1024, 1024, 1024, 256]
    - [117, 30306.0]
  - - [1024, 1024, 1, 1, 1024, 1024, 1024, 1024]
    - [12, 149.0]
  - - [1024, 2, 1, 10, 1024, 1024, 1024, 2]
    - [1, 3.0]
  - - [64, 21, 6144, 21, 64, 64, 393216, 21]
    - [91, 3430.0]
  - - [64, 4, 32768, 4, 64, 64, 2097152, 4]
    - [4, 226.0]
  - - [1024, 256, 1, 28672, 1024, 1024, 1024, 256]
    - [98, 31978.0]
  - - [34, 64, 4736, 34, 34, 34, 34, 303104]
    - [36, 5951.0]
  - - [128, 64, 512, 128, 128, 128, 128, 64]
    - [23, 21931.0]
  - - [256, 20992, 1, 8976, 256, 256, 256, 20992]
    - [132, 92663.0]
  - - [1024, 256, 1, 4352, 1024, 1024, 1024, 256]
    - [117, 25375.0]
  - - [256, 5888, 1, 8976, 256, 256, 256, 5888]
    - [88, 80496.0]
  - - [64, 31, 2048, 31, 64, 64, 131072, 31]
    - [59, 4815.0]
  - - [512, 64, 1, 512, 512, 512, 512, 64]
    - [58, 1762.0]
  - - [1024, 1024, 1, 10, 1024, 1024, 1024, 1024]
    - [35, 1409.0]
  - - [512, 32, 1, 200, 512, 512, 512, 32]
    - [120, 362.0]
  - - [5, 64, 960, 5, 5, 5, 5, 64]
    - [1, 155.0]
  - - [64, 35, 4608, 35, 64, 64, 294912, 35]
    - [119, 5981.0]
  - - [1024, 2, 1, 5120, 1024, 1024, 1024, 2]
    - [30, 277.0]
  - - [1920, 2048, 1, 2048, 2080, 2080, 2080, 2080]
    - [140, 97072.0]
  - - [2048, 2048, 1, 2048, 2080, 2080, 2080, 2080]
    - [64, 70921.0]
  - - [1024, 256, 1, 9728, 1024, 1024, 1024, 256]
    - [75, 29032.0]
  - - [4096, 1024, 1, 8160, 4096, 4096, 4096, 1024]
    - [158, 75280.0]
  - - [64, 34, 4736, 24, 64, 64, 303104, 34]
    - [114, 4861.0]
  - - [256, 26112, 1, 8976, 256, 256, 256, 26112]
    - [25, 101368.0]
  - - [3840, 4096, 1, 4096, 4192, 4192, 4192, 4192]
    - [63, 116122.0]
  - - [1024, 4096, 1, 5120, 1024, 1024, 1024, 4096]
    - [110, 74815.0]
  - - [64, 128, 160, 128, 64, 64, 64, 128]
    - [17, 17050.0]
  - - [1024, 1024, 1, 10064, 1024, 1024, 1024, 1024]
    - [161, 57228.0]
  - - [256, 5120, 1, 8976, 256, 256, 256, 5120]
    - [136, 70163.0]
  - - [35, 64, 4608, 35, 35, 35, 35, 294912]
    - [36, 5850.0]
  - - [1024, 30522, 1, 308, 1024, 1024, 1024, 30522]
    - [127, 67830.0]
  - - [1024, 30522, 1, 820, 1024, 1024, 1024, 30522]
    - [84, 82460.0]
  - - [1024, 30522, 1, 200, 1024, 1024, 1024, 30522]
    - [154, 56992.0]
  - - [15, 64, 10880, 14, 15, 15, 15, 696320]
    - [3, 2402.0]
  - - [1024, 30522, 1, 462, 1024, 1024, 1024, 30522]
    - [148, 74739.0]
  - - [256, 8960, 1, 8976, 256, 256, 256, 8960]
    - [26, 68702.0]
  - - [15, 64, 7680, 15, 15, 15, 15, 491520]
    - [118, 2408.0]
  - - [1024, 1024, 1, 8064, 1024, 1024, 1024, 1024]
    - [96, 58139.0]
  - - [13, 512, 1, 32768, 13, 13, 13, 512]
    - [100, 998.0]
  - - [256, 5632, 1, 8976, 256, 256, 256, 5632]
    - [88, 77069.0]
  - - [256, 32512, 1, 8976, 256, 256, 256, 32512]
    - [24, 92150.0]
  - - [64, 17, 7680, 15, 64, 64, 491520, 17]
    - [50, 2491.0]
  - - [17, 64, 6144, 17, 17, 17, 17, 393216]
    - [93, 2404.0]
  - - [1024, 2, 1, 1024, 1024, 1024, 1024, 2]
    - [43, 143.0]
  - - [1024, 4096, 1, 4096, 1024, 1024, 1024, 4096]
    - [96, 73343.0]
  - - [64, 512, 1, 512, 64, 64, 64, 512]
    - [11, 1719.0]
  - - [1024, 30522, 1, 77, 1024, 1024, 1024, 30522]
    - [121, 30264.0]
  - - [256, 11264, 1, 8976, 256, 256, 256, 11264]
    - [18, 85933.0]
  - - [1024, 1024, 1, 40, 1024, 1024, 1024, 1024]
    - [12, 5825.0]
  - - [1024, 1024, 1, 9520, 1024, 1024, 1024, 1024]
    - [103, 56233.0]
  - - [1024, 2, 1, 1, 1024, 1024, 1024, 2]
    - [5, 0.36]
  - - [1024, 1024, 1, 3840, 1024, 1024, 1024, 1024]
    - [145, 52157.0]
  - - [512, 512, 1, 1600, 512, 512, 512, 512]
    - [168, 17361.0]
  - - [1024, 512, 1, 32768, 1024, 1024, 1024, 512]
    - [40, 42091.0]
  - - [256, 15872, 1, 8976, 256, 256, 256, 15872]
    - [28, 73543.0]
  - - [1024, 2, 1, 8, 1024, 1024, 1024, 2]
    - [2, 3.0]
  - - [3200, 2048, 1, 1024, 3200, 3200, 3200, 2048]
    - [102, 80660.0]
  - - [1024, 1024, 1, 8, 1024, 1024, 1024, 1024]
    - [36, 1456.0]
  - - [1024, 42720, 1, 7200, 1024, 1024, 1024, 42720]
    - [26, 113336.0]
  - - [1024, 30528, 1, 4096, 1024, 1024, 1024, 30528]
    - [129, 108984.0]
  - - [27, 128, 32768, 27, 27, 27, 27, 128]
    - [147, 7048.0]
  - - [1024, 256, 1, 1024, 1024, 1024, 1024, 256]
    - [55, 14463.0]
  - - [64, 15, 7680, 15, 64, 64, 491520, 15]
    - [67, 2233.0]
  - - [560, 1024, 1, 1600, 560, 560, 560, 1024]
    - [99, 28672.0]
  - - [256, 128, 1, 32768, 256, 256, 256, 128]
    - [68, 5140.0]
  - - [512, 2048, 1, 256, 512, 512, 512, 2048]
    - [23, 23967.0]
  - - [1024, 256, 1, 21248, 1024, 1024, 1024, 256]
    - [170, 31490.0]
  - - [256, 12544, 1, 8976, 256, 256, 256, 12544]
    - [26, 95723.0]
  - - [1024, 1024, 1, 9600, 1024, 1024, 1024, 1024]
    - [41, 58881.0]
  - - [4096, 1024, 1, 5120, 4096, 4096, 4096, 1024]
    - [65, 76543.0]
  - - [1024, 4096, 1, 3072, 1024, 1024, 1024, 4096]
    - [110, 71266.0]
  - - [1024, 256, 1, 21504, 1024, 1024, 1024, 256]
    - [170, 31627.0]
  - - [32, 64, 4608, 32, 32, 32, 32, 294912]
    - [149, 9461.0]
  - - [1024, 1024, 1, 1152, 1024, 1024, 1024, 1024]
    - [130, 38618.0]
  - - [512, 480, 1, 512, 544, 544, 544, 544]
    - [80, 12099.0]
  - - [1024, 1024, 1, 1024, 1024, 1024, 1024, 1024]
    - [130, 36873.0]
  - - [1024, 4096, 1, 8160, 1024, 1024, 1024, 4096]
    - [24, 73979.0]
  - - [67, 2048, 1, 512, 67, 67, 67, 2048]
    - [66, 6364.0]
  - - [1024, 256, 1, 8192, 1024, 1024, 1024, 256]
    - [117, 28466.0]
  - - [64, 15, 10880, 14, 64, 64, 696320, 15]
    - [122, 2192.0]
  - - [64, 128, 1, 128, 64, 64, 64, 128]
    - [11, 170.0]
  - - [1024, 256, 1, 4608, 1024, 1024, 1024, 256]
    - [57, 25592.0]
  - - [1024, 1024, 1, 5120, 1024, 1024, 1024, 1024]
    - [110, 54471.0]
  - - [256, 17408, 1, 8976, 256, 256, 256, 17408]
    - [24, 80105.0]
  - - [1024, 1024, 1, 32, 1024, 1024, 1024, 1024]
    - [22, 5377.0]
  - - [1024, 42720, 1, 10080, 1024, 1024, 1024, 42720]
    - [26, 114554.0]
  - - [256, 32768, 1, 1, 256, 256, 256, 32768]
    - [12, 552.0]
  - - [256, 4096, 1, 8976, 256, 256, 256, 4096]
    - [88, 56158.0]
  - - [256, 14848, 1, 8976, 256, 256, 256, 14848]
    - [54, 112321.0]
  - - [24, 64, 4736, 24, 24, 24, 24, 303104]
    - [52, 4279.0]
  - - [64, 17, 7680, 17, 64, 64, 491520, 17]
    - [155, 2562.0]
  - - [1024, 2, 1, 3072, 1024, 1024, 1024, 2]
    - [97, 240.0]
  - - [256, 20480, 1, 8976, 256, 256, 256, 20480]
    - [24, 89946.0]
  - - [1024, 4096, 1, 2048, 1024, 1024, 1024, 4096]
    - [24, 69318.0]
  - - [7680, 8192, 1, 8192, 8384, 8384, 8384, 8384]
    - [109, 121958.0]
  - - [4096, 1024, 1, 8192, 4096, 4096, 4096, 1024]
    - [110, 78389.0]
  - - [512, 512, 1, 200, 512, 512, 512, 512]
    - [8, 5650.0]
  - - [1024, 2, 1, 1280, 1024, 1024, 1024, 2]
    - [30, 162.0]
  - - [256, 2816, 1, 8976, 256, 256, 256, 2816]
    - [74, 51585.0]
  - - [1024, 1024, 1, 1600, 1024, 1024, 1024, 1024]
    - [56, 40721.0]
  - - [479, 1024, 1, 32768, 479, 479, 479, 1024]
    - [45, 37686.0]
  - - [64, 128, 512, 128, 64, 64, 64, 128]
    - [15, 22075.0]
  - - [4096, 1024, 1, 3968, 4096, 4096, 4096, 1024]
    - [41, 75022.0]
  - - [1024, 256, 1, 2304, 1024, 1024, 1024, 256]
    - [104, 20405.0]
  - - [1024, 1024, 1, 200, 1024, 1024, 1024, 1024]
    - [130, 16804.0]
  - - [256, 16128, 1, 8976, 256, 256, 256, 16128]
    - [28, 74357.0]
- null
